제목,작성자유형,평점,리뷰
킹 오브 킹스,실관람객,7.0,"인류사에 가장 큰 영향을 끼친 자의 이야기, 그의 가르침을 아들에게 전해주는 아버지의 훌륭한 스토리텔링"
킹 오브 킹스,실관람객,5.0,재밋게 잘 봤습니다..
킹 오브 킹스,실관람객,10.0,기대안했는데 볼만했습니다!
킹 오브 킹스,실관람객,8.0,다 아는 이야기로 잘만든 애니
킹 오브 킹스,실관람객,10.0,"3대가 같이 봤습니다. 전도중인 가족이 있었는데, 예수님 스토리에 거부감 가지지 않고 생각보다 진지하게 보니까 좋았어요."
킹 오브 킹스,실관람객,7.0,종교와 상관없이 재미있게 볼수 있는 영화
킹 오브 킹스,실관람객,7.0,뭐랄까??.. 역사 속 위인을 보는 느낌... 종교적인 부분을 버리더라도 충분히 감동적인 느낌이 마음속에 나타난다.
킹 오브 킹스,실관람객,10.0,잔잔한 감동으로 속도감 있게 긴장되는 당면 하나하나 시간이 순식간에 지나갔네요
킹 오브 킹스,실관람객,10.0,오랜만에 보는 가족영화...또 오랜만의 더빙영화 ㅎㅎ 아이들과 어른이 같이 봐도 좋은 영화...캐릭터의 독창성과 섬세한 표정...자연스러운 움직임...따뜻하고 포근한 색감...병헌리의 자연스러운 목소리연기...모든 것이 어우러져... 당당하지만 자기를 낯추고 십자가에 달리는 희생과 사랑...다시 한번 나를 뒤돌아 보는 가슴 뭉클한 시간이었다. 자막버전도 다시 보러 가야겠습니다.
킹 오브 킹스,실관람객,10.0,아이에게 이차원적 성경을 삼차원으로.. 삶의 4차원으로 만들어준 영화
킹 오브 킹스,실관람객,10.0,좋았어요 잘 봤습니다.
킹 오브 킹스,실관람객,10.0,이미 알고 있는 내용인데도 영상으로 보니 감동과 감사가 나왔고 인간의 죄의 문제를 십자가를 지심으로 해결해 주시는 예수님의 사랑과 은혜가 다시 한 번 느껴지는 시간이었다.예수님 감사하고 사랑합니다.
킹 오브 킹스,실관람객,8.0,종교인은 아니지만 성경에대해 몰랐던 부분을 좀 알게되서 좋았습니다.
킹 오브 킹스,실관람객,10.0,이 나라 교회에서 단체관람 하면 천만 넘을 듯 교회도 안 다니는데 영화 스토리 다 알고 있는 나 놀라운 나라에 살고 있다
킹 오브 킹스,실관람객,7.0,킹오브킹스 영화 잘 봤습니다
킹 오브 킹스,실관람객,6.0,이병헌과 진선규의 목소리배역이 서로 바꼈음 더 좋았을듯 합니다.
킹 오브 킹스,실관람객,10.0,오늘 교회 가기 전에 한편 때렸는데 진짜 눈물나게 잘 봤습니다. 특히 저같은 기독교 청소년들이 꼭 봐야할 최고의 성경 이야기 영화네요~^^
킹 오브 킹스,실관람객,10.0,아이들과 재밌게 봤어요!!영상미도 뛰어나고 스토리도 부드럽게 흘러가며 성우 목소리도 찰떡입니다
킹 오브 킹스,실관람객,10.0,마지막 오에스티 굿입니다
킹 오브 킹스,실관람객,10.0,예수님은 그 모든 과정에서 무슨 기분이셨을까울면서 봤다
킹 오브 킹스,실관람객,10.0,예수님의 따뜻한 눈빛이 큰 감동을 주고 다 아는 성경 내용인데도 생동감이 느껴져 순간순간 눈물이 났네요.
킹 오브 킹스,실관람객,7.0,북미1위라 그래서 궁금해서 보고왔어요
킹 오브 킹스,실관람객,10.0,초등학생부터 성인까지 보시길 추천드립니다신약을 애니메이션으로 잘만든 느낌?기독교인이라면 꼭 보세요!전도용으로도 좋을듯합니다 감동적이에요^^
킹 오브 킹스,실관람객,8.0,배우 더빙이 어색하지 않아 괜찮았어요
킹 오브 킹스,실관람객,10.0,예수님 사랑합니다. 그리고 감사합니다♡
킹 오브 킹스,실관람객,4.0,기독교인이면 만족할만한 영화...기독교인만 만족해할만한 영화...기독교인이 아니면 어색하게 보인 영화...개인적인 관람평이었습니다.
킹 오브 킹스,실관람객,10.0,처음엔 아는 이야기라 지루하다했는데 마지막에 나도 모르게 눈물 줄줄….
킹 오브 킹스,실관람객,10.0,킹오브 킹스 잘보고갑니다
킹 오브 킹스,실관람객,10.0,이미 잘 아는 이야기여도 귀기울여지는 영화♡
킹 오브 킹스,실관람객,8.0,파편적으로 알고있던 이천년전 그 일을 깊이 이해하다
킹 오브 킹스,실관람객,8.0,내용이 띄엄띄엄인데 작화좋고 볼만했음
킹 오브 킹스,실관람객,8.0,와우 킹오브킹스 베리굿
킹 오브 킹스,실관람객,6.0,기독교인 분들이 공감하고 좋아할 것 같은 영화였다
킹 오브 킹스,실관람객,8.0,영상도 귀엽고 볼만했어요
킹 오브 킹스,실관람객,7.0,우리나라에서 만든 애니메이션이라고 해서 감상했습니다. 잡았습니다.
킹 오브 킹스,실관람객,7.0,예수의 탄생과 부활을 완벽한 작화로 만나는 몰입감
킹 오브 킹스,실관람객,10.0,킹 오브 킹스 킹 오브 킹스
킹 오브 킹스,실관람객,10.0,잘 봤습니다. 감사합니다.
킹 오브 킹스,네티즌,10.0,장성호 감독님 포기하지 않으시고 영화 만들어주셔서 감사합니다 감독님이 이 영화를 위해 쏟으신 제작기간 10년이 정말 값진 시간입니다ㅠㅠ
킹 오브 킹스,네티즌,9.0,15일 코엑스에서 시사회로 보고왔습니다 다 아는 내용이었지만 2시간동안 풀집중으로 주님의 길을 따라가다보니 마지막엔 눈물이 나더라구요 미국에서 역대 한국영화 흥행 1위라던데 한국에서도 이 영화를 시작으로 다시 부흥이 시작되기를 소망합니다
킹 오브 킹스,네티즌,10.0,너무 좋아요 꼭 보세요. 비기독교인이 봐도 정말 재미있고 손색없는 영화입니다. 꼭 보세요
킹 오브 킹스,네티즌,10.0,기독교인이라면 무조건 봐야 할 영화
킹 오브 킹스,네티즌,10.0,감동적이에요. 강추합니다.
킹 오브 킹스,네티즌,10.0,감동 그잡채입니다 ㅠㅠ
킹 오브 킹스,네티즌,10.0,"감동적입니다.,,, 꼭 보세요!!"
킹 오브 킹스,네티즌,10.0,너무 영화 좋넉요 ^^ 예수님 닮
킹 오브 킹스,네티즌,10.0,예수님 감사합니다ㅜㅜ
킹 오브 킹스,네티즌,10.0,저는 비종교인이고 여자친구가 보러가자해서 보고 왔습니다.북미에서 성공했다길래 기대를 좀 했고 비종교인이 보기에도 흥미있게 보았어요~한국 작품이라니 대단합니다
킹 오브 킹스,네티즌,10.0,예수님의 생애를 아이들에게 알기쉽게 보여줄수있다는게 너무 좋아요
킹 오브 킹스,네티즌,10.0,"기대했던것만큼 영상이 화려하거나 웅장한건 아니였지만, 사랑의 근본이신 예수님의 생애를 통해 우리를 향하신 하나님의 사랑과 구원을 다시 한번 느낄 수 있었던 시간이었습니다. 뿐만아니라 우리도 그 사랑을 본받아 다른 이들을 사랑하고 용서하는 삶을 살아..."
킹 오브 킹스,네티즌,8.0,아무것도 모르던 무종교인이 예수의 모든것을 알게되었다.
킹 오브 킹스,네티즌,10.0,저희 아이와 보고 왔어요 정말 감동 그 자체입니다. 꼭 가족들과 함께 보시길 바랍니다.
킹 오브 킹스,네티즌,10.0,현 시대에 꼭 필요한 강력한 진리가 담겨 있는 작품. 감동적이었습니다.
킹 오브 킹스,네티즌,10.0,40대 남자 개봉날짜에 맞춰 조조로 봤는데 눈물을 몇번 흘렸네요^^;
킹 오브 킹스,네티즌,10.0,아이들이 보기에 지루하지 않게 잘 만들었어요
킹 오브 킹스,네티즌,10.0,레전드입니다 꼭 보세용
킹 오브 킹스,네티즌,10.0,예수님 이야기를 모르는 분과 같이 관람했는데 너무 재미있다고 하시면서 믿으면 구원을 받는 다는 지점이 인상적이었다고 하시네요. 영화인지 실사인지 모를정도로 자연스러운 부분은 놀랍습니다. 특히 물 관련 된 내용은 해운대를 하셨던 회사라서 그런지 무척 실감이 나서.. 저도 그 현장에 있었던 것과 같은 착각을 불러 일으킬 정도였네요. 스토리 이어가는 지점 현장 교차하는 지점도 인상적입니다. 전체 스토리를 알고 봤는데도 뭔가 모를 잠시 쉼을 얻고 가는 느낌이었습니다.
킹 오브 킹스,네티즌,10.0,"북미 몰몬교 배급 등으로 SNS, 커뮤니티 발 잡음이 조금 있던데.. 직접 보시면 충분히 분별하실 수 있다 생각합니다! 특히 크리스천이면 충분히 분별하실 수 있으니 꼭 직접 관람 추천이요! 저를 건져내시고 희생하신 예수님 장면에서 흐르던 눈물이 아직도 안 멈추네요 ㅠㅠ"
킹 오브 킹스,네티즌,10.0,"조조 개봉 관람 엄마랑 함께 했어요,, 영화관 기술적문제인지 아님 원래 영화 장면 전환 컷의 문제인지 렉 살짝 걸린거 처럼 2.3회 정도 그래서피드백 드리고요,, 영상 송출 색감이 더욱 쨍하게 찐하게? 선명 하면 어떤가? 그런 생각도 들고 성경적 고증 거쳐 너무 연출도 좋고 물속에 마지막쯤 주님과 나의 교차!!! 최고의 장면 이네요!!!10년간 제작하시느라 너무 고생들이 많으셨고,, 나중 감독판 다시 개봉해서 다 못 넣은 장면 들 다 넣어서 긴시간 다시 보고 싶어요,,, 기독교인들 당연히 봐야하고,,, 비기독교인도 예수님이 역사의 실존하는 인물로 진정한 왕중의왕,, 살아계신 하나님 이심을 알게 되는 영화라 여깁니다,,걸작 역사에 길이 길이 남을 작품요,,, 나중에 한글 더빙판으로 한번더 볼 예정이에요,, 모든 영화 관계자분들 감사합니다 !!주님 감사합니다 !!예수님은 진정 왕이십니다 !!! 나중 아카데미 상 받겠죠? 지구에 모든 사람들이 이 영화를 통해 주님 만나게 되길 계속 기도 하겠습니다 !!!"
킹 오브 킹스,네티즌,10.0,인간의 공허함이 채워지는 듯했습니다.
킹 오브 킹스,네티즌,10.0,K영화 화이팅 입니다.
킹 오브 킹스,네티즌,10.0,영화관에서 꼭보세요~ 아이맥스면 더 좋을듯~장엄한 장면이 많습니다~일반영화관이면 앞자리를 추천드립니다~성경 내용에 충실합니다 비신자를 위해 재밌게 만든영화가 아니에요~커피로 따지면 아메리카노임~(시럽없음)
킹 오브 킹스,네티즌,10.0,"일상의 자극적인 매체에 찌들어있다가 힐링하고 온 영화입니다. 성경을 잘 모르는 저도 재미있게 봤습니다. 초반에는 너무 애들 영화인줄 알았다가 점차 몰입하게 되었네요. 19세기 영국의 위대한 작가였던 찰스 디킨즈의 원작을 바탕으로 한 애니메이션인데 아이들도 이해할 수 있도록 만들었고, 어른에게도 감동을 주네요."
킹 오브 킹스,네티즌,10.0,"지금도 예수님 눈빛이 생각이 나고요,왕 곧 만유의 주인이면서도다 품고 다 참고 기도하시는 장면에서는 눈물만 흘렀어요. 십자가에 달리시는 장면은혈흔 하나 보이지 않았지만아팠어요.대사 하나 하나가 나에게 주시는 예수님의 말씀이었습니다.월터는 당시와 나를 이어주는 아주 좋은극적인 장치이자 인물로 내가 마치 월터인 것처럼예수님을 따라 다니는 듯했어요.한국어 더빙판을 아이 때문에 봤지만영어판을 다시 볼 생각입니다.좋은 영화 감사합니다."
킹 오브 킹스,네티즌,10.0,너무나도 감동적인 작품
킹 오브 킹스,네티즌,10.0,"예수님의 스토리, 말씀 한구절 한구절을 이렇게 영화로도 잘 표현할 수 있구나, 주인공과 관객이 동일시 되면서 벅차오르는 감동과 감격을 이루말할 수 없었습니다. 영화보고 리뷰 처음 남겨보네요."
킹 오브 킹스,네티즌,10.0,"감독님, 영화 만들어주셔서 감사합니다♡꼭 보세요~~!"
킹 오브 킹스,네티즌,10.0,아버지가 아이에게 가장 전하고 싶었던 왕중의 왕 예수님의 탄생에서 부터 십자가에 달려 돌아가시는 모습을 아이가 이해하기 쉽게 풀어가는 과정을 성경에 나온 말씀 그대로 너무나 잘 표현하였고 특히 베도로가 바다를 걸어 예수님께 가는 장면을 너무나 잘 묘사하였다.
킹 오브 킹스,네티즌,10.0,이 영화를 통해 더 많은 사람들이 예수님을 알게 되길! k문화가 기독교 부문에서도 널리 쓰임받길 기도합니다! 할렐루야~♡
킹 오브 킹스,네티즌,10.0,어린아이의 시점으로 예수님의 생애와 사건들을 따라가면서 보는 관객들도 그 장소에 직접 가 있는 것 같은 생생함이 느껴졌고 모션 캡쳐에 실사영화와 같은 카메라 무빙 때문에 애니메이션이 아니라 영화 한 편을 보고 나온 것 같았습니다 더 많은 관객에게 이 작품이 알려지고 사랑 받기를!!~!!
킹 오브 킹스,네티즌,10.0,힐링 그 자체인 영화 오랜만에 좋은 영화 봤네요^^
킹 오브 킹스,네티즌,10.0,굳굳굳재믹게봣음 ㅎㅎ
킹 오브 킹스,네티즌,10.0,왕 중의 왕 예수님을 다시 한 번 깊이 생각하게 하는 영화. 6살 딸 10개월 아들과 감동적인 시간 갖게 해줘서 더없이 고마운 영화.
킹 오브 킹스,네티즌,10.0,"양옆 관람객들 다 우시더라고요. 물론 저도 포함..성경은 아는 내용이더라도, 늘 변화하는 내 상황에 따라 받는 위로와 깨달음이 다른 것 같습니다. 결코 변함없는 진리이기 때문이겠죠. 이 귀한 내용을, 남녀노소 관람할 수 있는 애니메이션으로 만들어주신 감독님께 감사합니다. 아이들도 이해하기 쉽게 풀어주셔서 기독교가 아닌 분들께도 추천드립니다. 혹시나 기독교에 관한 오해가 있으시다면 이 영화로 모든 오해가 풀어지고 진짜 예수님을 만나셨으면 좋겠습니다. 한국에서도 큰 흥행을 이루길 바랍니다."
킹 오브 킹스,네티즌,10.0,앗! 쿠키를 못봤네..ㅠㅠ
킹 오브 킹스,네티즌,5.0,이병헌의 더빙과 북미 흥행으로 한번 봤습니다기독교인 어린이용 애니메이션이라고 생각하면 괜찮은것 같네요무교 성인이 보기엔 볼만한 요소가 없습니다제가 본 상영관은 장년층이 많았는데 많이들 눈물을 흘리셨습니다. 이해가 안갔습니다…
킹 오브 킹스,네티즌,10.0,"예수님의 사랑을 가득 느낄 수 있는 작품!영화 속 내용 중 어린아이와 아버지의 관계가 점점 회복되어져 가는 것과 같이 우리를 죽음으로부터 건져내신 예수님의 사랑으로 우리도 또한 회복되어져간다는 메세지 즉, 감동과 깊은 울림을 주는 영화"
킹 오브 킹스,네티즌,10.0,"세상에 빛줄기. 회개와 감사. 폭풍감동. 폭력ㆍ선정적ㆍ동성애ㆍ이기주의가 난무하는 혼잡한 세상에 다시 하나님 질서와 복음, 헌신을 체험하는 깔끔하고 웅장한 영상과 사운드. 악마를 따르는 귀신이 아니라면, 인간이라면 반드시 보아야한다. 희망을 놓지 않으리. 하나님 믿고 사랑합니다. 예수님 목자님 따릅니다."
킹 오브 킹스,네티즌,10.0,"사랑하는 자녀에게 bedtime story 들려주듯,말씀 속으로 쏘-옥 들어갈 몰입감! 예수님의 탄생부터 부활까지 정말 쉽게 표현되었다 교회학교 아이들에게 설교해왔던 주된 성경 이야기들을시각적으로 더욱 잘 이해할 수 있게 표현되어서 아이들에게 꼭 보여주고 싶었다! 백문이 불여일견!특히 예수님의 시선은 언제나 낮은 곳으로 향하며 약자를 도와주고 계셨고 그분의 다정한 눈빛이 기억에 남는다.그리고 찰스 디킨스가 변화하는 모습에서아들 윌터의 눈에는 그가 예수님처럼 보인 것처럼, 나 또한 예수님을 닮아가기 위해 자기를 부인할 것을 되새겨 보게 되었다. 이 영화를 통해서 모두가 예수님에 대해서 오해없이 제대로 알게 되고, 더 궁금해졌으면 좋겠다"
킹 오브 킹스,네티즌,10.0,"기독교인이어서를 떠나 감독을 꿈꾸고 전공하는 학생으로서 짜임새 좋고, 돈 내고 볼 만한 가치는 있는 영화라고 생각합니다. 단순히 기독교 영화이기에 평가가 저하되어서는 안 된다고 생각합니다 감독님 수고하셨습니다"
킹 오브 킹스,네티즌,10.0,"7살 아들도 70대 할아버지도 모두가 이해 가능한 스토리 재미있는 설교로 들었던 것들이 기억난 7살은 마지막에 가장 기억에 남는게 뭐냐 물어보더라구요 자긴 십자가였다고, 중요한 메세지들을 꾹꾹 눌어 담으시느라 고생하셨어요♡ 자막도 보고 더빙도 보고 더 많이 오래 상영을 안하는게 아쉽습니다 너무 너무요"
킹 오브 킹스,네티즌,10.0,웰메이드 기독교 영화. 성경 이야기를 각색없이 그대로 전달하려고 한 노력이 돋보였다.
킹 오브 킹스,네티즌,10.0,왜 재밌지?왜 재밌지?왜 재밌지?왜 재밌지?왜 재밌지?왜 재밌지?왜 재밌지?왜 재밌지?왜 재밌지?왜 재밌지?왜 재밌지?왜 재밌지?왜 재밌지?왜 재밌지?좀 유치할것 같았는데 재밌게봐서 자존심상함
킹 오브 킹스,네티즌,10.0,영화가 끝난 뒤에도 감동과 여운이 남아 계속 앉아 있었어요. 더빙으로 봐도 괜찮은데 자막으로도 한 번 더 보고 싶네요.
킹 오브 킹스,네티즌,10.0,연령에 관계없이 쉽게 접할수 있을것같습니다
킹 오브 킹스,네티즌,10.0,"종교를 떠나, 우리가 쓰는 달력의 기준이 된 예수님은 역사적으로 실존했던 중요한 인물이죠.예수님에 대해 궁금하지만 성경이나 다른 책을 통해 알아가기 주저했던 분들에게, 이 영화는 좋은 대안이 될 것 같아요.애니메이션으로 쉽고 편안하게 예수님의 일생을 따라갈 수 있어, 역사적 인물로서의 예수님을 알아가기에도 아주 좋은 역사 교육 자료입니다.추천합니다."
킹 오브 킹스,네티즌,10.0,감동 감동 감동 입니다~~~
킹 오브 킹스,네티즌,10.0,"하나님이 진짜 있는지, 가족 친구가 말하는 예수님에 대해 알고 싶은 분이 있다면, 강추합니다"
킹 오브 킹스,평론가,10.0,이젠 신약도 단기 속성 클래스로
킹 오브 킹스,평론가,10.0,"눈에 쏙쏙, 간추린 어린이 성서"
킹 오브 킹스,평론가,10.0,종교에 갇히지 않는 보편적 도덕과 지혜의 경로
긴키 지방의 어느 장소에 대하여,실관람객,10.0,하 진짜;;;; 집가서 꿈꿀 것 같아요 여운 쩌는듯… 한동안 엄마 옆에서 자려고요ㅠㅠㅠ 팝콘 사지 마세요 어차피 무서워서 못먹음
긴키 지방의 어느 장소에 대하여,실관람객,10.0,영화 잘 봤습니다 재밌네요
긴키 지방의 어느 장소에 대하여,실관람객,10.0,"주제곡오에스티가 시나링고 인것은마음에들고,귀신 외계인같은것이 나올때만 재밌음.. 전체적으론 너무 안무서움.."
긴키 지방의 어느 장소에 대하여,실관람객,10.0,나는 아카소 얼굴보러 봤다가 괴담에 오싹하고 나옴... 소설 읽어봐야지...
긴키 지방의 어느 장소에 대하여,실관람객,10.0,소름 쫙...간만에 제대로된 공포 영화 봤어요
긴키 지방의 어느 장소에 대하여,실관람객,10.0,평소에 눈썰미가 좋은 관객인데요 둘이서 돌덩이 부수러 가자고 으쌰으쌰하는? 차 안 장면이 잡히는데 칸노 미호가 슬쩍 웃고 있더라고요 잘못 본 줄 알았는데 ㅋㅋ 아니었음ㅋㅋ기괴하고 음침하고 너무 내 스타일이야 이런 결말 아니었음 실망했을거야 ...
긴키 지방의 어느 장소에 대하여,실관람객,10.0,와....진짜 내가 뭘본거지.... 고통스럽지만 끝까지 보고싶게 만드네
긴키 지방의 어느 장소에 대하여,실관람객,8.0,나름 반전도 있고 재밌게봤어요
긴키 지방의 어느 장소에 대하여,실관람객,10.0,후반 제외하면 기대이상으로 나옴.
긴키 지방의 어느 장소에 대하여,실관람객,10.0,"일본 특유의 공포 감성을 제일 잘 만든 영화, 원작 책을 알고가면 더 재미있게 볼 수 있는 영화라고 생각됩니다. 올 여름이 무척 더운데 정말 재미있게 잘 봤습니다. 공포 매니아라면 흥미롭게 보실겁니다."
긴키 지방의 어느 장소에 대하여,실관람객,10.0,안무섭단 애들 ㅡㅡ쎈척 좀 그만해라난 지릴뻔...
긴키 지방의 어느 장소에 대하여,실관람객,10.0,바로 술 먹으러 왔습니다 못잘 것 같아서.
긴키 지방의 어느 장소에 대하여,실관람객,10.0,너무 소름끼쳐서 잠 못잘거같아서 술 마시러 왔습니다..
긴키 지방의 어느 장소에 대하여,실관람객,7.0,실체를 드러내는 순간 생명력을 잃는 괴담
긴키 지방의 어느 장소에 대하여,실관람객,10.0,오랜만에 공포영화다운 공포영화를 봤네요 몰입도 미쳤어요..
긴키 지방의 어느 장소에 대하여,실관람객,10.0,"내 생에 제일 무서운 영화임,, 꿈에 나올ㄲㅏ 무서움"
긴키 지방의 어느 장소에 대하여,실관람객,10.0,배우들 연기력 때문에 더 무섭고 지릴뻔했던.. 마지막 장면은 진짜 지금도 등골이 오싹해집니다.. 오랜만에 아주 무섭고 재밌는 영화..!!!
긴키 지방의 어느 장소에 대하여,실관람객,10.0,기대안하고 봤는데 너무 재밌었습니다
긴키 지방의 어느 장소에 대하여,실관람객,10.0,너무 재밌게 봤어요..진짜 이 영화는 끝까지 안보면 손해봐여
긴키 지방의 어느 장소에 대하여,실관람객,7.0,배우들 연기가 좋았습니다일본호러 특유의 분위기가 좋아서여름에 공포영화 보실분들 추천드립니다
긴키 지방의 어느 장소에 대하여,실관람객,10.0,숨참고 보게 만드는 영화...ㄷㄷ 숨 넘어갈 뻔 했습니다
긴키 지방의 어느 장소에 대하여,실관람객,10.0,생각보다 무서웠음 너무 하.. 잠자면 꿈에 나올듯 짜증남
긴키 지방의 어느 장소에 대하여,실관람객,10.0,왠만하면 공포영화 안보는데재밋을거같아 친구꼬셔서 봤는데너무 오싹하면서 재밌었어요
긴키 지방의 어느 장소에 대하여,실관람객,10.0,와.. 너무 무서워서 신랑 손 꼭 잡고 봤네요! 몰입감 완성도 너무 훌륭해요~!! 간만에 좋은 영화 봤네요!!
긴키 지방의 어느 장소에 대하여,실관람객,10.0,"진짜 이거 보고 무서워서 친구랑 같이 자자고 했습니다,, 오늘 절대 혼자 못자요.. 이런 공포영화 진짜 오랜만에 봤어요! 공포영화 좋아하시는 분들께는 강추입니다!!"
긴키 지방의 어느 장소에 대하여,실관람객,10.0,"끝까지 보세요 소름 끼칩니다 …..,,"
긴키 지방의 어느 장소에 대하여,실관람객,10.0,일본공포는 확실히 다르다…팝콘쏟음….
긴키 지방의 어느 장소에 대하여,실관람객,10.0,와....진짜 내가 뭘본거지.... 고통스럽지만 끝까지 보고싶게 만드네
긴키 지방의 어느 장소에 대하여,실관람객,10.0,기대한만큼 재미있었습니다 여름 막바지에 보기 괜찮은 영화였어요 한번쯤 보는거 추천합니다
긴키 지방의 어느 장소에 대하여,실관람객,10.0,몰입도도 좋고 영상미가 정말 예쁘네요 ㅠㅠ저는 소설 보고 봤더니 더 재밌게보았어요
긴키 지방의 어느 장소에 대하여,실관람객,10.0,몰입도 장난아니네요 오랜만에 완전 집중해서 봤네유 추천헙니다
긴키 지방의 어느 장소에 대하여,실관람객,10.0,"평소 좋아하던 책이 영화로 나와 기대를 하고 봤는데, 스토리는 말 할것도 없이 좋았고 같이 하나씩 사건의 전말을 밝혀내는 전개라 영화보는 내내 지루 하지 않았고 재밌었음"
긴키 지방의 어느 장소에 대하여,실관람객,6.0,다큐로 시작해서 SF만화로 끝나는 이 밑도 끝도 없는 황당함
긴키 지방의 어느 장소에 대하여,실관람객,1.0,초중반 이야기와 사운드까지는 괜찮았는데... 하...
긴키 지방의 어느 장소에 대하여,실관람객,10.0,영화보는 내내 화장실가고싶을만큼 무서워서 후덜덜반전까지 갖춘 영화네요시~~~원 오~~~싹해지고 싶음 보세요
긴키 지방의 어느 장소에 대하여,실관람객,10.0,혼자보기 너무 무서웠어요! 한여름밤에 더위를 싹날려줄 영화추천!
긴키 지방의 어느 장소에 대하여,실관람객,10.0,오랜만에 무서운영화봤어요 영화볼 때 입막고 봤어요 식은땀 ;;반전도 있네요ㅋㅋ실화라니ㄷㄷㄷ
긴키 지방의 어느 장소에 대하여,실관람객,10.0,간만에 소름이 쫙 돋는 영화였어요 정말로 너무 흥미진진해서 재밌었어요 ??
긴키 지방의 어느 장소에 대하여,실관람객,10.0,소설책으로 보고 영화로 다시 한번 봤는데 몰입감이 장난없네요재밌게 봤습니다
긴키 지방의 어느 장소에 대하여,실관람객,10.0,다큐멘터리 같은 연출 덕분에 실제 괴담을 파헤치는 느낌이라 몰입감이 대단했어요. 갑자기 놀래키는 장면보단 분위기로 서서히 조여와서 오히려 더 무섭더라구요.
