제목,작성자유형,평점,리뷰
왕과 사는 남자,네티즌,2.0,진짜 개노잼인데 평점 실화입니까?
왕과 사는 남자,네티즌,10.0,추석음식 다 해놓고 집앞 영화관에 다녀왔어요. 이렇게 감동주는 영화 오랜만이네요.2시간 순삭이예요. 단종에 대하여 다시 찾아보고있네요 오랜만에 극장가 훈풍붑니다. 천만가세요~목소리 멋진 촌장 아들도 기억에 남네요
왕과 사는 남자,네티즌,10.0,영화를 본 지 며칠이 지났는데도 아직 여운이 가시지 않았습니다. 정말 오랜만에 본 사극영화인데 보기를 너무 잘 한 것 같아요. 아버지랑 같이 봤는데 둘 다 마지막에 눈물 흘리면서 나왔네요 ㅠㅠ 배우님들의 연기력에 정말 과몰입해서 봤어요. 설 연휴에 가족들이랑 보면 딱일 것 같습니다. 저는 쉬는 동안 역사책을 다시 펴야겠어요
왕과 사는 남자,네티즌,10.0,연기자들 역시 연기가 너무 대단했고 박지훈...내가 그에게 색안경을 끼고 있었다는것을 ..반성하게 되네요 ..아직도 그의 눈빛이 아른거립니다.. 내 기억속의 단종은 앞으로도 박지훈의 연기속의 단종으로 기억될듯 하네요
왕과 사는 남자,네티즌,10.0,너무 잼있게 봤어요또 보고싶고
왕과 사는 남자,네티즌,10.0,너무보고싶었고 기대치가커서 실망할까봐걱정도됬는데 기대만큼 재미있게봤습니다~!연기도 다들너무 잘해서...순간 유지태님이 미웠었네요! ㅎㅎ
왕과 사는 남자,네티즌,10.0,스토리가 상상력을 가미하긴 했지만 너무 억지로 꾸밈도 없었고 연기차력쇼로 인해 보는내내 너무나 재밌게 봤어요역사적인 슬픈 사실을 이렇게나 다른 시각으로 시선으로 해석할수 있구나하며 감탄하며 봤습니다~좋아하는 사람과 또 보겠습니다.
왕과 사는 남자,네티즌,10.0,박지훈의 감동적인 서사가 가득한 눈빛연기 잘봤습니다. 여자의 가슴을 울리는 단종오빠...
왕과 사는 남자,네티즌,6.0,요즘 개봉한 영화중에 솔직히 기대하고 봤는데 실망했습니다.배우들의 진지하고 맛깔스런 연기 빼곤 내용의 감동 포인트나 감성자극점이 거의 없네요좀 더 사극에서 느껴지는 깊은 정서가 없는게 아쉽습니다.
왕과 사는 남자,네티즌,8.0,연기가 진짜 미쳤음 명품배우들이 다 나와서 진짜 몰입됐고 특히 박지훈? 나중에 충무로 간판 할 것 같다연출은 진짜 개별로임 딱딱끊기고 자꾸 맥이 끊기는 느낌이 들었음. 조금 더 잘 만들었을 수 있을 것 같은데 시나리오가 약간 중구난방한 느낌 뭔가 조금더 길게 가져갔으면 하는 씬들이 짧게 짧게 넘어가고 중간에 유머가 들어가지만 연결성이 부드럽지 않았음.연기로 8할 만들어낸 영화임. 연출이 정말 아쉬웠다 조금 더 잘만들 수 있을 것 같은데..
왕과 사는 남자,네티즌,1.0,유해진 배우님의 열연이 아까운 최악의 영화
왕과 사는 남자,네티즌,6.0,어딘가에서 본 듯한 장면만 가득한 영화주-조연 배우들의 연기는 훌륭했다
왕과 사는 남자,네티즌,10.0,단종이 유배가며 뗏목 타는 장면이 그렇게 여운이 남더라는. 물에 젖어버린 단종의 눈빛에서 자신이 처한 지금과 앞으로의 날들이 그냥 그려졌었던 거 같다. 엔딩크레딧이 올라가고도 한 동안 먹먹해서 앉아있었는데 배우들 연기가 정말 최고였다
왕과 사는 남자,네티즌,10.0,마음을 깊이 울리는 이야기
왕과 사는 남자,네티즌,10.0,"박지훈의, 박지훈을 위한, 박지훈에 의한. 박지훈이 모든걸 다 살린 영화"
왕과 사는 남자,네티즌,10.0,넘 감동입니다 울다웃다 보니 2시간이 순식간에 지나갑니다
왕과 사는 남자,네티즌,10.0,고작 17세인 단종의 어린 나이에도 불구하고 왕의 무력감을 간접적으로나마 느낄 수 있어 너무나 슬펐습니다.
왕과 사는 남자,네티즌,10.0,너무너무 재밌게 봤습니다.감동까지 한가득~추천합니다.
왕과 사는 남자,네티즌,10.0,잔잔히 계속 기억에 머무르며..몇백년전이지만 지켜주지 못하여 울컥울컥 하네요...
왕과 사는 남자,네티즌,10.0,연출 연기 다 너무 감동이에요.. 최근에 본 영화 중 가장 최고네요.
왕과 사는 남자,네티즌,10.0,앞으로 모든 역사 프로그램에 나올 단종 자료영상은 박지훈의 단종이 될것
왕과 사는 남자,네티즌,10.0,전하께서는 꼭 환생하시어 오래도록 진심어린 사랑을 받는 삶을 사세요 부디 강녕 하시옵소서 전하
왕과 사는 남자,네티즌,10.0,부모님데리고. 가족들과 꼭 보세요 ㅠㅜ
왕과 사는 남자,네티즌,10.0,이런 영화가 1000만을 가야지
왕과 사는 남자,네티즌,10.0,유해진씨 마지막 씬에서 하염없이 뜨거운 눈물이 ... 인터뷰 하실때도 울컥하시던데 얼마나 이 작품에 몰입 하셨었는지 알 수 있는 꼭! 입소문 타고 천만 가기를 바랍니다^^
왕과 사는 남자,네티즌,10.0,"거대한 스케일의 사극이라기보다는, 역사 속 한 장면을 인간의 시선으로 다시 들여다보게 만드는 영화였습니다. 이미 알고 있는 비극적인 결말로 향하는 이야기임에도, 그 과정을 지켜보는 동안 묘하게 따뜻하고 씁쓸한 감정이 동시에 남는 작품이었습니다. 좋았습니다."
왕과 사는 남자,네티즌,6.0,"알바가 많나보네요. 요즘 영화판을 생각하면 후하게 쳐주고 싶은데 연출에 허술함이 많습니다. 전체 스토리가 부드럽게 이어지지 않고 연기자들의 표정, 연기에 의존한다 느낄 정도에요ㅕ. 드라마라면 이해하겠지만 비싼 돈 주고 영화 보러왔는데 어설픈 연출에 어이가 없다가 마지막 단종 죽을 때 10분간은 감동을 줘서 울리게 해줘서 점수 보통 줍니다. 솔직한 평이고 그리 느낀 사람 많을거니 꼭 참고하세요"
왕과 사는 남자,네티즌,2.0,"OTT로 나왔으면 10분 보다가 껐을 영화다.무슨 의도로 만들었는지 짐작조차 안간다.재미있는 이야기라기에는 이야기가 너무 무겁고,감동을 주고자한 이야기라기에는 공감이 안되고,메세지를 주고자한거라면 내용이 없다.장항준. 실망이다."
왕과 사는 남자,네티즌,6.0,소재 자체도 충분히 좋고 캐스팅도 잘됬는데 마을 사람들과 왕이 갑자기 너무 빠르게 친해져서 후반부에 감동이 덜 했음 조금 더 정서적으로 친해지는 과정에 대하여 빌드업을 잘해뒀으면 훨씬 좋았을듯… 기대한것보다는 아쉅지만 볼 만하다..
왕과 사는 남자,네티즌,10.0,유해진과 박지훈의 연기가 인상깊었습니다!혼자보기보단 누군가와 같이 보기 좋은 영화네요
왕과 사는 남자,네티즌,10.0,오랜만에 만나는 역사 영화가 괜히 반가워서 더 즐길 수 있었던거같아요. 특히 한번도 다뤄지지않았던 단종 얘기를 이렇게 영화로 마주할 수 있어서 역사 덕후는 너무 행복하면서도 직접 눈으로 보니 더 슬픈...ㅜㅜㅜ 배우들 연기는 말해뭐해요 더 감정을 극적으로 느낄 수 있어서 행복했습니다 강추!!
왕과 사는 남자,네티즌,8.0,단종의 숨겨진 이야기를 만들었고 역사속 실화를 바탕으로 만들어서 관심이 갔어요 평점이 9점대로 많이 높아서 기대를 많이해서인지 조금은 실망했지만 재밌게 봤어요 중반부부터 후반부로 갈수록 재밌어지더라구요 그런데 역사가 스포일로라서 결말을 아니...한국영화 화이팅 ~~~
왕과 사는 남자,네티즌,10.0,영화보다가 운적은 처음이예요
왕과 사는 남자,네티즌,6.0,중반부터 괜찮았음.초반은 좀 지루함???
왕과 사는 남자,네티즌,2.0,울음은 커녕 졸았을 뿐이다.
왕과 사는 남자,네티즌,10.0,나만 질질짜고 나온게 아니었어...역사적 결말 알고 보는거지만 너무너무 슬픈 단종이야기ㅠㅠ
왕과 사는 남자,네티즌,10.0,앞으로 박지훈 배우님이 나온 영화는 다 보겠습니다..
왕과 사는 남자,네티즌,4.0,좋은 스토리이지만 연출에서 아쉽습니다.인물들 사이의 유대감에서 개연성이 떨어져서 감동이 좀 더 올수 있는 장면에서 반감되는 느낌이었어요. 왕과 촌장과 마을 주민과의 연대부분이 너무 약해서 뒤에 촌장의 행동이 와닿지 않고 납득이 잘 안되는 부분도 있었습니다.
왕과 사는 남자,네티즌,7.0,배우들은 연기 잘함. 좀더 잘 만들 수 있지 않았을까
왕과 사는 남자,네티즌,4.0,엄흥도라는 미스테리한 행적에 주목한 시작은 좋았음. 그러나 영화자체가 저는 재미가 없네요. 뭐든 재미가 있어야하는데 이게 진짜 재미있나? 관상은 영화가 처음부터 끝까지 재미있었는데 이건 전혀 재미 없었음. 하긴 저는 파묘도 별 두개 생각하는 사람임. 개인 감상일뿐 .
왕과 사는 남자,네티즌,10.0,끝을 알아 더 눈물나..
왕과 사는 남자,네티즌,10.0,단종의 이야기를 다시한번 생각해볼 수 있었던 시간이었네요. 유해진님의 연기에 다시한번 감동했습니다.
왕과 사는 남자,네티즌,10.0,연기력 좋은 배우들 때문에 상영 내내 집중해서 잘 봤습니다. 후반부에 갈수록 감동이 돼서 울컥했어요. 좋은 영화 잘봤습니다.
왕과 사는 남자,네티즌,10.0,유해진 배우님의 연기가 기가 맥혀요
왕과 사는 남자,네티즌,10.0,그냥 보세요 봐도 후회 안합니다 눈물 흘리고 싶으면 바로 예매하시길
왕과 사는 남자,네티즌,10.0,열글자이상써야해서 쓰는중 그냥 굿
왕과 사는 남자,네티즌,10.0,"최근 몇년간 본 영화중 최고의 영화..연기, 내용, 감동, 웃음, 슬픔 모두 잡았다..저런 사람이 왕이 되면 좋겠다라고 느낀 영화..다시 보고 싶고 추천해 주고 싶은 영화.."
왕과 사는 남자,네티즌,10.0,최근에 본 영화 중에 최고의 영화였음.
왕과 사는 남자,네티즌,10.0,가족들이랑 연휴에 또 보고싶은 영화ㅏ다같이 보고 싶음
왕과 사는 남자,네티즌,10.0,마지막 장면 보고 슬퍼서 친구하고 같이 울었어요 ㅠ
왕과 사는 남자,네티즌,6.0,**알바 많은 것 깉아서 솔직한 평 남깁니다. 스포주의**단종이라는 큰 역사적 소재를 이런식으로 밖에 연출하지 못했나라는 실망감이 있습니다.10년 지난 최종병기활에 나온 호랑이 CG보다 못한 퀄리티로 몰입도 많이 떨어지구요. 유해진 배우님의 연기를 유머로 소비하는게 아쉬웠습니다. 다행히 박지훈 배우 연기가 영화에 진지함을 더해준게 천만다행이네요. 요약하자면 스토리/연출 측면에서 큰 부족함이 느껴져서 돈이 살짝 아까웠구요. 박지훈 배우 연기가 다한 영화였습니다.
왕과 사는 남자,네티즌,4.0,단종이랑 엄홍도 서사가 너무 부족하고 갑자기 엄청 친해져서 둘도없는 사이가 된 느낌그래서 슬픔이나 감동을 못받았다
왕과 사는 남자,네티즌,10.0,"배우 박지훈의 연기력과 발성으로 단종이 환생한듯 빠졌던 영화, 외모 또한 수려한 천만 배우 탄생할 듯"
왕과 사는 남자,네티즌,10.0,박지훈 배우는 단종 그 인물이었다 다른 대체할 배우가 떠오르지 않는다 오랜 시간 역사를 공부한 사람으로서 오랜만에 가슴 한편에 여운을 주는 작품이었다
왕과 사는 남자,네티즌,10.0,"모든 배우들의 연기에서 진심을 느낄 수 있어 너무 행복했습니다... 특히 박지훈, 유해진 배우의 모습은 눈물이 멈추지 않고 흐르게 하기에 충분했고, 연출과 각본까지 연기와 조화를 이루는 완벽 그 자체였습니다 하루를 보냄에 있어 이 영화를 보기로 선택한 것은 단 1초의 후회도 하지 않을 수 있는 결정이었다고 생각합니다"
왕과 사는 남자,네티즌,10.0,오랜만에 재미있고 감동적인 영화였습니다.제가 그렇게 울줄 몰랐네요.
왕과 사는 남자,네티즌,10.0,너무 울어서 눈이 안 떠짐. 박지훈 얼굴만 떠올려도 눈물남. 수양대군 묘에 별점테러 하는 심정을 알겠음.
왕과 사는 남자,네티즌,6.0,솔직히 호랑이 영상미도 별루고… 큰 감동도 없고 웃기지도 않고 … 기억에 남는 장면도 없음
왕과 사는 남자,네티즌,10.0,한명희 지옥에서도 벌 받아라 미친ㄴ 이미 죽어서 죽으라고 할 수도 없네
왕과 사는 남자,네티즌,10.0,2026년 최고의 영화가 벌써 나와버렸네!! 박지훈=단종의 환생..
왕과 사는 남자,네티즌,1.0,CG는 조잡하고 대사는 공허하다. 유해진만 고군분투
왕과 사는 남자,네티즌,10.0,왕의 눈에 모든것이 담겨있다
왕과 사는 남자,네티즌,10.0,연출 스토리 모두 꽉 잡은영화
왕과 사는 남자,네티즌,10.0,"""천만리 머나먼 길에 고운 님 여의옵고/내 마음 둘 곳 없어 냇가에 앉았으니/저 물도 내 안 같아야 울어 밤길 예놋다."" 이것이 어찌 왕방연만의 심정일까. 만백성의 임금이자 아들이었던 고운 님 단종. 그리고 절절한 만인의 아비 엄흥도. 아무리 명배우라지만 미혼의 유해진이 어찌 저토록 징한 연기로 우리 모두를 따뜻이 안아 건질 수 있었던 것인지, 그 신들린 속삭임에 오열을 넘어 통곡까지 하고는 쫓기듯 집에 와서 박시백의 조선왕조실록을 찾아 읽었다. 여운이 앞으로도 길고도 깊을 것 같다."
왕과 사는 남자,네티즌,10.0,"아내의 권유로 함께 감상한 영화입니다.단종의 마음이 고스란히 느껴지고 극중 유해진씨와 신분의 차이를 넘어선 우정 이랄까 의리 때문에 나도 모르게 눈물을 흘렸습니다.저의 짧은 소견으로는 역사는 되풀이 된다고 보기 때문에 사극을 더 많이 제작해 주셨으면 합니다.주책일수도 있고, 이번 영화보면서 아내도 느꼈을 수도 있지만, 내 자신이 울었다는 것이 조금도 부끄럽지 않은 영화라고 생각합니다.새벽에 잠에서 깨어 두서없이 적은이는 참고로 올해 칠십이나 된 사람입니다.제 또래분들께 감상해 보시도록 권하고 싶고, 유해진씨를 다시 보게 된 계기가 되어준 영화라고 감히 생각합니다!"
왕과 사는 남자,네티즌,10.0,두번 본 영화는 거의 없는데 내일 또 보러감..알고도 울거같아서 휴지챙기는중
왕과 사는 남자,네티즌,10.0,한번 더 보고싶은 영화인 것 같아요
왕과 사는 남자,네티즌,10.0,이거보고 역사에 푹 빠졌어요… 연기를 너무 잘해서 아직도 헤어나올 수가 없네요 영화에 빨려들어가서 제가 조선에 있는 것 같았어요 가슴은 먹먹해지고 단종앓이를 하게된 후유증이 심하지만 모두가 보면 좋겠는 영화입니다 ㅠ
왕과 사는 남자,네티즌,10.0,치명적인 유해진을 만나는 시간
왕과 사는 남자,네티즌,10.0,"유해진님 연기 보러, 단종 눈빛 보러 또 갑니다"
왕과 사는 남자,네티즌,10.0,보고 나서 며칠간은 계속 못헤어나오고 있어 관람평까지 찾아왔습니다...
왕과 사는 남자,네티즌,10.0,믿고보는 유해진 배우님이라 개봉날만 기다렸다가 봤는데 기대이상 박지훈 배우님의 연기에 감탄했습니다.
왕과 사는 남자,네티즌,10.0,"픽션과 논픽션을 오가며 디테일하게 깔아놓은 복선이 촘촘하게 연결되어, 어느 하나라도 놓치면 안되는 영상미.연기자들의 어우러진 연기력 또한 영화를 보는 내내 빨려 들어가게 함 .조금도 지루할 틈 없는 정말 오랜만에 좋은 영화 봤네요. 영화를 보셨다면 꼭 청령포와 장릉을 다녀오시길. 해설사의 해설까지 곁들이면 굿"
왕과 사는 남자,네티즌,9.0,솔직히 돈값 이상의 결과물이잖아훌륭한 연기력 볼 가치가 있다
왕과 사는 남자,네티즌,10.0,"진짜 두 배우 뿐만 아니라 수많은 배우들이 연기구멍이없었음,,, 잔잔하게 흘러가려나 싶으면 재밌어지고 그냥 막 막 마음이 아파와ㅜ"
왕과 사는 남자,네티즌,10.0,영화관에서 볼 영화가 없어서 아쉬웠는데 오랜만에 영화관에 가게 만든 작품이다
왕과 사는 남자,네티즌,10.0,"2년만에 극장에 방문을 했네요…. 이 영화가 보고싶어서 ott, vod 기다리기 현기증 날 것 같아서요 N차 관람 각 입니다극장 가서 보길 잘했네요 역사 속 실존 인물들에 빙의된 배우들을 보았네요 시간 가는 줄 모르고 봤네요역사의 결말을 알고 봐도 단종이 복위하길 응원히며 봤습니다"
왕과 사는 남자,네티즌,10.0,휴민트 볼시간에 왕사 재관람하시길 추천합니다 호랑이가 문젠데~~
왕과 사는 남자,네티즌,10.0,유해진 박지훈 연기 정말 최고였어요…여운이 너무 남아서 일상생활 불가합니다ㅠㅠ
왕과 사는 남자,네티즌,10.0,진짜 간만에 너무 재밌게봄 ㅜㅜㅜ 또보고싶을정도
왕과 사는 남자,네티즌,10.0,2번 봤는데 2번째가 더 오열했음ㅠㅠ설에 가족들이랑 또 볼 예정
왕과 사는 남자,네티즌,10.0,최근에 본 영화 중 제일 좋았어요. 특히 여운이 엄청 남네요.. 보면서 우리나라도 정말 백성을 사랑하는 왕이 있었으면 좋겠다. 단종이 살아계셔서 이어갔으면 어땠을까 상상하게 되더라구요. 왜 세조 왕릉 리뷰에 욕이달리는지 이해하게 됐어요 ㅎㅎ 부모님 모시고 갔는데다 눈물 흘렸어요 ㅠ
왕과 사는 남자,네티즌,10.0,오랫만에 제대로 된 한국영화 재밌게 보았습니다. 부모님 모시고 한번더 볼 계획입니다.
왕과 사는 남자,네티즌,10.0,저는 보통 기대하고 보면 보고나서 실망을 크게하는 편인데 이 영화는 엄청나게 기대하고 봐도 그만큼의 감동을 주고 배우들 연기력이 정말 미쳐서 또 보고싶은 영화.. 박지훈과 유해진의 연기가 정말 미쳤고 눈물이 그냥 주르륵 흘러요ㅠ
왕과 사는 남자,네티즌,10.0,박지훈 연기 최고 되시다 ㅠ
왕과 사는 남자,네티즌,10.0,"왕과 사는 남자는 배우들의 연기, 감독의 새로운 시선, 청룡포의 영상미... 26년 상반기 기대작!돈과 시간이 아깝지 않은 작품입니당.가슴 뭉클함이 아직도 여운이 가시질 않아요~~장항준감독님 일 냈어요!!!"
왕과 사는 남자,네티즌,10.0,미쳤다 엉엉 울었어요ㅠㅠㅠ다들 연기 왜 이렇게 잘하는지 우와 진짜..너무 재밌게 잘 봤습니다영화 끝났는데도 가슴 아프네요 후..
왕과 사는 남자,네티즌,10.0,단종 역할의 박지훈님과 엄흥도 역할의 유해진 배우님 그리고 다른 배우분들까지 다들 너무 잘 해주셔서 감명 깊게 보고왔어요 단종의 아픈 역사를 영화를 통해 이렇게 또 보니 감회가 새로웠고 혼자와서 영화보는내내 눈물 머금고 봤습니다 영화를 만들어주신 감독님께도 감사합니다 왕사남 화이팅 두번 세번 네번 보고 봐도 또 보고싶을 영화!
왕과 사는 남자,네티즌,10.0,진짜 오랜만에 재밌고 감동적인 영화가 나왔다고 생각합니다
왕과 사는 남자,네티즌,10.0,처음 써봅니다..배우분들 연기력이 진짜 존경스러울정도로몰입도가 높아서 눈물콧물흘리며 재밌게봤습니다몇년만에 정말 재밌는영화였어요
왕과 사는 남자,네티즌,10.0,배우들의 깊이있고 섬세한 연기력이 일품입니다! 오랜만에 온 가족이 함께 볼 만한 영화가 나왔네요
왕과 사는 남자,네티즌,10.0,2024~2026 본 영화 중 1등
왕과 사는 남자,네티즌,10.0,영화보고 이렇게 운적은 또 처음이네요역사시간에 배우지 못한 단종의 유배 뒤 모습을 알게될수 있었습니다 정말 배우분들의 연기로 유해진 배우님 대사에 웃다가 박지훈 배우님의 연기를 보며 소름이 돋고 유지태배우님 너무 연기잘하세요 미도배우님 역시 믿고보는 배우입니다 이준혁배우님은 넘 잘생기셔서 더 마음 아팠어요ㅜ 네이놈 왕족을 능멸하는가 그 부분 정말 소름돋게 좋습니다 정말 여운이 가시지 않는 영화네요 꼭 보세요
왕과 사는 남자,네티즌,10.0,이건..진짜 꼭 보셔야되는 영화입니다..박지훈과 유해진의 연기가 말이 안나와여..
왕과 사는 남자,네티즌,10.0,별생각없이 봤는데 박지훈입덕함.. 본지 며칠 됐는데도 아직 관련영상 찾아보는중이고.. 여러번 다시볼예정 마지막 진짜 처슬퍼서 펑펑울었음
왕과 사는 남자,네티즌,9.0,보고나서 단종에 대해 자꾸 찾아보게 되네요. 그만큼 몰입감이 대단했고 거기엔 배우분들의 연기가 제일 큰 역할을 하는것같아요! 해진배우님 꼭 연기상 받으시길!
왕과 사는 남자,네티즌,10.0,"역사적 인식을 일깨워 준 영화,현재 이 시대에 태어나 살고 있다는 것만도 감사하게 느껴지는 과거 역사...과거의 분들께 추모의 마음이 든다."
왕과 사는 남자,네티즌,10.0,아니 박지훈 연기 왜 이렇게 잘하나요 유해진은 말해뭐해고 ㅜㅅㅜ
왕과 사는 남자,네티즌,10.0,이렇게까지 연기가 완벽한 영화는 못 본듯 합니다 박지훈님 연기도 미쳤고 얼굴도 미친거 같고 유해진님 연기가 말도 안됩니다 저는 원래 영화볼때 잘 울지만 저희 엄마는 잘 안 우시는데 둘다 완전 오열했습니다 배우분들 다 완벽한 연기를 하신거 같습니다 다시한번 봐야겠다는 생각이 드네요 완전 추천합니다 그리고 박지훈님 사랑합니다
왕과 사는 남자,네티즌,10.0,보고 싶으면 보세요!! 보는 것이 고민 되면 보세요!!보기 싫으면 보세요!!
왕과 사는 남자,네티즌,10.0,역사적 사실이여서 더 가슴 아픈 결말...
왕과 사는 남자,네티즌,10.0,박지훈배우에 슬픈눈빛이 보는 내내 제 눈물이 멈추질 않았어요단종에 마지막을 알기에 보는 내내 너무 맘이 아팟어요 해진배우님 연기에 다시 한번 감탄했어요하지만 연출은 조금 묵직하지 못한 느낌배우들에 연기로 오랜만에 데대럿 된 영화본 기분입니다
왕과 사는 남자,네티즌,10.0,1시간 30분은 웃다가 막판 20분은 엉엉 울고 나옴연기가 진짜ㅠ.. 오랜만에 영화관 갔는데 너무 좋았습니다. 다들 꼭 보세요!
왕과 사는 남자,네티즌,10.0,마지막에 안 울 수 있어요?
왕과 사는 남자,네티즌,10.0,너무 슬프고 제 생에 봤던 영화 중 가장 잘 만들었다고 생각 듭니다
왕과 사는 남자,네티즌,10.0,재밌습니다. 오랜만에 재밌는 영화 봤네요.
왕과 사는 남자,네티즌,8.0,배우분들 연기가 다 살린 영화 같아요.. 솔직히 스토리는 좋은데 연출이 많이 아쉽네요… 음향도 좋습니다!
왕과 사는 남자,네티즌,10.0,역사를 알고 슬픔을 느끼고 재미를 보고
왕과 사는 남자,네티즌,10.0,상영 전 무대인사부터 엔딩 스크롤까지 꼼꼼히 관람했습니다~사실.. 무대인사 상영 전에 보길 너무 잘했다 싶어요 끝나고 했더라면 유지태씨 등장 때 박수 못?. 아니 안 쳤을 것 같아요넘나 무섭고 나아쁜!! 한명회!!지금까지 청령포 두 번 갔었는데 꼭 조만간 다시 가야겠단 생각이 들었어요ㅜㅜ단종 전하 찾아뵙고 위로 드리고 싶어졌습니다배우들 하나하나 연기 너무너무 감동입니다유해진 배우님은 올해 남우주연상 따놓은 당상입니다!!진짜 진짜 어차피 다 아는 결말이라 안 울 줄 알았는데 대성통곡을 했다는...ㅜㅜ그리고 이 영화는 첨부터 끝까지 장항준 시그니처네요 감독님 특유의 서민 웃음. 그 진정함이 담긴 따뜻한 유머^^아 이건 장항준만 할 수 있는 유머다 싶었습니다~!오늘 무대인사 박지훈 배우 못 봐서 좀 아쉬웠어요 앞으로가 너무나 기대되는 젊은 배우라는 생각이 드네요.진짜 영화 보고 이런 생각 별로 안 드는데 이 영화는 엔딩 스크롤 올라갈 때 아! 또 보고 싶다는 생각이 파도처럼 들었습니다~너무너무 잘 봤어요~~^^
왕과 사는 남자,네티즌,10.0,오랜만에 극장에서 한국 영화 그것도 사극너무 좋았고 다 완벽특히 배우들 연기가 한몫함
