제목,작성자유형,평점,리뷰
야당: 익스텐디드 컷,네티즌,10.0,"전체적 흐름 좋네요.끝나고 주~~욱 가다리면, 쿠키영상 있어요."
야당: 익스텐디드 컷,네티즌,10.0,강하늘과 유해진과 출연진 너무 재미있고 잘봤습니다
야당: 익스텐디드 컷,네티즌,9.0,강하늘연기 좋고 유해진 연기기가막히고
야당: 익스텐디드 컷,네티즌,7.0,기존보다 상영시간이 증가했지만 크게 넘치는 곳 없이 영화 전개에 어울리게 적절히 채워 넣은 거 같다.
야당: 익스텐디드 컷,네티즌,10.0,"극장에서 못 보고 지나가서 아쉬웠는데 익스텐디드 컷 만들어주셔서 감사합니다. 쫀득한 이야기, 각인되는 이미지 좋았습니다. 추천!"
야당: 익스텐디드 컷,네티즌,10.0,야당 익스텐디드메가박스보고왔습니다 강하늘 유해진 류경수 채원빈디시보는까15분자리추가됐습니다배우들연기잘하고모두액션미쳤다 진짜 음악 좋아요 긴장감 하면서봤다 스토리가 유해진검사높은곳올라가고싶어배신감 하고반전있고사람들정말로 액션최고입니다
야당: 익스텐디드 컷,네티즌,8.0,뻔한 반전과 결말의 영화스토리 지만 짜임새가 나쁘지않고 배우들의 연기력이 좋음
야당: 익스텐디드 컷,네티즌,6.0,강하늘 유해진 조합좋아
야당: 익스텐디드 컷,네티즌,8.0,"대한민국의 모든 문제는 검사들 때문이다. 검찰개혁, 내란극복 반드시 이뤄야 한다."
야당: 익스텐디드 컷,네티즌,6.0,야당 두번봤네.. 봤던사람이라면 굳이 안봐도
야당: 익스텐디드 컷,네티즌,10.0,관점 자체가 색달라서 좋았다.
야당: 익스텐디드 컷,네티즌,10.0,어떤 내용인지 아예 모르는 상태로 재개봉 소식에 바로 보러 갔는데 그래서 그런지 더 재밌게 잘 보고 왔습니당 배우님들 한 분도 빠짐없이 연기력이 진짜 최고 ??
야당: 익스텐디드 컷,평론가,10.0,어떤 내용인지 아예 모르는 상태로 재개봉 소식에 바로 보러 갔는데 그래서 그런지 더 재밌게 잘 보고 왔습니당 배우님들 한 분도 빠짐없이 연기력이 진짜 최고 ??
