제목,작성자유형,평점,리뷰
쥬라기 월드: 새로운 시작,실관람객,10.0,"옛날 느낌 나요. 공룡 보러 가시는 거면 강추. 스필버그 감독님이 많이 개입하셨다던데, 그런 것 같아요. 쿠키는 없습니다 : )"
쥬라기 월드: 새로운 시작,실관람객,4.0,영상미나 공룡 자체는 그럴듯하게 나오고 변종공룡도 좋았으나 스릴과 서스펜스는 못 느낀게 인간들 하는 행동이 너무 짜증나고 비호감이라 다 죽길 바람 몰입이 하나도 안되고 모든 쥬라기 시리즈 중에 최악의영화
쥬라기 월드: 새로운 시작,실관람객,1.0,쥬라기 월드가 아니라 키메라 월드임...
쥬라기 월드: 새로운 시작,실관람객,2.0,스칼렛 조핸슨 나와서 전작보다 달라질까 하고봤는데 비슷한 수준이네 큰 임팩트도 없고 초반에 말 드럽게 많아서 지루함 그리고 굳이 특별관 고집할 필요 없이 일반관에서 봐도 충분함
쥬라기 월드: 새로운 시작,실관람객,2.0,공룡의 비중은 줄고 인간 서사만 루즈하게 만든 최악의 작품
쥬라기 월드: 새로운 시작,실관람객,4.0,8편 찍으려면 감독.각본 다바꿔라. 긴장감 속도감 모두 부족한 짭퉁 블록버스터+비호감 민폐캐릭터 짜증스러웠던 두시간
쥬라기 월드: 새로운 시작,실관람객,10.0,확실히 스릴감이 있어서 좋았음. 그리고 덕후 조나단 귀여움 ㅋㅋㅋ
쥬라기 월드: 새로운 시작,실관람객,8.0,눈은 매우 즐겁지만내용은 없고 스토리전개도 진부합니다.요한슨 누님버프로 8.5점 주고 싶지만 .5점이 안되네요.무난무난한 8점짜리 영화입니다.
쥬라기 월드: 새로운 시작,실관람객,5.0,불법적인 일이지만 큰돈을 벌기 위해 목숨 걸고 뛰어든 던컨이 배도 잃고 선원과 친구 모두 잃고 남을 위해 희생까지 시도 했음에도 자기도 모르게 누군가의 결정에 의해 돈을 못벌게 된다는 설정은 이해가....그리고 제약회사 의뢰자는 큰돈을 투자하고 업무 방해가 예상되지만 결국 가족 구조활동도 묵인해 주고 적극적으로 임무에 같이 도움을 주었는데 뭘 그리 잘못했다고 그렇게 죽었어야 하는지? 그리고 중남미계 민폐가족은 영화에 뭔 도움이 된다고 출연을 시켜서 사람들 복장을 터뜨렸는지? 단지 스필버그식 가족영화를 강조하고 싶어서인가?
쥬라기 월드: 새로운 시작,실관람객,1.0,괴랄한 돌연변이로 오마주만 한 최악의 작품입니다.쥬라기공원1때부터 엄청난 팬인데실망이 너무큽니다.
쥬라기 월드: 새로운 시작,실관람객,10.0,역시 공룡버스터 근본..미쳣다. 이런 큰 스크린으로 다시 공룡 봐서 넘 재밌었음. 진짜 긴장? 스릴? 이런 느낌이 강했음. 심장 아파ㅜㅜ
쥬라기 월드: 새로운 시작,실관람객,2.0,가족이야기는 통으로 날려도 스토리에 전혀 지장없음처음보는 에일리언 공룡이며 감독의 의도를 모르겟는 영화...
쥬라기 월드: 새로운 시작,실관람객,8.0,"공포영화 못지않은 긴장감과 다양한 볼거리, 웅장한 사운드는 가히 압도적"
쥬라기 월드: 새로운 시작,실관람객,6.0,예고편이 전부였어요마지막은 괴물이 나오는데 공룡을 원한건데 아쉬움가득이요
쥬라기 월드: 새로운 시작,실관람객,4.0,쥬라기와 에일리언 그 사이 어딘가.
쥬라기 월드: 새로운 시작,실관람객,1.0,이게 영화냐 공룡은 뭔 고질라 처만들어놓고 티라노는 뭔 노즈위크 놀이 하고 걍 영구와 티라노발톱 보는게 더꿀잼
쥬라기 월드: 새로운 시작,실관람객,10.0,456 보다 이번 7편이 조금 더 재밌다고 생각듬
쥬라기 월드: 새로운 시작,실관람객,2.0,굳이 봐야할까요? 다른 영화 보시는 걸 추천합니다
쥬라기 월드: 새로운 시작,실관람객,2.0,예전 영화들은 선과 악의 구분이 명확 했는데 요즘 영화들 인물의 성격은 굉장히 애매모호 하고 짜증나는 성격이 많다.물론 재미를 위해서 구해준 가족들을 넣었겠지만 보는 내내 이들의 행동도 성격도 빌런에 가깝다.
쥬라기 월드: 새로운 시작,실관람객,1.0,생각 생각보다 별로였습니다..
쥬라기 월드: 새로운 시작,네티즌,10.0,이 영화를 스토리를 보고 가는 사람이 있나ㅋㅋ 공룡보려고 가는거지ㅋㅋ
쥬라기 월드: 새로운 시작,네티즌,10.0,첫영화가 9시 45분인데 9시 48분에 지루해서 잔다는 애는 3분만에 흥미를 잃은거임? 인내력이 갓난아기 수준인데
쥬라기 월드: 새로운 시작,네티즌,10.0,네이버 평점은 영화티켓 인증한 사람만 평점 남길 수 있게 만들어라 방구석에서 할짓없이 평점테러나 하는 인간들 거르자 역겹다
쥬라기 월드: 새로운 시작,네티즌,3.0,주연들 과거 서사가 쓸데없이 길고발암가족은 도대체 왜 나오는지 모르겠다민폐만 존나 흩뿌리면서 왜 끝까지 살아남아서 더 발암을 일으키냐주인공들도 뇌 뺀 캐릭터로 설정했는지조난된 발암가족 놔두면 알아서 다른 배가 구조하러 갈텐데 불법 저지르러 가는...
쥬라기 월드: 새로운 시작,네티즌,2.0,솔직히 쥬라기공원을 떠오르게 전혀 하지않네요..그냥 앞 쥬라기월드 처럼 내용은 여전히 없고 그냥 배우 연기만 좋은거 같아요; 무슨 공룡을 보여달라했더니 외계인을 만들어 놓질 않나 그리고 항상 똑같은 패턴이라 별로 실감 나지 않습니다. 이대로면 쥬라기월드의 공룡이 멸망 하기 전에 공룡영화가 먼저 멸망 할 것 같네요 ㅋㅋ
쥬라기 월드: 새로운 시작,네티즌,10.0,쥬라기 1부터 32년의 세월을 함께했다..그동안 함께 살아줘서 고맙다.
쥬라기 월드: 새로운 시작,네티즌,2.0,대학원 졸업논문급 주제를 가지고 대학생이 chat gpt를 통해 과제를 만든 듯한 영화
쥬라기 월드: 새로운 시작,네티즌,3.0,"거지발싸개 같은 전개에 살려줬더니 가방 내놓으라고 하는 가족들과 끼리끼리 만나는 인성 파탄 커플, 동료보다 처음본 가족을 더 챙기는 이상한놈 내용도 재미도 감동도 없고 왜 만든거지 싶다"
쥬라기 월드: 새로운 시작,네티즌,10.0,스토리는 기대하지 마세요 공룡 보는 재미 ㅋㅋ
쥬라기 월드: 새로운 시작,네티즌,1.0,"일단 각본을 발로 씀. 배가 섬으로 가는데 왜 바다에 처내리는거며, 공룡이 오는데 설렁설렁 걷듯이 도망가고 요한슨은 슬라이딩 액션이 끝. 무한반복. 팀 전문가처럼 말하더니 전혀 전문가가 없음. 박사가 제일 요원같다. 공룡 다리까지 만지고 놀면서 왜 총을 쏴서 피를 뽑아? 그냥 다리 처만지면서 꼽지? 이런식의 말도 안되는 스토리와 연출, 발연기 무한반복. 볼거리? 볼거리도 전혀없음. 진심 개노답"
쥬라기 월드: 새로운 시작,네티즌,2.0,어거지 연출과 어색한 연기의 향연뛰지 못하는 디렉스와 멍청한 공룡들의 공연영화를 본 우리 와이프의 한마디 “병X공룡들만 나와”
쥬라기 월드: 새로운 시작,네티즌,2.0,하....진짜 이런 졸작이..내 쥬라기공원의 좋았던 추억 돌려주세요ㅠ경치하나는 볼만합디다
쥬라기 월드: 새로운 시작,네티즌,2.0,아니 내용과 스탈이 완전 구시대 .글구 가족들은 바로 공룡이 앞에서 공격해도 안잡히는거 너무 억지네요
쥬라기 월드: 새로운 시작,네티즌,2.0,박치기공룡의 머리 티라노의 눈 브라키오의 몸집 이건뭐 공룡영화를 sf괴물 B급영화로 만들어놨네 쥬라기공원123 쥬라기월드123보다 못함
쥬라기 월드: 새로운 시작,네티즌,1.0,이걸 보라고 만들었냐?
쥬라기 월드: 새로운 시작,네티즌,2.0,초반에 보다가 나갈까 생각이 들었음
쥬라기 월드: 새로운 시작,네티즌,1.0,3개 중에 2개 찾았다고 했을 때 아 아직 하나나 더 남았느냐는 생각밖에 들지 않음
쥬라기 월드: 새로운 시작,네티즌,3.0,"내 쥬라기공원, 쥬라기월드 돌려줘.... 공감이 잔혀 안되던 영화.."
쥬라기 월드: 새로운 시작,네티즌,2.0,낚였네요. 지질한 화질에 유전자변형 공룡... 3류 시간때우기 영화.. 엘리베이트 옆에 사람 쥬라기영화중 최악..저도 공감합니다.슈퍼맨은 재밌을라나ㅠㅠ
쥬라기 월드: 새로운 시작,네티즌,1.0,"그냥 망한영화.올드팬들은 특히나 보지마세요.시리즈 대표공룡은 티렉스와 랩터는 왜 나왔는지조차 모르겠고, 새로운 친구들은 디자인부터 개연성이나 압도감 다 망했습니다.영화 자체로만 봐도 하급 클리셰에 스토리라인은 뻔한데다가 초반서사는 억지로 넣은 것 마냥 어색합니다. 최악인 건 장면마다 연기랑 상황이 매칭이 안되서 억지공감조차 안됩니다."
쥬라기 월드: 새로운 시작,네티즌,1.0,쥬라기 공원 시리즈 관짝에 박히는마지막 못
쥬라기 월드: 새로운 시작,네티즌,1.0,새로운(몰락의) 시작...진짜 역대급이네요.. 이게 영..화?? 다신 쥬라기 시리즈찍지마세요.;;
쥬라기 월드: 새로운 시작,네티즌,4.0,상영시간 동안 시간 체크를 여러번 했네요. 뭔가 급하게 만든 작품 같습니다. 요한슨 누님 고생하셨습니다.
쥬라기 월드: 새로운 시작,네티즌,2.0,완전 재미 없음.. 공룡인가.. 돌연변이는 무슨 에어리언에 나오는 애 같고.. 아 돈 아깝다
쥬라기 월드: 새로운 시작,네티즌,2.0,3편보다재미없고스토리도 별로
쥬라기 월드: 새로운 시작,네티즌,1.0,역대 최악의 쥬라기 시리즈 갱신.. 안타깝다 ㅠㅠ
쥬라기 월드: 새로운 시작,네티즌,1.0,이거 볼 시간에 점박이나 보러갑니다
쥬라기 월드: 새로운 시작,네티즌,10.0,재밌는데? ㅋㅋㅋㅋ뭐가 재미없단겨
쥬라기 월드: 새로운 시작,네티즌,2.0,"에고편이 전부야,, 시간낭비 돈낭비 하지마"
쥬라기 월드: 새로운 시작,네티즌,2.0,영화가 딱 에이리언vs프레데터처럼 ㅈㄴ어두움 ㅋㅋㅋㅋ그리거 진짜 에이리언 같은놈나오는게 진짜 조금나옴
쥬라기 월드: 새로운 시작,네티즌,1.0,좋게 볼 건덕지가 없음. 보트피플은 대체 왜 넣은거냐.
쥬라기 월드: 새로운 시작,네티즌,10.0,그냥 공룡보러가라 뭘바라는거야?
쥬라기 월드: 새로운 시작,네티즌,10.0,좀 보고해라 이것들아 확마 학씨
쥬라기 월드: 새로운 시작,네티즌,2.0,보지마세요 보지말라면 보지마세요
쥬라기 월드: 새로운 시작,네티즌,2.0,"쥬라기월드의 이전 시리즈를 본적이 있는 사람이라면 이번 영화는 시작부터 끝까지 잠이 올 것이다. 이전 시리즈와 내용이 연결되지 않은 작품이기 때문에 연관성을 갖기 어려워 영화 제작자가 관객들이 이해하는데 어려움을 겪을 것이라고 생각했는지 이전 시리즈들을 오마주한 내용이 너무 많았다. 이는 매우 흥미를 떨어트리는 요소였다. 또한 영화를 이끌어가는 내용적 측면도 미흡해 영화에 몰입하기 어려웠다. 그리고 배우들의 연기, 영화 속 출연하는 캐릭터들의 서사, 캐릭터들 자체의 매력, 캐릭터들 간의 관계에서도 흥미를 유발할만한 요소를 찾기 힘들었다. 관객의 몰입을 도우려는 장치를 몇가지 확인할 수는 있었으나 이 또한 매우 부족했다. Ex)감동 서사 인류애 서사 등공룡도 매우 실망했다. 이 영화 보지말고 그냥 넷플 2개월 끊어라."
쥬라기 월드: 새로운 시작,네티즌,2.0,멍청하고 느린공룡들 스릴은 전혀없고 마지막에 유전자변형 공룡은 느려터지고 임팩트도없다 스토리도 허접함하고 캐릭터도 짜증난다
쥬라기 월드: 새로운 시작,네티즌,1.0,시간 아까운 영화아들땜시 겨우겨우 봤지만..지겨움
쥬라기 월드: 새로운 시작,네티즌,1.0,"초반 30분 졸다가 봤는데 4인 가족도 너무 짜증나고 아빠도 가만히 있는데 던컨은 왜!!! 남의 딸 구할려고 목숨 거냐!! 용병들이 돈에는 관심도 없고, 나오는 공룡들은 아무런 위협도 안 되고!! 올해 본 영화 중 최악"
쥬라기 월드: 새로운 시작,네티즌,1.0,쥬라기 시리즈 최악의 발악 눈물의 똥꼬쇼 공룡영화는 이제 멸종 10000%
쥬라기 월드: 새로운 시작,네티즌,2.0,지금 영화관인데 나갈까말까 고민 중이다..중남미 가족과 그 딸내미 남자친구...그냥 죽게 냅뒀어야 한다.
쥬라기 월드: 새로운 시작,평론가,2.0,"공룡 보기를 아이돌 보듯이 하라, <쥬라기 공원> 생태주의 에디션"
쥬라기 월드: 새로운 시작,평론가,2.0,"1편 이후 가장 무서운 티라노, 가장 다채로운 어트랙션"
쥬라기 월드: 새로운 시작,평론가,2.0,여전히 가장 무섭고 또 설레는 으뜸 테마파크
쥬라기 월드: 새로운 시작,평론가,2.0,스필버그 동산 파묘
쥬라기 월드: 새로운 시작,평론가,2.0,"사육된 공포가 끝나고, 진짜 세계가 입을 벌린다"
노이즈,실관람객,10.0,너무 무서웠음윗집에 표 끊어주고 싶다
노이즈,실관람객,10.0,사운드로 주는 공포가 무서운 영화
노이즈,실관람객,10.0,"요 몇년 사이 개봉한 한국공포영화 제일 잘 뽑힌 영화 인 듯. 다만, 스릴러 장르로 오해하고 본 관객들 중 공포영화에 내성이 없는 사람들은 당황 할 듯."
노이즈,실관람객,10.0,위아래 양옆으로 노이로제 걸리는 지옥의 사운드
노이즈,실관람객,10.0,오메.귀신나오겄네.. 층간소음문제 요즘이렇게큰 문제여..예쁘니 여주인공이 미쳐뿐네..
노이즈,실관람객,10.0,다들 시끄럽다 힘들다 하는데 그게 공포고 스릴러 아닌가? 보고 나서 개무서웠는데 힘든게 당연하죠
노이즈,실관람객,10.0,최근 개봉한 공포영화들에 비하면 괜찮은 편 너무 무서워여
노이즈,실관람객,10.0,사운드로 주는 공포가 무서운 영화입니다
노이즈,실관람객,10.0,배우분들 연기 겁나 잘함 몰입감 장난 아님 깝툭튀 몇번 있고 스릴러+공포 무서움 꼭 보세요!
노이즈,실관람객,7.0,너무나 잘들리는 아파트 시공시가 꼭 봐야 될 영화
노이즈,실관람객,10.0,"현대인들을 위협하는 일상 속 최악의 공포, 층간소음"
노이즈,실관람객,10.0,감사합니다 잘봤습니다
노이즈,실관람객,10.0,마지막까지 오싹하네요
노이즈,실관람객,10.0,영화 잘 봤습니다 재밌네요
노이즈,실관람객,1.0,"능력 없는 낚시꾼이 떡밥만 잔뜩 뿌린채 단 한마리의 고기도 잡지 못한 영화. 이선빈도 스토리 이해안가서 연기하기 힘들었을듯. 평점이 비정상적으로 높아서 1점으로 보정함. 이 영화 좋다고 9, 10점 남발하는 사람들은 딱 세 종류임. 1.'영화관계자(친인척포..."
노이즈,실관람객,8.0,사운드에 신경 쓴듯한 영화로 연출 연기 영상 분위기까지 어우러져 쫄리면서 봤다
노이즈,실관람객,10.0,너무 재밌게봤어요 최근 본 공포영화중 최고!
노이즈,실관람객,10.0,사운드 빵빵하고 보는 내내 긴장하면서 재밌게 봤어요 ! 연기도 대박
노이즈,실관람객,10.0,복도식 아파트 무서워요 ㅠㅠㅠㅠ사운드가 주는 공포감이 장난아니에요..
노이즈,실관람객,1.0,이게 대체 뭔내용인지 모르겠음 ㄹㅇ 김치찌개마카롱임 떡밥 회수도 전혀 안되고 결과에 대한 원인도 안나오고 모든게 의문투성이로 끝남 결말도 왜 그런지 모르겠음
노이즈,실관람객,4.0,"미스터리한 초반, 힘빠지는 중반, 엉성한 후반."
노이즈,실관람객,10.0,배우들이 연기 때문에 더 소름!! 너무 재미있게 봤어요
노이즈,실관람객,10.0,감사합니다 잘봤습니다
노이즈,실관람객,9.0,오래되 보이는 복도식 아파트가 늦은 밤에 아무도 없을때는 정말 오싹한 기분이 드는거 같네요. 왠지 복도 끝에 누가 있을것만 같다는 생각이...
노이즈,실관람객,10.0,스릴러라고해서 보러갔는데 걍공포물이네요최근에 본 공포영화중에 제일 무섭고 재밌었음
노이즈,실관람객,6.0,스릴러로 알고 봤는데 너무 공포잖아..
노이즈,실관람객,10.0,오랜만에 공포 여행 제대로네요.너무 무서워서 화장실도 못갈꺼같아요ㅠㅠ무서워도 여름엔 역시 공포영화네요!!
노이즈,실관람객,10.0,"아,, 소리 아직도 생생하게 생각남,,ㅠㅠㅠ배우들 연기 장난아님"
노이즈,실관람객,9.0,그냥 공포영화임 개무서워서 눈 반쯤 뜨고 봄아무 기대없이 봤는데 끝나고 남친이랑 스토리 해석해보니 다시 한번 소름이.... 근데 나처럼 이명 있는 사람들은 중간중간 삐소리 들으면 견디기 힘들수도..그거빼곤 스토리+사운드가 긴장감있어서 갠찮음 그리고 생각보다 영화사운드가 엄청 컸고 그만큼 심장도 같이 쪼그라드는..
노이즈,실관람객,10.0,올여름 공포영화 중에 최고...! 진짜 무서워요ㅠㅠㅠ
노이즈,네티즌,10.0,이선빈 연기 메쳣다... 층간소음이 이렇게 무섭습니다요.. 조용히 좀 사세요...
노이즈,네티즌,10.0,사운드 엄청 신경 썼는지 돌비 관에서 보고 왔는데 나까지 스트레스ㅠ 우리 윗집 사람들도 좀 보고 느끼는 게 있었으면 ㅎㅎ.. 영화 자체는 러닝타임도 짧고 해서 킬링 타임용으로 갠춘
노이즈,네티즌,10.0,영화 노이즈 재미있어요~
노이즈,네티즌,10.0,층간 소음때문에 맘 고생했던 경험이 있어서 그런가 더 몰입되고 스트레스 받았음ㅠㅠ 특히 사운드가 너무 공포스럽고 신경쓰여..
노이즈,네티즌,10.0,내 귀 돌려줘... 너무 무섭잖아... 아 류경수 배우님 흥하세요ㅠ_ㅠ짧지만 최고였다
노이즈,네티즌,10.0,현실에서 있을법한 일이라는 생각이 들어서 더 소름 끼쳤던것 같아요 특히 소리가 너무 무서워서 깜짝 깜짝 놀래요ㅠㅠ
노이즈,네티즌,10.0,사운드가 미챴음 ㅜㅜㅜ 개무섭거 잼남
노이즈,네티즌,10.0,이선빈 이런 연기도 하는구나 뭔가 새로웠음
노이즈,네티즌,10.0,분위기가 계속 쎄 해서 긴장감이 장난 아니었음.층간소음이라는 설정도 현실적이라 더 몰입됐고 보는 내내 불편하게 만드는 연출이 진짜 잘 살린듯배우들도 다 연기 잘해서 누가 믿을 만한 사람인지 계속 헷갈림.후반부로 갈수록 몰입 쩔고 반전도 있어서 시간 순삭됐다.딱 영화끝나고 집가면 윗집 발소리 들리면 괜히 무서워지고 괜히 나도 층간소음 조심하게됨.... 스릴러 좋아하면 꼭 보길 추천함.
노이즈,네티즌,10.0,"이선빈 연기력 너무 좋았음,, 무엇보다 층간소음이라는 현실 공포 소재 덕분에 더 무섭고 몰입됐던 거 같음 ㅠ 올여름 영화로 노이즈 추천~!~!"
노이즈,네티즌,10.0,끝까지몰입되는탄탄하고뛰어난영화!!!!많은사람들이보고이감상을같이느껴보기를!!!
노이즈,네티즌,10.0,공포 좋아해서 개봉하는 호러 영화는 다 보는 편인데 오랜만에 수작이 나온 것 같다
노이즈,네티즌,10.0,와 간만에 발암없이 재밌게봤네
노이즈,네티즌,10.0,시나리오와 적절한 공포물 배치가 인상적이었습니다. 배우분들 연기도 어색하지 않고 몰입하기 좋았어요.
노이즈,네티즌,10.0,진짜 개 무섭다 간만에 공포영화다운 공포를 느꼇다
노이즈,네티즌,10.0,간만에 잘 만든 공포영화 나왔다.. 층간소음 문제 답게 사운드를 너무 잘 씀 무조건 영화관에서 봐야함ㅠㅠ 가짜 무서움 공포영화랑은 다르다 진짜 무서워서 오늘 잠은 다 잤다..
노이즈,네티즌,10.0,스릴러로 시작해서 호러까지 장악하네요! 웰메이드 호러 한편 나온듯!
노이즈,네티즌,10.0,704호 사는사람 어떻게 하라규ㅜㅜ???!!!일단 이선빈 연기가 미쳤음 믿고보는 이선빈....
노이즈,네티즌,10.0,그냥미침 꼭 보세요 진짜
노이즈,네티즌,10.0,"굉장히 재밌게 봄! 확실히 공포영화에서는 사운드가 가장 중요한 듯. 이외에도 연출, 연기, 스토리 다 좋았음."
노이즈,평론가,10.0,정교한 사운드 연출부터 넘쳐흐르는 야심까지 모든 것을 응원하고 싶은
노이즈,평론가,10.0,현실과 초현실의 하이브리드 호러
F1 더 무비,실관람객,9.0,"저렇게 살고, 저렇게 죽고싶게 만드는 것. 만가지 미학과 이론에 선행하는 영화적 감동의 본령."
F1 더 무비,실관람객,10.0,"땅건 사운드 미쳤습니다. 상영관 바닥도 울려버리네요. 이건 꼭 극장에서, 그것도 아이맥스, 돌비, 광음과 같은 특별관에서 보셔야 합니다! 출력이... 와....대박"
F1 더 무비,실관람객,8.0,우스만 뎀벨레 명품연기 잘 봤습니다.챔피언스리그 우승 축하드리고 축구와 연기 두마리 토끼 모두 잡았네요.
F1 더 무비,실관람객,10.0,"F1 쥐뿔도 모르지만 빵형 하나 때문에 아이맥스로 봤습니다. 근데.. 그 안에 녹아있는 드라이버들의 노력, 팀원들의 환상적인 팀웍과 노고, F1만의 전술, 그리고 타이어의 중요성까지. F1 뽕 제대로 차며 정말 오랜만에 심장 뛰는 영화를 봤습니다."
F1 더 무비,실관람객,9.0,"스토리는 살짝 아쉽긴하지만 연출,cg 이런건 압도적이다. 내가 직접 레이싱 하는느낌도 있고 시원시원함"
F1 더 무비,실관람객,9.0,폭발하는 도파민과 압도적인 ‘카’타르시스
F1 더 무비,실관람객,10.0,레이싱 장면이 체감상 90퍼센트처럼 느껴지기에 아이맥스나 돌비 추천. 음악도 잘 나와서 눈과 귀 다 즐거움. 그리고 브래드피트 왜 이렇게 멋있냐
F1 더 무비,실관람객,9.0,헤리케인도 라라랜드에서 연기 잘 하던데 뎀벨레도 꿀리지 않네요. 광음시네마로 생생한 현장감 느끼며 끝내주는 음악과 소울을 울리고 왔네요.
F1 더 무비,실관람객,7.0,낭만과 멋을 아는 올드스쿨 형님들.
F1 더 무비,실관람객,10.0,"f1 팬으로서 이런 영화 만들어줘서 고맙습니다,,"
F1 더 무비,실관람객,9.0,극장이 존재해야 하는 이유
F1 더 무비,실관람객,10.0,나도 2시간 반동안 F1 시트에 앉았다.
F1 더 무비,실관람객,10.0,탑 건이후로 가장 만족.처음으로 네이버에 별점남깁니다.
F1 더 무비,실관람객,7.0,'그' 순간에는 음악조차 필요 없었다
F1 더 무비,실관람객,10.0,극장에서 보는걸 강추!!영화보고 뽕에 취해엑셀 밟는건 주의!!안전운전하세요~
F1 더 무비,실관람객,10.0,뜨거운게 뭔지 아는 영화
F1 더 무비,실관람객,10.0,뭐이런 영화가…이건 꼭 영화관에서 봐야돼….
F1 더 무비,실관람객,10.0,흥미진진해요 도파민터지고 졸려죽겠다는 신랑 끌고갔더니 좋아죽네요
F1 더 무비,실관람객,9.0,인물 간의 깊은 서사는 조금 부족할지라도 레이싱의 심장 떨리는 그 긴장과 전율은 놀랍도록 극적으로 표현했기에 시간 가는 줄 모르고 재밌게 봤음. 돈값은 충분히 하는 충실한 팝콘무비였음! 마지막엔 뻔할지몰라도 나는 찡하고 감동적이었음
F1 더 무비,실관람객,7.0,한계를 돌파하는 순간의 고요함과 폭발을 담았다.
F1 더 무비,네티즌,10.0,개쩌는 전율의 드라이빙
F1 더 무비,네티즌,10.0,이정도면 자동차 경주에서 최고로 보여줄건 다 보여준거다..스피드감이나 엔진음도 충분하다.
F1 더 무비,네티즌,10.0,그냥 ㅈㄴ 올해 가장 sexy한 영화.
F1 더 무비,네티즌,10.0,올해 최고영화 특히 사운드 미친듯 너무 감동 입니다
F1 더 무비,네티즌,10.0,최고 아이맥스로 봐야함
F1 더 무비,네티즌,8.0,F1 팬이라면 한번쯔음은 볼만한영화~F1을 알면 오글 F1을 모르면 그냥 액션영화리카도가 없는 아쉬운 한편 ~
F1 더 무비,네티즌,7.0,오글거림과 느끼함이 있지만 F1팬이라면 한 번쯤은 보는것도 나쁘지 않다. 말도 안 되고 억지스러운 장면은 제치고.. 레이싱 보는 재미는 있다. 물론 자신이 F1을 잘 안다면 불편하거나 말도 안 되어서 헛웃음 나오는 장면이 있을 수 있지만 판타지 영화라 생각하면 ...
F1 더 무비,네티즌,10.0,극장관람을 꼭 추천드립니다
F1 더 무비,네티즌,8.0,영상효과나 음악은 좋았으나 연출적으로 빈약한 느낌이 강했습니다... 특히 싸우자! 하면서 책상 치는 거는 좀 많이 오글거렸습니다...
F1 더 무비,네티즌,7.0,"그 속도와 굉음은 매우 훌륭, 이야기는 평범하지만 오히려 그런 평범함이 특별함을 돋보이게 한다"
F1 더 무비,네티즌,10.0,전직 레이서다. 내가 본 레이싱 영화중에 최고다. 꼭 4d로 보기를 추천한다.
F1 더 무비,네티즌,10.0,내 인생 최고의 영화! 탑건보다 더한 감동!!
