제목,작성자유형,평점,리뷰
킹 오브 킹스,네티즌,5.0,이병헌의 더빙과 북미 흥행으로 한번 봤습니다기독교인 어린이용 애니메이션이라고 생각하면 괜찮은것 같네요무교 성인이 보기엔 볼만한 요소가 없습니다제가 본 상영관은 장년층이 많았는데 많이들 눈물을 흘리셨습니다. 이해가 안갔습니다…
킹 오브 킹스,네티즌,10.0,"예수님의 사랑을 가득 느낄 수 있는 작품!영화 속 내용 중 어린아이와 아버지의 관계가 점점 회복되어져 가는 것과 같이 우리를 죽음으로부터 건져내신 예수님의 사랑으로 우리도 또한 회복되어져간다는 메세지 즉, 감동과 깊은 울림을 주는 영화"
킹 오브 킹스,네티즌,10.0,"세상에 빛줄기. 회개와 감사. 폭풍감동. 폭력ㆍ선정적ㆍ동성애ㆍ이기주의가 난무하는 혼잡한 세상에 다시 하나님 질서와 복음, 헌신을 체험하는 깔끔하고 웅장한 영상과 사운드. 악마를 따르는 귀신이 아니라면, 인간이라면 반드시 보아야한다. 희망을 놓지 않으리. 하나님 믿고 사랑합니다. 예수님 목자님 따릅니다."
킹 오브 킹스,네티즌,10.0,"사랑하는 자녀에게 bedtime story 들려주듯,말씀 속으로 쏘-옥 들어갈 몰입감! 예수님의 탄생부터 부활까지 정말 쉽게 표현되었다 교회학교 아이들에게 설교해왔던 주된 성경 이야기들을시각적으로 더욱 잘 이해할 수 있게 표현되어서 아이들에게 꼭 보여주고 싶었다! 백문이 불여일견!특히 예수님의 시선은 언제나 낮은 곳으로 향하며 약자를 도와주고 계셨고 그분의 다정한 눈빛이 기억에 남는다.그리고 찰스 디킨스가 변화하는 모습에서아들 윌터의 눈에는 그가 예수님처럼 보인 것처럼, 나 또한 예수님을 닮아가기 위해 자기를 부인할 것을 되새겨 보게 되었다. 이 영화를 통해서 모두가 예수님에 대해서 오해없이 제대로 알게 되고, 더 궁금해졌으면 좋겠다"
킹 오브 킹스,네티즌,10.0,"기독교인이어서를 떠나 감독을 꿈꾸고 전공하는 학생으로서 짜임새 좋고, 돈 내고 볼 만한 가치는 있는 영화라고 생각합니다. 단순히 기독교 영화이기에 평가가 저하되어서는 안 된다고 생각합니다 감독님 수고하셨습니다"
킹 오브 킹스,네티즌,10.0,"7살 아들도 70대 할아버지도 모두가 이해 가능한 스토리 재미있는 설교로 들었던 것들이 기억난 7살은 마지막에 가장 기억에 남는게 뭐냐 물어보더라구요 자긴 십자가였다고, 중요한 메세지들을 꾹꾹 눌어 담으시느라 고생하셨어요♡ 자막도 보고 더빙도 보고 더 많이 오래 상영을 안하는게 아쉽습니다 너무 너무요"
킹 오브 킹스,네티즌,10.0,웰메이드 기독교 영화. 성경 이야기를 각색없이 그대로 전달하려고 한 노력이 돋보였다.
킹 오브 킹스,네티즌,9.0,"불교신자입니다.패션오브크라이스트 영화를 볼 정도로는 예수에 대해 관심이 많아요.애니메이션으로 연출된다길래 예수 주제로 어린이들에게 어떤 식의 가치관을 뿜어내는지 유심히 봤어요.이병헌 목소리로 보고 듣고 싶어서 우리나라 더빙버전으로 관람했구요.영화보면서 다소의 허무맹랑한 애기도 있다고 생각했지만, 뭐 그리스로마신화 지하감옥도 실제 장소적배경으로 있으니까요.십자가에 못박혀 죽었기에 예수가 대단한건 아니라고 생각했어요.성경이 깨알같이 입바른 말들로 가득하기에 예수가 대단한 것도 아니라고 생각했어요.하나님 아들이 맞았다고는 생각합니다."
킹 오브 킹스,네티즌,10.0,영화가 끝난 뒤에도 감동과 여운이 남아 계속 앉아 있었어요. 더빙으로 봐도 괜찮은데 자막으로도 한 번 더 보고 싶네요.
킹 오브 킹스,네티즌,4.0,스토리텔링이 너무 단순한 나열형이라 아쉬웠음. 큰 예산을 쓰는데 다 아는 얘기를 잘 구성했더라면 좋았을 걸. 씬의 호흡과 디테일도 좀 아쉬웠고. 최근 수작인 드래곤 길들이기 보다가 비교할 건 아니지만 그래도 10년간 고생해서 만든 열정에 박수를 보냅니다.
킹 오브 킹스,네티즌,10.0,연령에 관계없이 쉽게 접할수 있을것같습니다
킹 오브 킹스,네티즌,10.0,예수님을 믿은지 얼마되지 않았거나 non -크리스챤들보다는 믿음생활 오래된 사람들이 보기에 좋은 영화인듯 합니다 예를 들면 예수님이 십자가에서 못박혀 죽은뒤 천지가 진동하고 휘장이 위에서 아래로 찢어지는 영상부분이 압권이었는데 이해 못하거나 놓친 관객들이 많을 듯 합니다.
킹 오브 킹스,네티즌,10.0,"종교를 떠나, 우리가 쓰는 달력의 기준이 된 예수님은 역사적으로 실존했던 중요한 인물이죠.예수님에 대해 궁금하지만 성경이나 다른 책을 통해 알아가기 주저했던 분들에게, 이 영화는 좋은 대안이 될 것 같아요.애니메이션으로 쉽고 편안하게 예수님의 일생을 따라갈 수 있어, 역사적 인물로서의 예수님을 알아가기에도 아주 좋은 역사 교육 자료입니다.추천합니다."
킹 오브 킹스,네티즌,10.0,감동 감동 감동 입니다~~~
킹 오브 킹스,네티즌,10.0,"하나님이 진짜 있는지, 가족 친구가 말하는 예수님에 대해 알고 싶은 분이 있다면, 강추합니다"
킹 오브 킹스,네티즌,10.0,연출이랑 영상미가 엄청났어요. 스토리는 이미 갓벽
킹 오브 킹스,네티즌,10.0,모두가 들어야 할 이야기
킹 오브 킹스,네티즌,6.0,360억제작비라는말에애니메이션 이지만 기대를 너무많이하고 봐서그런지 졸다가옴이건 어른들보다 어린이용~
킹 오브 킹스,네티즌,6.0,자막편 봤는데 솔직히 신자로서 관람하긴 했지만 비 그리스도인이 보면 유치하거나 기독교 교육 영상용으로 느껴질듯 신자인 나도 중간에 졸았음
킹 오브 킹스,네티즌,1.0,크리스천들은 보면 괜찮게 볼수있을듯 나는 무교라 노잼이었음
킹 오브 킹스,네티즌,10.0,올해 본 최고의 영화! 가족들 친구들 소중한 사람들과 보기 너무 좋아요. 요즘 보기 드문 가슴 따뜻해지는 애니메이션입니다. 더빙판으로 봤는데 너무 좋았어요.연출도 뛰어나고 세계적으로 히트를 쳤다고 하는데 우리나라에서 만든 웰메이드 애니메이션이라 더 자부심이 느껴집니다!
킹 오브 킹스,네티즌,10.0,왜 재밌지?왜 재밌지?왜 재밌지?왜 재밌지?왜 재밌지?왜 재밌지?왜 재밌지?왜 재밌지?왜 재밌지?왜 재밌지?왜 재밌지?왜 재밌지?왜 재밌지?왜 재밌지?좀 유치할것 같았는데 재밌게봐서 자존심상함
킹 오브 킹스,네티즌,10.0,우리나라 만화영화 수준이 정말 높아졌다고 실감했습니다 외국자본으로 투자받았으면 판권이 넘어갔을텐데 끝까지 인내로 저희나라 작품으로 남겨주신 감독님께 감사드립니다!!
킹 오브 킹스,네티즌,10.0,찰스디킨스가 아들 월터에게 들려준 왕의 이야기. 이미 성경을 알고 있는 사람보다 모르는 사람에게 더 좋을 웰메이드 애니메이션
킹 오브 킹스,네티즌,10.0,세계 어디에 내놔도 자랑스러울 애니메이션 영화~!!아이들에게 보여주고 싶은 영화영상미도 멋져요~!!
킹 오브 킹스,네티즌,10.0,뚱냥이 윌리 너무 귀여움♥물 위를 걸어오시는 장면 봐도 봐도 또 보고싶음~~
킹 오브 킹스,네티즌,10.0,종교와 상관없이 보면좋을것같아요~~가족끼리봐도좋아요~
킹 오브 킹스,네티즌,10.0,"어릴 적 들었던 찬송가가 떠올랐습니다.“단비를 내리시듯, 새생명 주옵소서.”예수님의 모습이 그 가사처럼 조용히, 깊게 다가왔습니다.영상미와 음악도 인상적이었고,무엇보다 어린아이의 시선으로 이야기를 따라갈 수 있어 더 깊이 몰입할 수 있었습니다."
킹 오브 킹스,네티즌,10.0,어린 아이와 보기 좋은 영화
킹 오브 킹스,네티즌,10.0,모든분들이 보셨으면 좋겠습니다.:)
킹 오브 킹스,네티즌,10.0,사실에 바탕을 기준으로 아이의 시선으로 바라 본 예수 그리스도의 생애
킹 오브 킹스,네티즌,10.0,정말 강추합니다. 영상이 주는 힘을 다시 한번 느꼈어요. 예수님의 삶이 입체적으로 확 와닿아요. 진짜 왕이신 그리스도를 찬양합니다.
킹 오브 킹스,네티즌,10.0,아는 내용인데도 눈물이 나네요
킹 오브 킹스,네티즌,10.0,너무나 감동적이고 또 보고싶은 영화입니다!
킹 오브 킹스,네티즌,10.0,잘만든 영화..성공한 이유를 알겠네요
킹 오브 킹스,네티즌,1.0,"이 영화를 보고 감동을 받을 수 있다니... 종교적인 이야기라 비판을 하는게 아님. 이걸 10년동안 걸쳐서 기획하고 투자받고 만들었다니. 믿을 수가 없다. 우리가 너무나 잘 알고 있는 이야기에 뭔가 새로움은 없고, 지루한 스토리, 그저 예수님 이름 팔아서 장사하는 느낌.찰스 디킨스의 이야기가 극의 전개를 흐트러트림. 잼있다고 찬양하는 사람들. 정말 재미있었는지 하나님 걸고 말하시길... 그냥 덮어두고 재미있고 훌륭한 작품이라고 말한다면 당신들은 당신들 본인의 마음 부정하는 것이고 거짓말 하는거임.이러니 종교계가 발전이 없지. 누군가는 이러겠지? 예수님을 몰라서 그래? 그렇다면 당신들의 눈을 가리고 있는 것이 무엇인지 봐야함. 나는 성경의 스토리는 너무나 대단한 스토리라고 생각함. 하지만 이작품은 그걸 갈기 갈기 찟어서 막 흐트러 놓은 작품 같음. 영화라고 말하기도 아까운 이 영화는 교회에서 시청각 자료로 짤라서 쓰면 딱 좋을 정도의 내용임.모두다 솔직해지시길 바람. 영화는 영화고 종교는 종교임. 이 영화가 별로라고 종교를 부정하는게 아님. 그냥 영화의 스토리나 전개가 엉성하다는 것은 비난해야하면 비난해야함. 스토리 전개가 엉성한걸 가지고 성우가 별로였다는 소리로 이 지루함을 이겨볼려고 하는데 그거 너무 눈가리고 아웅하는거 아닌가?정말 중간중간 극장에서 뛰쳐 나오고 싶었지만 같이 보러 간 사람을 보면 꾹 참음.나는 솔직히 이영화보다 리뷰를 보면 더 놀랐다. 예전에 모가수가 음주운전으로 사회에 지탄을 받을 때, 그 팬들이 덮어두고 감싸주는 일이 있었다. 지금 이 영화를 보고 극찬하는 당신들의 모습과 무엇이 다른가. 영화가 재미없다는 소리가 예수님의 이야기가 재미없다는 이야기와는 다른 것인데 종교를 믿는 사람이라면 영화를 진실된 눈으로 보라. 그리고 자신에게 되물어라 나의 말이 하나님앞에 한점 부끄럼이 없는 것인지 아닌지.작화나 채색은 좋았다, 영화는 그걸로 끝은 아니기에 평점은 1점"
킹 오브 킹스,네티즌,10.0,그리스도교에 대해선 전혀 몰랐지만 정말 재밌게 봤어요!
킹 오브 킹스,네티즌,10.0,시사회에서 봤는데 무교인 나도 몰입하면서 봄 아이들과 함께 보기 좋은 가족영화
킹 오브 킹스,네티즌,10.0,오래도록 소장하고 싶은 애니..종교를 떠나 사랑을 의미로 본다면누구도 감동받지 못할 이유가 없는멋진 작품입니다..
킹 오브 킹스,네티즌,10.0,기독교이든 아니든 이기적인 이시대의 참사랑이무엇인지를 깨닳게 해주는 영화
킹 오브 킹스,네티즌,10.0,"생각했던거 보다 훨씬 좋았음.. 스토리도 좋고, 그래픽도 아주좋음."
킹 오브 킹스,네티즌,10.0,기독교인들의 초심을 잡게 해주는 따뜻한 영화
킹 오브 킹스,네티즌,10.0,정말 감동적인 영화였습니다 ㅜ
킹 오브 킹스,네티즌,10.0,이 영화 모르는사람 없게해주세요.감동이며 마음이 따뜻해지는 영화
킹 오브 킹스,네티즌,10.0,성경에 나와 있는 스토리를 영상으로 볼 수 있어 좋았고~~^^감동적이예요초등 아이와 잘 보았습니다.
킹 오브 킹스,네티즌,10.0,이런 영화를 만들어주셔서 감사해요 많은 사람들이 가족과 함께 보면 정말 좋겠네요 ^^
킹 오브 킹스,네티즌,10.0,디즈니에서 만든줄 알았는데 우리나라 기술이라니..대박입니다. 스토리도 구성도 완벽하고 감동도 있어요! 꼭 보시길 추천드립니다~~!
킹 오브 킹스,네티즌,10.0,아이와 함께 눈물을 닦았네요 더많은 예수님 이야기가 나오면좋겠습니다. 화이팅!!
킹 오브 킹스,네티즌,10.0,연출과 영상이 돋보임 신선한 전달이 느껴짐
킹 오브 킹스,네티즌,10.0,예수님의 메시야이심을 충실하게 표현하고 그 복음을 오늘의 나와 연결하는 멋진 영화였습니다.
킹 오브 킹스,네티즌,10.0,"생각보다 괜찮았음, 고양이도 넘 귀엽고."
킹 오브 킹스,네티즌,10.0,애니메이션 자체로도 훌륭했음
킹 오브 킹스,네티즌,10.0,"내가 살게 된것, 그리고 누군가를 붙들어 주는 삶을 살고 있는것이 이 예수 때문었구나 를 깨닫고 오열하였습니다"
킹 오브 킹스,네티즌,10.0,영상미도 좋고 보는 내내 감동이 밀려왔음
킹 오브 킹스,네티즌,10.0,아이들과 함께 보며 정말 많은 감동을 받았습니다! 좋은 영화를 만들어 주셔서 감사합니다^^
킹 오브 킹스,네티즌,10.0,인물 표현도 영상미도 너무 좋었던 애니매이션이었어요 ! 우리나라 최고의 애니메이션이었어요
킹 오브 킹스,네티즌,10.0,꼭 가족과 함께 보시면 좋겠습니다
킹 오브 킹스,네티즌,6.0,오늘 보고 왔습니다.솔직한 얘기로 실망스러운 내용이었습니다.어린 아이들 대상으로 예수님을 알게 해 주는 목적이라면 모를까 영화적으로는 기대에 많이 못미치는 작품이었습니다.
킹 오브 킹스,네티즌,1.0,개노잼임 제발 보지마세요
킹 오브 킹스,네티즌,6.0,중간중간에 어디까지 했더라 라는 대사가 너무 많이 나와요 . 한두번이 였음 좋았을걸 그리고 아이설정이 너무 어림. 유치원생이다보니 보는 동안에 살짝 유치하고 차라리 12살13살 정도 였으면 차분한 느낌이였을듯... 기대한만큼 아쉬움이 많이 남네요.
킹 오브 킹스,네티즌,10.0,성경기반한 내용이 잔잔하게 시처럼 아름다웠습니다~! 영상미도 너무좋았고 요즘 자극적인 콘텐츠가 범람하는시대에 예수님 영화라니 너무행복합니다 감사합니다
킹 오브 킹스,네티즌,10.0,엔딩크레딧에 올라가는 많은 한국이름들이 자랑스러웠습니다 영상도 사운드도 너무 좋아요!
킹 오브 킹스,네티즌,10.0,종교이야기 이지만 누구나 볼수있는 아름다운 이야기로 아이들과 함께 보면 좋아요
킹 오브 킹스,네티즌,10.0,정말 스토리 탄탄하네요. 제가 봤던 기독 영화 중에 최곱니다. 성격 이야기를 정말 포인트 잘 전달했습니다. 감독님 감사합니다.
킹 오브 킹스,네티즌,10.0,이걸 우리나라에서 만들었다구? 레알? .... 한국인이라서 감사했습니다. 진심으로 감사합니다
킹 오브 킹스,네티즌,10.0,재밌기만하구만 기독교인사람이고아니고봐야함
킹 오브 킹스,네티즌,10.0,예수님 이야기를 재밌게 잘 풀어냈어요
킹 오브 킹스,네티즌,10.0,"이린이들이 보는 만화수준으로 생각했는데, 오히려 성인들이 볼만한 영상과 감동이 있는 놀라운 영화입니다. 한 번더 보고 싶은 영화네요."
킹 오브 킹스,네티즌,10.0,최고의 영화! “어린왕자”와 같이 자신의 상황과 내면의 성장도에 따라 전혀 다르게 다가오는 작품. 어릴때 봤다면 5년에 한번씩 다시보면 또 다르게 아주 새롭게 다가올 작품.
킹 오브 킹스,네티즌,1.0,얼떨결에 보게 된 영화라 그런건가..? 그냥 전 개인적으로 진짜 별로 였어요 리뷰가 좀 좋은 편 인거 같은디 다 개인의 생각이 있는거겠죠!
킹 오브 킹스,네티즌,6.0,오늘 딸들과 보러 갔는데 솔직하게 선한영향 력 받으라고 보자고 했던 영화인데 ㅋㅋ 애들 눈높이엔 이해도 안되고 종교인들만 이해 되는 스토리인듯 아이들은 아빠 이게 뭔 내용임?솔직하게 너무 재미 없다고 하는데 ㅋㅋ 내 입 장엔 교훈이 될것 같아 보여 준것인데 ㅋㅋ 좀 아쉽네요...
킹 오브 킹스,네티즌,1.0,너무 내용을 요약한거같고 지루했어요.무교인이 보면 진짜 이해가 안되네요...
킹 오브 킹스,네티즌,5.0,더빙은 성우분이 하는게 진리....교회다니는 사람만 보는걸로.그림이나 음악은 좋았음
킹 오브 킹스,네티즌,6.0,"영화 속 청자(어린이)에게 딱 알맞은 완성도이고, 종교인들은 확실히 만족스럽게 볼 것 같다. 하지만 비종교인에게 산발적인 구성과 촘촘하지 않은 이야기는 다소 단조롭게 다가올 수도 있다."
킹 오브 킹스,네티즌,7.0,영화가 너무 단편적이다. 아이들을 위한 애니메이션이라고 해도 예수님의 공생에 기간이야기가 물에 발만 살짝 담구듯이 순식간에 스쳐지나간다. 무엇하나 깊게 이해 할 수 가없다. 교회에 출석도장 찍듯이 다니는 성도들은 절대 이 영화로 그리스도가 왜 이땅에 오셨고 왜 십자가에 못 박히고 부활 하셔야했는지 절대 알 수 없다. 그러므로 나는 모든 성도들이 이런 예수님의 단편적인 공생애가 담긴 영화가 아닌 성경을 직접 읽고 하나님과 그 아들 예수그리스도를 진정으로 영접했으면 좋겠다.
킹 오브 킹스,네티즌,4.0,무교라 그런가.. 보는 내내 지루했습니다ㅠㅜ초등학생 아이도 유치원생 아이도 모두 지루해했습니다저 같은 경우 어렸을땐 교회다녀봐서 아는 내용을 영화로 봐서 지루한가 싶기도하고요.. 글고 전 더빙봤는데 이병헌씨 목소리만 뭐라하는지 잘 안들려요 목소리도 혼자 너무 작고..ㅠ 여튼 저희는 별로였습니다
킹 오브 킹스,네티즌,2.0,"북미에서 흥행했다고 해서 기대하고 봤는데연출도 엉망, 서사도 엉망, 영상미는 정말 싸구려, 스토리도 진부하고 돈이 아깝습니다.나라에서 주는 쿠폰으로 할인해서 봤는데도 9천원이 아까울정도였습니다.와, 크리스쳔 주머니를 너무 우습게 보는거 아니에요?"
킹 오브 킹스,네티즌,10.0,영상퀄리티가 넘 좋네요.
킹 오브 킹스,네티즌,4.0,천주교 20년 신자입니다. 기대 하면서 봤는데 솔직히 감동도 재미도 케이팝 데몬 헌터스가 훨 재밌습니다
킹 오브 킹스,네티즌,10.0,"재밌어요. 더빙도 한번 볼까 싶네요. 기독교인으로써, 가 아는 내용이지만. 신선하게 예수님의 인생을 잘 풀었다고 생각합니다."
킹 오브 킹스,네티즌,10.0,"우리를 위해 목숨 바치신 예수님의 이야기가 모태신앙인 저에게는 어느 순간부터 당연하게 여겨졌습니다.어렸을 때부터 교육 받았기 때문에 익숙해졌던 것일지도 모르겠습니다.그러나 예수님의 일생을 영화로 보고 나니, 그 희생이 절대 당연하지 않았음을, 그 은혜에 익숙해져선 안 됨을 깨닫게 되었습니다.좋은 영화를 만들어주신 제작진 여러분께,그리고 우리 같은 죄인을 영원히 한결같이 사랑해주시는 예수님께 감사드립니다."
킹 오브 킹스,네티즌,7.0,"평이 너무 좋아서 기대에 부풀어 혼자 보고 왔어요.크리스마스 시즌 때 보면 딱 좋을 듯. 예수님의 탄생과 부활까지 낭독가 아빠가 장난꾸러기 아들에게 이아기해주는 스토리예요~아이들이 거부감없이 배우고 쉽게 받아들일 수 있게 잘 만들었네요~~더빙으로 봤는데 예수님 목소리 베드로 목소리 신관 목소리 넘 좋았어요~자막버젼의 영어목소리도 엄청난 배우들이던데, 영어버젼으로 어떻게 다를지 한번 더 보고싶긴해요~카톨릭신자지만 초반에 살짝 지루함감이 있어요~클라이막스 십자가 희생 전에 괴로워하는 예수님의 내면을 잘 그렸어요~"
킹 오브 킹스,네티즌,10.0,진정한 미디어 사역이란 이런것이다
킹 오브 킹스,네티즌,8.0,디테일도 좋고 내용도 좋고 감동적이고 예수님을 알수있다는것이 좋다
킹 오브 킹스,네티즌,10.0,"애니메이션의 quality가 아주 높습니다. 2D가 아니라 3D보는 것 같아요. 스토리도 뻔할 것 같은데 뻔하지 않고요. 더빙으로.뵜는데,.자막으로 다시 보고 싶네요"
킹 오브 킹스,네티즌,10.0,정말 감동적이었습니다
킹 오브 킹스,네티즌,10.0,"두 번 봤습니다. 같은 장면에서 눈물을 멈출 수가 없었습니다. 예수님의 그 사랑과 희생, 부활... 감사합니다. 사랑합니다."
킹 오브 킹스,네티즌,10.0,월터가 집중하는 만큼 집중 해서 본 영화
킹 오브 킹스,네티즌,1.0,"솔직히 나는 일부 기독교인들의 사고방식을 이해하기 어렵다. 자신의 뜻과 다르면 무조건 틀렸다고 여기고, 세속적인 재물이나 노력을 마치 ‘마귀’나 ‘사탄’의 유혹처럼 몰아가는 건 과장되고 이분법적인 태도로 느껴진다. 또한 예수에 대한 성역화가 지나치다고 생각되는데, 이런 절대화는 비판이나 의문조차 허용하지 않는 분위기를 만든다. 그런 면에서 보면, 북한 김돼지들을 신격화하는 주체 사상과 과연 얼마나 다른가 하는 의문도 든다."
킹 오브 킹스,네티즌,2.0,"예수그리스도에 관심이 있는 성인의 경우에는 모르겠으나, 평범한 가족이 여름철 극장에 가서 재미있게 보고 나올만한 영화는 아닙니다.(관객 절반 이상은 조는것 같았음)"
킹 오브 킹스,네티즌,6.0,고루&밋밋&지루 어캐이리 평이 좋을까? 1989년 개봉했다면 모를까
킹 오브 킹스,네티즌,1.0,역시 (주)예수 팔이는 돈이 된다
킹 오브 킹스,네티즌,10.0,너무 좋습니다. 뉴스에 흔들리지않고 직접 보시고 기도하며 결정하는 건강한 그리스도인이.되길 바랍니다.
킹 오브 킹스,네티즌,10.0,별다를수없는 내용의 애니메이션이라고 생각했으나예수님의 발자취에 동행할수있어서 너무감사했습니다
킹 오브 킹스,네티즌,10.0,"오랜 기간의 역사고증과 준비로, 당시 옷차림, 건물의 형태 등 잘 표현되었다고 들었어요.그래서인지 이미 알고 있는 성경 내용이지만 더 입체적으로 보였어요.무엇보다 이야기 하면서 진행되는 구조이면서, 듣는 아이가 이야기 속에 등장하는 연출이..!! 마치 성경의 사건이 옛 이야기가 아니라 오늘 나의 이야기라는 느낌이 들게 해주는 것 같아요. 초중등 아이들 셋과 봤는데.. 너무 좋아하고 잘보네요."
킹 오브 킹스,네티즌,10.0,"너무 잘 만들어진 영화, 아이들도 어른들도 재미있어요!"
킹 오브 킹스,네티즌,5.0,종교적 성향이 강한 애니메이션입니다. 성경에 나온 내용을 '아동'들을 위해 가감없이 이해하기 쉽게 풀어놓은 교육적 내용이랄까^^
킹 오브 킹스,네티즌,10.0,감동적인 스토리와 에니메이션 기술에 놀랐습니다. 다시 보고싶네요.
킹 오브 킹스,네티즌,10.0,현실속으로 빠져드는 느낌과 모든게 훌륭합니다 ~^^~
킹 오브 킹스,네티즌,10.0,예수님의 삶을 통해 자기 성찰을 하게 되었습니다.
킹 오브 킹스,네티즌,10.0,4대 성인 중 한분인 예수님에 대해 성경이 말하는 예수님이 누구인지를 이야기로 잘 풀어낸 애니메이션.
킹 오브 킹스,네티즌,10.0,왕중의 왕 나의 예수님사랑합니다
킹 오브 킹스,네티즌,10.0,성경 누가복음과 요한복음을 눈으로 보는듯했습니다~! 성경을 읽으며 머릿속으로 상상했던 장면들이 훨씬 더 멋지고 실감나게 표현된 것을 보면서 장면마다 감탄을 안할 수 없었고 최선의 작품을 위해 갈고닦기를 멈추지 않은 장인의 손길을 눈으로보며 그 수고에 감사한 마음도 들었습니다. 무엇보다 예수님의 눈빛… 사람을 너무 사랑하시고 불쌍히 여기시는 긍휼이 묻어나는 눈빛이 뇌리속에 깊이 남습니다~! 다음엔 한국더빙판으로 한 번 더 보려구요~^*^ 제작진분들 다시 한 번 멋진 작품 남겨주셔서 감사합니다~^*^
킹 오브 킹스,네티즌,10.0,하나님의 죄인을 향하신 사랑이 너무나도 잘 나타난 영화예요 또 보고 싶어요
킹 오브 킹스,네티즌,10.0,모든 사람이 봐야 할 쉽게 이해할 수 있는 예수님 이야기
