제목,작성자유형,평점,리뷰
노이즈,실관람객,5.0,평점 거르고 보셔야 할 듯.
노이즈,실관람객,10.0,층간소음 현실 스릴러인 줄 알았지만 에나벨 컨저링 이쪽 계열이었다는... 결말은 좀 실망스러움 무섭긴 무섭다
노이즈,실관람객,6.0,공포 스릴러의 기본은 하는 소음 소재 한국 영화. 어쩔수 없긴 하지만 사운드가 듣기 힘듦. 뒤로 갈수록 아쉬워짐.
노이즈,실관람객,1.0,평점 왜 높은지 전혀 이해가 안됨..재미도 없고 감동도 없고 내용도 없고 공포도 없고 시끄럽기만 하다 ㅋㅋㅋㅋ
노이즈,실관람객,6.0,일단 귀마개하나 챙겨가세요.
노이즈,실관람객,7.0,아파트 지하창고가 그렇게 미로일수가 있나요 ㅋㅋ
노이즈,실관람객,9.0,후반부가 다소 힘이 빠지긴했지만 근래나온 한국공포물중엔 가장 나은느낌임
노이즈,실관람객,8.0,오랜만에 몰입하면서 본 공포영화에요ㅠ 무서워요
노이즈,실관람객,2.0,개노잼. 아니 밑에 댓글중 김치찌개마카롱이라는 말이 찰떡임. 온갖거를 다 섞어놓고 결말이없음
노이즈,실관람객,3.0,층간소음으로 인한 스릴러 영화인줄 알았는데 귀신나오는 공포영화네요ㅠㅠ
노이즈,실관람객,9.0,긴장감있게 본 공포영화
노이즈,실관람객,10.0,이름이 노이즈인 이유가 있다.. 한동안 머릿속에 맴돌 것 같은 음향. 웰메이드 호러무비
노이즈,실관람객,8.0,90분 지루하지않게 끌고가는건 괜찮았음
노이즈,실관람객,10.0,진짜 진심 소리가 개미쳤음
노이즈,실관람객,6.0,나쁘지 않게 봤는데 좀 짜침
노이즈,실관람객,8.0,음...층간소음 겪어보면 이해됨 진짜...욕나오지 영화 나름 재미있게 봤는데 조금더 다듬어서 나오지 조금 아쉽지만 잘봤슈
노이즈,실관람객,6.0,아니 떡밥은 회수 해야죠..
노이즈,실관람객,6.0,아파트 층간소음을 배경으로 사운드에 비중을 높인 공포 영화였다.
노이즈,실관람객,8.0,그럭저럭..이 만한 평점을 받을 각본 연출은 아닌데 국산이라 후한건가 ㅡㅡ
노이즈,실관람객,10.0,아 간만에 무서웠네요ㅋㅋㅋ 누가 저좀 집에 데려다주실분..?
노이즈,실관람객,10.0,소리가 진짜대박 …!! 아직도 들리는 것 같은 느낌이예요
노이즈,실관람객,10.0,"""조심해야돼요. 여긴 서로 다 들리니까"""
노이즈,실관람객,10.0,별기대안하고 혼자 보러갔다가 무서워 죽을뻔 했습니다. 2013년 손현주 주연의 숨바꼭질 좋아하신 분들이라면 분명 만족하실합니다. 나름 스릴러 호러 매니아인데도.. 영화보는 내내 움찔거리고 비명이 터져나와서 혼났습니다. 참고로 40대중반 아저씨임.
노이즈,실관람객,6.0,내용보다는 소리를 잘 사용한 듯
노이즈,실관람객,10.0,소리가 아직도 생생하게 들리는거같음 ㅠㅠ 연기미쳤…
노이즈,실관람객,10.0,소리가 진짜 소름.... 아직도 무서워요 오랜만에 볼만한 공포영화 나왔네요
노이즈,실관람객,10.0,배우들 연기 ㅠㅠㅠ 진짜 대박 사운드도 찰떡
노이즈,실관람객,10.0,사운드가 한몫하는 영화..꼭 영화관 가서 봐야함..
노이즈,실관람객,10.0,무엇보다 층간소음이라는 현실 공포 소재 덕분에 더 무섭고 몰입됐던 거 같아요! 잘 봤습니다. 감사합니다!
노이즈,실관람객,7.0,소재와 공포 장르로는 충실했으나 너무 뻔하고 구시대적 스토리가 아쉬움.
노이즈,실관람객,8.0,사운드가 무서운 공포영화
노이즈,실관람객,10.0,진짜 무섭다..ㅠㅠㅠ
노이즈,실관람객,1.0,OOO기 영화평점 알바 적당히해라
노이즈,실관람객,10.0,사운드가 진짜!! 러닝타임이 이렇게 순식간인가 싶을정도로 진짜 몰입되어 보았어요!
노이즈,실관람객,4.0,사운드가 섬세하다기보다 그냥 크네요.
노이즈,실관람객,8.0,그냥 볼만해요 ! 이선빈님 연기 굿
노이즈,실관람객,10.0,제대로된 공포영화 오랜만에 나왔네요!보고 나와서 집 가는데 뒤가 오싹해요.배우들도 연기 진짜 잘하네요.
노이즈,실관람객,8.0,연기도 좋고 스토리도 볼만해요.
노이즈,실관람객,4.0,아오 층간솜 3년째인데 복창터지게잘만듬
노이즈,실관람객,8.0,시끄러워 죽겠어요 시끄러워 죽겠어요
노이즈,실관람객,7.0,20분 늘려서 개연성 보완을 했더라면 더 완성도가 높았을 것 같다
노이즈,실관람객,8.0,공포한국영화에 좋은 귀감이네요
노이즈,실관람객,5.0,"보통의 한국 공포 영화, 기대하는 그대로"
노이즈,실관람객,10.0,아니… 나 아직도 소름돋아 있네 소리가 진짜 압권인 영화
노이즈,실관람객,10.0,올 여름 진짜 시원하게 보내고싶다면 보세요
노이즈,실관람객,10.0,한수아란 배우분 처음 뵌 분인데매력있고 인상적이네요영화도 참 긴장감 있고 좋았어요
노이즈,실관람객,6.0,소음이 이렇게 무섭다.
노이즈,실관람객,7.0,연출과 연기가 살린 영화. 스토리가 좀 아쉽다
노이즈,실관람객,6.0,중구난방 소음 같은 영화
노이즈,실관람객,6.0,노이즈 Noise
노이즈,실관람객,8.0,간만에 공포영화였습니다무서웠어요
노이즈,실관람객,8.0,배우들 연기가 장난이 아니네요너무 재밌게봤어요!
노이즈,실관람객,6.0,소재가 신선했지만 크게 무섭지않았다..
노이즈,실관람객,10.0,배우들 연기가 최고였구요 아직도 소리가 생생하네요!! 몰입감 최고에요!!
노이즈,실관람객,8.0,층간소음 문제에 있어 승자는 없다는 비유를 담은 결말이었다고 생각
노이즈,실관람객,10.0,여름엔 공포 영화!라는 말이 아직까지 남아 있는 이유를 보여준 영화!재밌었습니다! 추천해요!
노이즈,실관람객,10.0,실제로 있을법한 층간소음으로 공포감이 고조에 달했어요 ㅠㅠㅠ배우 연기력으로 몰입도 잘돼고 무서운데 잘봤어요!!! 소리가 압도적이였어요!!
노이즈,실관람객,8.0,사운드가 주는 공포는 무서움을 넘어 괴로움이 느껴진다
노이즈,실관람객,6.0,초중반까지는 괜찮았는데 갈수록 내용이 이상함
노이즈,실관람객,8.0,무섭게 잘 봤습니다 추천
노이즈,실관람객,10.0,진심 ㅈㄴ무서워요 중도에 나가고싶었던 영화 처음임 여운 오래감
노이즈,실관람객,6.0,노이즈라는 제목에 맞게 사운드의 불쾌감 표현은 괜찮았는데 스토리는 좀 평범하네요 엔딩은 아쉽습니다.
노이즈,실관람객,8.0,초반에는 흥미로운 설정이었는데 뒤로 갈수록 느슨해짐.
노이즈,실관람객,4.0,생각보다 무섭진 않았지만 공포 분위기를 조성하는 건 탑중에 탑 제목에 걸맞게 소리만으로 분위기 조성은 잘했다만 스토리 면에선 깔끔하게 떨어지는 부분이 없어서 아쉽. 떡밥 회수도 부족하고 이해 안 가는 부분만 좀 여럿... 하지만 이선빈 연기는 최고였다
노이즈,실관람객,10.0,오랜만에 보는 공포스릴러너무 즐겁게 관람했습니다~
노이즈,실관람객,10.0,사운드에 압도되서 몰입감 대박 ..올 여름 최고영화입니다
노이즈,실관람객,10.0,너무 무서워요 오랜만에 제대로 공포 ㄷㄷ
노이즈,실관람객,10.0,일어날수 있는 일이라 생각하니 더 무서웠어요 여름에 딱 보면 좋을영화!!!
노이즈,실관람객,10.0,간만에 볼만한 공포영화가 나왔습니다 워후.. 일상에 흔한 층간소음을 소재로 해서 그런가 집에와서도 소름돋고 떠오르네요... ott같은거 아무리 무섭다해도 잘 보는 사람인데 영화관 사운드가 다르긴 다릅니다... 추천..
노이즈,실관람객,10.0,제목 진짜 너무 잘 지었음. 소리에 대한 공포가 진짜 엄청남. 개인적으론 공포영화는 소리가 다 한다고 생각하는데 사람들이 공포스러워하는 포인트를 진짜 잘 잡은듯ㄷㄷ오랜만에 공포영화 재밌게 봤습니다
노이즈,실관람객,10.0,어우 보고나온 지금도 무서워요..사운드가 다 한 영화ㅠㅠ무스워요ㅋㅋ
노이즈,실관람객,10.0,소리에 압도당했어요!!!! 보는내내 긴장하면서 집중하며 봤어요!!
노이즈,실관람객,10.0,심장이 쫄깃쫄깃하면서 귀가멍멍해지고 온몸에소름도 돋고 진짜 오랜만에 제대로된 공포영화봣네요 무서워요 짱!!!
노이즈,실관람객,10.0,악 소리 너무 무섭 ㅠㅠ 날도 더운데 오싹하게 영화 잘 보고 왔습니다. 오랜만에 볼만한 공포영화였던 것 같아요! 추천 x 1000
노이즈,실관람객,10.0,무서워서 눈을 조금 감고 봤어요.
노이즈,실관람객,10.0,결국 미친 사람이 제일 무서운 법.
노이즈,실관람객,2.0,영화 자체가 거대한 소음
노이즈,실관람객,7.0,매력적인호러볼만합니다.
노이즈,실관람객,7.0,분위기 조성은 탁월한데 극후반부 맥이 풀림
노이즈,실관람객,6.0,"연출과 스토리는 대충 예상가능, 최근 한국영화중 오랫만의 공포라 재미있게 봄"
노이즈,실관람객,5.0,층간소음은 진짜 공포 그자체임
노이즈,실관람객,6.0,아파트를 제대로 만들면 층간 소음이 사라질런지...
노이즈,실관람객,10.0,복도식아파트가 아니라서 다행이라고 느껴진 영화였어요.. 덜덜... 현실적인 소재였네요~
노이즈,실관람객,10.0,오랜만에 공포영화 진짜 볼만하네요~ 시원하게 감추!!
노이즈,실관람객,10.0,일상과 밀접한 느낌의 공포라 더 무서워요 익숙한 무서움ㄷㄷ
노이즈,실관람객,10.0,기대했는데 기대이상으로 재밌게봤어요배우 연기도 사운드도 .. 너무 마음졸이며봤어요올여름 이렇게 시작하네요!!!
노이즈,실관람객,10.0,와.. 소름돋으면서 봤네요 연기력 대박이구요 ㅜㅜ 무서워요 ㅠㅠ
노이즈,실관람객,10.0,층간소음을 못 느꼈던 사람들이 보시면..고통을 같이 즐길 수 있을 것 같은 영화..(OTT로 느낄 수 없는 소리가 더 무서움..)
노이즈,실관람객,10.0,등골이 서늘해요....층간소음 오늘부터 시끄러운게 아니라 너무 무서울것같아요 ㅠㅠ
노이즈,실관람객,10.0,오랜만에 볼만한 공포영화였어요!! 강추강추!!!!무섭게 봤습니다ㅎㅎ
노이즈,실관람객,10.0,배우분들 연기….진찌 대박이다 ……재밌고 무섭고
노이즈,실관람객,10.0,와 진짜 완전 간만에 재미있게 본 영화입니다! 배우들 연기도 좋고 몰입도가 미쳤어요~
노이즈,실관람객,10.0,여름은 역시!!!긴장감+스릴이죠ㅋㅋㅋ재미있게 봤습니다
노이즈,실관람객,10.0,이건 음향때문에 무조건 영화관에서 봐야 하는 영화네요!! 소리만 들어도 오싹오싹 합니다!! 소리가 귀에 맴돌아서 보고 나왔는데도 무섭네요~! 오랜만에 영화관에서 봐도 아깝지않은 작품이라 좋네요! 배우들 연기도 너무 잘해서 몰입이 더 잘됐어요~
노이즈,실관람객,9.0,공포 영화 잘 보는 편인데 간만에 엄청 무서운 영화 봤네요 사운드가 대박입니다!
노이즈,실관람객,8.0,"우리도 층간소음으로 난리도 아닌데,,괜히 무습따,,"
노이즈,실관람객,10.0,오랜만에 제대로 무서운 공포영화였어요. 찐 추천이애요
노이즈,실관람객,10.0,배우들 연기 최고!!너무 재미있음
노이즈,실관람객,10.0,"층간소음의 공포, 소름돋는 사운드까지 올 여름 대박"
노이즈,실관람객,7.0,처음으로 눈 가리는 대신 귀 막고 본 공포영화사람이 제일 무섭다
노이즈,실관람객,10.0,사운드에 진짜 많이 신경쓴거 완전 대박이에요!!완전 무서워요!!!
노이즈,실관람객,10.0,사운드가 생생해서 더 무서웠어요ㅠㅠㅠ영화를 현실감 있게 만들어서 더 몰입돼서 봤던것 같아요 !!!!사뿐사뿐 걸어야겠어요….
노이즈,실관람객,10.0,와 진짜 배우들 연기가 너무 소름 돋아요ㅜㅜㅜ!!!진짜 대박소리로 공포감 느끼는거 처음이에요ㅜㅜㅜ
노이즈,실관람객,10.0,"후,, 공포영화 너무 오랜만이라 심장이 지금까지 떨리네요,, 공포영화 좋아하시면 추천"
노이즈,실관람객,10.0,올 여름에 넘 재밌게 볼 공포물이네요 강추해요 ㅎㅎㅎ
노이즈,실관람객,10.0,배우는 진짜 아무나 하는게 아님ㅠㅠ연기력 짱...0
노이즈,실관람객,10.0,사운드가 빵빵한 영화관에서 꼭 봐야하는 영화와.. 소리가 아직도 맴돌아요..넘 무서움..오늘은 엄마랑 자야겠어요
노이즈,실관람객,10.0,배우들 연기에 소름 사운드에 소름!!! 오랜만에 긴장하며봤네요!!
노이즈,실관람객,10.0,진짜 연기 미쳤어요! 사운드도 그렇고 소름이 쫘악.. 보는 내내 긴장하면서 봐서인지 시간 가는지 몰랐어요!
노이즈,실관람객,10.0,올여름 후회없는공포 ㄷㄷㄷ 배우들 연기 소름 강추
노이즈,실관람객,10.0,진짜 오랜만에 초집중해서 봣어요 ! 이제 진짜 여름이 온거같네용 ㅋㅋㅋ 이런 스릴러 너무 좋아요 !! 남편이랑 손 꼭 잡고봣어용ㅋㅋㅋㅋ 또 보고싶어요! 연기력 굿굿
노이즈,실관람객,10.0,진짜 오랜만에 볼만한 공포영화라 너무너무 추천!!!!
노이즈,실관람객,7.0,저예산 영화지만 연출로 상당히 잘 커버했네요볼만합니다
노이즈,실관람객,7.0,층간소음과 공포를 잘 어우른듯
노이즈,실관람객,10.0,사운드도 무섭고 연출도 쫄깃하니 공포영화 답게 무서움
노이즈,실관람객,10.0,간만에 공포영화 대작 나온거 같아요 전체적으로 매우 만족합니다
노이즈,실관람객,10.0,올 여름 시원하게 보낼만한 영화에요
노이즈,실관람객,10.0,배우들 연기가 장난아니에요!!!! 완전 재미있게 봤습니다
노이즈,실관람객,10.0,나무 재밌고 긴장가득한 영화..
노이즈,실관람객,10.0,"순간 깜놀하는 부분때문에, 손에 땀이 엄청 남…;;;;"
노이즈,실관람객,10.0,아파트 단지가 배경이라 현실감있게 무서웠음ㄷㄷ 집에 못갈듯
노이즈,실관람객,10.0,오랜만에 보는 공포영환데 사운드 대박이라 더 무섭고 실감나네요 ㅜㅜ 최고
노이즈,실관람객,10.0,배우들 연기에 보다보니 흠뻑 빠졌고 사운드가 진짜 미쳤습니다.. 오랜만에 몰입해서 영화 봤어요
노이즈,실관람객,10.0,"소리진짜.... 공포영화가 소리로 이렇게 무서울수 있다는걸 경험해봤습니다~ 연기는 말할것도 없는.,, 여운이 과 소리가 아직도 맴돌아요!!"
노이즈,실관람객,10.0,배우들 연기 왜 이렇게 잘해요ㅠㅠ너무 소름 끼쳐서 꿈에 나올꺼 같아요.
노이즈,실관람객,10.0,"현실 공포로의 정체성을 유지했으면 하는 아쉬움은 있지만, 연출력으로 승부한 공포 스릴러라는 점이 대단하다"
노이즈,실관람객,10.0,와 이거 여름에 왜 안봐요? 더위 다 날라갔네..
노이즈,실관람객,7.0,소리때문에 더 무서웠어요
노이즈,실관람객,10.0,사운드가 아주.. 제대롭니다 계속 맴도는듯해서 오늘 불켜고 자려구요ㅜㅜ
노이즈,실관람객,8.0,어쩌면 아파트에 사는 괴물은 우리 자신일지도 모른다.
노이즈,실관람객,10.0,이선빈 너무 이쁘자나!!사운드 모야모야 너무 무섭자나ㅠㅠ완전 대박 오랜만에 오싹
노이즈,실관람객,7.0,"올여름 서늘하게 할 새로운 공포 영화, 청각을 자극하는 소리의 공포 신선하다!"
노이즈,실관람객,7.0,영화의 사운드로 줄 수 있는 공포감을 괜찮게 표현했던거 같다
노이즈,실관람객,8.0,재밌게 잘 보았습니다~!
노이즈,실관람객,8.0,뭔가 좀 끝이 아쉽긴 하네요
노이즈,실관람객,8.0,"왜 우리는 이렇게 힘들까? 서로가 서로를 미워하기 바쁜 현대사회, 너무나 무서운 영화지만 한 편으로 또 슬픈 영화"
노이즈,실관람객,10.0,배우들의 실감나는 연기감독의 영리한 연출이 좋았네요서늘한 영화
노이즈,실관람객,10.0,사운드 미쳤음 ...복도식 아파트에 사는데 ... 집에 못갈듯 ... 친구랑 자야할꺼같아요
노이즈,실관람객,8.0,아파트 사는데.... 겁나 무섭게 봤어요. 사윤드에 놀라서 심장 멎을뻔 ㅋㅋㅋ
노이즈,실관람객,7.0,기대없이 봤는데 전 무서웠어요
노이즈,실관람객,7.0,저녁에 봐서 그런가 무서웠어요
노이즈,실관람객,6.0,뭔가 예전 영화 불신지옥 하위호환보급형 버전 느낌임 놀라는거 좋아하는분들은 한번 볼만할듯
노이즈,실관람객,10.0,층간소음과 초자연소음이 교집합되는 '소리(노이즈)'를 매개로 현실 공포와 초자연 공포를 아우른다.
노이즈,실관람객,10.0,소리가 무서운데 재밌게 봤어요.
노이즈,실관람객,10.0,큰 기대 없이 킬링타임용으로 사촌들이랑 같이 보면 적당히 재미있게 볼만한 영화입니다 ㅎㅎ
노이즈,실관람객,8.0,현실적이라서 더 무섭게 본 영화
노이즈,실관람객,10.0,배우들 연기도 좋고 사운드가 진짜! 정말 재밌게 봤어요
노이즈,실관람객,9.0,기대 이상의 공포스릴러!
노이즈,실관람객,8.0,여름되니 공포영화 보고싶어서 봤는데 소름쫙 끼쳤어요 ㅋㅋ
노이즈,실관람객,8.0,사운드가 사람을 긴장시키는데ㅎㄷㄷ간만에 몰입해서 봣어요
노이즈,실관람객,10.0,아진짜 ㅠㅠ 공포영화 너무 간만이라 무서워서 잠을 못잣..어여 ㅋㅋㅋㅋ 긴장감 놓칠못하고 봣네요 배우들 연기진짜 너무 잘해요 !!! 여름에 보기좋은영화 !!
노이즈,실관람객,7.0,생각했던 것보다 더 무서워요
노이즈,실관람객,8.0,오…진짜 소오름 오늘밤에 잠 다잤어요 ㅠㅠㅠ 소리가 계속 생각나요
노이즈,실관람객,10.0,배우들 연기 끝장남!!!!아직도 생생 ? 여운 장난아님 리얼 현실이라 더 무서움
노이즈,실관람객,10.0,이제 더운데 이 영화보고 무서워서 추워요..연기잘하는 좋아하는 배우들이 많이나와서 많이 추천하고다닐거예요!!
노이즈,실관람객,10.0,아 오늘 잠다잤네진짴ㅋㅋㅋㅋ 오랜만에 공포다운 공포영화봄!!
노이즈,실관람객,8.0,더운여름 오싹하게 잘 봤네요! 사운드 때문에 진짜 깜짝깜짝 무서웠어요 !
노이즈,실관람객,10.0,소리가 완전…무서움 그 자체더우면 이거보세요
노이즈,실관람객,10.0,오랜만에 진짜 무서웠어요 ~~ 현실감 쩔어서 진짜 무섭고 재밌게 봤어요배우들 표정 연기 진짜 리얼 ㅠㅠ
노이즈,실관람객,10.0,심장이 쫄깃쫄깃해지는 전개와 소름 돋는 연출!끝날 때까지 긴장감 놓을 수 없었던ㄷㄷㄷ
노이즈,실관람객,10.0,복도식 사는데 오늘 집에 못들어 가겠어요 와..진짜 무서움..
노이즈,실관람객,10.0,배우들 연기실력 진짜.. 보는 내내 너무 무서웠어요 ㅜ 소리까지 대박
노이즈,실관람객,10.0,와… 아파트 살고 있어서 공포감 더 지리는 듯… 사운드랑 배우들 연기가 한 몫 하네요!
노이즈,실관람객,10.0,소리가 주는 공포가 장난 아니네요. 올해 여름 공포영화 시작으로 정말 좋았어요.
노이즈,실관람객,10.0,일상 속 층간소음이 주제라 더 와닿고 무서운.. 올 여름 제대로 소름 돋고 싶다면 노이즈 강추!
노이즈,실관람객,10.0,와 진짜 무서워요 더운여름 싹 가시게 하는 영화네요스릴러아니고 공포....
노이즈,실관람객,10.0,윗집 소음은 아무것도 아니었군.. 진짜 현실공포네요 무섭게 잘 봤습니다
노이즈,실관람객,10.0,음향이 주는 공포가 어마어마 합니다 ㅜㅜ 오랜만에 극장에서 공포영화 보니 진짜 무섭네요
노이즈,실관람객,10.0,아 대박!! 간만에 간담이 서늘!! 집에서도 늘 조심해야겠다는 경각심이 들어요!!
노이즈,실관람객,10.0,세상에나 이런 현실판 공포영화를 만들다니? 현실 고증 미쳤구요. 감독님도 배우님들도 대단하신것 같아요... 이 영화가 어떠한 여름 공포영화보다 무섭게 느껴졌습니다...ㅠ_ㅠ 다들 보면 깜짝 놀랄 수 밖에 없습니다. 배우들 연기 너무 소름...하 오늘 밤 잠은 다 잤다!
노이즈,실관람객,10.0,이 영화보니까 여름이 왔구나싶네요 ! 영화보는내내 심장이 쿵쾅쿵쾅 어마어마했어요
노이즈,실관람객,10.0,배우들 연기력이 좋아서 집중도 잘되고 사운드 퀄리티도 대박이에요
노이즈,실관람객,10.0,이것 정말 현실판 공포 아닌가요? 아 요새 윗집 소음으로 고통받았는데... 현실판 공포에 놀라고 소름끼치고 이 영화 널리널리 흥했으면 하는 마음이 드네요.재미있...아니 무서워 소름입니다ㅠㅠ
노이즈,실관람객,10.0,너무 현실적으로 있을것같은 이야기라 더 소름이고 몰입감있었어요 배우들 연기도 완전 최고!!
노이즈,실관람객,10.0,공포영화 너무 잘 만들었네요!사운드도 최고 배우들 연기도 최고더운날 서늘하네요ㅋㅋ
노이즈,실관람객,7.0,뻔한 층간소음 내용인줄알았는데 너무 공포스러움 깜짝놀래거나 듣기싫은소리들이 나오니 주의요망 ㅎ
노이즈,실관람객,10.0,층간소음이라는 현실적인 공포를 몰입감 있게 그려낸 작품. 사운드 연출과 배우들의 연기가 인상적이다.
노이즈,실관람객,8.0,현실보다 더 현실 같은 영화. 함께 사는 세상에서 가장 무서운 치부를 보여준다. 무섭다
노이즈,실관람객,8.0,노이즈 영화를 잘 관람한듯 합니다
노이즈,실관람객,10.0,쫄리는 맛은 있음. 깜짝 깜짝 놀래키는 소리때문에 미침ㅜ
노이즈,실관람객,9.0,대리만족하면서 봤어요
노이즈,실관람객,10.0,와 배우들 연기 .. 몰입감 대박 사운드도 장난아니에요 꼭 보세요
노이즈,실관람객,10.0,한 번쯤 볼 만 한것 같아요
노이즈,실관람객,10.0,층간소음으로 인한 공포와 스릴러의 잘 짜여진 소재
노이즈,실관람객,10.0,어우 아파트사는데무셔ㄷㄷㄷ
노이즈,실관람객,10.0,배우들 연기 좋았습니다.
노이즈,실관람객,10.0,오랜만에 공포영화다운거봤어요!! 스트레스가 풀리드아아연기진짜 최고!!
노이즈,실관람객,10.0,소리가 무섭다 재밌네요
노이즈,실관람객,10.0,공포영화 마니아인데 진짜 재미있고 무섭게 봤어요 사운드 대박..
노이즈,실관람객,10.0,소리로 무서운 영화 에요.
노이즈,실관람객,10.0,사운드가 진짜 공포 영화 제대로 본거같네요!! 공포영화 좋아하는데 너무 재밌게 봤습니다!!
노이즈,실관람객,10.0,소리가 이렇게 무서운건지 알게되는 영화...
노이즈,실관람객,10.0,연기도 연기고 사운드 고퀄 영화라 보고난뒤로도 넘 무서워요하지만 너무 재밌었어요 꼭 보셔요!
노이즈,실관람객,10.0,배우들 연기력 무슨일.. 더 몰입해서 봤더니 더 무섭고..ㅜㅜ
노이즈,실관람객,10.0,생각보다 너무 무서웠어요 ㅠㅠ 꼭 옆사람 손잡고 보세요
노이즈,실관람객,10.0,스릴 만점 보는 내내 긴장감이 최고조에요 꼭 보세요 강추추추
노이즈,실관람객,10.0,와 사운드가 대박이에요. 긴장감에 배우들 연기까지 소름끼쳐서 대박이에요!
노이즈,실관람객,10.0,친구가 제발보자고보자고 해서 봤는데 보길잘했어요!! 오랜만에 영화에 몰입한 시간이였습니다! 연기최고!
노이즈,실관람객,10.0,정말 무서운 공포영화는 오랜만이네요... 너무 추천!!
노이즈,실관람객,10.0,사운드 빵빵해서 더 무서웠어요… 배우들 연기도 좋아요!!
노이즈,실관람객,10.0,와 오랜만에 사운드(공포) 괜찮은 영화네요 여름에 시원하게 볼수 있는 영화예요 추천합니다
노이즈,실관람객,10.0,영화관에서 보니까 사운드에 큰 화면까지심장이 완전 쫄깃했어요. 실생활에서 쉽게 겪는 소재라서 더 몰입되고 재밌었습니다!
노이즈,실관람객,8.0,사운드가 진짜 너무 생생해서 무서웠어요 ㅜㅜ
노이즈,실관람객,10.0,등골 오싹하다는걸 간만에 느꼈어요ㅠㅠ 무서워 후덜덜...간만에 무서운 영화 중 탑..
노이즈,실관람객,10.0,올 여름 최고의 공포영화연기 진짜 잘하시네요소리도 대박
노이즈,실관람객,10.0,좋아하는 배우들 많이 나와서 재밌고 몰입감 있게 봤어요 ! 주제도 평상시에 일어날법한 주제를 다뤄서 그런지 집중해서 잘봣습니다 ㅎㅎ
노이즈,실관람객,10.0,무서운 영화는 역시 영화관에서 봐야 몰입력 대박..여름과 딱 어울리는 오싹함이었어요시간 가는 줄 모르고 재밌게 봤네요!
노이즈,실관람객,8.0,너무 잼나네요 배우들 연기도.. 사운드도 소름.. 너무 재밌으면서도 무서워요..!!!
노이즈,실관람객,10.0,안그래도 더웠는데 영화보고 배우들 연기네 소름끼쳐서 너무 시원했습니당 ㅎㅎ
