제목,작성자유형,평점,리뷰
국보,네티즌,10.0,"이 영화에 대해 한 단어로 표현하자면 '마스터피스'이다. 그 이유는 연기랑 그토리도 좋았지만 무엇보다 좋았던게 연출이었다. 지금도 기억에 남는게 키쿠오가 국보에 자리에 올라서 한 공연 장면. 초반에 약간의 조명과 거의 들릴듯 말듯한 소리, 하얀 기모노에서 나중에 조명이 밝아지고 소리가 커지면서 붉은 기모노로 바뀌는 거랑 벚꽃비가 내리면서 별처럼 연출되는데 진짜 하나의 예술 작품 같았다."
국보,네티즌,10.0,"오랜만에 제대로 된 영화본 것 같다. 배우들의 연기가.. 너무 좋았고, 연출이 감동적이다."
국보,네티즌,10.0,눈이 시리게 아름다운 영화네요 연기 연출 영상미 너무 훌륭하고 오랜 여운이 남을거 같네요
국보,네티즌,10.0,예술을 향한 무서울만큼 강한집착이 아름답게 느껴지는 영화예요.찡한 감동과 여운이 느껴지네요.
국보,네티즌,9.0,3시간 가까운 상영시간이 (보기 전에는) 좀 부담스러움. 보고 나면 3시간 금방임. 올해 본 영화중 나에겐 최고였음.
국보,네티즌,10.0,동료의 추천을 받아 보게 되었습니다.왜 추천을 해줬는지 알겠더군요3시간이 지루하지않게 잼나게 봤습니다
국보,네티즌,10.0,스토리 구조는 비교적 단순한데 영상미와 연출력이 미쳤습니다. 깊은 여운을 남김
국보,네티즌,10.0,아름다운 영화 인거 같아요.
국보,네티즌,10.0,악마랑 계약한건 요시자와 료 본인이다
국보,네티즌,10.0,3시간이 길개 느껴지지않고 연출 섬세하고 너무 이뻐요..공감하기에 어려운 가치관?이라서 그런거 없어서 감탄 대단함을 크게 느꼈어요..
국보,네티즌,10.0,배우들이 너무 쟁쟁해서 기대됩니다. 몰입해서 볼 수 있을 것 같습니다
국보,네티즌,10.0,"솔직히 일본에 대한 반감때문인지 만화영화말고 실사영화는 잘 보지 않는다.그런데 일본에서 천만관객을 넘은 영화이고, 또 재일교포가 만든영화라고 해서 관람을 계획중이다."
국보,네티즌,8.0,오랜만에 영화다운 영화를 보았다.누군가어 게 간절한 것이 누군가에겐 벅찬 짐이 되는 인생의 아이러니.이 이야기를 이상일 감독이 그려내었기어 비로소 완성된 느낌.배우들의 연기도 누구하나 빠짐 없이 완벽했다.난 앞으로 이 영화를 몇 번이나 더 보 게 될까. 무섭다
국보,네티즌,10.0,러닝타임 3시간에도 전혀 지루함 없는 스토리 전개로 한껏 몰입되는등 오랫만에 재미있는 한국영화를 접할수 있는 기회였다
국보,네티즌,10.0,관람내내 강도높은 압박감과 완벽한 갈증을 표현했다!치밀한 연출이 완벽으로 이끌었다.완벽에 가까운 연출과 뛰어난 배우진들과 가부키 장면들이 정말 칭찬할만했다
국보,네티즌,10.0,3시간이고 가부키도 모르고 원작도 몰랐는데 감명 깊게 보았습니다.요즘 일본 영화들 새로운 시도를 많이 하는데 완성도도 높아서 문화의 힘을 느낍니다. 한국 영화도 우려먹기 재탕보다는 새로운 시도를 많이 하는 영화가 나왔으면 합니다.
국보,네티즌,10.0,긴 러닝타임동안 세심하게 쌓아올린 서사에 여운이 깊어요.
국보,네티즌,10.0,정말 좋았어요 모든 배우에게 박수를..
국보,네티즌,10.0,올해 최고의 영화였습니다
국보,네티즌,10.0,미치도록 시리고 아름답다
국보,네티즌,10.0,"부산국제영화제에 이어 개봉날 2차관람.그리고 포스터랑 특별티켓 받으러 3차 관람 예정.토키오, 슌스케, 그리고 제3의 시선에서..."
국보,네티즌,10.0,개인적으로 올해 최고의 영화.
국보,네티즌,9.0,"일본판 아마데우스+패왕별희 보는 기분... 가부키에 미친 한 사람의 인생을 첨예하게 다루면서도, 동시에 서술하는 방식은 철저하게 객관적이고 건조해서 참 매력적이었음. 영화관에서 꼭 봐야하는 정말 세련된 아트 필름! (일뽕+일본 특유의 오버액팅 없음)"
국보,네티즌,10.0,이렇게 아름다운 영화라니
국보,네티즌,10.0,예술영화는 이런 것 눈물나게 아름다워요
국보,네티즌,10.0,오랜만에 작품다운 작품을 보았다영상연출이 너무 아름답고배우들 연기가 미쳤음
국보,네티즌,10.0,"연출,연기력,영상미,배경음악 무엇 하나 빠지는 게 없는 영화입니다."
국보,네티즌,10.0,좋았다. 주인공의 눈가에서 점점 희미해져가는 생기와 더불어 그를 온전히 삼켜버린 집념의 열기가 영화내내 우리를 매료한다.
국보,네티즌,10.0,"진짜 가부키극을 보고 싶다면 이 영화 국보를 꼭 보시길...,진한 감동이 오래도록 남을것 같음."
국보,네티즌,10.0,이런 영화가 있다니 말도 안 됩니다. 제 인생영화 바로 등극입니다. 가부키라는 소재로 어떻게 이렇게 감동을 줄 수 있는 건가요… 보면서 몇 번을 울었나 모르겠습니다.
국보,네티즌,7.0,아름다운 괴물이 된 걸 축하해 키쿠오
국보,네티즌,10.0,화려하지 않지만 그 이상의 가슴에 뭄직한 여운을 오랫동안 주는 영화네요. 정말 가슴 따뜻해지는 영화네요. 특히 OST가 명품입니다.
국보,네티즌,10.0,오랜만에 만족스러운 영화를 만났네요. 줄거리. 배우들의 연기. 영화음악. 영상미 모든게 잘 어울어져 완벽한 시너지를 창춣했네요.
국보,네티즌,10.0,가부키를 잘 몰랐는데 이 영화를 보면서가부키의 아름다움에 반해버렸어요..배우들 연기도 너무 아름다워요!
국보,네티즌,10.0,올해 만난 가장 아름다운 영화 이건 정말 꼭!!! 극장에서 꼭 봐야하는 영화인듯
국보,네티즌,10.0,오랜만에 본 영화 국보! 너무 내용이 재미있게 전개되서 진짜 지루할 틈 없이 3시간이 금방 지나간것 같아요~ㅎㅎ다 좋았지만 특히 배우들 연기력이 한 몫하지 않았나 싶어요ㅎㅎ아 그리고 영화 스케일 상 집보단 극장에서 봐야 더 실감나고 재미있는 영화가 아닐까 싶어요~! 블록버스터급인만큼 꼭 극장에서 보는걸 추천드립니다~^^
국보,네티즌,10.0,정말 눈물나게 아름답고 뜨거웠던 영화였다.
국보,네티즌,10.0,영상미가 끝내줍니다이
국보,네티즌,7.0,"이것은 영화라기 보다는 4개 정도의 에피소드를 가진 미니시리즈를 스트레이트로 본 느낌. 가부키의 춤사위나 무대, 연출은 충분히 아름답지만 그들을 둘러싼 당시의 사회분위기나 역사 모두가 거세된 한 인간의 변화 과정을 지켜보는 일은 그저 허무한 마음만 남긴다. 혈통주의가 만연한 일본사회의 부조리도 영화가 표현하고자하는 가부키의 아름다움에 매몰되어 산산이 부서진 눈꽃처럼 흩어지고 그것을 응시하는 인물의 표정도 결국 허무한 마음으로 귀결된다."
국보,네티즌,8.0,두 남자 주연의 전체 인생굴곡 서로 잘될때 안될때가 겹쳐 나오는게 흥미
국보,네티즌,9.0,감탄 나오게 만드는 연기력과 미친 몰입감
국보,네티즌,10.0,
국보,네티즌,10.0,서로가 있었기에 더 치열하고 아름다웠던 영화
국보,네티즌,10.0,이렇게 연기자들에게 몰입이된다니 믿을수 없어요. 추천합니다.
국보,네티즌,10.0,배우들 연기가 국보급. 너무 아름다운 영화~
국보,네티즌,10.0,최고다!!!! 또보고싶은 영화
국보,네티즌,10.0,하루에 최대 3개의 영화까지만 등록이 가능합니다. 모든 평점은 게시판 운영원칙에 따라 운영되며 용도에 맞지 않는 글은 운영자에 의해 삭제될 수 있습니다
국보,네티즌,10.0,연기가. 아주 재미나고~~유쾌하게 즐길수있는 영화로 더위를 식혀줄~~재미 있는 가족영화예요~~꼭 가서 보시길
국보,네티즌,10.0,"인정받은 자가 흘리는 눈물, 왜 외로움이 느껴질까"
국보,네티즌,10.0,"?와, 진짜 이 영화 시간 가는 줄 모르고 봤어요! 3시간이 훌쩍 지나갔는데도 전혀 지루할 틈이 없어서 엄청 몰입하면서 봤습니다.?특히 배우들 연기가 정말 대박이었어요. 감정선이 너무 자연스럽고 강렬해서 제가 다 울컥할 정도였네요. 연기력 덕분에 영화에 완전히 빠져들 수 있었습니다.?그리고 이 영화는 꼭 극장에서 봐야 해요! 스케일이나 영상미가 블록버스터급이라, 큰 스크린으로 봐야 그 완성도가 훨씬 살아나는 타입의 영화입니다. 최고였어요!"
국보,네티즌,9.0,세습의 피를 넘어서는 열망이 아름다웠다
국보,네티즌,10.0,재밌게 봤고 가부키공연장면들 다 인상적이고 너무 좋았다...근데 3시간은 정말 너무 길다.화장실 참느라 힘들었슴
국보,네티즌,9.0,슬프도록 아름답다. 외로움과 고독이라는 거름으로 아름다운 꽃을 피운 영화
국보,네티즌,10.0,한국 감독이 만든 일본영화. 재일교포 감독이 일본전통 예술인 가부키를 배경으로 영화화했다는것이 감동적이다. 아름다운 예술은 고통속에서 피어나는것같다.
국보,네티즌,9.0,적나라한 아름다움... 키쿠오는 슌스케의 ‘피’를 간절히 원했지만 결국 슌스케는 그 ‘피’로 인해 죽고 키쿠오가 인간국보가 되었다
국보,네티즌,8.0,일본의 가부키에 대해 좀 이해할 수 있는 기회가 되었고 무섭게 변화하는 현대 사회에서 전통과 문화에 대하여 생각하는 계기가 되었고 전통을 힘겹게 고수하는 사람들 이야기~ 화면도 아름다왔고 스토리도좋았다
국보,네티즌,9.0,긴 런닝 타임에도 불구하고 부담되거나 지루하지 않았음. 좋은 작품이란 이런것.
국보,네티즌,10.0,평점이 좋아 관람했는데 만족하고 봤습니다ㅎ잘만들어진거 같아요ㅋ
국보,네티즌,10.0,"영상미, 연기력, 최고가 되기위한 인간의 노력 등 감동적인 영화임"
국보,네티즌,10.0,오랜만에 영화다운 영화를 보았다.연출과 배우들의 뛰어난 연기가 대단한 영화입니다.
국보,네티즌,10.0,평상시에 볼수 없었던 가부키 공연의 예술성이 돋보였고 연출이 아름다움을 부각시킨 영화였네요~~
국보,네티즌,10.0,아름다운 영상에 그대로 도취
국보,네티즌,10.0,연기력이 우수한 작품입니다가부키 공연 진짜 예술이네요몰입감이 매우 깊은 영화입니다 강추해요
국보,네티즌,10.0,영화자체가 공연이었다. 가부키공연에 대해 문외한이지만 이 영화로인해 예술인들의 혼에 대해 존경하는 마음이 생긴다
국보,네티즌,8.0,가족을 원했지만 가족을 버린 주인공.
국보,네티즌,8.0,"평생에 걸쳐 자기 한 인생을 바쳐 한가지 일에 오롯히 자기 생을 바치는 장인정신, 모든 장인들이 한 나라의 보물, 국보! 이상일 감독님의 절정의 연출력에 존경과 숭배를!"
국보,네티즌,10.0,"전통이란 무엇인가, 지켜야 하는건 무엇인가, 우리의 역할은 무엇인가"
국보,네티즌,10.0,일본에서 천만 관객 동원한 영화라 해서 궁금했는데 배우들의 연기 및 영상미가 돋보였다. 기억에 오래 남을 영화~~
국보,네티즌,10.0,타인들과 타국을 이해할수 있는 최고의 텍스트...인간바퀴벌레야...일을 좀 해라...비공감을 쳐눌러야지...
국보,네티즌,10.0,백로 아가씨를 연기하자 말로 설명할 수 없었던 풍경을 보았다
국보,네티즌,10.0,"연기자들 연기최곱니다,극장에서 꼭봐야 할것같아요,"
국보,네티즌,10.0,강렬한 배우들의 연기에 빠져 지루 할 틈없이 어느새 3시간이 지나가 버렸네요역시 이런 블럭버스터급 영화는 영화관에서 봐야 제맛!!!
국보,네티즌,10.0,아름답고도 처연하다.
국보,네티즌,10.0,"조선 기술자 '장영실'은 능력 하나로 자신을 증명해 결국 노비에서 정 1품까지 올랐고, '키쿠오'도 마찬가지다. 비 혈통의 억울함에서 시작해 오직 능력으로 '일본 국보'가 됐다. 관객이 바라는 결말이란 바로 이런 것이 아닐까. '가문'의 최고가 아니라 '국가'의 최고. 과연 그 어떤 영화가 이보다 완벽한 3시간을 다시 만들어낼 수 있을까. 이 정도면 결코 아니 당연히 명작이라 말하지 않을 이유가 없다."
국보,네티즌,10.0,아름답다. 그저 아름답다
국보,네티즌,9.0,덧없이 아름다웠다. -별개로 차 가지고 가시는 분들 출차시간 유의하세요!
국보,네티즌,10.0,요시자와 료 나온 영화는 전부 보고싶어질 만큼 최고의 연기였습니다..!
국보,네티즌,10.0,가부키 잘 모르지만 너무 재미있게 잘봤고 참 매력적인 영화같습니다
국보,네티즌,10.0,매우 드높은 예술. 몰입감. 만족감. 해소감. 강력 추천. 피. 연기. 가부키. 온나가타. 집안. 타고남. 재능. 도망침. 빼앗김. 부채. 눈빛. 시쯔레. 일본스러운 박수. 당뇨. 끝까지. 가짜. 야쿠자. 문신. 빨강. 새하얀. 우산. 반짝임. 게이샤. 악마. 3대. 식당. 담배. 얼굴. 나는 알아. 국보
국보,네티즌,10.0,예술은 아무리 싫은 나라의 것이라도 그 자체가 훌륭하면 빠져들수 밖에 없다어떤 무기보다 더 강력하다. 그리고 아름답다
국보,네티즌,10.0,
국보,네티즌,10.0,"몰입감도 좋고 재미있어서 3시간이 지루하지 않았고, 배우들의 연기력도 좋아서 감정선이 자연스럽고 강렬하게 다가왔으며 극장에서 직접 봐야 더 맛이 사는 블록버스터급 영화였습니다~^^"
국보,네티즌,10.0,일본 카부키 영화는 다소 생소한 분야의 영화라는 편견을 깬 3시간의 시간이 짧게 느껴진다. 목적을 위해 경쟁하는 두 주인공의 간절함은 인생의 아이러니를 보여주는 듯.~~* 간만에 일본의 가부키 문화를 느낀 좋은 영화라 생각된다. 어느덧 한달여 남은 25년 국보영화를 보면 마무리함도 좋을듯 하다.
국보,네티즌,10.0,예술가의 삶에 대한 묵직한 성찰
국보,네티즌,10.0,"완벽한 연출, 완벽한 편집, 완벽한 연기의 앙상블. 과도한 분장으로 기괴하게 보였던 가부키가 아름답게 보일 정도. 아이돌 수준의 연기자라 생각되었던 두 주연배우가 아카데미를 노릴 정도로 강렬한 연기력을 보여주었음. 일본영화는 역시 배우가 문제가 아닌 감독들이 문제라고 느껴졌음. 영화제 심사위원들이 좋아할 작품이라 생각됨. 아카데미 작품상 가능성이 커보임"
국보,네티즌,10.0,시간가는줄 모르고 잼나게 봤네요3시간이 눈 깜짝할사이 지나갔어요
국보,네티즌,10.0,무조건 극장에서 봐야 하는 영화! 섬세한 연출과 아름다운 영상미에 3시간 순삭!
국보,네티즌,10.0,"영화보고 후기 남긴건 처음입니다. 일본 그 자체이며, 중반부부턴 숨죽이고 봤습니다. 주인공 연기고 압권이고요. 혼자 조용한 극장에서 보는걸 추천드립니다"
국보,네티즌,10.0,백로의 아가씨나도 모르게 박수를 쳤다아름답다..
국보,네티즌,10.0,간만에 재미있고 몰입감있는 영화를 볼수있어서 너무너무 좋았네요 고맙습니다
국보,네티즌,8.0,아주 재미있게 잘 봤습니다. 몰입감도 쩔고 스토리도 탄탄해 재밌게 봤어요!
국보,네티즌,8.0,관객을 매혹적으로 붙잡고 철학적으로 놓는다.
국보,네티즌,10.0,진짜 개인적으로 너무너무 좋았음
국보,네티즌,10.0,국보 스토리도 탄탄하고 배우들 연기도 정말 훌륭하네요~~
국보,네티즌,10.0,감동적이다. 예술의 힘이 느껴진다.
국보,네티즌,10.0,일본 가부키의 세계의 특별함과 최고의 가부키배우가되기위한 처절한 훈련 넘 감동적이고 재미있음 두 주연배우의 연기도 훌륭함요코하마 류세이의 연기는 잘 알고있었지만요시자와 료의 새로운 발견
국보,네티즌,10.0,3시간이라는 긴시간에도 불구하고 배우들의 자연스러운 감정연기가 계속 몰입하게 만듬 영화관에서 보길 잘한듯
국보,네티즌,10.0,"가부키라는게 다른 의미로만 알고있었는데 오늘 이영화하나로 재해석 하고 배우고 갑니다. 오랜만에 극장에서 영화다운 영화보네요, 3시간이 후딱 지나갔고 여운도 길게 남아서 뭉클합니다."
국보,네티즌,10.0,3시간이라는 러닝타임에도 불구하고 집중해서 봄 배우들의 명연기와 블록버스터급 연출 영화관에서 봐야함
국보,네티즌,10.0,가부키에 대해서 다시 생각해보게 만든 영화..ㅠ 3시간이라는 긴시간에도 불구하고 집중해서 봤음요
국보,네티즌,10.0,"대단한 원작소설의 수준 높은 각색. 섬세하고 깊이 있는 연출.눈부신 연기.3시간을 이렇게 몰입시키다니,,엄청난 작품. 쌍엄지 척!!"
국보,네티즌,10.0,일본 영화를 잘 보지 않는데 이 영화를 보면서 다시 일본 관심을 갖게 되었다. 정말로 감동 그 자체이다.
국보,네티즌,8.0,패왕별희보다 못함 별로 재미없음
국보,네티즌,8.0,일본 문화에 관심이 있었는데 ‘국보’란 영화를 통해가부키를 재평가한 기회가 된 것 같다가부키 배우에게 세습제도가 굳이 필요할까 하는 생각이 들었다주인공 배우의 연기에 감동을 받았고 러닝 타임에 비해 전혀 지루함을 못느꼈다
국보,네티즌,10.0,"재일교포 감독이 만든 가부키 영화라니 오랫동안 기다렸는데 영상미,음악,연기 모두 좋았습니다. 한번 더 볼거예요 강추"
국보,네티즌,10.0,최고의 영화 . 일본 영화라 선입견 갖지 마세요.
국보,네티즌,8.0,국보 감상평요즘 영화를 못봤는데국보를보게되어 기분좋아요아직 안보신분들 관심갖고 보셔도 좋아요
국보,네티즌,10.0,"몰입감 뭐임?! 주인공을 통해 내 삶을 되돌아보고 지난 과거를 깊게 회상케 만드는 영화,잘 봤습니다"
국보,네티즌,9.0,"정말, 몰입해서 보게 된다"
국보,네티즌,9.0,"부서질 듯한 인간의 마음을, 예술은 지켜낸 걸까 부순걸까."
국보,네티즌,10.0,오랜만에 극장에서 볼만한 영화가 나온거 같아용 배우들의 연기력으로 몰입도를 확 올릴수있었어용 추천합니다
국보,네티즌,10.0,소름돋았어요 러닝타임3이간 금방가요 박수가 저절로 나온작품
국보,네티즌,10.0,"생각했던 그 이상의 감동이 있네요. 그래서인지 긴 러닝타임이 무색할 정도로 흡인력이 느껴졌어요. 예술에 진심이었던 남자, 그의 진심가득 한 연기에 박수를 보냅니다."
국보,네티즌,10.0,올해 가장 아름다운 영화
국보,네티즌,10.0,극장에서 봐야 더 리얼감이 살아나고 배우들의 연기력도 뛰어나서 스토리솨 엔기로 몰입감이 있어 지루하지않고 재미있어요.
국보,평론가,10.0,피와 이름의 세계의 시련을 극복한 인간만이 볼 수 있는 풍경
국보,평론가,10.0,미치도록 간절하고 아름답게
국보,평론가,10.0,예술잔혹이야기: 별이 등꽃처럼 내리는구나
국보,평론가,10.0,불꽃을 화마로 키우는 어느 예술가의 욕망
국보,평론가,10.0,"지극한 아름다움, 궁극의 시각 경험"
국보,평론가,10.0,"영원히 소유할 수 없고, 그래서 아름다운 무대 위의 시간"
프레데터: 죽음의 땅,실관람객,10.0,"프레데터 모르고 봐도 진짜 재밌고액션씬이 너무 탄탄하고 퀄리티가 미쳤다 진짜,,!!"
프레데터: 죽음의 땅,실관람객,10.0,오랜만에 재미나게 본 영화
프레데터: 죽음의 땅,실관람객,7.0,“넌 포기가 너무 빠르다.”
프레데터: 죽음의 땅,실관람객,10.0,시간가는줄모를고 봄 재밋음 엘르패닝은 너무이쁘구
프레데터: 죽음의 땅,실관람객,10.0,아니 괴수 로봇 외계인까지 나오는데 이게 재미 없다고?
프레데터: 죽음의 땅,실관람객,10.0,"전체적으로 아바타+스타워즈 섞은 느낌인데, 매 장면 배경보면서 디자인팀이 얼마나 고생했을지가 느껴졌다…전체적으로 매우 완성도 있는 작품"
프레데터: 죽음의 땅,실관람객,10.0,프레데터 시리즈 처음인데도 재밌게 봄
프레데터: 죽음의 땅,실관람객,10.0,크리처 디테일 좋고 스토리 탄탄함
프레데터: 죽음의 땅,실관람객,10.0,이런 SF 영화 너무 보고싶었음 …. 개봉날 본 보람이 있다!!
프레데터: 죽음의 땅,실관람객,10.0,영화 이제 시작했는데 무슨 벌써부터 평점을 매겨 테러방지용으로 10점 준다
프레데터: 죽음의 땅,실관람객,10.0,한국영화와 같은 가격으로 볼 수 있다는 사실이 제일 큰 충격
프레데터: 죽음의 땅,실관람객,9.0,"못난이 프레데터 얼굴 두 시간을 보고 밖에 나왔더니, 다들 잘생김으로 보이네요. 프레데터1 제외하고 가장 볼만함."
프레데터: 죽음의 땅,실관람객,10.0,기대 안하고 봤는데 너어무 기대 이상임!!! 액션 완전 미쳤고 ㅜㅜ 이 서사에 감동받는 거 나 뿐인가 ㄷㄷ 다음편 완전 기대됨 ㅠㅠ
프레데터: 죽음의 땅,실관람객,10.0,프레데터가 좀 못생기긴 했는데 보다 보면 정 들음...;;; 좀 귀여워보이기도;;; 재밌다ㅋㅋㅋㅋ
프레데터: 죽음의 땅,실관람객,10.0,역대급 퀄리티ㅋㅋㅋ 무조건 영화관에서 보세요 이건 스크린으로 봐야 감동이 두배임
프레데터: 죽음의 땅,실관람객,10.0,"근간에 나온 프레데터 실사영화의 각본들을 고려한다면 아주 준수한 내용이다. 복선을 깔고 회수를 하며, 인물마다 갈등요소를 설정하고 무난하게 해결 한다. 무엇보다, 에일리언 시리즈와 프레데터 시리즈를 즐긴 사람이라면 보일수 있는 소재들을 적극적..."
프레데터: 죽음의 땅,실관람객,10.0,"액션도 속도감 있고 나름 괜찮은데, 이전 프레데터 시리즈를 몰라도 스토리도 이해하는데 어렵지 않습니다. 오랜만에 완성도가 있는 액션 영화를 본 것 같네요."
프레데터: 죽음의 땅,실관람객,10.0,오랜만에 매우 만족스러운 SF 액션 영화. 눈과 귀가 즐거웠다. 아이맥스로 정가로 때려 박아도 아깝지 않았음. 매. 우. 추. 천.
프레데터: 죽음의 땅,실관람객,10.0,프레데터 망친 감독들은 프레이 감독한테 108배해라 차원이다르다
프레데터: 죽음의 땅,실관람객,10.0,방금 보고 왔습니다. 세계관을 몰라도 끊김없이 볼수있고 스토리도 재미 있네요 미드로 나오면 더좋을정도로 재미있습니다. 꼭 보세요.
프레데터: 죽음의 땅,실관람객,9.0,초반 평점 테러 당해서 낮아 걱정했는데 보니까 올해 최고 영화다.액션도 볼만한데 캐릭터도 다 매력적임ㅋㅋ외계괴물들 신비롭고 합성로봇도 신비하고 액션도 화려함시간 가는 줄 모르겠다
프레데터: 죽음의 땅,실관람객,10.0,앞 시리즈 모르고 봤는데 그냥 봐도 재밌게 볼 수 있음 비주얼도 비주얼인데 사운드며 연출이며 액션이며 재밌었음~!
프레데터: 죽음의 땅,실관람객,10.0,"""프레데터""의 관점으로 보는 그리고 프레데터의 시선으로 해석되는 우주에서 가장 위험한 행성에서의 생존기 결국 프레데터도 하나의 약한 생명체에 불과했고 ,불안함과 공포감을 똑같이 느낀다 . 결국 협력을 통해 다중우주 세계관을 통일시키는 협력의 힘, 프레데터지만 인간처럼 낯선 생명체에겐 한없이 약하고 무지하다 , 이런 부분들이 괴리감없이 하나의 인간의 성장과정을 보듯이 너무 잘표현된것같다."
프레데터: 죽음의 땅,실관람객,10.0,개봉 하자마자 보고 옴..아무 할인없이 19000원 내고 봄.. 돈 진짜 1도 안아깝다….
프레데터: 죽음의 땅,실관람객,10.0,프레이 감독이래서 기대하고봤는데 재밌음 굳
프레데터: 죽음의 땅,실관람객,10.0,이런 영화면 돈주고 봐도 돈 하나도 안아까움 너무 잘만들었다
프레데터: 죽음의 땅,실관람객,9.0,프레데타와 에이리언 세계관의 완벽한 조화. 엄청 재밌습니다.
프레데터: 죽음의 땅,실관람객,9.0,"세계관, 액션, 크리쳐, 캐릭터, 참신함 뭐 하나 빠지지가 않네요 후속작이 기대됩니다"
프레데터: 죽음의 땅,실관람객,8.0,전개가 빨라서 지루하지 않아요. 정석적인데 신선한 부분들이 있어서 만족스러웠어요. Cg가 자연스럽고 좋아요. 프레데터 시리즈를 처음 봤는데 다음편이 나오면 봐야겠어요.
프레데터: 죽음의 땅,실관람객,10.0,쌉T가 F가 되어가는 참신한 과정
프레데터: 죽음의 땅,실관람객,10.0,"엘 패닝 매력 폭발 영화! 프레데터와의 티키타카 너무 재밌고, 겐나 행성은 아바타 판도라 행성의 다크 버전이라 할 정도로 신비롭고 볼만했음!"
