제목,작성자유형,평점,리뷰
하이파이브,네티즌,8.0,정말 간만에 영화관가서 봤는데 스트레스 확 풀리고 오랜만에 웃어봅니다. 덕분에 행복지수 얻고갑니다
하이파이브,네티즌,2.0,유치한 cg 범벅.. 웃기긴함
하이파이브,네티즌,10.0,유아인 진짜... 악마의재능이다. 깊이 자숙하고 다시봤으면 좋겠음 몇몇배우도 마약으로 논란있었지만 연기로 보답해줬으면 함
하이파이브,네티즌,1.0,와 진짜 살면서 본 영화 중에 가장 재미없습니다졸려서 진짜 잘 뻔 했네진짜 돈 내고 볼 영화가 아닌 것 같습니다보지 마세요
하이파이브,네티즌,4.0,"스토리도 뻔하고 너무 재미없어서, 중간에 몇번이나 영화관을 나가고 싶었네요"
하이파이브,네티즌,2.0,진심으로 재미없었어요... 피해가시라고 영화리뷰 살면서 첨 적어봅니다^^
하이파이브,네티즌,1.0,진짜 살면서 본 영화중에 제일 최악입니다코미디 영화 좋아하는데도 진짜 ;;; ㅋㅋㅋㅋ 대본 잘 고르는 배우들이 나오길래 믿고봤는데… 유아인이 이런 영화를 왜 찍었는지 모르겠네요
하이파이브,네티즌,1.0,중간에 보다못한 할아버지 한 분께서 영화관 가로질러서 나가셨는데 그게 젤 재밌었습니다
하이파이브,네티즌,10.0,유아인 나올때 입쩍 벌리면서 봤다. 멋있네
하이파이브,네티즌,1.0,진짜 노잼ㅠㅠ재미 없어요 유치하구 지루하구 억지웃음 유발..
하이파이브,네티즌,1.0,"과속스캔들, 써니를 만든 감독이 제작한 영화라는 네임밸류를 믿고 보러갔으나 희대의 ADHD식 전개와 시끄럽기만한 답도없는 내용에 평점 적는 시간이 아까움. 다른 사람들은 피해가라고 올리는 리뷰감독님 제작팀이 이 영화에 대해 쓴소리없이 좋은 평가를 했다면 진심으로 정리하세요"
하이파이브,네티즌,10.0,"연기에는 아쉬운 배우님들이 없었고,신구선생님의 다른 모습에 놀라고유아인배우님의 색다른 연기(?)에 놀라고연출과 박자 모두 착착 잘맞는 영화라스토리 지루한감 없이 넘나 재밌게 봤습니다극장에있는 사람들이 자기도모르게 재밌어서 중간중간에 박수쳐도 자연스러웠던 ㅎㅎ"
하이파이브,네티즌,2.0,솔직히 까놓고 말해서 이게 재밌냐 양심을 가지고 살자
하이파이브,네티즌,1.0,공짜표로도 시간이 아까운 느낌
하이파이브,네티즌,10.0,아.. 유아인 그는 대체.. 연기로는 깔 수가 없다.
하이파이브,네티즌,1.0,와 알바가 판을치네 진심으로 비급영화고 돈아깝습니다 이거 배우들 캐스팅빵빵한데 배우들이 이거 왜찍었는지도 신기할정도에요 영화 취향 안까다로운데 이거 심형래 영화급입니다
하이파이브,네티즌,10.0,주연들이 너무 탄탄해서 보게된 영화가볍게 즐겁게 재미있게 잘 봄. 유아인은 이런 가벼운 역할도 잘하는 듯.
하이파이브,네티즌,2.0,이 영화 리뷰를 보고 댓글 알바가 있다는 것을 알았습니다. 보다보다 이렇게 재미없어서 돈 아깝고 시간 아까운 영화는 처음이었습니다. 공짜로 보라고해도 안볼영화...
하이파이브,네티즌,2.0,"이 영화를 보고 다시한번 느꼈다. 한국영화가 왜 망했고, 극장에 사람들이 왜 안가는지."
하이파이브,네티즌,1.0,재미없어요. 영화관에서 보면 웬만한 재미없는 영화들도 다 집중해서 보게되는데 이 영화는 보는 내내 시간이 너무 안가고 지루했어요인물마다 서사를 푸는데 제대로 풀지도 않고 개연성도 없구요 개그도 진짜 재미없고 인물들의 이해안되는 행동과 감정선들.. 그래도 배우들 연기는 좋았어요 그치만 러닝타임도 긴 편이어서 시간 돈 모두 버린 느낌이었습니다. B급영화 예상하고 보러간거였는데 c급영화..혹은 그 이하였어요.
하이파이브,네티즌,2.0,"밀수 이후 간만에 극장가서 봤는데....ㅜㅜ진심 한국영화 잘 되길 바라는 맘으로 봤는데...ㅜㅜ댓글 알바에 속아 이런 영화를 보다니... 당했다 ㅡㅡ+ 영화 끝나고 같이 보자고 한 와이프한테 ""미안해"" 시전함.안본 눈 삽니다."
하이파이브,네티즌,10.0,진짜 굿캐스팅이에요각자 캐릭터를 너무 잘 살린것 같고 히어로물인데유치하지않고 스토리가 탄탄해요
하이파이브,네티즌,2.0,통신사 맴버십으로 꽁짜로봤는데 돈주고봤으면 좀 아까울뻔했음..
하이파이브,네티즌,10.0,액션과 코미디가 잘 조화돼서 재미가 배가되네요. 잘 짜여진 스토리와 배우들의 명연기. 적극 추천합니다
하이파이브,네티즌,2.0,이런영화 만들것면 그냥 드라마로 만들었으며.... 돈 너무 아까움
하이파이브,네티즌,10.0,B급 감성에.. 진짜 유아인 특별하다.
하이파이브,네티즌,10.0,최고에요-!새로운 히어로의 탄생-!재미와 액션까지 좋았어요!!!!음악도 너무 좋았고 ㅠㅠ유아인 배우님 너무 아쉬워요 ㅠ
하이파이브,네티즌,10.0,오~~ 간만에 유쾌한 영화보네요. 한국영화는 히어로는 쫌 유치한데 이번 영화는 아니에요. 각자 캐릭터가 확실하게 잡힌영화들 연기들도 각자 너무 뛰어남! 내 돈 시간 안 아깝다. 초등학생아들과 온가족이 봐도 너무 잼있어요유아인 정말 아까운 인재!! ㅜㅜ
하이파이브,네티즌,10.0,하이텐션으로 끝까지 달리는게 지루하지않고 재밌었어요배우들도 제색깔에 맞게 연기잘해줬구요전 좋았습니다
하이파이브,네티즌,10.0,친구랑 봤는데 너무 재밌어서 이번 연휴에 부모님 모시고 다시 보려구여!ㅋㅋ무빙 엄청 재밌게 봤는데 무빙 같은 초능력 판타지??에 스토리 자체도 몰입도가 좋아서 너무 재밌게 봤어요~배우들 연기도 다 너무 좋고 믿고 볼 배우들이라서 더 흥미진진하게 봤네요!!
하이파이브,네티즌,10.0,시리즈 강력 추천입나다 잼나요 유아인씨 무거운 연기만하다 이런물에서 보니 좋았거 주인공 모두 좋아하는 배유들만 나와서 짱짱
하이파이브,네티즌,1.0,평점 높아서 봤는데 평점이 무색하리만큼 재미도 없고 개연성을 찾아보기 힘들었음. 배우들 연기는 좋았고 시지도 돈 투자 많이한 것 같은데 거기에 투자한 돈을 시나리오 디벨롭에 투자를더 했어야 됐음.
하이파이브,네티즌,2.0,"한국영화 요새 힘들다는데, 이 정도로 막나가도 되나? ㅎㅎ"
하이파이브,네티즌,1.0,"대체 내가 뭘 기대하고 본건지,,, 연출 개연성 모두 망"
하이파이브,네티즌,10.0,의외로 코믹한 유아인 연기도 좋았고 전체적으로 유치한 느낌이 없어 좋았습니다. 크게 웃기려고 무리하기 보다는 틈새틈새 웃음 코드를 넣은 게 취향 저격! 스토리가 늘어지지 않고 액션도 적당히 박진감 있었어요!
하이파이브,네티즌,1.0,시간 돈 아깝다 그냥 중국영화 욕할게 아님 똑같음
하이파이브,네티즌,10.0,"남녀노소 할 것 없이 다 같이 웃고 즐길 수 있는 유쾌한 영화였고,엉뚱한 초능력으로 벌어지는 코믹 액션이 생각보다 훨씬 재미있었어요!"
하이파이브,네티즌,1.0,10점을 달아 나만죽을수 없다고 죄를 지어야 하나.. 1점을 달아 사람을 구해서 선한 일을 해야하나.. 고민 했지만 난 착하니 진실을 말하기로 함 응 넌 1점이야
하이파이브,네티즌,10.0,전과4범이 대통령되는 세상인데 유아인 다시 복귀해라. 연기는 니가 갑이다
하이파이브,네티즌,4.0,리뷰하고 광고보고 기대한 영화였는데딱 10분 보자마자.. 재미없음이 느껴진 유치한 영화였네요.
하이파이브,네티즌,10.0,뻔하지만.웃긴.ㅋㅋㅋ그와중에 유아인연기..ㅋㅋㅋ소름하...아인아...연기계속하자ㅜㅜ
하이파이브,네티즌,1.0,어디 댓글이나 리뷰 잘안다는데 여테까지 봤던 영화중에 최고로 지루했던 영화..재미없어서 미치는줄 유치함..
하이파이브,네티즌,10.0,Bgm 완전 굿 유아인 등장씬 너무 멋짐 정말 유쾌하고 재밌음 한번 더 보고싶음
하이파이브,네티즌,1.0,영화보다 중간에 나온적 처음입니다.진심으로 잘 생각하고 보세요…
하이파이브,네티즌,1.0,여지것본영화중에 제일유치하고재미없네요.. 하..시간아깝고 돈아깝고..배우들이 아깝네요...1점도 아까운데 최소가 1점이네요.. 어릴적보던 후레쉬맨이 천만배는 낫습니다
하이파이브,네티즌,1.0,시간 돈 아까워요… 영화 보면서 현타온건 처음..나 여기서 뭐하고 있지…?
하이파이브,네티즌,10.0,유아인 진짜 대체 불가한듯... 모든 캐릭터들이 다 좋았어요!! 2나오면 무조건 봅니다
하이파이브,네티즌,10.0,아오 유아인 다시 좋아짐 스토리도 가볍고 시간빨리감! 재미있음 영회보면 잠자는데 안잤음
하이파이브,네티즌,10.0,진짜 너무 재밌고 영화관 나오자마자 다시 보고싶었어요!!유아인님 너무 좋아하는데 이렇게 멋있고 귀여운 역할로 뵐수있어서 너무 좋았네요 다른 배우분들도 능청스러운 연기로 억지로 웃기려는 유머가 아니라서 너무 재밌개 봤습니다ㅎㅎ
하이파이브,네티즌,1.0,누가 재밌다했냐 와 넷플릭스에서 봤어도 다 돌려봤다 이걸 돈주고 보다니ㅜㅜ 내돈ㅜㅜ
하이파이브,네티즌,2.0,소름돋았습니다... 관람평보고 갔는데...영화관에서 내가 이걸 봤다니...' ㅜㅜ한달안에 넷플이든 어디서 나올듯...
하이파이브,네티즌,10.0,유아인님 등장 런웨이씬 너무 간지 작살난다…보면서 감탄하고 연기도 너무 잘하심!!
하이파이브,네티즌,4.0,연기력은 아주 훌륭해요.. 다만 서사라던지.. 조금 많이 유치해서...ㅠㅠ
하이파이브,네티즌,6.0,기대하고 들어갔다가 기대없이 나온 영화
하이파이브,네티즌,10.0,재밌어요! 배우들이 다들 연기를 너무 잘하고...특히 유아인은 대체불가인듯. 어쩜 저리 연기를 잘할까. 웃겨 죽는줄 알았네요 ㅋ
하이파이브,네티즌,10.0,진짜 오랜만에 웃으면서 본 영화에유역시 .. 유아인 연기 넘 감칠맛나고 안재홍. 김희원. 신구 연기 말해 모해요이재인님?도 진짜 너무 연기 잘하고 오정세. 라미란님도 너무 최고 이렇게 모든 연기자가 다 완벽한 영화 너무 오랜만이에요 정말 재밌었습니다!!
하이파이브,네티즌,10.0,써니 인생 영화라서 몇십번볼정도로 좋아했는데 같은 감독이래서 믿고 봤다ㅋㅋㅋ 역시 기대이상임 엄마랑 같이 보고 왔는데 가족이랑 같이봐도 좋은 영화더라 내용도 복잡하지않고 코믹요소도 있어서 재밌게봄
하이파이브,네티즌,2.0,평점에 속았다. 유치한 만화 영화 정도.
하이파이브,네티즌,4.0,지루함.시간 너무질질끔.끝날듯안끝남.답답함.영화관더움.크게 웃긴장면도없음.평점사기치는거열받아서 관람평처음적어봄
하이파이브,네티즌,4.0,저는 지루하고 재미가 없다고 느껴지면 잠이 드는편인데도 불구하고 잠이 들었습니다
하이파이브,네티즌,2.0,어떻게 하면 평점이9점대가 나오냐?솔직한 후기~ 중학생이보면 졸 유치하다할것이고 초등생이봐도 유치하다 할거같다
하이파이브,네티즌,4.0,다 알바냐? 중간에 몇번 나갈려다가 끝까지봤다 젤 재밌는건 초반부고 갈수록 유치하고 재미없다
하이파이브,네티즌,1.0,평점이게맞나.... 유치한개그라 웃기지도않고 전개도 산만하고 연기빼고는 건질게없다...
하이파이브,네티즌,1.0,1점을 줘야하다니...
하이파이브,네티즌,10.0,오랫만에 즐겁고 재밌고 유쾌하게 본 것 같네요 온 가족이 함께 영화 보러 가도 좋을 것 같아요
하이파이브,네티즌,10.0,김희원씨 생각하면 빌런느낌이많은데 이영화로 인해 또다른 김희원님의 연기로 볼수있어서 재미있었습니다
하이파이브,네티즌,10.0,아니 최근에 본 영화중에 젤 재밌음 ㅋㅋ 케미 미쳤고 또 영화 볼 예정 ㅎㅎ 무조건 추추 !!
하이파이브,네티즌,10.0,유아인은 진짜 연예인이구나 느낀 영화.
하이파이브,네티즌,10.0,여러가지 장르가 복합되서 시간가는줄 모르고 재미있게 볼 수 있었고 배우들의 연기 또한 좋아서 아주 유쾌하게 볼 수 있었던 영화입니다 6월에 보면 너무 좋을 것 같습니다 추천해용!!
하이파이브,네티즌,10.0,정말 재미있게 봤어요 중간 웃긴 장면 영화 끝나도 생각이 나네요
하이파이브,네티즌,2.0,"근데. 이 영화 컨셉 및 설정은 베낀거 아닌가? 아""뜻밖에 히어로즈"" (2017년 제작 방영)https://tv.naver.com/unexpectedheros?tab=information나에게 미래가 있을까? 꿈은 사치, 학교생활은 수치의 연속이었던 고삐리 3인방. 몸과 마음에 장애를 안고 움츠린 삶을 살던 아이들에게 어느 날 초능력이 생겨났다. 그것은 바로 장기 이식으로 얻게 된 놀라운 능력! 절대로 평균치 이상으로 뛰지 않는 심장, 한 번 보면 사진 찍듯 기억하는 시각기억력과 공간지각력! 그리고 엄청난 괴력! 이렇게 특별한 능력을 갖게 된 아이들은 ...https://tv.naver.com/unexpectedheros?tab=information"
하이파이브,네티즌,2.0,댓글알바 ...진짜 있네요제발 보지마세요 ㅠ
하이파이브,네티즌,1.0,잘뻔 재미도 없고 감동도 없고
하이파이브,네티즌,4.0,이거 평점 알바 풀었냐?
하이파이브,네티즌,10.0,지루하지않고 재밌었다유아인이 킥인듯간만에 유쾌한 영화였음가족들과 웃으며봄예고편이 액기스지만특히 신구역 맡은 친구 목소리 재법이었음액션도 시원했음
하이파이브,네티즌,4.0,진심 실망임. 재밌다고 별 5개준 사람들 진심 영화 본 사람들임??이 배우 라인업으로 이런 영화 만든게 놀라울 정도다ㅋㅋ 영화 산업 어렵다면서 작품 이런식으로 만들면 어쩌잔겨.. 돈 아깝다 정말.스토리 개연성도 없고 특히 대사는 정말 오그라들고 웃음포인트도 없고. 제 2의 극한직업은 무슨.. 배우들 연기 빼고는 볼게 전혀 없음.써니 이후로는 뭐..
하이파이브,네티즌,1.0,돈 버리고 싶으면 봐라 7광구 / 염력 수준의 영화네
하이파이브,네티즌,1.0,"하... 극장 산업이 명백히 끝났다는 걸 느끼게 해 준 영화다. 집에서 봤으면 시간낭비 안하고 꺼버리면 되는데, 극장에서 보면 이딴걸 참고 끝까지 봐야한다.감상 포인트가 없는데 안 고르면 등록도 안 되네 망할 거…"
하이파이브,네티즌,1.0,너무 유치함.. 웃음코드도 안웃겨서 모르겠음...내용이 진짜 술먹고 잔날 꿈에서 꾼 내용만큼개판인거같음...
하이파이브,네티즌,2.0,할말이없습니다...
하이파이브,네티즌,3.0,이해 안되는 부분이 너무 많았음1. 교주는 갑자기 힘이 왜 강해진거고2. 신도의 흉터 치료할때는 흉터가 자신에게 옮겨졌는데 휠체어에 앉은 사람의 다리 고칠때는 다리가 불구가 되지 않았으며3. 갑자기 염동력은 어떻게 쓴건지 모르겠음이 외에도 문제는 많았음CG의 수준이 처첨했고 개그의 수준이 너무 낮았음영화에 대한 점수는 1~2점 이지만 유아인님이 연기 잘 하고 무엇보다 아버지께서 재밌게 보셨으니 3점 줌
하이파이브,네티즌,2.0,이 영화를 배잡고 웃었다는 사람들은.. ㅋㅋㅋ전개 자체가 뜬금없구웃음포인트를 욕으로 잡은 2000년대 영화같음아라한 장풍 대작전 짝퉁 느낌이랄까초등학생들이 학예회한다고 연극 대본짜서 연기하는 거 무표정으로 바라보는 심정이었음..ㅎ 연기가 대단하다고하는데 이게 연기를 잘하고 못하고 논할 영화는 아닌듯함ㅋㅋ
하이파이브,네티즌,8.0,"아무 내용 모르고 봤는데 개존잼이고 유아인 진짜 간지 본새 잘 냄,,, 악마의 재능"
하이파이브,네티즌,10.0,일단 유아인캐릭터 너무 잘살림!!아빠랑 딸 싸움씬이 제일 재밌었어요!ㅋㅋ
하이파이브,네티즌,10.0,너무 재미있게 봤어요 중학교 딸들이랑 봤는데~아이들이 시간가는줄 몰랐다고 재미있다고하네요. 유아인 연기 잘해요 라미란님도 최그ㅡ
하이파이브,네티즌,4.0,관람평 잘 안쓰는데..글쓴이들이 알바인건지… 잘 낚이긴 했음 관람평보고 예매한 1인..
하이파이브,네티즌,1.0,평점 낮추기로 1점 드립니다... 솔직히 한 5점정도 영환데 이게 왜 이렇게 마케팅 된지 모르겠네요 ㅋㅋㅋ진짜 노잼이구요. 무표정으로 2시간 봤습니다. 너무 뻔한 전개에 소재만 좋았지 초등학생 작가가 쓴 전개내용입니다. 전개 수준 진짜 유치하고요 개연성 하나도 없습니다. 유머만 넣거나 진지하게만 해야되는데 괜히 섞이니 b급도 아까운 수준이네요.. 괜히 속지마시고 다른 영화보세요..이런 영화가 평점높은게 참 암울하네요.. 다 알바인가
하이파이브,네티즌,10.0,존잼존잼ㅋ4학년딸래미랑봣는데 너무즐겁게잘봤어요 유아인연기는 인정ㅋ내용도 잘짰고 볼거리가득이라 가족영화로 추천ㅋㅋ
하이파이브,네티즌,10.0,오랜만에 재밌는 영화봤네요~모든배우가 연기 너무 잘하고 특히 진영배우 연기너무잘해서 다시봤습니당~그리고 유아인 보는내내 참 아까운배우다 ㅠㅠ 믿고보는 강형철감독!!!꼭 영화관에서 봐야하는 영화!!! 강추~~~
하이파이브,네티즌,10.0,오랜만에 유쾌하고 따뜻한 영화를 보았습니다. 배우들의 캐릭터가 다 사랑스러웠고 ost도 얼마나 흥겹던지! 이런 암울한 시절에 맑은 통쾌함을 전해주었어요. 유아인 배우 다시 복귀하여 스크린을 채우길 기대합니다.
하이파이브,네티즌,10.0,새로운 초능력물이라 재미있어요출연진들 케미도 굿!!!
하이파이브,네티즌,10.0,요즘 볼만 한 영화가 정말 없어서 약간 영화 예고편울 봐도 흥미고 안생기고 그랬는데 하이파이브 예고편보고 정말 바로 보러 갔거든요? 근데 재미있었어요. 다른 연화둘 비하면 웃간 장면도 몇몇 나오고 또 익숙한 배우 분도 나오시고 정말 웃음을 유발하는 영화였어요. 그래서 다음에 친구랑 보러 갈려고요~ 추천 할 말한 영화가 생겨서 너무 좋아요 !
하이파이브,네티즌,2.0,헛웃음조차 나오지 않았다. 넷플에 있어도 중간에 보다 끌정도임. 별점알바 장난아니게 썻네 진짜……….
하이파이브,네티즌,4.0,이렇게 유치한영화가 평점이 9점 넘는게 아이러니하다....영화관에서 잠온적은 오랜만임
하이파이브,네티즌,1.0,하.. 누가 재밌다했냐첫날 평점 9.5로시작해서네티즌평점 8.2까지 떨어지는거보면 딱 답나오지그냥 웃음기 1도없는 억지웃음전개에주먹다짐싸움씬만 20분넘게한다
하이파이브,네티즌,1.0,B급말고 C급 한국영화의 미래가 어둡다.10점은 얼마받고 올리는건가...
하이파이브,네티즌,10.0,유아인 연기 다른분들 케미도 좋고 정말 오랫만에 신나게 웃었습니다
하이파이브,네티즌,10.0,모든게 너무나 신명나는 영화!보고보고또보고싶은 영화입니다!v댓글 어떤분이 아인님 악마적인 재능이라는 말에 이백프로 공감하며 배우님들 라인업 미쳤구요d 오랜만에 너무 신명나는 영화입니다. 지금 당장 보러 가셔서 스트레스 푸세요!!
하이파이브,네티즌,10.0,시간가는줄 모르고 웃으며 봤네요~특히 유아인 배우의 코믹 새로운 발견이였습니다!
하이파이브,네티즌,2.0,가족끼리 갔는데..도망쳐.. ㅠㅠ클레멘타인ㅜㅋㅋ
하이파이브,네티즌,10.0,배우들이 웃기면서도 연기 퀄리티가 상당해서 수작이에요별 생각 없이 스트레스 풀러 가기 좋아요 웃깁니다 ~
하이파이브,네티즌,10.0,아 한국 히어로 유아인 간지아쉽다 또 브라운관에서 보길
하이파이브,네티즌,10.0,상영전부터 엄청 기대했는데 역시!오랜만에 웃으면서 본 영화고요. 유치할 수 있는 소재지만 배우들의 연기와 스토리가 최고였어요. 특히 안재홍과 유아인 대박!간만에 추천할만한 한국영화네요
하이파이브,네티즌,10.0,오랜만에 스트레스풀며 웃고가네요 가족들과 함께웃고 스트레스가풀리는 하루였던것같아요.
하이파이브,네티즌,10.0,"초능력 설정이 신선하고 웃긴 장면도 많아서 시간 가는 줄 모르고 봤어요. 가족, 친구들이랑 보기에 딱이에요!"
하이파이브,네티즌,1.0,"주말, 하루 마무리 후회스러운 선택..최근에 본 영화 중 제일 최악.차라리 치킨이나 뜯으며 넷플 영화나 볼 것을.."
하이파이브,네티즌,1.0,억지 삼류 만화영화같은연출
하이파이브,네티즌,2.0,"아라한장풍대작전 이라는 류승완 감독이 있다 요즘세대들은 모를수도....거기서 사용했던 빌런의특징, 문신처럼 옮겨다니는 능력.가장큰 줄기을 그대로 써버린 감독은 류승완감독에게 허락은 받았을까 싶다모든 댓글이 알바인가 싶을 정도의....B급이라고 말하기도 애매한 X신같은 영화다이걸 돈주고 본 내자신이 한심스럽다진짜 좋은 배우들을 데려다 놓고 이렇게 찍은걸 보니 배우들이 감독에게 전생부터 현생까지 빚이 잔뜩있구나 싶다 소재를 똑같이 배껴쓰는건 아니지 않나?이걸 과연 감독이 생각하고 만든건가? 감독의 고민이 있나?더 충격적인건 댓글에 속아 관객수가 올라간다는 것이다대한민국영화의 수준을 진짜 바닥까지 떨어뜨리는 영화다 반드시 보지말길 OTT에서도 안사갈 퀄리티임"
하이파이브,네티즌,2.0,진짜 이게 재밌다고..? 세상이 날 속이나….?보는내내 너무 웃음 (어이없어서 헛웃음만 나옴..)
하이파이브,네티즌,1.0,"이걸 진짜 “영화”라고 내놓은 거냐. 처음부터 끝까지 정신이 멍해질 정도로 후졌다. 사운드는 지옥. 녹음실이 아니라 그냥 방음 안 된 지하주차장에서 찍은 느낌. 목소리는 웅얼거리고, 잡음은 자글자글, 폴리는 손으로 툭툭 친 수준. 기본 중의 기본이 안 됐다. 이건 기술이 아니라 태도의 문제다. “우린 대충 해도 봐줄 거잖아?” 이 마인드가 느껴져서 더 불쾌했다.CG는 말해 뭐해. 진짜 2000년대 플래시 게임에서 본 폭발 효과가 더 실감난다. 웰컴투 동막골 팝콘 CG가 레전드처럼 느껴질 줄은 몰랐다. 요즘 인디게임도 이것보단 잘 만든다.그런데 가장 빡쳤던 건 신세대 감성 입히겠다고 무리하게 욱여넣은 낡은 밈들. 2015년에나 쓰였을 법한 짤방 스타일, 유행 한참 지나간 단어들… 제작진 평균 나이 45세 이상 확신한다. Z세대 감성은 커녕, 중년 아재가 “요즘 애들 이런 거 좋아하지~?” 하고 만든 유튜브 광고 수준. 오글거림 MAX. 그냥 부끄러웠다.스토리는 더 말할 필요도 없다. 초등학생이 장난치듯 휘갈긴 느낌. 개연성, 긴장감, 몰입감 전부 실종. 캐릭터는 자기 감정도 못 잡고, 스토리는 이유도 없이 튕기고 뻗고 비틀어진다. 전투씬은 박진감 제로에 상상력도 바닥. 아무 감흥도 없이 지나간다. 그냥 감독이 관객을 사람으로 안 보는 느낌.이 영화가 재밌다고 느껴졌다면… 진심으로 축하한다. 당신은 제작진이 상상한 유일한 관람객일지도 모르니까. 내 돈과 시간이 이렇게 허무하게 증발한 건 진짜 오랜만이다. 친구가 이 영화 보자고 하면 다시는 안 볼 생각이다. 그 정도로 심각하다."
하이파이브,네티즌,2.0,하~중간에 나가는 팀이 있었습니다.ㅠㅠ저도 그때 나갈것을..ㅠ
하이파이브,네티즌,2.0,제발 이런 영화 보지마세요
하이파이브,네티즌,4.0,오늘 보고 왔는데... 역시 알바들의 힘은 대단하군요. 크게 코믹하지도 않고 줄거리도 뚝뚝 끊어지는 듯한.. 겨우 참고 봤네요
하이파이브,네티즌,10.0,Bgm너무 잘깔았늠ㅋㅋㅋ또보고싶 근데 유아인은 머리카락도 연기를잘하네
하이파이브,네티즌,10.0,유아인 연기 너무 조아요…영화도 넘 재미있음 꼭 보세요 오늘 하루 기분이 좋아지는 영화
하이파이브,네티즌,10.0,오랜만에 실컷 웃은 오락영화였어요유아인 정말 찰떡 캐릭터임 제발 2편도 만들어주세요!! ㅠ
