제목,작성자유형,평점,리뷰
F1 더 무비,네티즌,7.0,"솔직히 유치함. 그리고 스토리 초반부터 차가 완전 문제 있다는 식으로 계속 나왔는데 코너돌때 좀 더 빠르도록 완화한걸로 모든게 해결된다고? 싶음. 또 마지막쯤에 주인공 신체에 문제있는걸로 연출해놓고 아무것도 없어서 좀 의아함... 마지막으로 브래드 피트 사생활하고 영화는 다르다고 생각하고 봤는데 키스신 보니까 걍 짜증남. 그래도 잘은 모르지만 f1 고증 잘된것 같고, 차 엔진 소리 낭만있습니다."
F1 더 무비,평론가,7.0,흥분과 환호 사이 두통도
F1 더 무비,평론가,7.0,전작과 동일한 방식의 할리우드 아이콘의 노스탤지어적 소환
F1 더 무비,평론가,7.0,서킷을 압도하는 영화의 묵직한 다운포스
F1 더 무비,평론가,7.0,"아이맥스로 보잖아, 이건 정말 OTT에선 꿈도 못 꿀 일!"
F1 더 무비,평론가,7.0,할리우드의 향수와 하이테크팀의 쾌적한 드라이브. 결승선까지 거뜬하다
첫사랑 엔딩,실관람객,10.0,영화를 보는 내내 첫사랑의 순간이 떠올랐어요ㅠㅠ
첫사랑 엔딩,실관람객,8.0,첫사랑은 언제나 기억에 남는다
첫사랑 엔딩,실관람객,10.0,그냥 첫사랑 그 자체였다. 설렘+그리움 패키지 하..
첫사랑 엔딩,실관람객,10.0,너무나도 좋은 영화예요
첫사랑 엔딩,실관람객,10.0,"안녕, 너를 만나 행복했고... 그게 내 인생의 선물이었다.."
첫사랑 엔딩,실관람객,10.0,첫사랑의 기억을 꺼내줘서 힐링됐어요.
첫사랑 엔딩,실관람객,10.0,내 얘기 같다고 생각한 사람 있다 없다??
첫사랑 엔딩,실관람객,10.0,한동안 잊지 못할 듯해요...
첫사랑 엔딩,실관람객,10.0,볼 가치 있는 영화입니다~!
첫사랑 엔딩,실관람객,10.0,"엄청난 감정이입과 몰입이 된다고 하기 보다, 그냥 잔잔히 옛 첫사랑이 간간이 떠올랐던 영화. 그리워하지 말고 있을 때 많이 표현해야 한다는 걸 그땐 왜 몰랐을까."
첫사랑 엔딩,실관람객,9.0,보는 내내 너 생각 나더라
첫사랑 엔딩,실관람객,4.0,흔한 청춘멜로지만 비주얼이 다한
첫사랑 엔딩,실관람객,9.0,청춘 낭만 추억의 학창시절 이 영화는 여주인공을 죽이진 않네요
첫사랑 엔딩,실관람객,10.0,"주인공들의 어색하고 풋풋한 케미가 현실적이면서도 따뜻하게 다가왔어요. 스토리는 잔잔하지만 몰입감 있고, 엔딩은 긴 여운을 남깁니다. 첫사랑의 기억이 있는 사람이라면 공감하며 볼 수 있는 작품입니다. 너무 재밌게 봤어요"
첫사랑 엔딩,실관람객,10.0,이런 로맨스영화를 OTT로 많이 봐왔는데 영화관에서 보는게 확실히 몰입이 훨씬 잘되는거 같아요 재밌어요!!!
첫사랑 엔딩,실관람객,10.0,가끔 이런 영화가 참 필요하다 먹먹하고 따뜻하네요
첫사랑 엔딩,실관람객,3.0,푹자고 일어나니 엔딩~
첫사랑 엔딩,실관람객,6.0,가볍게 보기 좋은 하이틴 로코... 남주 머리 기르니 훨씬 잘생겼네...
첫사랑 엔딩,실관람객,6.0,전교에 소문 다 났어. 지난번에 치마 입은 남학생이 골다공증까지 있다고.
첫사랑 엔딩,실관람객,7.0,그럭저럭 볼만은한데 좀 아쉬면이 있어요 스토리가 너무 뻔하네요
첫사랑 엔딩,실관람객,10.0,"중력과 같은 사랑, 벗어날 수 없다."
첫사랑 엔딩,실관람객,5.0,첫사랑 로맨스로 포장한 중국 우주개발 홍보영화 ㅠ 우리 정서에도 안맞고 이질감만 느껴짐
첫사랑 엔딩,실관람객,7.0,그냥 잘 아는 그 맛 여주가 귀엽다
첫사랑 엔딩,실관람객,6.0,항상 먹던 제육덮밥 돈까스 맛
첫사랑 엔딩,실관람객,8.0,"남주와 여주는 처음보는 얼굴.이 영화를 본 이유는 '여름날 우리'를 기대해서.결과적으로 느낌은 달랐지만, 충분히 좋았다."
첫사랑 엔딩,실관람객,10.0,"한줄 요약, 남주.여주 케미가 역대급입니다~!"
첫사랑 엔딩,실관람객,7.0,생각보다 재미있게봤습니다 주제가 주제이다 조니 풋풋하네요
첫사랑 엔딩,실관람객,6.0,남주 여주는 잘 골랐음다만 스토리가 영~전교 1등이 수능을 어떻게 망치냐 ㅋㅋ
첫사랑 엔딩,실관람객,8.0,생각보다 괜찮게 본 청춘영화..
첫사랑 엔딩,실관람객,10.0,한때는 신선했던 중화권 로맨스물도 슬슬 피로도가 쌓이는 중
첫사랑 엔딩,실관람객,8.0,대만 청춘로맨스 영화를 좋아하신다면. 참신하진 않지만 무난했어요
첫사랑 엔딩,실관람객,7.0,처음으로 누군가를 좋아한 그 순간을 잘 담아내서 좋았습니다.
첫사랑 엔딩,실관람객,5.0,배우들 이쁜게 유일한 장점인 중국영화
첫사랑 엔딩,실관람객,6.0,초반 시끌시끌 중국어 적응하는게 장벽
첫사랑 엔딩,실관람객,10.0,"보면서 첫사랑이 생각나는 영화입니다 , 그때 그감정이 떠오르는 시간이였습니다"
첫사랑 엔딩,실관람객,10.0,풋풋한 느낌이 많이 나고 재밌어요.
첫사랑 엔딩,실관람객,10.0,감정몰입하면.. 눈물납니다.. 휴지 챙기세요..
첫사랑 엔딩,실관람객,8.0,무난하게 재밌어요 청춘영화
첫사랑 엔딩,실관람객,6.0,배우들의 비주얼과 분위기가 괜찮았다
첫사랑 엔딩,실관람객,10.0,설레는 첫사랑의 기억이네요.
첫사랑 엔딩,실관람객,7.0,첫사랑의 설렘이 달달하게 담겼다
첫사랑 엔딩,실관람객,7.0,귀엽고 풋풋한 첫사랑 이야기
첫사랑 엔딩,실관람객,7.0,기대하지 않고 봤는데 생각보다 괜찮았어요! 재밌었어요
첫사랑 엔딩,실관람객,8.0,한 번쯤 볼 만 한것 같아요
첫사랑 엔딩,실관람객,10.0,여름의 끝자락에서 청춘 영화 한 편
첫사랑 엔딩,실관람객,10.0,오랜만에 풋풋한이야기로 잘 관람했습니다
첫사랑 엔딩,실관람객,8.0,첫사랑의 설레임보다는 장난스러움이 많이 느껴지는 중화권 학창시절 첫사랑 멜로물
첫사랑 엔딩,실관람객,4.0,몇 안되는 첫사랑 해피엔딩
첫사랑 엔딩,실관람객,8.0,공식대로 충실하게 뽑아낸 아시아 청춘 로맨스 영화. 뻔하지만 (적어도 중반까진) 충분히 즐김.
첫사랑 엔딩,실관람객,10.0,저 청춘이 참부럽다 달달구리
첫사랑 엔딩,실관람객,8.0,기대 했는데 볼만 하네요.
첫사랑 엔딩,실관람객,8.0,2시간동안 락창시절로 덜아간 느낌
첫사랑 엔딩,실관람객,8.0,엔딩크레딧 때 띄워준 첫사랑들의 편지들이 뭉클했다 중반까진 뻔하다가 끝까지 보고 나니 너무 예쁜 영화!
첫사랑 엔딩,실관람객,8.0,"서툴었던 그 때가, 고스란히 떠오른다"
첫사랑 엔딩,실관람객,10.0,엄청 풋풋하고 달달하네요
첫사랑 엔딩,실관람객,5.0,첫사랑 엔딩 첫사랑 엔딩
첫사랑 엔딩,실관람객,8.0,끝이 아닌 시작이었다.
첫사랑 엔딩,실관람객,10.0,첫사랑의 기억과 추억이 떠오르는 영화네요 좋았어요
첫사랑 엔딩,실관람객,7.0,"올드하지만 새롭고, 유치하지만 재밌음"
첫사랑 엔딩,실관람객,10.0,누군가가 자연스럽게 생각나게 하는 영화
첫사랑 엔딩,실관람객,4.0,남여주 멋있도 이쁘네요
첫사랑 엔딩,실관람객,10.0,너무 재밌게 봤습니다 강추 드려요!
첫사랑 엔딩,실관람객,10.0,첫사랑이 생각나는 영화군요. 마음이 따뜻합니다.
첫사랑 엔딩,실관람객,10.0,몽글몽글하니 학창시절이 떠오르네요 설레는기분!!!
첫사랑 엔딩,실관람객,6.0,클리셰 범벅인데 남주여주가 너무 이뻐서 볼맛 난다
첫사랑 엔딩,실관람객,8.0,여느 청춘물과 다른 엔딩이 좋았습니다
첫사랑 엔딩,실관람객,8.0,재미있게 잘 보았습니다.
첫사랑 엔딩,실관람객,6.0,이전에 봤었던 그 나라의 영화들처럼... 이것저것 모아놓은 그런 맛
첫사랑 엔딩,실관람객,7.0,이런 엔딩이라면 좋다. 두 배우의 매력이 잘 드러난다.
첫사랑 엔딩,실관람객,8.0,배우들과 스토리가 풋풋해서 귀여웠어요.
첫사랑 엔딩,네티즌,10.0,보는 내내 네 생각이 났다
첫사랑 엔딩,네티즌,10.0,여름의 끝에 잘 어울리는 영화
첫사랑 엔딩,네티즌,10.0,마지막 멘트를 꼭 마음에 새길 것
첫사랑 엔딩,네티즌,10.0,류호존과 송위룡의 얼굴합이 기대되어서 봤지만 영상미 내용 다 너무 완벽했다..
첫사랑 엔딩,네티즌,10.0,여름에 잘 어울리는 청량 감성 로맨스 영화 보는 내내 나의 첫사랑은 어땠는지 떠올리게 됩니다 마음이 시큰하면서 따뜻해지네요 추천드립니다
첫사랑 엔딩,네티즌,10.0,메마른 감정에 ~ 감동과 풋풋함과~ 주인공들도 예쁘고 멋지고ㅎ 너무 잘봤어요^^
첫사랑 엔딩,네티즌,10.0,나도 나의 청춘을 돌아볼 수 있는 영화.풋풋했던 짝사랑이 생각나는 영화. +남주여주 조합 좋았다.+ost 좋음
첫사랑 엔딩,네티즌,10.0,큰 기대없이 갔는데 너무 재미있게 잘보고 나왔어요. 추천해요
첫사랑 엔딩,네티즌,10.0,오랜만에 로맨스 영화 재미있게 봤네요.다시 학창시절 청춘을 기억하게 해주는따스한 영화네요~♡
첫사랑 엔딩,네티즌,10.0,보는데 괜히 가슴이 뛰고ㅜㅜ 오랜만에 설렘 충전 완료.
첫사랑 엔딩,네티즌,8.0,제법이다.. 보고싶네 후
첫사랑 엔딩,네티즌,10.0,그 시절 우리가 좋아했던 소녀랑 비슷한 느낌은 있는데 그래도 좋았다
첫사랑 엔딩,네티즌,5.0,대만 하이틴 익숙한 내용의 짜집기.. 그 속에 특별함은 없었다.
첫사랑 엔딩,네티즌,10.0,"너무 순수해서 아련하고, 여운이 남네요."
첫사랑 엔딩,네티즌,10.0,잘지내니... 흐...
첫사랑 엔딩,네티즌,10.0,학창시절 첫사랑하면 떠오를 거 같은 영화!
첫사랑 엔딩,네티즌,1.0,나쁘진 않으나 굳이 영화관에서 볼 가치가 있나 싶다.. 뻔한 내용의 연속
첫사랑 엔딩,네티즌,10.0,진짜이건봐야해요진짜사랑해
첫사랑 엔딩,네티즌,2.0,중국영화는 내돈주고 보고싶지 않음
첫사랑 엔딩,네티즌,10.0,진짜 너무 설레서 돌아가실 거 같고 그래수 내일 또 보러갑니당 제발 넷플이나 티징에 나와쥬세요ㅜㅜㅜ
첫사랑 엔딩,네티즌,10.0,로맨스 영화 안좋아하는데 이거는 재밌게 봤네요
첫사랑 엔딩,네티즌,10.0,여주남주 비주얼도 미쳤고 연기도 너무 좋았어요몽글몽글한 예쁜 학창시절 첫사랑을 잘 표현했어요뻔한 내용일수도 있지만 너무 재밌었어요중간중간 코믹요소도 있어서 좋았고 쓸데없는 장면없이 서사를 잘 풀어서 보는 내내 즐거웠어요한번쯤 보면 좋을것 같아요!!
첫사랑 엔딩,네티즌,10.0,"이런 종류의 영화를 좋아한다면 꼭 보는걸 추천함.영화 보는 내내 너무 좋았음.남주,여주 얼굴도 미쳤고,OST도 좋았음."
첫사랑 엔딩,네티즌,10.0,풋풋하고 첫사랑이 기억나는 영화
첫사랑 엔딩,네티즌,10.0,오랜만에 여운의 남는 로맨스 영화였습니다
첫사랑 엔딩,네티즌,1.0,여자들 ㅈㄴ 보네 ㅋㅋㅋㅋ
첫사랑 엔딩,네티즌,10.0,보는 내내 잔잔한 웃음을 짓게 되는 따뜻한 영화. 남주여주의 현실적인 케미가 돋보인다. 몽글몽글한 감정이 생기는 영화로 강력 추천!
첫사랑 엔딩,네티즌,8.0,잔잔하고 별것 없지만 여자 주인공 얼굴 하나만으로 이 영화는 재미있었다 너무 예뻐서 하이틴 중국 영화 다운 재미가 있었어
첫사랑 엔딩,네티즌,10.0,대만풍 하이스쿨 로맨스의 정석 (중국영화임)간만에 재밌게봄
첫사랑 엔딩,네티즌,10.0,
첫사랑 엔딩,평론가,10.0,
투게더,실관람객,7.0,개인적으로 결말이 쌩뚱맞다고 생각함
투게더,실관람객,8.0,꽤 독특하고 괜찮은 호러영화입니다
투게더,실관람객,6.0,그냥 저냥 본 영화입니다
투게더,실관람객,7.0,결말에서 약간의 눈물이 났다
투게더,실관람객,5.0,투게더~~~!!!@
투게더,실관람객,6.0,투게더투게더투게더.
투게더,실관람객,8.0,새로운 바디호러 재밌습니다.^^
투게더,실관람객,8.0,좋아요 추천합니다.좋아요 추천합니다.
투게더,실관람객,7.0,같이 하는 것과 하나가 된다는 것에 대해
투게더,실관람객,7.0,오감을 통해 생생히 ‘느껴지는’ 장면들. 성공적으로 하나가 된 둘을 보며 이상하게도 만족감이 느껴졌다.
투게더,실관람객,10.0,절정의 순간에 울려 퍼지는 2 become 1의 적절함
투게더,실관람객,6.0,생각보다 내용이 약했지만 바디호러 장르 팬이라면 추천하고 싶다
투게더,네티즌,10.0,이렇게 로맨틱한 호러가 어디있음.. 사랑스럽고 기괴하다
투게더,네티즌,2.0,서브스턴스가 잘만든 영화였구나 흠..
투게더,네티즌,10.0,작년에 서브스턴스가 있다면 올해는 투게더! 완전 기괴한 찐 로맨스 영화였어요!중간중간 눈도 감았습니다.. ㅎㄷㄷㄷ
투게더,네티즌,10.0,기대 이상인데??? 부부의 로맨스...달다...
투게더,네티즌,10.0,알고보니 로맨스 영화? 두 배우의 연기력으로 기묘한 분위기를 끝까지 밀고 나간다.
투게더,네티즌,6.0,"뭔가 몸이 붙은 연출이 나올때마다 걱정스럽다기보단 웃겼던 CG, 그리고 왜 이게 붙었다는 이유가 나오지않고 결말이 결국 둘이 하나되어 끝이었던 영화"
투게더,네티즌,10.0,권태기를 겪어본 사람이라면 공포장면에도 눈물이 흐를것
투게더,네티즌,7.0,평론가것들 평론 남긴거봐바. 쟤들 진짜 중이병 걸린 애들이야. 유치하기 짝이 없다. 나름 머리 짜서 쓴 한줄평 수준좀 봐바. 쟤들 민낯 좀 보라고.
투게더,네티즌,9.0,ㄱㅊ네 보세요 재밋음ㄱ
투게더,네티즌,10.0,로맨스와 공포의 조화. 매우 신선함
투게더,네티즌,8.0,서브스턴스가 떠올리기도 하는 평범하지 않은 신선함과 두배우의 훌륭한 연기가 볼만한 충격적인 영화였다...
투게더,네티즌,2.0,노잼 결말도 별로고 영화 보면서 도대체 무슨말을 하고싶은건지를 모르겠음
투게더,네티즌,7.0,생각보다 재밌었다근데 왜 청불이 아니지...?
투게더,네티즌,10.0,어쩜 이런생각을 했을까.징그러워서 몇몇장면에서는 시선을 돌릴수밖에 없었지만그만큼 재밌었다
투게더,네티즌,8.0,"그냥 초자연적인 사건에 휘말린 커플의 이야기로 봐도 좋지만어떻게 보면 남성성과 여성성, 인간의 자아성취 및 연애에 대한 질문을 던져주는괜찮은 영화였다고 생각합니다. 징그러운 장면이 있지만그걸 견딜 수 있다면 충분히 괜찮은 영화라고 생각합니다."
투게더,네티즌,8.0,"잔인함과 흉측함이 아닌 사람 사이의 ""연민과 서로를 향한 기댐""이 잔상으로 남아지는 영화."
투게더,네티즌,8.0,조금은 충격적인 컬트영화
투게더,네티즌,5.0,“바디” 호러 영화가 아닌 바디 “호러” 영화
투게더,네티즌,10.0,최근 본 영화중에 가장 좋았습니다 공포 스릴러 하나도 부족할께 없습니다
투게더,네티즌,6.0,소재가 신선했고 보는 내내 지루하지 않았다.
투게더,네티즌,8.0,식욕제거다이어트영화
투게더,네티즌,8.0,생각보다 점프스케어 많음..음향을 진짜 잘 쓴 것 같습니다
투게더,네티즌,4.0,1-0으로 89분을 앞서다가 추가시간에 2골 쳐맞는 전개. 결말이 허무를 넘어 욕이 나옴.
투게더,네티즌,6.0,내가 너무 기대를 많이 했던걸까.. 너무나도 전형적인 공포 스릴러 물이라 아쉬웠음
투게더,네티즌,7.0,하나가 되자 그냥 받아들여
투게더,네티즌,4.0,아…내 돈 주고 봐 버렸다.
투게더,네티즌,10.0,마침내 부부가 되는 과정
투게더,네티즌,6.0,그렇게 재미없진 않았지만 ㅋㅅ하는장면이 너무 많이 나와서 17살인 내가 봤을땐 너무 민망했다
투게더,네티즌,10.0,"기괴하고 독특한 소재이고 잘 만들었다.몰입도가 장난이 아니였다.나우 유 씨 미로 친숙한 데이빗 프랑코, 제임스 프랑코의 동생이다.그의 연기도 좋았다.특히 알리슨 브리도 연기를 잘 했다고 본다(둘은 실제 부부다).열린 결말인데, 관람하고 나서 곱씹게 만든다.기분은 나쁘지 않았다."
투게더,네티즌,6.0,바디호러영화. 괜찮아요
투게더,네티즌,7.0,"괜찮은 분위기, 뻔한 전개와 결말. 놀라운건 19세 영화가 아니라는 것뿐"
투게더,네티즌,8.0,재밌었어요! 지루한 틈 없고 15세라 적당히 고어해서 볼만 하고 무서운 영화라고 생각 안하고 봤는데 놀라는 부분 꽤 있었어요
투게더,네티즌,10.0,어떻게 이런 스토리를 생각해낼 수 있는지 정말 작가가 천재적입니다. 스팩타클한 배경이 아니어도 이렇게 몰입되고 쫀득하게 만들수 있는지 보는 내내 긴장감 가운데 몰입해서 봤습니다 평점 10점이 아깝지 않습니다. 아무튼 굉장한 스릴러 고어물입니다.
투게더,네티즌,8.0,이야기도 좋고 소재도 참신해서 끝까지 몰입하면서 보았다
투게더,네티즌,8.0,"두 배우 연기도 좋았거, 내용도 흥미롭게 잘봤습니다.긴장감도 있고 재미있었어요"
투게더,네티즌,6.0,끝내주는 발상과 표현이 호러의 무기력을 위해 지옥의 이지선다로 내몰린다.
투게더,네티즌,7.0,"평소에 관심있던 장르는 아니던데, 선명한 기억의 서브스턴스부터 보기 시작했던 것 같아요.이 영화를 알고 얼마지나지 않아서 관람을 결정했는데요. 영화도 재밌게 봤습니다!"
투게더,네티즌,10.0,진짜 공포감 지리게 잘주고 결말에서 박수침. 새로운 느낌의 공포임 꼭보셈
투게더,네티즌,10.0,대만족입니다^^ 최근에 본 영화중에 제일 흥미진진하게 본 것 같아요
투게더,네티즌,10.0,졸라재밋가!보세요..남주귀여미
투게더,평론가,10.0,사랑하기 딱 좋은 신체로의 진화
투게더,평론가,10.0,초강력 본드 마사지가 남긴 것은
투게더,평론가,10.0,빈말이 아니라 진짜 둘이 하나가 될 때
투게더,평론가,10.0,그들은 아픈데 웃어도 되는지 고민했다
투게더,평론가,10.0,너는 내가 되고 나도 네가 될 수 있었던 수많은 기억들
투게더,평론가,10.0,하나면 하나지 둘이겠느냐
