제목,작성자유형,평점,리뷰
로비,네티즌,2.0,"하정우감독작품 기대하고 봤는데... 시나리오, 대사 전혀공감이 안가는... 연기도 빠른 대사에 무슨말인지 전달도 안되며... 스토리도 애매합니다.... 첫장면은 기대를 모았으나... 갈수록 졸음이 몰려옴..."
로비,네티즌,1.0,"아무리 영화여도 소수의 캐디들이 행하는 것들을 과장되게 보여주지 않았나-가볍게 넘기기엔, 지인이 캐디라... 같이 저 영화 보고 기겁함.10여년 캐디 하면서 만취한 채로 근무하는 분들 못 봤다며. 암튼 뭐 B급 갬성으로 가벼어어어업게 보고 갑니다."
로비,네티즌,1.0,승부 볼껄… 그냥 골프치러가고 선물주고 대화하다 일 꼬인줄 알았는데 잘해결되고 끝남특별히 기억나는 장면이나 대사가 없음..
로비,네티즌,6.0,그냥 평범한 영화라고 생각해요 제 취향에는 별로
로비,네티즌,1.0,재미도 없고 연출이라고 할 것도 없고그냥 배우 친구들 모아서 콩트 찍음
로비,네티즌,2.0,보다 잠듬뭘 보여주려는건지…..
로비,네티즌,2.0,"천박한 것들의 뷔페. 보면서 웃는 사람의 인성도 의심될 정도로 보기에 역했다 -_- 웩. 최종적으로 멀쩔하다고 설정된 둘. 하나는 연기를 너어무 못하고, 하나는 이미 문제가 이것저것 있었으니 가증스러워 보이고."
로비,네티즌,4.0,"특별히 만나뵙고 싶던 배우님이 아니었다면 시간내어 가지 않았을 것 같아요. 재미, 감동, 교훈 어떤 요소도 만족스럽지 못했어요. 웃음을 위해 심어놓은 듯 보이는 코드들이 있었는데 저에게는 다소 맞지 않았네요... 몇몇 장면들은 다소 불쾌하게 느껴지기도 했습니다. 그럼에도 출연진들이 모두 참석해서 서로 격려하며 열심히 홍보하시던 모습은 보기 좋았고 인상적이었습니다. 연기 자체에 대한 불편함은 없었지만 주연을 맡아도 손색이 없는 배우님들이 참여하신 만큼 더 좋은 시나리오가 주어졌다면 어땠을까하는 아쉬움이 남습니다."
로비,네티즌,2.0,음....무슨 영화인지ㅠㅜ 코미디인데 웃음 포인트는 저랑 안맞았어요.
로비,네티즌,1.0,진짜 재미 1도 없어요.. 좋은 배우들로 왜… 너무 안타까워요 .영화에서 뭘 전달할려고 하는지.. 잘 모르겠어요 ㅠ 그냥 골프 라이딩 하는 내용..그게 끝..
로비,네티즌,1.0,영화 어떤의미로 만들었고 뭘이야길 전달하는지 모르겟음 내내지루햇고 대사몇마디만 웃겻고골프장씬부터는 최악.. 대사전달도 잘안되고 무슨말을 하늨지도 모르겟고 골프를 주제로 삼앗나.. 굳이 왜.. 이걸 영화로? 진짜 재미없고 시간아까웟던 영화.. 그냥 인맥영화인듯
로비,네티즌,1.0,깊이와 철학은 애초에 기대도 안했음. 최소한 내용 전개라도 관객이 이해할 수 있도록 친절해야되는데 초반부 등장인물에 대한 소개가 너무 부실해서 뭐가 어떻게 전개되는지 이해 자체가 어려움. 붕붕 뜨고 오버하는 연기는 덤이고 전개가 매끄러운 것도 개연성 있는 전개도 아니고 각본과 감독의 역량 한계가 고스란히 느껴지는 작품. 프로 골퍼 여배우 캐스팅 잘 한 것 하나 인정. 이런 작품들이 나오는데 어떻게 영화관에를 가겠나. 이런 작품을 내놓고 사람들보고 영화관 오라는건가. 영화관 가서 영화보고 싶다. 그에 걸맞는 작품이 나왔으면 좋겠음. 정말 반성이 필요하다는 의미에서 강도높게 씁니다.
로비,네티즌,1.0,이걸 지금 영화라고 만든건가요?? 보는내내 어떤감독이 만든영화가 이정도인가 했네요. 진짜 비추하네요
로비,네티즌,2.0,넷플릭스로도 안볼 영화평점보고 갔는데 절대 가지마세요특히 보러가고싶다면 누구한테 같이가자고 제안하지 마세요
로비,네티즌,4.0,정우형 제발 연기만하자ㅠㅠ
로비,네티즌,4.0,아뉘 정우형좀잘하는거하자잇
로비,네티즌,2.0,화려한 캐스팅에...못 미치는 구성.내용...너무 재미없어용...감동도 웃음도 재미도 없음관객의 마음에 로비 실패인듯합니다ㅜㅜ
로비,네티즌,1.0,하정우는 감을 잃었다. 예능 나와서 홍보는 주구장창 하는데 자기들 만담같은 이야기들이 재밌다고 하이 코미디라고 강요받는 느낌 진짜 웃겨서 웃고싶다. 공부를 좀 더 공부를 해야한다고 본다
로비,네티즌,4.0,배우들 인지도만 믿고 너무 대충 만든거 아닌가요.. 실망입니다..
로비,네티즌,1.0,내시간.. 아깝... 이런 영화면 나도 만들겠다
로비,네티즌,2.0,영화 보다 나오기는 첨이네요스토리 구성이 넘 단조롭고 대사의 90%가 말장난인거 같아 좀 지루했네요 믿고 보는 배우라 관람했는데 좀 실망했어요
로비,네티즌,4.0,그닥 재밌지는 않아요!!!죄송해요….영화관가서 볼 영화는 아닌것같아요
로비,네티즌,2.0,하정우 배우보고 개봉하자마자 평점보고갔는데~중간에 나오고싶은맘이 생긴건 첨임~제갠적 평은평점0이에요
로비,네티즌,2.0,하정우배우님은 그냥 배우만 해주세요.ㅠ
로비,네티즌,2.0,"보나마나 지들끼리 잼있다고 낄낄거리면서 찍었겠지,연출은 당신들이 재밌자고 하는것이 아니라 관객들 재밌으라고 만드는거입니다.최근 주연작들도 말아 드시더니 연출작으로 발우공양하셨네..."
로비,네티즌,1.0,졸라 개 졸라 노잼임처음부터 끝까지 골프이야기 하...내돈 누가 보상해주냐....
로비,네티즌,1.0,K영화는 오늘 죽었다 다시는 속지않는다
로비,네티즌,2.0,이런 영화는 도대체 왜 돈 들여서 제작하는거임?
로비,네티즌,1.0,"영화를 매우 좋아하는 사람이라 굳이 시간내고 돈 써서 극장가서 봤습니다.뭔가 더 있겠지,,, 뭔가 더 있겠지,,, 30분 정도 그런 생각하며 버텼는데 너무 힘들고 지루하고 실망만 커졌습니다.그냥 감독 그만하고 제대로된 작품에 연기나 하셨으면 좋겠네요.허삼관보다 더 심한거 같아요."
로비,네티즌,2.0,이게 끝이라고???? 밖에 생각.안나네요
로비,네티즌,1.0,오티티에 나올 수준이다
로비,네티즌,2.0,이 영화 개봉시킬려고 로비했나…
로비,네티즌,2.0,출연자만 쓸데없이 많아서 산만하고 딱히 내용이 없는.. 재미도...감동도 ㅠ
로비,네티즌,2.0,"뭘 보여주려고 한거지 모르겠네요골프장에서 흡연,음주,불륜까지최시원 빤OO람 최악이네요"
로비,네티즌,1.0,시간 남아도시면 가서 보세요!
로비,네티즌,6.0,최시원 대사 하나도 안들리는데 나만 그런건가요? 너무 기대안하고 보면은 쏘쏘한 영화
로비,네티즌,2.0,골프소재예능 싹다망함영화라고다를건없다고느낌
로비,네티즌,1.0,와 무섭다 부끄러운줄 알아야지
로비,네티즌,6.0,여자프로골프가 몸로비로 했다는 발상이 감독의 수능점수를 궁금하게 한다 열살 안되는 동생있는 콩가루 딴따라
로비,네티즌,4.0,뭔가 대단한 로비가있을줄알았는데.. 그냥골프접대영화였네 저런 대단한배우들이 ㅁ많이 나오는데 왜 저렇게밖애 못끄는건지.. 아쉽
로비,네티즌,4.0,하하하 통신사 무료관람이 아니였다면 돈 너무 아까울뻔 했어요;;ㅎㅎㅎ
로비,네티즌,2.0,영화보는내내 지루하고 따분
로비,네티즌,5.0,ㅎㅎ 기대없이 봤는데도 참... 그렇다
로비,네티즌,5.0,아 기대햇는데 이게 뭐노
로비,네티즌,5.0,로비 윌리암스에게 로비해도 소용 없음
로비,네티즌,2.0,와이프랑 오랫만에 극장에서 분노한영화. 지루하면 잠이라도 잘건데 이건 영화보다 분통이 터져 잠도 안오네요. 영화 승부 보면서 유아인을 용서해주고 로비 보면서 괜시리 하정우가 미워지네.
로비,네티즌,4.0,로비 영화가 아니라 그냥 골프 영화 같아요~~!골프 용어밖에 기억이 안나요~~!저랑은 안맞는 것 같네요..ㅠ.ㅠ배우들의 연기력은 좋았습니다.
로비,네티즌,1.0,이거 왜 별 눌러야하냐왜 내시간 아깝다감상포인트없는데 왜 눌러야하냐
로비,네티즌,4.0,숏폼으로 보기 좋은 영화임 잔잔히 웃기기는 하는데 기대하고 보면 힘들 수 있음
로비,네티즌,4.0,배우분들 연기 좋고 피식 피식. 근데 영화관에 시간내서 가서 볼 정도는 아닌것 같습니다. 배달음식 시켜서 집에서 ott로 가볍게 보기는 딱일것 같아요.
로비,네티즌,1.0,제가 살다살다.. 1점준 영화는 처음이에요...하정우부터 주영찡 까지 진짜 나오는배우 다좋은데 무슨 이런 망작을.. bgm도 너무커서 자막 넣으셔야할거같은데요.. 골퍼로써 기분도 나쁩니다.. 누가 공을 저렇게칩니까ㅜㅠ 카트주차장에 무슨 말도안되는 리셉션부터 시작해서 ㅋㅋㅋ대체 어딜가야 카트서 술먹고 뭔 별.. 실소만 짓나가 나왔네요. 아 시간 돈 다 아까워..
로비,네티즌,2.0,왜만들었지 ;;지루해 죽는줄;;시간낭비;;
로비,네티즌,1.0,스토리도 이해안되고 어디서 웃어야하는지도 모르겠고 후반부는 너무 역겨웠음
로비,네티즌,1.0,그냥 냉정하게 추석영화로도 방영 안될듯 ㅋㅋ
로비,네티즌,2.0,하정우씨는 연기만 하는걸로...
로비,네티즌,1.0,아 진짜 빡치네 뭔내용임이게
로비,네티즌,4.0,하정우님 이 영화 만들고 완성본 보고 재밌으셨나요?롤러코스터보고 전 님이 개그천재인줄알았어요웃기려고 안하는데 웃긴게 감독님 스타일인줄 알았는데 너무 억지스럽고 참신하지도 않아요하품 계속했고 양옆이 막혀있어서 못나갔어요개그영화는 이제 그만
로비,네티즌,4.0,예상보다 별루였어요. 박진감도 긴장감도 없는 영화는 처음이였어요 처음으로 돈이 아깝다는 느낌이였습니다
로비,네티즌,4.0,배우들을 이영화에 아깝다
로비,네티즌,4.0,저는 이영화를 재미있게 보아슴미다^^하지만...이영화의 손익분기점은 150만! 하지만 딱! 15만봐도~괜찬을 저예산 냄새가 풀풀 ㅠㅜㅠ 촬영때 골프장 빌리고~ 알만한 배우들의 출연료가 전부ㅠㅜㅜㅠ
로비,네티즌,2.0,댓글알바들인가요..ㅜㅜ 그닥 재미도 감동도 없는.. 배우분들도 별점1점도 넘 아까울지경..ㅜㅜ
로비,네티즌,2.0,재미도 감동도 유머도 액션도 뭐 하나 특출나지 않았던 산상종같은 영화
로비,네티즌,2.0,점수 후하게 드렸습니다. 이제 감독은 그만.
로비,네티즌,1.0,정우형 그냥 배우만 하면 안될까?나 진짜 극장 뛰쳐 나올뻔 했어Snl 이 더 재미있으면 어쩌란말야...
로비,네티즌,1.0,이걸 영화라고~~대실망~배우는 극중 이미지였다는걸..하정우 개그 코드는유치에 저질~
로비,네티즌,4.0,기대했는데.. 재미없었어요.연기는 잘하는데 내용이 별로에요. 배우탓은 안해요.스토리에 신경써주세요. 돈이 아까웠어요.어려운 영화판에 다음엔 힘내주세요
로비,네티즌,2.0,줄거리가 납득이 안되네요
로비,네티즌,1.0,"내 살다살다 이런 거지같은 영화는 첨본다. 불편, 노잼, 저질, 내용파악안됨 . 하정우씨는 연기자면 연기에 몰입하지 왜 자꾸 일벌려요 능력도 안되면서? 본인에게 맞는 일을 하세요 능력 안되면서 할 수 있다는 신념으로 자꾸 하면 인생 고달파요.내가 살면서 본 영화 중 제일 저질이 '그 남자의 책 198쪽' 이었는데 어제 이후로 로비가 제일 저질 영화로 바뀜. 확씨 영화비 당장 환불받고 싶네"
로비,네티즌,2.0,롤러코스터보다 더 퇴보한듯 감독은 포기하고 그냥 배우만 했으면
로비,네티즌,1.0,탱고샷 에서 나왔다감독도 골프도 너무 싫어짐
로비,네티즌,1.0,평점 ?별시니 머이런걸
로비,네티즌,4.0,차라리 롤러코스터 처럼 완전 b급 감성으로 갔더라면...
로비,네티즌,2.0,최악이다 진짜 이걸영화라고ㅜㅜ하정우나온다고해서 봤는데 실망 내용도없고보는내내지루...보다가 나와버림 돈아깝다ㅜ
로비,네티즌,2.0,친구들아 미안하다. 내가 고집 부려서.
로비,네티즌,4.0,코미디라고 하기에는 그닥 그냥 텔레비전에서 드라마로 볼까 하는 정도요
로비,네티즌,2.0,대실망.. 아.. 돈아까워...
로비,네티즌,2.0,하정우 골프 tv ㅋㅋ 사업쬐끔 10 ㅡ 골프접대 영상 90 ㅡ 경쟁사 나락 10 ㅡ 기타
로비,네티즌,1.0,한예종 부정입학한 녀석이 만든 졸업작품. 결국 수료.
로비,네티즌,1.0,영화 보다가 나온 건 처음이다. 진짜 너무 재미없어요.
로비,네티즌,2.0,별로 돈낭비 영홯ㅎㅎㅎㅎ
로비,네티즌,1.0,골....프..만..보고..ㅡ...왔다는..감성포인트 선택할게 없다는 출연자들은 빵빵한데 스토리는..폭..망
로비,네티즌,1.0,참담함을 넘어선 비참함이 억누른다 도대체 누가 투자한 건지 뇌를 좀 보고 싶다
로비,네티즌,2.0,승부와 달리 영화관에서 보는 것보다 그냥 넷플에서 시간 때우기용으로 보는게 맞긴하고 정우형 이제 연출 그만하자
로비,네티즌,2.0,이제 감독은.. 그만.. 너무하네요.관객이 왜 극장을 찾지 않는지 한번 돌아봐주시길
로비,네티즌,4.0,아니 근데 하정우는 연출을 왜 자꾸 하는건가요? 객관적으로 봐도 재능 이 없는게 보이 잖아요 정말 이해가 안가네요
로비,네티즌,2.0,기대하고 봤는데 너무 실망이 크네요
로비,네티즌,6.0,"2000년 초반부터 하정우 배우의 출연작을 보아온 70~80년대생들에겐 옛 향수를 불러옴-> 전개가 올드함. 못 봐줄 영화는 절대 아니지만, 넘치는 캐스팅에 비해서 왜…. 이것밖에…..라는 생각이…..자꾸 스침.원경의 대단했던 차주영도 나오고 슈주에서 잘생겼다고 소문난 최시원도 흉측하게 털도 안깎고 열정적으로 찍은거 같은데 ㅠ 물가가 많이 오르니 이거 볼라고 내가 여기 있나 살짝 현타옴.하배우의 연기도 좋아 하고 그의 영화도 많이본 팬이지만, 감독으로써는 잘 모르겠다 돈 많으실테니까 취미로 찍으신다면 할말 없지만,,,,"
로비,네티즌,2.0,...인생 최악의 영화 휴... 승부를 보지 않고 로비를 보다니....솔직히 하정우는 연기만.... 하시는게
로비,네티즌,4.0,이건..배우들 연기력이 멱살잡고 하드캐리했습니다. 배우들에게 고맙습니다
로비,네티즌,6.0,"하정우 감독 보다는 배우가 적성에 맞을듯 합니다. 스토리,구성,연출력이 부족해 보입니다. 배우들 연기가 좋아서 별세개 줍니다, 골프치는 장면이 너무 길어요."
로비,네티즌,4.0,그냥 아무 생각 내용 없고 재미난 부분 몇 포인트
로비,네티즌,6.0,영화를 보고나니 지금의 현실이 더 안타깝다.
로비,네티즌,6.0,코미디 영화답게 빵빵 터지는 부분이 있었습니다. 그런건 좋은데 음 일단 궁금하면 보세요. 호불호가 많지않을까 싶습니다.
로비,네티즌,4.0,재능낭비~~^^몇달뒤 무료감상가능할듯
로비,네티즌,2.0,누가 자꾸 투자해주는거냐?롤러코스터 띠동갑으로 나온 하감독의 두번째 행위예술
로비,네티즌,1.0,기승전결에 결밖에 없다
로비,네티즌,1.0,인생 최악의 영화 더 할 말이 없는데 10자 채워야하네
로비,네티즌,2.0,조용한 환경에서 잘 보았습니다한국영화의 고질적인 오디오효과 배우들의 발음 웅성웅성거림으로 뭔말인지 못알아듣는게 태반 이영화는 더심하네요 자막도입이 시급합니다
로비,네티즌,1.0,저랑은 좀 안맞네요...ㅠ
로비,네티즌,1.0,진짜 눈을의심햇다 보면서이게 뭐냐ㅠㅠ 클리셰 개범벅 그냥 재미가 1도없고 돈내고봐야할 이유는 더더욱 없음그리고 내용전개가 느린것도 아닌데 개지루함영화 내내 골프치다끝남결말은 초스피드전개라 그냥어벙벙결말도 꽉막힌 결말이고친구랑 보면서 웃음만 참다나왓다너무어이없어서그리고제일 빡치는거는 노린듯한 웃음포인트가 다 느껴진다는거
로비,네티즌,6.0,대사전달이 부적확함...뭔소리를 하는건지~~
로비,네티즌,1.0,주인공의 자기연민이 대단합니다.
로비,네티즌,4.0,"작품하실 때, 감독이나 배우 둘 중 하나만 하시면 어떨까요? 확실히 시야가 좁은 느낌이 작품에서 느껴지고, 장면 흐름이 매끄럽지가 않아 전체적으로 학생작품 같은 느낌입니다. 배우들 연기는 너무 좋았습니다."
로비,네티즌,4.0,"못볼정도는 아닌데, 그렇다고 볼만하지도 않은"
로비,네티즌,4.0,"이거 볼바에는 그냥 승부를 한번 더 본다... 배우들 연기는 잘함근데 영화가 재미가 없잖아... 연기 잘하는건 승부도 마찬가지인데 어떻게 바둑영화보다 재미가 없을수가,,,"
로비,네티즌,1.0,한국영화의 현주소ㅋㅋ 관객을 개 호구로 앎
로비,네티즌,1.0,진심 이거를 보라고 만든건가요..
로비,네티즌,4.0,하정우님 팬이라 나오신 영화들 전부 보고 일부러 영화관가서 엄마랑 관람했는데 솔직히 너무 재미없어서 당황스러웠어요..ㅠㅠ훨씬 옛날에 봤던 롤러코스터가 더재밌네요..고민하다 봤는데 진짜 돈아까웠습니다ㅠㅠ평 좋게 쓰고 싶었는데 이건 좀 아닌거 같아요..
로비,네티즌,2.0,진짜 팬인데 연기만 하는 걸로 해요 … 오히려 저는 허삼관이 더 재미있었던 거 같아요
로비,네티즌,1.0,웃으러갔는데 한번도 못웃고 나왔습니다…
로비,네티즌,4.0,"돈내고 보기는 아까운편이고, 시간때우기용으로도 별로.."
로비,네티즌,4.0,김의성이 나오는 영화는 일단 거름
로비,네티즌,6.0,시간떼우기용 영화로 보시면되겠어요
로비,네티즌,2.0,별로 그렇게 반갑지는 않았던 것 같네요.그냥 일반적인 코미디인 느낌.
로비,네티즌,1.0,김의성 재수없네 진짜 와
로비,네티즌,4.0,롤코 기대하고가면 안댐
로비,네티즌,2.0,정우오빠 미안해요.. 한번도 웃지 못했네요.. 김의성 배우님 연기가 너무 리얼해서 거북했어요 연기 최고!
로비,네티즌,2.0,스포할게 없음그냥 케이블에 골프방송 보는줄...딱2명 앉아서 봄 관객 없음스토리도 없음내용이 시작과 끝도 없음?
로비,네티즌,1.0,"하정우님너무팬이고,하정우식말맛도알겠는대이건아닌듯싶네요..보다잤어요..시간아까웠는대그나마첫무대인사라며영화끝나고배우분들봐서좋았어요!"
로비,네티즌,1.0,역합니더….우웩엑엑
로비,네티즌,1.0,야~ 그걸 영화라고 만들었어요?
로비,네티즌,3.0,정우형 왜그래..이건 아냐
로비,네티즌,2.0,좋은 배우들을 데리고 이렇게 밖에 만들지 못했다는 게 아쉽습니다... 이야기의 개연성도 없어보인다는 느낌이 많이 들었어요.
로비,네티즌,1.0,"평점이 왜 7점이나 되는지 이해가 안가는 영화.재미도 감동도 없는 영화.인생 처음으로 보다가 중간에 나간 영화.이걸 보느니 공중에 돈을 날리는게 더 보람찬 영화.더 빨리 나갈걸 후회하게 만든 영화.OTT로 봤음 중간에 껐을 영화.내용 개연성도 없고, 발음 안좋은 배우는 뭔말하는지 못알아 들어서 자막 찾게 되는 영화.돈이 썩어 넘쳐나도 시간은 넘치지 않으시잖아요? 비추합니다.1시간 20분을 쓰레기통에 쳐박은 기분, (1시간 20분 보고 뛰쳐 나옴)(더 빨리 나갈걸 후회 함.)"
로비,네티즌,2.0,시간 돈 매우아까움!!!
로비,네티즌,2.0,"일단 영화 너무 허접하다.비오는 주말 오래간만에 영화검색을 하다, 하정우감독,배우라는 말에 예약하고 봤는데..너무실망내용 너무 단순하고, 코믹하지도 안고,주연급배우,조연급배우 우르르 조연으로 나오고...감독으로는 초보라서 그런지..앞으로 좋은 작품 나오면 좋겠습니다."
로비,네티즌,4.0,음..이건 아닌거 같아요 ..
로비,네티즌,7.0,"롤러코스터를 잇는 하정우표 블랙코미디 역시나 말맛은 취향저격,캐릭터들 앙상블이 조화로우나몇몇 아쉬운 캐릭터들이 있음(최시원- 뭐라는지 잘안들리고 억지스러움, 현봉식-캐릭터랑 안맞아보임)"
로비,네티즌,3.0,웃기려고 매우 노력하지만 캐릭터연기 대사한마디한마디가 역겨워 미안 진심임
로비,네티즌,1.0,기대하고 봤는데 노잼....
로비,네티즌,4.0,똥사러갔습니다. ~이거 말고 웃을게 없었음뭐가몬지 내용을 잘 모르겠음
로비,네티즌,4.0,글쎄요 기대한 만큼 실망이 크네요
로비,네티즌,4.0,제목을 골프로 바꾸지 로비 ㄴㄴ
로비,네티즌,2.0,이거 보고 로비하는 법을 배웠습니다. 앞으로 로비 더 열심히 해야겠어요. 대한민국 화이팅!
로비,네티즌,1.0,하정우 배우로는 소질은 있으나 감독으로는 소질자체가 없다고생각합니다..이제 하정우 감독 영화 패쓰 패쓰....
로비,네티즌,10.0,기대없이 봤다가 끝까지 웃고 나온 영화 배우들 케미도 잘맞고 티키타카도 잘됨그냥 계속 흐믓하게 웃으면서 맘편하게 볼수있어서 너무 좋았음
로비,네티즌,4.0,냉정한 평가가 미안하긴 하지만..하정우식 유머를 기대했지만 수준미달이었습니다.화려한 출연진만 볼만했을 뿐 그 외에는 공감할 수 없는 개그와 흥미없는 내용이었습니다.이제 감독은 그만.. 그래도 하신다면 하정우식 유머는 빼고 진솔한 시나리오이길..
로비,네티즌,2.0,초반에 볼만하다가 뒤로갈수록 이게 뭐지….시간아깝..
로비,네티즌,2.0,댓글이 공감순으로 보면 죄다 별점이 한두개짜리인데 전체 갯수로는 별점 4~5개가 제일 많네...이거 사기아닌가
로비,네티즌,1.0,감상평: 진짜 욕도 아깝다...
로비,네티즌,2.0,뭔가 스토리 중간이 자꾸 끊어진 느낌! 뭐지? ㅠㅠ
로비,네티즌,3.0,국밥맨 ㅠㅠ걍연기만요 요즘너무국밥이네
로비,네티즌,1.0,"감상 포인트가 없는데 왜 자꾸 고르라해여?대사가 지나치게 너무 많고, 잘 들리지도 않았으며, 웃음 포인트도 없었습니다. 대한민국 극장영화가 엄청난 하락기이며 비수기임을 느꼈습니다."
로비,네티즌,1.0,영화 본 걸 후회 했다는 걸 처음 느낀 영화
로비,평론가,1.0,"드라마는 능청맞게, 웃음에는 진지하게 임하는 앙상블"
로비,평론가,1.0,로비 없이 이길 수 없는 게임에서 내 룰을 지켜야 하는 것의 곤란함
로비,평론가,1.0,떼지어 요리조리 어정쩡하게
로비,평론가,1.0,대중적으로 풀어내 살짝 아쉽지만 여전히 웃긴 하정우의 코미디
로비,평론가,1.0,순진해서 싱겁다
로비,평론가,1.0,가장 잘할 줄 아는 말맛 소동극의 연출로 돌아오다
승부,실관람객,10.0,"믿고보는 이병헌, 볼수록 아까운 유아인"
승부,실관람객,10.0,그냥 둘의 연기만 봐도 충분하다
승부,실관람객,8.0,오늘 10시30분영화 보고왔다 댓글알바도아니다. 누구 하나 욕심부리는거없이 그 실존인물에 들어가 깔끔하게 연기했다라고 말할수있다 . 어느누가 연기로 그들을 깔수있을까 싶다 연기는 진심 뭐 말할게없다지루했다는 평이 있던데 나는 솔직히 지루하지...
승부,실관람객,9.0,유아인의 연기를 다시 볼 수 있어서 좋았다..ㅜㅜ
승부,실관람객,10.0,진짜 영화같은 실화네요. 배우들 연기도 너무 좋았어요.
승부,실관람객,8.0,"이병헌은 명불허전이고, 유아인은 기대 이상이다."
승부,실관람객,10.0,"2025년 최고의 한국영화, 영화가 고급스럽다는게 딱 어울리는 표현인 것 같습니다 아는 사람들은 가치를 알아보는 영화인거죠, 결말을 알면서도 쫄깃하고 긴장감 있게 봤고 바둑은 흰돌 검은돌 밖에 모르는데 게임 경기 보는 것 같아서 너무 재밌었어요 ㅋㅋㅋ 저에게 한번 더 보고싶다는 생각 들게 한 몇 안되는 영화였어요 강추드립니다"
승부,실관람객,8.0,곁가지 하나 없이 우직하고 담백하게 보여줄것을 보여주다.
승부,실관람객,10.0,"마치 그 시절로 돌아간 듯한 착각 속에 바둑의 전설이라 불리는 두 사람의, 손에 땀을 쥐게 하는, 긴장감 넘치는 바둑 대결을 훌륭하게 잘 표현한 멋진 작품이네요^^"
승부,실관람객,10.0,역시 믿고 보는 연기의 신! 병헌리의 무한 연기 변신은 끝이 없다! 명불허전 연기로 스크린을 압도하는 영화!
승부,실관람객,7.0,이병헌 보러 갔다가 유아인 연기에 놀람
승부,실관람객,7.0,지루한건 어쩔수가 없는데. 유아인이 이창호를 너무 잘 연기함. 악마의 재능
