제목,작성자유형,평점,리뷰
퍼스트 라이드,실관람객,10.0,그냥 코믹인줄 알았는데 감동적인 장면도 있어서눈물 찔끔 했어요 역시 배우들 연기 최고강하늘 코믹 존잼 차은우는 그냥 얼굴이 잼있음!한선화도 연기 잘하고 가볍게 보기에 꿀잼 입니당 ㅎㅎ
퍼스트 라이드,실관람객,2.0,30일 재밌게 봐서 기대했는데...
퍼스트 라이드,실관람객,2.0,동남아 여행의 경각심을 알려주는 영화
퍼스트 라이드,실관람객,6.0,진짜 심각함 비공 폭탄 맞자ㅋㅋ
퍼스트 라이드,실관람객,4.0,보스 다음 타자 심각한 한영 코미디
퍼스트 라이드,실관람객,3.0,올드하고 유치해요 전작 30일감독 맞나요
퍼스트 라이드,실관람객,6.0,차은우 잘생김만 기억남.
퍼스트 라이드,실관람객,1.0,그냥 재미없어요 코미디장르 맞나 싶음
퍼스트 라이드,실관람객,5.0,오바한 개그가 마지막에 나오는 영화의 진정성마저 해친다. (영화의 구성이 괜찮은데 개그장난질로 영화를 망쳐서 짜증이 났음. 차은우는 허위매물)
퍼스트 라이드,실관람객,4.0,강하늘 차은우 보려고 보긴 했는데 끝까지 노잼 ㅠㅠ
퍼스트 라이드,실관람객,4.0,차은우 나온다며 보러 간 사람들아 미안해
퍼스트 라이드,실관람객,5.0,후반부의 예정된 갑작스러움이 역시나 당황스럽다
퍼스트 라이드,실관람객,6.0,얼굴은 웃긴데 영화는 안 웃기다.
퍼스트 라이드,실관람객,6.0,아쉽게도 억지웃음과 유치함만이 가득.. 전작 대비 그다지였네요..
퍼스트 라이드,실관람객,6.0,기약없는 다음에가 아닌 바로 지금.
퍼스트 라이드,실관람객,3.0,영화가 뭘 말하려는지 전혀 모르겠음 웃음 포인트도 별로 없고 .. 캐스팅이 아까운 영화
퍼스트 라이드,실관람객,6.0,무난한 코미디 영화로 저는 재미있게 봤습니다만 꼭 극장에서 봐야할건 아닌것 같습니다.
퍼스트 라이드,실관람객,6.0,제발 아니었으면 하는 결말을 향해 다가가는 기분. 그 새롭지도 재밌지도 않은 결말만 아니었어도 훨싼 더 나았을텐데.
퍼스트 라이드,실관람객,6.0,강하늘 연기잘해서 본건데 작품선택이 아쉽네요 다른멋진 작품 기대할게요
퍼스트 라이드,실관람객,7.0,그저그런데 배우들은 열심히함
퍼스트 라이드,실관람객,8.0,이 정도면 나쁘지는 않다 생각합니다
퍼스트 라이드,실관람객,6.0,30일 감독과 강하늘을 쓰고도 이정도밖에 못만드나싶은.. 그나마 싸게봐서 평점 진짜 후하게 준거다
퍼스트 라이드,실관람객,6.0,친한친구들의 우정이 있다면 트라우마 하나쯤은 이겨낼 수 있다는 것을 깨닫게 해주는 영화
퍼스트 라이드,실관람객,1.0,여러모로 아쉬운 점이 많은 생각이 드는 영화..개연성도 모르겠고 엄청 재미있는지도 잘..가볍게 보기 좋다길래 봤는데 가볍다 못해 뭐가없는 느낌..
퍼스트 라이드,실관람객,10.0,"차은우 얼굴도 재밌고, 역시 강하늘 코미디 연기도 믿고 봄. 올해 본 코미디 영화 중에 제 취향은 이거입니다~"
퍼스트 라이드,실관람객,5.0,시간 아끼세요... 재밌지도 않네요
퍼스트 라이드,실관람객,4.0,정말 재미없어요 최악입니다
퍼스트 라이드,실관람객,1.0,재미없어요 일부러 웃길려고하는게 더 재미없는거같아요
퍼스트 라이드,실관람객,5.0,그저 그런 한국 양산형 코미디 영화.아 좀 신선한 거 어디 없나?
퍼스트 라이드,실관람객,4.0,"초반에 전개가 지루해서 집중하기 힘들었지만, 후반 반전이 있었네요."
퍼스트 라이드,실관람객,5.0,그냥 고등학생 때 바로 여행가는 스토리였으면 더 나았을 것 같은데..
퍼스트 라이드,실관람객,7.0,"재미없는 상황의 연속인데, 영화속 캐릭터들만 재미있다고 소리치는거 같은 영화."
퍼스트 라이드,실관람객,7.0,가볍게 볼수있지만 아쉬운 영화였습니다.
퍼스트 라이드,실관람객,4.0,여행영화라서 예쁜 관광지 풍경을 기대했는데 웬 장기적출 공장이 나오네요?캄보디아 뉴스들 생각나서 소름... 코미디영화인데 내가 이상한건지 웃음은 안 나오고...
퍼스트 라이드,실관람객,4.0,"아쉬운 완성도의 각본, 어색한 코믹 연출, 부족한 개연성. 과한 연기."
퍼스트 라이드,실관람객,4.0,퍼스트 라이드 봤습니다. 추천하지는 않습니다.
퍼스트 라이드,실관람객,5.0,"예상 가능했던 이야기 전개, 낮은 웃음 타율!"
퍼스트 라이드,실관람객,7.0,재미없고 너무 옛날스타일
퍼스트 라이드,실관람객,2.0,너무 산만하고 재미가 없어요.
퍼스트 라이드,실관람객,2.0,"웅남이,아마존 활명수를 잇는..."
퍼스트 라이드,실관람객,8.0,감독의 전작 때문에 찾아보게 된 영화... 다음 작품도 잘 부탁드립니다
퍼스트 라이드,실관람객,2.0,내 평생 이런 쓰레기 영화는 진짜 보다가 나왔습니다. 알바들 진짜 짜증나네남대중? 너는 감독 하지마라
퍼스트 라이드,실관람객,5.0,강하늘 연기 잘하고 김영광 연기 잘하는데 이번 배역은 뭔가 안어울림
퍼스트 라이드,실관람객,5.0,아 근데 아니 진짜 이거 맞아요?
퍼스트 라이드,실관람객,10.0,"30일 남대중감독, 강하늘,김영광,차은우,강영석,한선화 등 배우진들과 함께 어린시절부터 지금까지 모이면서 태국 여행지에서 벌여진 버킷리스트와 위험한 상황, 반전이 더해 나름 웃음과 감동이 담긴 영화."
퍼스트 라이드,실관람객,6.0,생각보다 별로였어요.
퍼스트 라이드,실관람객,2.0,전체적으로 많이 아쉽습니다.
퍼스트 라이드,실관람객,10.0,평점왜낮음? 완전재밋게봄
퍼스트 라이드,실관람객,6.0,초반엔 재미있었다. 10대 떄는 의외로 괜찮은데? 30대 때는 이 영화를 이렇게 망친다고? 아쉬운 영화다. 차은우 안나오니까 재미가 없어지는 희한한 영화.
퍼스트 라이드,실관람객,1.0,재미없다.유머어 포인트가 민망하기까지 히다.유치하다. 너무!!
퍼스트 라이드,실관람객,10.0,전 재미 있어요 웃음 많이 나와요 강하늘 멋지다
퍼스트 라이드,실관람객,10.0,리브 떠나다 패스트 빨리 ㅋㅋㅋ 옥심이 러블리하고 재밌어요
퍼스트 라이드,실관람객,10.0,올해 영화 중 젤 재밌었닼ㅋㅋㅋㅋ
퍼스트 라이드,실관람객,10.0,감동과 웃음 모두 잡은 영화입니다!! 영화관에서 정말 깔깔 웃다가 나왔네요ㅎㅎ 그리고 차은우가 정말 잘생겼어요.
퍼스트 라이드,실관람객,1.0,태국 디제이왕이 막 디제이콘솔에 디제이페스트에 막무가내애덜 올라오게 한다고?.. 진짜 이렇게 안웃긴데 내용까지 대충만든듯한 어설픈영화는 오랜만에본다. 아까운내돈 돌리도.. 거액 2천원. 스쿠할인으로 거금 2천원이나 날리게만든 똥망작. 보스와 똥망작왕을 다투거라..
퍼스트 라이드,실관람객,3.0,"고등학생을 '연기'하는 배우들. 고등학생들을 보고 있구나가 아닌, 배우들의 고등학생 연기를 보는 듯한 느낌. 어느정도만 고등학생 같아도 넘어가지만, 비주얼적으로 일단 1차적으로 몰입이 안됨. 고등학생들 여행이라는 소재가 일단 재미있기도 힘들 것 같다는 생각. 단순한 스토리에 변주와 감동을 주기 위해서인지 너무 억지 스토리와 감동을 집어넣은 것 같다. 너무 중구난방 스토리에 중간중간 장르가 훅훅 바뀌는 느낌을 많이 받았다. 너무 감동, 울음 포인트를 끌어내기 위해 스토리적으로 무리한 느낌. 모 배우의 현실 이슈에 스토리가 영향을 받았는지는 모르겠으나, 해당 캐릭터의 스토리 활용이 좀 아쉬웠다. 삽입된 ost들은 좋았다."
퍼스트 라이드,실관람객,4.0,The First Ride2025
퍼스트 라이드,실관람객,1.0,"재밌는줄 알고 웃으러 갔더니, 예고편이 전부임."
퍼스트 라이드,실관람객,4.0,퍼스트라이드 봤습니다. 배우들은 좋은데 내용 등은 아쉽습니다.
퍼스트 라이드,실관람객,3.0,마음 편히 보시면됩니다 평가는 하고 싶진 않아요
퍼스트 라이드,실관람객,6.0,배우들의 연기가 스토리의 부실함을 하드캐리.
퍼스트 라이드,실관람객,5.0,까메오인 대사관 직원이 제일 웃긴 포인트라니...
퍼스트 라이드,실관람객,4.0,평범합니다 돈내고 볼 영화는 아닌거같네요
퍼스트 라이드,실관람객,5.0,재미없음기대이하입니다
퍼스트 라이드,실관람객,4.0,차은우 얼굴도 커버못치는 영화 퀄러티
퍼스트 라이드,실관람객,4.0,차은우 얼굴만 100점
퍼스트 라이드,실관람객,2.0,"흠... 제발 이런 양산형 코미디 영화는 그만좀 나왔으면 하네요...코미디 영화라고 까는게 아닙니다. 극한직업이나 등등 이런류의 코미디 영화들이 왜 관객수가 잘나오고 평이 좋겠어요? 다 이유가 있는겁니다.이런 장르에서 스토리를 빡빡하게 보는것도 아닌데, 이 영화는 정말... 오랜만에 정말 한숨나오는 영화였습니다."
퍼스트 라이드,실관람객,10.0,강하늘 김영광 배우만 나오는거 알고 본건데 강영석 배우 눈만 봐도 웃음 나오고 보는 내내 즐거웠어요친구들이랑 봤는데 어릴때 추억도 생각나고 친구들이나 가족들이랑도 불편한 거 없이 즐겁게 볼수 있어요!
퍼스트 라이드,실관람객,4.0,코미디 영화인데 1도 안웃김 .
퍼스트 라이드,실관람객,3.0,어느 포인트에서 웃어야 할지...? 진짜 별로다 올해 본 영화 중에서 제일 별로
퍼스트 라이드,실관람객,1.0,관객들한테 돈주고 보여줘라 강하늘 아니었으면 중간에 나왔다
퍼스트 라이드,실관람객,1.0,절대 보지마세요진짜 뭐 이런걸 영화라고... 내시간 돌리도
퍼스트 라이드,실관람객,10.0,
퍼스트 라이드,실관람객,10.0,최근 본 영화중 최고! 감동이에요
퍼스트 라이드,실관람객,1.0,막판에 대환장이 웃음 파티을 기대했는데 모야이건~~
퍼스트 라이드,실관람객,10.0,툭툭 던지는 대화에서 너무 웃겨서 계속 웃음이 나왔어요~ 배우들의 연기랑 반전 스토리가 몰입감 있게 보기 충분했습니다. 아이들이랑 가족끼리 보기에 좋은영화인거 같아요~~
퍼스트 라이드,실관람객,9.0,인물들이 그려내는 첫 해외여행의 풍경은 때로 경쾌하게 때로는 템포를 놓치고 만다. 장면마다 웃음의 결은 살아 있으나 전체적으로는 느슨하고 서사의 한 축으로 응집되지 못한 채 흩어지는 인상이다
퍼스트 라이드,실관람객,10.0,"유쾌하고 따뜻한 영화. 배우들 케미도 돋보이고, 오랜만에 만나는 착한 코미디 영화라 누구와도 즐겁게 극장 나들이 할 수 있을 거 같습니다ㅎㅎㅎ"
퍼스트 라이드,실관람객,10.0,어렸을때 친구들하고만 있으면 그냥 마냥 웃던 시절이 생각나는 영화~배우들도 다 너무 좋고 계속 웃다가 뒤에 폭풍 눈물이...간만에 기분좋게 즐길 쉬 있는 영화였습니다.
퍼스트 라이드,실관람객,10.0,다섯 명 케미 합이 미쳤고.. 진짜 친구 같아서 더 웃긴 영화 ㅋㅋ
퍼스트 라이드,실관람객,10.0,올해 최고의 코미디 영화네요너무 웃기고 감동 포인트도 있어요추천합니다ㅋㅋㅋ!!
퍼스트 라이드,실관람객,10.0,생각지도 못한 반전이 있네요!
퍼스트 라이드,실관람객,1.0,진짜 너무 재미없음. 출연진에 제작비를 탕진한것같음. 초반에 홍보영상에도 나온 그 부분만 재미있고 뒤로 갈수록 뭐지라는 감정이 됨. 차은우 얼굴이 제일 재밌음. 학점 2.6인 대학생이 졸업작품으로 낸 작품같음.
퍼스트 라이드,실관람객,4.0,정신없이 웃기다가 감동으로 끝내려 하지만웃기지도 않고 예측을 벗어나지 않는다
퍼스트 라이드,실관람객,1.0,촌티를 나게 하려는게 아니라 진짜로 촌티가 난다
퍼스트 라이드,실관람객,6.0,차은우 보러갔는데 차은우 안나옴
퍼스트 라이드,실관람객,5.0,영화 행오버가 떠올랐어요
퍼스트 라이드,실관람객,6.0,작위적이고 허술한 영화연기로 어느정도 부족한점을 메우고는 있지만 연기력으로도 영화의 만듬새는 보완되지 못했다.
퍼스트 라이드,실관람객,4.0,배우들 비주얼은 좋은데 뭐라고 평가할 코멘트가 딱히 떠오르지 않는다
퍼스트 라이드,실관람객,8.0,재미는 있지만 내용이 너무 산만함
퍼스트 라이드,실관람객,6.0,감독의 30일 대비 많이 아쉬운 작품이었네요.
퍼스트 라이드,실관람객,5.0,"남대중 감독님이 관람평을 세세하게 다 보진 않겠지만 그래도 관람객이 있기에 영화도 있는거니 좋은 후기든 나쁜 후기든 꼼꼼하게 읽어봐주셨으면 좋겠습니다. 배우들 연기는 다 좋았어요. 각자 매력적이고 청춘영화 주인공들다웠습니다.^^ 무대인사도 열정적으로 해주셔서 영화 입소문이 나는데에 많은 몫을 하시는 것 같아요. 저는 강하늘 배우님을 보고싶어 관람했는데 강영석 배우님의 매력도 발견했어요! 강영석 배우님 앞으로 더 흥했으면 좋겠습니다. 내용면에서는 어떤 이야기를 하고자했는지 알겠으나 굳이 들어가야만 했을까 하는 장면들이 너무 많아 몰입이 깨질 때가 많았습니다. 중간중간 의도된 유머코드가 오히려 스토리를 방해한다고 느껴졌어요. 멋지고 좋은 배우들 덕분에 팬들이 n차 관람까지 열심히 해주고 있던데(물론 저도 했고요), 팬들의 열정에 미치는 영화라기엔 좀 실망스러운 부분이 많았습니다. 앞으로 좋은 배우들의 연기가 더 빛날 수 있도록 시나리오나 연출에 조금 더 고민해주시길 바랍니다."
퍼스트 라이드,실관람객,7.0,생각보다 코믹부분이 많이안터지네요
퍼스트 라이드,실관람객,7.0,코미디에 강하늘 차은우 나온다고 해서 보러갔는데 생각보다 빵 터지는 부분은 많아 없고 소소하게 웃음만 터짐. 근데 갑자기 막판에 사람을 막 울릴러고 그러니껜솔직히 눈물 좀 나왔어..그냥 한번 쯤 볼만하긴 한듯 함…엄청 재밌고 엄청 슬픈건 아닌데무난하다기 보단 훈훈한 영화?? 다른건 다 됐고 걍 차은우 개 존잘차은우 없는 차은우 영화같긴 한데 일단 그냥 잘생김
퍼스트 라이드,실관람객,4.0,코미디라면서아니잖아 결말은 좀
퍼스트 라이드,실관람객,7.0,그냥 가볍게 보는 영화. .
퍼스트 라이드,실관람객,1.0,최악입니다. 1점? 0점이 필요합니다.
퍼스트 라이드,실관람객,10.0,오랫만에 아무생각없이 웃으려고 선택한 퍼스트라이드 ^^ 생각보다 오잉 스러운부분도잇엇지만 그래도 배우들의 연기가 젛네요. 마지막엔 반전까지차은우 은근 웃기네요 ㅋㅋㅋㅋ 강영석배우 새롭게봣어요 친구들과 여행가고싶네요 ㅋㅋㅋㅋ 조금씩의반전들이 좀 웃기네요 ㅋㅋㅋ
퍼스트 라이드,실관람객,10.0,믿고보는 배우들이라기대했는데 역시!! 아이들과 함께 즐겁게 감상 했어요 ~ 유쾌하고 감동도 있고 배우들 연기도 자연스럽고 캐릭터 안에 잘 녹아 드는 거 같았어요. 좀비딸보다 ㅎㅎ 훨씬 재미있었어요 까메오로 나오시는 배우들 보는 재미도 쏠쏠합니다!
퍼스트 라이드,실관람객,2.0,"재미없었어요. 산만하고, 코믹 요소도 별로 웃기지 않았구요. 스토리도 극적인게 없었으며, 피식 웃는 정도로 끝나는 수준이에요. 차은우 잘생겼다, 강하늘 연기잘한다. 그정도요. 차은우 많이 안나와요."
퍼스트 라이드,실관람객,4.0,영화 재미없어요 재미없어요
퍼스트 라이드,실관람객,10.0,재미와 나름의 반전이 있네요. 어릴적 친구들과의 놀던 시절 생각도 좀 나고 ㅋㅋ 그리고 차은우가 진짜 너무 잘생겼는데 분량 짧은게 아쉽 ㅋㅋ
퍼스트 라이드,실관람객,10.0,"감상포인트: 영상미, 사유: 차은우 얼굴"
퍼스트 라이드,실관람객,9.0,개봉날 봤는데 솔직히 7.5-8점 정도는 되는 영화라고 생각합니다 작품성을 기대하고 본다면 당연히 실망할수도 있겠지만 그냥 생각없이 편하게 보고 웃고 하는것도 영화의 목적 중 하나아닌가요? 다들 코미디 영화에서 너무 진지함을 찾는게 아닌가싶네요....
퍼스트 라이드,실관람객,5.0,코미디 영화인데 웃음이 안 터집니다 이도 저도 못하게 돼버린...
퍼스트 라이드,실관람객,4.0,한영에 기대를 안하는 이유
퍼스트 라이드,실관람객,6.0,뭐하지는건지 모르겠음
퍼스트 라이드,실관람객,6.0,바보들의 우정 여행 이야기..!!
퍼스트 라이드,실관람객,6.0,웃기기 위한 과한 설정이 감동도 적게 만들었다
퍼스트 라이드,실관람객,6.0,감독의 전작 30일이 꽤 잘 나온 케이스였다는 걸 실감..
퍼스트 라이드,실관람객,5.0,한선화는 항상 비슷한 캐릭터만 맡네
퍼스트 라이드,실관람객,6.0,와... 한국 영화 정말 괜찮을까
퍼스트 라이드,실관람객,4.0,그냥 생각없이 스트레스 풀기 좋은영화
퍼스트 라이드,실관람객,1.0,진짜 시간이 아깝다환불해라
퍼스트 라이드,실관람객,2.0,과정은 유치뽕. 반전은 무리수
퍼스트 라이드,실관람객,10.0,차은우때문에 웃으러 갔는데 역시나 웃으면서 나왔네요.친구랑 보러 갔는데 둘다 웃으면서 나왔어요.누구랑 가서 보든 웃으며 나올 듯 합니다.영화보는데 친구랑 우정여행도 가고 싶더라구요 !중간중간 유머와 배우들의 케미 완전 최고네요.
퍼스트 라이드,실관람객,10.0,"영화가 전체적으로 밝고 유쾌한 분위기라 보는 내내 기분이 좋아졌어요. 억지로 웃기려는 부분 없이 자연스럽게 웃음이 나왔고, 배우들의 케미도 좋아서 몰입하면서 즐겁게 봤습니다."
퍼스트 라이드,실관람객,10.0,"솔직히 예상보다 훨씬 재밌었어요ㅋㅋㅋ처음엔 그냥 가벼운 우정 코미디인 줄 알았는데, 뒤로 갈수록 은근히 여운 남는 반전 있어서 놀람..친구들이랑 같이 보면 중간중간 공감도 많이 되고, 마지막엔 괜히 서로 얼굴 쳐다보게 됨ㅋㅋ 가볍게 웃다가 살짝 찡해지는 감정선이 있어서 생각보다 마음에 남았던 영화!"
퍼스트 라이드,실관람객,4.0,시간가는줄 알고 보았습니다
퍼스트 라이드,실관람객,8.0,행사로 보는거아니면 비추합니다
퍼스트 라이드,실관람객,10.0,강하늘은 이제 걍 믿고 보는듯 30일 재밌게 봤으면 보삼 같은 감독에 강하늘 주연 약간 스물 느낌 엄청 웃다 옴ㅋㅋㅋ
퍼스트 라이드,실관람객,10.0,장점 : 차은우 나옴단점 : 차은우 보다가 내용 기억 안 남은 아니고 차은우때문에 웃다가 걍 영화가재밌어서 깔깔 거렸네용 재밌었슴당
퍼스트 라이드,실관람객,10.0,코믹하면서 그 속에서 의미도 찾아볼 수 있네요
퍼스트 라이드,실관람객,10.0,진짜 뻥안치고 ㅈㄴ 웃겼다
퍼스트 라이드,실관람객,5.0,감독의 전작 보고 기대했는데 배신당함. 유치뽕짝
퍼스트 라이드,네티즌,1.0,태어나서 처음 관람평 써봅니다댓글 알바들 믿지 마세요 최악의 입니다시간관 돈이 너무 아깝네요너무 유치하고 재미 없어요영화관이 왜 망하는지 알것 같아요
퍼스트 라이드,네티즌,1.0,보스 이후 2연타 맞았네 어질어질 하네 코메디 영화가 상영관에 적막이 1시간이상 흐른다 단 한명도 웃는사람 못봄
퍼스트 라이드,네티즌,1.0,부모님 효도하려 보러갔는데 불효했다 이정도로 재미없으면 감독문제다
퍼스트 라이드,네티즌,1.0,장르가 코미디인지 성장물인지 로맨스인지 브이로그인지 송크란 광고영상인지 스릴러인지신파인지 알 수가 없어요
퍼스트 라이드,네티즌,1.0,음 그냥 스물처럼 철없는 고딩들의 첫해외여행을 풀어냈으면 어땠을까싶어.
퍼스트 라이드,네티즌,2.0,평보고 기대하고 갔는데 하나도 안웃겨요....ㅠㅠ
퍼스트 라이드,네티즌,1.0,진짜 관람평 안 남기는데 퇴근하고 난 평일 저녁 귀한 시간을 이 영화에 날린게 너무 짜증나서 평 남김.10월 29일 (수) 용산 아이파크몰 무대인사로 영화보고 나옴.1. 강하늘 배우의 채무가 상당한가 의심하게 될 정도의 스토리. 스토리나 연기들이 느끼해서 돌아가시...
퍼스트 라이드,네티즌,2.0,시사회 갔다온 시간이 아깝다최악의 코믹영화 출연진이 아깝다개콘이 10배이상 재미있고 임창정 영화에비하면 처참하다고 표현하고싶다웃음 코드 딱 초등2학년 수준웃음 포인트 마다 억지스럽고 어처구니가없었고 짜증이 났었다영화 후기 올린적 몇번없는데 악평은처음이다
퍼스트 라이드,네티즌,1.0,올해 본 영화중 가장 맞지 않음... 이런 스토리가 2025년에 나왔다는게 믿기지 않음
퍼스트 라이드,네티즌,1.0,진짜 이렇게 재미없는 영화 첨 ㅠㅠㅠ이런 극본이 투자를 받았다는게 ㅠㅠㅠ
퍼스트 라이드,네티즌,1.0,영화관에서 영화 보면서 욕하기는 처음이었고몇 없는 관객들 중 화나서 자리 박차고 나가도나가는 이를 공감했을 정도였고리뷰를 남기지 않는 나도 처음으로리뷰를 남길 정도로 이야기 하고 싶었다1점도 너무 후하게 준 것 같다
퍼스트 라이드,네티즌,1.0,웃고 싶어 보러갔더니 화만 나네요
퍼스트 라이드,네티즌,1.0,진짜 집에서 쉬는게 더 재밌어요
퍼스트 라이드,네티즌,1.0,이런 영화 처음 봐요.정말 별 한개도 아깝고 이 영화를 보기 위해 시간과 돈을 쓴게 정말 아깝습니다.
퍼스트 라이드,네티즌,1.0,"너무한거 아니냐, 무슨 투니버스에서 짱구 에피소드보다 재미가 없냐"
퍼스트 라이드,네티즌,1.0,희대의 쓰레기영화 이거 돈 영화할인받고 보기도 아까움 배우 각자 억지로 연기하는 느낌이 강함 스토리 개연성도 이상함 악플이아니고 직접 봐보시길처음에 평점 평균 9.8이여서 봤다가 왜 갑자기 7점대로 박은지 알것같은 영화 진지하게 이거 재밌다고 생각하면 한국영화 무시하는 꼴밖에안됨 내말에 반박할 사람들은 영화 다시보고 반박해아
퍼스트 라이드,네티즌,1.0,진짜 이 딴거때문에 한국영화판 망하는거다.연출 스토리 감성 무엇하나 진지함이 안보이고 그냥 이름값 높은 배우들 섭외해서 뚝딱하면 한국영화 끝이지 이 생각이 다 인 영화
퍼스트 라이드,네티즌,4.0,7점이상 준 사람들 무조건 댓글알바임.
퍼스트 라이드,네티즌,1.0,제 인생 영화관에서 본 영화중 가장 재미없었어요..ott킬링타임용정도도 안되는거 같기도하고 ㅠㅠ.. 내용도 올드하고 코미디영환데 하나도 안웃김..
퍼스트 라이드,네티즌,1.0,0점이 있다면 주고 싶은 영화임 차라리 잘걸 이렇게 만들었는데 분기점 넘기면 한국영화계가 문제가 있다
퍼스트 라이드,네티즌,1.0,맛없는 부대찌개에 크림소스를 부은 영화
퍼스트 라이드,네티즌,1.0,이거 어떤새끼가 재밌다고 했냐? 존나 화나네
퍼스트 라이드,네티즌,1.0,뭐하자는 건가요? 차은우를 홍보용으로 쓰고 인형으로 떼우는 것도 기가 차는데 스토리 작가가 아예 없는 건가요? 이런 것도 영화라고 투자 받을 수 있다는 사실이 놀랍네요. 최근 본 영화 중 최악입니다. 한국 영화가 이렇게까지 수준 떨어졌다는 게 안타깝네요.
퍼스트 라이드,네티즌,1.0,한국영화 진짜 위기다.
퍼스트 라이드,네티즌,1.0,웃길려고 넣은 장면은 많은거 같은데 딱 한번 피식한듯. 영화관 조용했음
퍼스트 라이드,네티즌,1.0,우리나라 영화는 망한게 맞다 영포티가 만들었냐?
퍼스트 라이드,네티즌,1.0,코메디영환데 코메디 요소는 어디 갔노?
퍼스트 라이드,네티즌,2.0,진심으로~ 노잼입니다.
퍼스트 라이드,네티즌,1.0,퍼스트로 패스트하게 나갔습니다.
퍼스트 라이드,네티즌,1.0,저번에 보스에 데였다면 이번엔 퍼스트라이드에 타죽을뻔 했네요.. 이제 한국영화 안볼랍니다.. 돈 많고 시간 많으면 보세요
퍼스트 라이드,네티즌,1.0,이런영화를 어떻게 극장에서 개봉하나 싶다...감독은 이게 재미있거나 웃기거나 감동적이라고 생각하는건지 진짜 묻고 싶다.
퍼스트 라이드,네티즌,6.0,킬링타임용 영화 그렇다고 엄청 재미난것도 아님....
