제목,작성자유형,평점,리뷰
보스,네티즌,1.0,출연진이 너무 아까움 정경호때문에 평도 안보고 예매했는데...
보스,네티즌,2.0,정말 너무너무 유치함 10년전에 나온 영화를 한번 더 보는게 정신 건강에 좋음
보스,네티즌,4.0,아. . 재미없어. . 기대도안했지만. .
보스,네티즌,2.0,아 연휴에 할거없어서 봤는데 너무나 후회되네요. 떡하나 더 사먹을걸
보스,네티즌,2.0,차라리..천장을 보세요..그게 더 재미있습니다...
보스,네티즌,2.0,화가난다...이런걸 돈내고 봤다니
보스,네티즌,1.0,관람평보고 이건 진짜 망작이라고 보기싫었는데 여자친구가 자긴 웃음장벽 낮다고 보고싶다고 해서 봤습니다..인생 처음으로 보다가 나왔습니다 말다했죠 평점10점 댓글알바 티나요ㅋㅋ진짜 아무내용도없고 하나도안웃김
보스,네티즌,1.0,지극히 상업적인 영화 킬링타임 그이상 그이하도 아닌 시간낭비 영화
보스,네티즌,2.0,보다가 나왔어요 인생 최악의 영화 초등학생이 만들어도 이것보다 수준높을것 같네요
보스,네티즌,2.0,영화보면서 지루에서 리뷰쓰긴 첨이네요 ㅠㅠ 시간 아끼세요나가고 싶어요 진심 ㅠㅠ
보스,네티즌,2.0,정말 실망이다 보다가짱개생각나서 1시간만에 나온 영화. 최근에 얼굴 작품 너무 재밌게봐서 또 예매한건데 내돈2만원ㅠㅠ
보스,네티즌,1.0,돈 아깝다 배우들도 아깝고...이걸 왜 찍었을까?
보스,네티즌,2.0,최고의 배우분들을.. 이런 결과물로 만드시다니.. 안타깝습니다ㅠ
보스,네티즌,1.0,너무너무 재미없음. 최악이다
보스,네티즌,2.0,진짜 영화매니아입니다 41살인제가 영화보러가서 자고 왔습니다 진짜 돈아까워보이긴 처음 입니다살기 힘든요즘세상 . . . .돈아끼세요
보스,네티즌,1.0,매불쇼최광희가 재미있다고 했는데..이사람 조사해봐야겠다.
보스,네티즌,1.0,추석용으로 급하게 만든것 같아요.. 영화 언제끝나나 기다리긴 처음인듯 ㅠㅠ
보스,네티즌,1.0,반성하세요.여기에 참여한 당신들은국민의 귀한 추석연휴를 망친참으로 죄인들입니다. ㅜㅜ
보스,네티즌,1.0,이것도 영화라고..돈과 시간이 아깝다
보스,네티즌,1.0,"진짜 내 인생에 최악의 영화로 뽑겠습니다.이 좋은 배우들로 이렇게 밖에 못만든다는 아쉬움이 너무 컸고, 정확히 50분 지났을 때 영화관을 나가는게 훨씬 도움이 된다고 판단이 드는 영화입니다."
보스,네티즌,2.0,뭐 이런 영화가 다 있냐 사기 당했음
보스,네티즌,1.0,한국영화지만 무슨영화인지 모르겠음 진짜 역대급최악의영화
보스,네티즌,1.0,추석 명절을 노린 개그영화지만 상영관은 고요하기만 했다
보스,네티즌,1.0,너무재미없어서 깜짝놀랐어요.. 계속 남성 성기나 때리고
보스,네티즌,1.0,알바들 왠간히 해라 평점 알바 경찰에서 빡쎄게 조사해야 할듯 싶다이게 영화냐? 투자받아서 이따위로 영화만들어서대중들에게 보이면 쪽팔리지 않냐? 감독아?
보스,네티즌,2.0,별 하나도 아깝다...추석 명절 처가집 갔다가 오는 길에 어쩔수가 없다보다 예매율이 높다기에 봤다가....돈 시간 다 날렸다...나중에는 화가 나더라...
보스,네티즌,1.0,진짜 개 노잼임 시간 아까우니까 시간 넘쳐나는 분들도 안 보시는거 추천
보스,네티즌,1.0,아.. 배우들이 아까운영화; 정말.. 다좋아하는 배우님들인데;
보스,네티즌,1.0,하 진짜 저 관람평 처음 써봐요시간 아까워 돈 아까워이걸 본 내가 제일 안타깝네요ㅠㅠㅠ
보스,네티즌,2.0,완전 OOO기 영화.. 눈 버림.
보스,네티즌,1.0,스토리나 연기나 뭔가 그냥 막 만든느낌… 한국영화 다신 안봐야겠단 생각드는 영화. 효과음만 엄청 커서 귀먹는줄 알았고 말이안되는게 좀 있음 . 배우들 연기나 표정에서 좀 깸
보스,네티즌,1.0,하 ………… 생일에 본건데 너무합니다
보스,네티즌,1.0,인생 첫 관람평을 쓰게 만든 대단한 영화. 영화관에서 본 모든 영화 통틀어 제일 재미가 없음.. 중간에 나오고 싶었는데 돈아까워서 안나온 나 자신에게 미안함;; 웃기지도 않고 액션도 난잡하고 스토리 너무 뻔하고 유치함제발.. 한국영화 재밌는것좀 만들어주세요..
보스,네티즌,1.0,재미없음 안보는게 나은듯
보스,네티즌,1.0,이런 싸구려 조폭 영화 그만 좀 만들어 제발 수준 떨어지게 ㅉㅉ
보스,네티즌,2.0,조폭도아니고 짱깨도 아니고한마디로 장난 때리네
보스,네티즌,1.0,2025 워스트 1등 축하드립니다.
보스,네티즌,1.0,"짧은 인생 (40초반) 극장영화에서 졸았던 경우 타이타닉(3시간 넘어서), 극장에서 30분만에 나와버린 영화(너무나 재미없었음)."
보스,네티즌,1.0,"이걸 어찌 설명한단 말이오. 무려 평점은 8.7점대인데, 보면 왜 한국 영화가 망하고 있는것을 알수가 있네요. 액션 기대하지 마세요. 스토리 없어요. 멜로 원래 없음, 감동 개뿔. 기대감... 만점입니다. 이 영화는 알수 없는 기대감만 존재합니다. 언제 재미난 장면이 나오는지, 언제 웃음 포인트가 있는지...끝날때까지 기대감만 주는 영화입니다. 극장안이 죽은듯이 조용한 한국 영화는 처음입니다. 기대감을 기대하시는 분들에게는 추천합니다. 그리고... 10점 주시는 알바분들...적당히 주시죠. 두줄 요약 합니다. 10점 만점에 비공강이 많은 영화. 1점도 안되지만 추천이 넘지는 영화"
보스,네티즌,2.0,하.. 진짜 드럽게 재미없다ㅜㅜㅜ영화보는 도중에 도저히 못보겠어서 평 남기는데.진짜 개 노잼....ㅡㅡ
보스,네티즌,2.0,"이따구 영화가 실제 관람객 평점이 8점이 넘고 추석 1위라니 이 자체가 코메디다. 코메디 영화라는데 영화내내 극장서 웃음소리가 들리지 않는다. (끝부분에 한번?)철지난 조폭영화에 요리를 입혀서 억지 웃음을 유도한 짜증가득한 영화다.추석때 박찬욱감독의 ""어쩔수가 없다"" 보려다 잔혹하고 찝찝하다기에 가족이 다같이 웃으며 재밌게 코메디 영화 보려다가 똥밟았다!"
보스,네티즌,1.0,네이버 평점도 믿을게 못되는구만 ? 남자는 평균 7점 대 인데 여자는 9점 대 ?? 평점 평균은 9점 가까이 되는데 추천수 많은 댓글들은 1점 짜리 혹평 일색 ?? 개판이네 ㅋㅋ
보스,네티즌,1.0,재미도 없고 감동도 없다
보스,네티즌,1.0,와 ㅋㅋㅋ 정상적?으로 평점을 매기는데 이런 평점이 나온다고?
보스,네티즌,1.0,댓글알바들 다 양심 갖다버렸나
보스,네티즌,1.0,이러면 안되지..배신감까지괜찮은 배우들을 이런 스토리에 쓰는건 아니지..ㅡㅡ
보스,네티즌,2.0,이게 왜 저런 평점이 나왔는지 이해가 안가요~~~ 도망챠~
보스,네티즌,1.0,올해 본 영화중 최악의 영화
보스,네티즌,1.0,극한직업 같이 아무생각 안하고 맘껏 웃을 수 있을까 싶어 가족 다 데리고 극장에 갔는데....미안한 마음만 들뿐....진짜 내 시간과 돈 돌리고 싶다
보스,네티즌,2.0,한번도 웃음이 안나는 코미디 영화
보스,네티즌,2.0,하.. 감상평을 쓸수가없을정도임.
보스,네티즌,1.0,실관람평 알바들 조작하는거 개역겹네. 속지마셈
보스,네티즌,1.0,불과 얼마전 좀비딸에 당하고 또 당하는 국민들... 우리나라 영화는 다 죽었다. 이제 회생불가능. 뭐가 문재인인가? 한국영화도 이재 명이 다했다. 정치경제판처럼... 영화하나 죽는건 다행이다만 영화처럼 나라도 죽었다.우리나라 영화는 스토리 연출 연기 액션 그래픽 기술 어느하나 잘하는게 없다. 10-20년전 호평의 영화들이 있었지. 그런데 아직 그 수준내지 그이하 영화만 나옴. 그러니 개욕처먹는건데 국뽕이라고 쉴드치는 인간들 역ㄱ움.
보스,네티즌,1.0,댓글알바 너무한거 아냐? 해도 좀 적당이 하던가
보스,네티즌,1.0,후회 많이 했음나의 선택에….
보스,네티즌,2.0,영화보다가 중간에 나갈까?라고 생각한 적은 처음..
보스,네티즌,1.0,"재미도,감동도,도저히 찾아볼수가 없고,90년대 초반에나 볼수있는 스토리전개,작품성,연기도 개연성이 없고,요즘 너튜브에서 잘만든 영상보다 시간이 아까울정도로 저급한 영화였습니다.친구는 오프닝 시작하고 1시간넘게 잤고,전 내가 왜 여깄지 싶을정도로 명절연휴 망치는 시간이었습니다.제발 쓴소리보고 감독님,시나리오작가,연출팀 저예산이든 돈받고 영화찍으시면 좀 더 노력좀 하세요.절대 비추천합니다."
보스,네티즌,1.0,한국영화는 재밌다는 소문 듣고 보세요 제발...추석연휴 가족들 데리고 모처럼 영화관 갔는데어머니한테 불효하고 왔네요 연출자가 나름 웃음장치 여러개 준비한거 같은데 진짜 하나도 안웃겨요 이렇게 재미없는 영화 돈주고 본게 아깝네요
보스,네티즌,1.0,진짜 최악이에요 너무시간아까워요
보스,네티즌,2.0,감독 한번만더 영화만들면 패죽인다 진짜 기술학교가서 기술배워라
보스,네티즌,1.0,넷플에는 겨우 들어올듯
보스,네티즌,3.0,심심풀이용이라도... 이건...
보스,네티즌,2.0,티비로 봐도 시간 아까울 정도의 퀄리티
보스,네티즌,2.0,"장르가 코미디인데 한 번도 웃지 않았습니다 ,,,"
보스,네티즌,2.0,웃기지않는 코메디영화
보스,네티즌,1.0,노잼... 극한직업 따라하려거 했으나 재미도 감동도 없음
보스,네티즌,1.0,보는 사람이 부끄러워지는영화시간이랑 돈아깝다
보스,네티즌,1.0,내인생 최악의 영화...
보스,네티즌,2.0,엄마랑 보러갔는데 별로 재미없었음 대실망
보스,네티즌,1.0,영화 끝나고 남은건 ‘짜장면 맛있겠다' 밖에 없다
보스,네티즌,1.0,어지간했으면 감상평 안쓰는데…ㅠㅠ생애처음으로 영화보다가 그냥 나오고싶었습니다. 재미도 감동도 내용도 뭐도 아무것도 없어요.10점 호평알바들 정말 너무해요 ㅠㅠ
보스,네티즌,1.0,너무 재미없어요... ㅠㅠㅠ
보스,네티즌,1.0,이나이먹도록 영화보다 자긴 처음이네 별 하나를 눌러야 해 꼭?
보스,네티즌,2.0,댓글 알바들 많네요 . 한국 영화 제발 정신 차리자
보스,네티즌,4.0,좋은 배우들 데려다가 뭐하는짓인지
보스,네티즌,2.0,조폭이 아니면 영화를 못만드는 추석한국 극장가. 흥행여부를 떠나 이젠 관뒀으면
보스,네티즌,2.0,와 내가 뭘본거냐 한국영화 정말 심각하네 박찬욱꺼 제꼇다길래 볼만하겠거니 아무생각 없이 봤다가 제대로 뒤통수 씨게 후려맞았네 그래도 다른사람들은 죄명이가 돈뿌린거 쿠폰으로라도 봤겠지만 나는 지금 볼라카니까 쿠폰 다끝나고 없던데 통신사할인만 받고 이걸 만원넘게 가족끼리 3명이서 본 내가 레전드네 넷플릭스 한달에 얼마 안하는거 사람들이 왜 영화관 안가고 넷플릭스 보는지 이제야 알겠다 감독 라희찬? 이새기 도대체 누구냐? 연기잘하는 배우들 데려다 도대체 무슨 짓거리를 한거? 한국영화 싹다 망했으면 와 김수현의 리얼도 이정도는 아니었다 진짜 심각하다 그래도 리얼은 이해도 안가고 난해하긴 하지만 쨌든 뭔가 알지못하는 개똥철학이랄까 그런 실험정신? 영상미? 그런거라도 있었던거 같지 고인의 서비스씬도 있었고 이건머 도대체 뭘 보고 웃어야하냐? 코디미라며? 뭔데 이거? 역대급 개수레기네 혼종이여 머여 이번에 제대로 수업료 치뤘네 앞으로 영화관 갈일 있더라도 사전에 꼼꼼히 후기 반응들 살펴보고 가야겠네 난 원래 별 정보없이 아무생각없이 걍 보러가는 타입이었는데 이건 좀 너무 심하잖아 이건 아니자나 이건 아니자나 아 집에서 넷플같은걸로 보면 몰입도 안되고 보다말다 자꾸 멈추고 딴짓하게 되고 노잼이라서 영화관에서 딱 몰입 집중해서 보는걸 좋아하는데 넷플로 갈아타야하나 진지하게 고민중 이딴영화가 박찬욱꺼 제끼고 1위라니 와 진짜 레알루다가 심각하다 k컨텐츠니 한류니 케데헌이니 뭐니 난리 부루스인데 정작 한국영화는 이따위 수레기나 극장에 걸지 않나 이거 만든 감독은 은퇴를 하던가 할복을 하던가 뭔가 좀 해라 앞으로 두번다시 보지 말자 배우들도 이게 뭔 죄냐 배우들도 이제 두번다시 극장에 걸리는 작품에 출연 안하고 무조건 ott로만 갈듯 에라이 잘 돌아가는 꼬라지다 개빡치네 아우 돈아까워 개.노.잼. 내가 이딴거보다 더 재미없게 본 영화가 있었던가? 싶을 정도로 역대급 최악이다 안본눈 안본뇌 삽니다
보스,네티즌,2.0,명절에 가족끼리 가서 못나왔지 아니면 중간에 나왔을듯
보스,네티즌,3.0,난 웃음허들 정말 낮고 희안해서 웃기라고 만든 장면 몇개에서는 웃끼끼 하다가 나오긴 했는데... 이런 영화애서 스토리 기대하는것도 참 웃기긴 하지만 스토리가 넘 이상함 그리고 마지막에 싸우는장면은 증말 유치해서 못봐주겠슴... 영화 초반에는 이걸 웃기라고 만든건지 의문가는것도... 평점알바 그만 쓰셈
보스,네티즌,1.0,"와 살면서 영화감상평이란걸 처음 써봅니다세상에 이렇게 개연성없고 웃기지도 않고 감동도 없는 영화는 처음입니다,,와,,,.. 진짜 개노잼,,, 절레절레,,,오죽하면 같이보던 중1 아들이 엄마 영화가 줄거리가 무슨 개연성이 없어? 그럽디다끝까지 앉아있었던 나를 칭찬합니다"
보스,네티즌,1.0,진짜 기대 안 하고 봤는데도 재미가 너무 없네요 지금이라도 안 보셨으면 제발 딴거나 보세요..
보스,네티즌,1.0,갈수록 한국영화는 재미가 없네요 ㅜ
보스,네티즌,1.0,지금 실시간으로 영화 보면서 쓰는즁나 이런글 처음 쓰는데 배우가 아깝다 ㅋㅋㅋ얼마나 재미없음폰 보다가 쓴다
보스,네티즌,1.0,이게영화라고.. 내 연휴가 망가졌다
보스,네티즌,1.0,리클라이너 극장이라 마누라는 너무잘자고 나도 자고나왔음
보스,네티즌,2.0,자다 중간에 나옴 평점에 낚였다 시끄럽기만엄청 시끄럽고 내용도 없고 어수선 짜증난다
보스,네티즌,1.0,1점 이라도 받을수 있는게 다행이라고 생각해라.. 0점 주고 싶었다.
보스,네티즌,2.0,장난하냐? 스토리도 엉망 배우도 엉망 감성은 개나주고 이딴걸 추석에 쳐내놓냐?
보스,네티즌,1.0,추석이라 가족끼리와서 나가지도못하고영화관람중에 인생처음으로 평남기는데진짜 너무 재미없어요… 개억지스토리…
보스,네티즌,2.0,정말 최악의 영화… 영화보고 화나기는 처음이네요
보스,네티즌,1.0,이거 보지마세요잣같네 욕하면서 화장실 갈겁니다역시 국산영화는 극장용은 아님조금 기다렸다 집에서 tv로 보세요광고내용이 전부임배기성 노래 뮤직비디오조폭버전임끝
보스,네티즌,1.0,평점때문에 설마하고갔는데 진짜네요.1점도 아까울정도네요.ㅠㅠ
보스,네티즌,1.0,평점이 높아서 재밌나 하고 실제 네티즌 댓글을 봤는대 다들 재미 없다고 해서 반신반의로 보고옴. 진심 역대급 재미없음. 개인적으로 박지환 배우랑 조우진 배우 좋아하는대도 이영화는 진심 용서가 안됨.근대 이평점 나오는게 말이 죽어도 안됨. 평점은 높은대 실제 관람객은 재미없다? 이유를 알꺼 같음 매불쇼에서 홍보를 겁나 해주는거보고 평점 조작했다고 개인적인 생각이 든다.이제부터 평점은 거르세요 네이버 나 영화계도 많이 오염된듯 합니다.
보스,네티즌,1.0,평생 돈주고 본영화중에 돈아까운 영화 탑3안에들어갑니다 상영10분후 그만봐도 다알거같은 내용3류 영화 웃음 없어요 억지웃음 몇장면있네요
보스,네티즌,1.0,"연기력 좋은 배우들을 섭외해 놓고 이런 영화를 만들다니 배우들의 연기력이 아깝습니다,, 스토리도 별로고 재미도 없습니다,, 초반 3분은 캔 봄날은간다 뮤직비디오 보는 느낌입니다,, 이 영화 말고 박찬욱 감독 영화보세요! 그게 시간도 아끼고 돈도 아끼는 방법입니다."
보스,네티즌,1.0,진짜 OO 이거 투자한새끼랑 연출한 감독사기친거임 봄날은간다 ost말고 기억나는게단하나도 없음 ㅅㅂ ㅋㅋ
보스,네티즌,1.0,진짜 하나도 재미없었어요.전개도 지루하고 웃음도 감동도 없어요.그냥 시간 아까웠습니다. 안 보셔도 될 것 같아요.
보스,네티즌,1.0,"빵점 주고싶은데 선택지가 없음. 보는내내 딴생각밖에 안남.웃음포인트 1도 없고.코믹이 맞는지...이건 재앙이야!!! 평점에 속지말구 보지 마시길..시간,돈 낭비ㅠ 집와서 ott로 F1보고 마음 정화됨"
보스,네티즌,2.0,평점 여성비율 70% 알바 바이럴 썼네 ㄷㄷㄷ
보스,네티즌,1.0,배우들이 아깝고..내 시간이 아깝고..내돈이 아깝고..
보스,네티즌,1.0,정말 저급하다. 쓰레기 영화
보스,네티즌,1.0,진짜로 최악 오브 최악...영화보다 나온거 10년만인 것 같네요...딱 초1 수준 코미디...
보스,네티즌,2.0,"너무 형편 없는 영화. 함께 보자 했던 남친에게 미안했던 영화. 이제는 한국 코미디 못 믿을 것 같다. 아, 돈 아까워~~"
보스,네티즌,1.0,이렇게 빠방한 배우진을 가지고 이정도 수준은.. 돌고래유괴단이 더 재밌던 것 같습니다.. 매우 비추
보스,네티즌,2.0,보다가 중간에 나옴너무 말도안되게 유치한 설정 그렇다기보다는 황당한 설정
보스,네티즌,1.0,이래서 한국영화가 망하는거다. 이딴 유치한 영화는 왜 만드는거냐?
보스,네티즌,1.0,영화관 안온다고 찡찡거릴게 아니라 본인들이 만들어놓은 참담한 영화수준을 한번 돌아보시길..
보스,네티즌,1.0,"와 진짜 노잼;;내용 부실에 진짜 돈,시간 진짜 아까움;;"
보스,네티즌,1.0,한국 영화 산업이 왜 망하고 있는지 느끼게 됩니다. 안타까울 따름이에요
보스,네티즌,1.0,마지막 부분 조금 제외하고는 정말 재미없네요 …. 3류 영화도 재미만 있으면 볼만 한데 이거는 뭐 … 재미도 없고 감동도 없는 … 3류라는 수식어조차 아까운 영화네요 감독 이름 좀 알아놔야겠어요 명배우들 데리고 이런 결과물을 내놓다니 다른의미로 대단하신 분 같습니다.
보스,네티즌,2.0,이걸 영화라고만들었나요?절대보지마세요.
보스,네티즌,1.0,쓰레기들이 세상에 이런걸 예매해서 직접가서 극장이 터지도록 봐놓고 주절주절 불만이야???이영화가 왜나왔냐고??왜아직도 한국조폭영화나오냐고??어떻게 정경호가 나올수있나고?? 니들덕이지 누구덕이야~~~박수~대~단하다ㅋㅋ
보스,네티즌,1.0,18181818181818
보스,네티즌,1.0,좋아하는 배우들 많이 나와서 어느정도 기대하고 봤는데 30분 넘어서부터 뭔가 억지로 내용을 이어가는 느낌을 지울수가 없다 무도 쪽대본 드라마 특집도 아니고 뭐하는걸까 아무리 재미없는 영화라고 해도 영화관에서 잔다는 사람 이해 못했는데 영화 보면서 하품 두번이나 함
보스,네티즌,2.0,연출과 스토리 망작...저런 연기자를 데리고 이렇게 코믹도아니고 그렇다고 스토리가 짜임새있는것도아니고...
보스,네티즌,2.0,아 차라리 치킨시켜놓고 전참시를 볼껄..평가하기도 아까움
보스,네티즌,2.0,진짜 한장면도 웃음이 우러나온 장면 없었음.
보스,네티즌,1.0,배우들이 아깝다 이것도 영화라고 명절에 본. 영화중 최악 재미 감동도 없고 진짜 내생에 봄날은 간다만 기억남 방금 영화관 갔다옴 이거 재밌다고 한 알바놈들 제정신이냐 나 처음. 댓글달았다 하도 열받아서
보스,네티즌,1.0,에휴....진짜 올해 영화 중 최악
보스,네티즌,2.0,진짜 한국영화를 위해서도 이런 거 그만 만들자웃기지도 않고어쩔수가 없다가 7점대인데 이런 영화 8점대라니 말다했다
보스,네티즌,1.0,스토리도 별로고 웃기지도 않고 좋은 배우들 데려다가 뭐하자는 건지 모르겠는 영화
보스,네티즌,2.0,중국집 광고인가요? 짱깨먹으러 왔어요.
보스,네티즌,1.0,별로네요...ㅠㅠㅠ
보스,네티즌,1.0,뭐하나 제대로된게없는 보는내내 재미도감동도없는 영화
보스,네티즌,4.0,극한직업+해롱이 요약 끝
보스,네티즌,3.0,스토리가 너무 뻔하고 처음에 정말 기대하고 갔는데 정말 실망이였어요 그래도 연기는 잘하시더라구요
보스,네티즌,2.0,재미없어용 ㅠㅠ 연휴첫날부터보러왔는데
보스,네티즌,2.0,내용도없고 재미도없고...
보스,네티즌,1.0,재미없음돈아까움최악
보스,네티즌,2.0,진짜 웃긴 포인트도 없고 시간 지루해요 너무넘. 유치하고 재미두 웃음도 내용도 없어요
보스,네티즌,2.0,영화를 왜 이렇게 만드는지...코리안갱스텅무비는 90년대까지는 그럭저럭 먹어줬지만 지금은 참으로 어색하네요....거기에 철권 리로이스미스를 재현한 무술까지 등장이라니...에휴~~모를지 알았쥬?
보스,네티즌,1.0,와 너무 심해요장르가 코믹이라는데 웃음기 싹 빠졌네요살아생전 리뷰 처음 남겨봐요진짜 리뷰 쓰면서도 할 말이 없어요보면서 내 자신에게 너무 실망했어요배우들이 무슨 죄겠어요보드람치킨으로 마음 달래봅니다
보스,네티즌,1.0,보다 졸았습니다.. 유투브에서 홍보용으로 올린 영상이 전부인 영화.. 참고하세요.. 당신의 돈은 소중합니다
보스,네티즌,2.0,추석대목 특수를 노린 그냥 저급영화돈 시간 둘다 버렷네요
보스,네티즌,2.0,"하...핸섬가이즈제작진, 그리고 그 많은 좋은 배우들 모시고...하이브가 완전히 대국민 사기쳤네요 ㅠㅠ 스토리설득력 최하. 관객에게서 웃음을 마른행주에서 물짜듯 강제로 짜내는 안타까운 노력... 판교 롯데시네마에서 직관한 평.(1)스토리: 완성도가 너무 낮아 스토리 몰입에 어려움(2)배우 연기: 허술한 스토리로 인해 배우 개인기에 의존해야했으나 느와르쟝르을 소화하기 어려운 캐스팅과 주연급 배우들의 각개전투식 개성연기가 조화롭게 하나의 주제로 수렴되지 못해 산만함(3)연출: 글쎄...내가 감독이면 이 시나리오로는 감독맡지 않았을듯...허술한 시나리오에 그저 최선을 다했을 감독이 안스러움.추석연휴에 볼 영화가 너무 없네요..."
보스,네티즌,2.0,다들 내가 좋아하는 연기자들인데이런영화에 왜 출연들하셨는지 궁금하네요시간이 너무 아깝고 화가납니다
보스,네티즌,2.0,연기력은 좋으나 스토리가... 많이 아쉽습니다..
보스,네티즌,2.0,평점에서 알바냄새가 솔솔~~
보스,네티즌,1.0,만든 사람 자기 영화 안보고 개봉한건가?
보스,네티즌,1.0,추석때 가족들끼리 봤다가 이런거 예매해서 너무 미안했습니다.. 저런 배우들을 데리고 이런 영화가 나올수도 있구나 싶었네요
보스,네티즌,1.0,별점 댓글 알바들 넘쳐나네 0.1점이 제격임
보스,네티즌,1.0,하...배우보고 예매했다가 스토리랑 억지 연출보고 실망만 가득했던 영화.홍보하려고 프로그램 나오는 배우들 보기 민망할정도.
보스,네티즌,1.0,내생의 최악~별점없이하려니 등록이 안되 어쩔수없이 반쪽만
보스,네티즌,1.0,"처음 평 남기는데, 휴~~좋은 배우들을 3류로 만든 감독은 정말 반성 해야 합니다 어지간 해야죠 웃음 1도 안나옴 추석 연휴라 좌석이 찼는데 분위기 어쩔꺼야 아~~ 화나게 하려고 그랬나? 암튼 쉽지 않습니다 ㅜㆍㅜ"
보스,네티즌,1.0,"가문의영광 시리즈 아류작, 관객들을 개돼지로 보는 한국영화의 전형"
보스,네티즌,1.0,난 암환자인데 이런 영화로 내 남은 소중한 시간을 보냈다는게 허망하다...
보스,네티즌,1.0,옆사람만 없었으면 나갔다
보스,네티즌,1.0,좋아하는 배우들이라 본거지.. 하 참 ㅋㅋㅋ가문의영광 시리즈 억지웃음에 b급이라 생각했는데이건 한술 더뜹니다 재밌게 본영화 아니면 평 잘 안남기는데.. 이건 티켓값에 팝콘값에 다 아까웠습니다
