제목,작성자유형,평점,리뷰
윗집 사람들,네티즌,1.0,"시간 아까운 정신병 유발 영화제작비 20% 댓글알바 80% 쓴 버러지삼류 영화. 지 딴엔 미국식 블랙코미디라 생각했겠지만 수준미달.. 귀한시간, 돈 내고 불쾌함만 얻어오실분들에게 추천. 오죽하면 이 시나리오보고 참여한 출연진,배우들한테도 정이 떨어질 지경."
윗집 사람들,네티즌,10.0,배우들의 연기가 정말 멋졌던 작품이에요시간가는줄 모르고 정말 재미있게 보았습니다 다른 사람들에게 추천 해 주고 싶어요
윗집 사람들,네티즌,10.0,하정우님의 감독력과 연기력이 돋보이는 작품입니다.다른배우들 연기도 말할것도 없고하정우식 유머를 좋아하신다면 강추합니다!
윗집 사람들,네티즌,10.0,최곱니다~~꼭 봐야하는 영화~~~
윗집 사람들,네티즌,10.0,재밌다 공효진 오랜만의 영화라 기대했는데 기대만큼 재밌음 특유의 말장난개그가 저에게 통했네요 오랜만에 많이웃고갑니다
윗집 사람들,네티즌,10.0,윗집 사람들이라 그래서 뭔가 했는데^^합방을 시도하는 윗집 사람들정도 되겠네요.스포일러될까봐 다는 못적겠고...하정우의 느끼한 연기가 콧수염과 찰떡입니다.공효진은 역시나 넘 러블리하구요.이하늬의 독백 나래이션은 어김없이 귀에 쏙쏙 들어오네요. 근데 이하늬씨 이번에 공효진배우랑 같이나와서 그런가 심하게 말라져서 나오시더라구요. 김동욱은 정말 현실 인물을 연기하는 진짜 진짜 같은 유일한 캐릭터^^신과함께의 김수홍이 살아 돌아온 느낌이었어요.19금이라 설마 합방 장면이 너무 적나라할까봐 긴장헀네요. 어쨌든 즐거운 시간이었습니다.
윗집 사람들,네티즌,10.0,믿고보는배우들이라 몰입도가 아주 최고웃기도엄청웃었네요
윗집 사람들,네티즌,10.0,"어제부터 개봉한 영화인데, 바로 보았쪄! 작년에도 층간소음문제를 다룬 비슷한 영화가 있었는데, 연출과 연기가 뛰어나고 몰입감이 장난아녀서 한시간 40분이 쏜살같이 지나감^^"
윗집 사람들,네티즌,10.0,하정우감독만의 독특한 개그가 한방했어요! 배우들 연기력은 말할것도 없이 최고입니다! 스트레스없이 즐길수 있는 영화예요!
윗집 사람들,네티즌,10.0,스릴넘치고 코미디영화라 그런지 하정우배우 연기가 정말 너무웃겼어요! 슬픈데 웃고싶으신분들 윗집사람들 추천합니다!
윗집 사람들,네티즌,10.0,섹드립 미쳤고 너무 재밌었습니다!간만에 즐거운 영화 봤네요!
윗집 사람들,네티즌,10.0,피감독님 영화 잘 봤습니다ㅋㅋㅋ 배우님들 대사 어케 외웠나몰랔ㅋ 너무웃김ㅋㅋ 출근길에 계속 생각나서 피식피식했던
윗집 사람들,네티즌,10.0,연기 좋아용 믿고 봅니당
윗집 사람들,네티즌,10.0,아침에 봤는디 곳곳에서 찐텐으로 웃겼고 정우햄 의도대로 동시에 다 터짐 ㅋ
윗집 사람들,네티즌,1.0,내가이상한건가 인생 쓰레기영화 평들이 왜이러지ㅜㅜ 아무리 이해하려해도 교훈도없고 전개도 지맘데로고 뭐가웃기다는건지모르겠네
윗집 사람들,네티즌,10.0,하정우 배우가 크린트이스티우드 감독처럼이제 진짜 감독이 된듯ㆍㆍ
윗집 사람들,네티즌,3.0,"이거 집에서만 촬영하고 토크쇼 같은 영화던데제작비 집 3일임대료:150 배우출연료:5억 와인및안주,식비:300만원 이거 ㅋ배우출연료 우정 출연이면 제작비 500만원이네요? ㅋ 진짜 미치겠다 ㅋ"
윗집 사람들,네티즌,1.0,"알바들이 진짜 많구나ㅋㅋ 조작을 해봐야 이제 대중은 속지 않는다. 하정우가 손대는 영화마다 왜 계속 망하는 지 여실히 느낄 수 있는 작품이다. 개봉한지 2주가 넘었는데도 40만에 머물고 있는 이유는 작금의 한국영화의 위기로 인식되는 그 모든 요인들이 이 영화 한편에 모두 녹아있기 때문이다.정말 한국영화의 위기다. 매번 똑같은 연기의 배우들 비슷한 소재, 저급하고 마모된 상상력...다 바꿔야한다고 본다."
윗집 사람들,네티즌,1.0,진심 이렇게도 재미없는영화는 손에꼽는다졸다나옴
윗집 사람들,네티즌,1.0,이런게 돈내고보는 영환가?
윗집 사람들,네티즌,2.0,대한민국 영화계가 썩어가는 이유 중 가장 큰 원인이 ‘댓글 알바’와 ‘조작’임을 왜 그들만 모르는걸까.
윗집 사람들,네티즌,2.0,아...도대체 이 영화는 뭘 말하고 싶은건지..개실망
윗집 사람들,네티즌,1.0,재미도없고 감동도없고시간이 아까웠습니다무슨 이런영화를 ㅡㅡ;;
윗집 사람들,네티즌,1.0,왜.. 평점이 높죠?; 진짜 재밌으신거죠?
윗집 사람들,네티즌,4.0,2시간 가까이 아파트 안에서만 장면전환 없이 배우들의 연기와 대사로만 채워져서 답답한 기분이 들었네요.짬밥 있는 배우들이라 발연기는 아니었지만 스토리나 내용이 딱히 유쾌하거나 재밌진 않았습니다.초 저예산 영화인듯.. 앞으로 한국영화는 더 멀리 하기로 했습니다.
윗집 사람들,네티즌,2.0,소재도 공감안가고.. 그닥너무졸림 10점은 알바인가
윗집 사람들,네티즌,2.0,부부 그룹 섹스 모임 같이 하자고 설득하는 게 너무 길어서 짜증이 나긴 했으나 좋은 메세지를 마지막에 주려했던걸 감안해서. 별 방개 더 보태 별 한개 드림.. 와 병맛
윗집 사람들,네티즌,4.0,이게 정말 웃겨요...? 끝부분에 교훈 하나는 있지만 그걸로 충족되진 않네요
윗집 사람들,네티즌,1.0,정말 너무한 수준입니다...대체 높은 평점들은 어떻게 된것이며..소중한 주말의 시작을 망쳤습니다.네이버리뷰에 아직도 알바가 이렇게많다니..
윗집 사람들,네티즌,1.0,진짜 충격적이다. 세상이 날 속이나?보는 내내 짜증이 그냥..완벽한 타인은 진짜 재밌게 봤었는데
윗집 사람들,네티즌,4.0,"평점이 왜 높은지 의문 ,,, 쓰레기영화"
윗집 사람들,네티즌,1.0,"연기는 너무 좋으나 방에서 주저리 주저리 티키타카 2시간임;;; 19금은 오직 대화의 수위 때문일뿐, 장소 이동이나 연출 1도없음. 그냥 연극처럼 한곳에서 2시간 토크쇼가 끝임... Ok! 보는 사람마다 달르겠지 라는 생각에 보는내내 그래도 뭐라도 있겠지의 희망이 너무 허무해서 지난시간들에 현타옴...."
윗집 사람들,네티즌,2.0,관람평에 속아 영화 본 1인 진짜 시간낭비 절대 보지말길...
윗집 사람들,네티즌,2.0,다다다다 대사가 너무 많고 너무 싸워서 보는내내 스트레스받아요 보다가 나왔어요ㅜㅠ
윗집 사람들,네티즌,2.0,ㅋㅋㅋㅋ 머지 이게 통신사 포인트로 봐서 그나마 돈주고 보면 똥싸고 나올듯
윗집 사람들,네티즌,1.0,"진짜 ㅡㅡ오만천지 홍보 다 하고 다니길래 기대했더니 와 내 살면서 이리재미없고 기분 더러워지는 영화는 처음이네.. 50분쯤 때 보다가 도저히 역겹고 재미없고 스토리도 없고;, 잠만 오고 나옴하... 진짜 너무 돈아깝네..뜯어말리고싶다 본다는 사람들 ..절대보지마라..."
윗집 사람들,네티즌,2.0,알바들에 속지마라.. 진짜 핵노잼 영화임
윗집 사람들,네티즌,1.0,영포티감성 이런건 누가 재밌단거임?
윗집 사람들,네티즌,2.0,취향 엄청 탄다...하정우도 감다뒤
윗집 사람들,네티즌,1.0,그룹S스가 일반적인건가요?40대 후반 애 둘 키우면서 화목하고 즐겁게 지내는 부부의 감상평은 성 도착증 정신병자 3인과 짜증이 많지만 정상인1인 (공효진 남편) 의 이야기 입니다.와이프도 보는 내내 계속 나가고 싶다고 ..
윗집 사람들,네티즌,1.0,유치하고 감독수준이 븅이다이게 평점이8?한심한 감독진연출진 쓰레기
윗집 사람들,네티즌,1.0,하정우씨가 감독으로 하는 영화 다신 안볼라구요^^재미도 없고 무슨 내용인지 하나도 모르겠습니다
윗집 사람들,네티즌,2.0,돈아까움 쥬토피아볼걸. 공효진 연기 너무 못한다
윗집 사람들,네티즌,1.0,진짜 이게 재밌다고? 진짜 이해가 안가네 ㄹㅇ 오늘 보고 돈 너무 아까웠다 짐짜
윗집 사람들,네티즌,1.0,"여러분 시간, 돈 아껴드릴게요. 진짜 댓글알바 믿지 마시고 다른 거 보세요. 이렇게 노잼 불쾌한 영화 처음입니다. 별점보러 매일 들어옵니다. 3점까지는 내려가야 진짜예요."
윗집 사람들,네티즌,1.0,왜보냐 하 ; 추천 다 댓글알바같음중간에 나가려다 후반에 재미있겠지 참고 봤는데 ㅈㄴ지루하고 너무 저질스러움 야동을 합리화시키는듯한 영화
윗집 사람들,네티즌,1.0,"연기자분들 당연히 연기 너무 잘하고, 재밌는 요소도 있지만, 시간내서 볼 영화는 아닙니다.상영시간 대부분이 거실에서 부부끼리 싸우고 설득하는 내용으로 끝납니다.허무하고 예상되는 시나리오입니다."
윗집 사람들,네티즌,10.0,한공간에서 4명의 배우들 말로만 흘러가는데 지루함이 없이 잘 봤다..
윗집 사람들,네티즌,10.0,기대했던 것보다 재미있네요. 오랫만에 영화관에서 재미있게 봤어요.
윗집 사람들,네티즌,10.0,하정우 배우의 능청스러운 코믹 연기가 평소 본인과 싱크로율이 높고 공효진님의 일상 대화같은 괴리감없는 연기톤이 너무 좋아요 재미있었고 부부와의 관계를 돌아보게 하는 영화입니다
윗집 사람들,네티즌,10.0,문제가 있는 부부 또는 연인들에게 좋은 소스가 될만한 이야기를 흥미롭게 전개해 나간 것이 시간 가는 줄 모르고 감상했네요
윗집 사람들,네티즌,10.0,피카쥬 감독의 작품 넘 잼있게 봤다.웃다가 눈물났음.근래 드문 수작이었다.다시보고 싶은 영화
윗집 사람들,네티즌,10.0,유머코드 나랑 잘 맞는듯 ㅋㅋㅋㅋ
윗집 사람들,네티즌,10.0,사랑때매 싸우고 결국 웃는 평범한 우리 부부의 이야기같은 영화.
윗집 사람들,네티즌,10.0,수위가 높을 수 있는 얘기를 높지 않게 잘 풀어가는 감독의 실력 굿!!
윗집 사람들,네티즌,10.0,배우들 연기 템포가 너무 좋아서 끝까지 웃으면서 봤어요.
윗집 사람들,네티즌,10.0,시간 순삭되는 코미디 영화^^
윗집 사람들,네티즌,10.0,역쉬 기대를 져버리지 않는 배우들입니다.스트레스 풀릴만큼 웃고 즐기고 재밌게 보고 왔어용~♡♡
윗집 사람들,네티즌,10.0,아진짜 요즘 웃을일 없었는데 깔깔 웃고나왔네요 ㅋㅋ이런게 코믹영화죠 ㅋㅋ사람들 다같이 터질때 뭔가 그 희열감도 있고 암튼 너무 재밌었어요 굿굿
윗집 사람들,네티즌,10.0,연기를 너무 잘해서 몰입감 최고입니다 믿보배
윗집 사람들,네티즌,10.0,영화 사실 기대안하고 봤는데 시간가는 줄 모르고 봤네요... 웃음포인트도 많고 하정우 연기는 정말 최고 ㅠ
윗집 사람들,네티즌,10.0,하정우의 유머가 우리의 성에 대한 이중적인 태도를 능청스럽게 그러나 적확하게 보여준다. 무엇보다 재밌다. 극장에서 웃음이 여러번 튀어나온것이 그 증거.
윗집 사람들,네티즌,10.0,재미가 없을 수 없는 조합이라 봤는데 기대를 뛰어넘네요
윗집 사람들,네티즌,10.0,코미디 장르가 이렇게 훌륭한지 몰랐어요추천합니다
윗집 사람들,네티즌,1.0,완전 노잼나오는 인물보고 예매했다가 완전 실망보다가 나오고 싶었음이혼숙려캠프가 훨 재밌음아무런 기대도 하지 마세용
윗집 사람들,네티즌,10.0,역시 하정우 너무 재밌어여!! 육아에 찌들어 지쳐 있었는데 간만에 영화 보면서 겁나 웃다가 왔습니다ㅋㅋㅋㅋ
윗집 사람들,네티즌,10.0,유치하지 않은 코미디 영화 간만에 봤네요 사실 보기 전엔 자극적인 내용이 더 메인인 줄 알았는데 그게 아니었다니 ㅎㅎㅎ 하정우 감독님 다음 작품도 기대돼요
윗집 사람들,네티즌,10.0,영화는 전반적으로 재미나게 보았어요~~아쉬운점은 액션이 조금 부족한 부분이네요...^^
윗집 사람들,네티즌,10.0,간만에 너무 즐겁게 영화 관람을 하였습니다.스트레스 날렸어요
윗집 사람들,네티즌,10.0,하정우부부나올때너무웃김 역시비급감성은하정우가최고 공효진연기최고
윗집 사람들,네티즌,10.0,개그코드가 예상 할 수 없어서 재밌었다
윗집 사람들,네티즌,10.0,극장 안 웃음바다재밌어요~
윗집 사람들,네티즌,10.0,하정우 감독의 위트있고 유쾌한 코미디는 이제 장르가 되었다. 김동욱 공효진 이하늬 하정우 배우 모두 능청스런 연기 너무나 최고!!!
윗집 사람들,네티즌,10.0,"솔직히 기대이상으로 너무 재밌엇고, 이 영화 대박날듯하네요"
윗집 사람들,네티즌,1.0,진짜 보다가 중간에 나옴...ㅂㄷㅂㄷ
윗집 사람들,네티즌,2.0,황당했음.뭔이언 영화가있지.첨에는 웃다.주요내용보고... 토나올뻔.
윗집 사람들,네티즌,1.0,재밌다고 한 사람 나와!!
윗집 사람들,네티즌,1.0,개연성 없는 전개. 도파민에 취해서 만든 듯한 초반 이야기가 방향성을 못찾고 어떻게든 엔딩을 봐버림. 영화가 끝나고 배우자를 사랑하는 사람이 많을까. 아니면 윗집과의 성관계를 꿈꾸는 사람이 많을까. 답은 영화를 본 분들이 잘 아실듯. 재미로도 사회적으로도 최악.
윗집 사람들,네티즌,2.0,"말 그대로 저예산, 리메이크 작품그 이상 기대하면 안됨"
윗집 사람들,네티즌,1.0,진짜 최악.. 재미도 감동도 없음 알바가 많긴한가보네요
윗집 사람들,네티즌,2.0,유명배우만을 앞세운?저급하고 자극적으로 퇴폐문화를 앞서 가고 싶은 욕심이 지나친듯하다. 영상미도 없고? 제작비만 아꼈을듯한?돈이 아깝다
윗집 사람들,네티즌,1.0,돈이 아까웠어요... 평점 왜 높은 거지...
윗집 사람들,네티즌,1.0,대체무슨영환지 진짜 노잼임
윗집 사람들,네티즌,1.0,개연성이 이렇게 없는 영화 만들기도 힘듬개연성이 전혀 없으니 몰입감도 하나도 없고이 정도는 ott로 나와도 초반 잠깐보다가 안볼수준
윗집 사람들,네티즌,1.0,누가 이게 재밌다고 아내한테 추천해줘서 주말 2시간 날리고 그냥 술먹고 떠드는게 더 재밌을듯 만취해서 떠는 것처럼 스토리가 없음 ㅋㅋ
윗집 사람들,네티즌,2.0,불쾌함 앞뒤양옆으로 웃는 사람들도 불쾌함
윗집 사람들,네티즌,2.0,한국정서랑은 맞지 않는 설정이다보니… 좀..배우들 연기는 잘하는데..ㅠㅠ
윗집 사람들,네티즌,2.0,관람평 보고 갔는데 진짜 알바들이 관람평을 쓴듯?이렇게 지루하고 재미없는 영화는 처음 봄?진심임?시간만 버리고 옴?
윗집 사람들,네티즌,1.0,댓글 단 사람들 죄다 알바임절대 보지마세요
윗집 사람들,네티즌,2.0,돈도 안들어가고 그냥 날로 먹는 쓰레기영화
윗집 사람들,네티즌,1.0,시간 아깝다… 아오……….
윗집 사람들,네티즌,2.0,최악의 영화보다나가는사람 여러명드럽고 스토리 없어요
윗집 사람들,네티즌,2.0,진자 이거왜봐 영화보다 잠들었음억지웃김 개별루 ..배우들이아까움
윗집 사람들,네티즌,1.0,관객들에게 뭘 시사할려고 만든건지.섹스리스의 문제점과 파해법을 알리는건지.그룹섹스가 하고 싶다는건지?내 머리로는 이해불가다. 꼭 환불 받고 싶은 영화
윗집 사람들,네티즌,1.0,재미도 감동도 없고.. 무슨 내용을 전하고 싶은 건지; 지루해서 중간부터 잤음
윗집 사람들,네티즌,1.0,별점주기도아깝습니다.무슨이런영화를...공짜표가있어서봤는데시간이아까웠습니다
윗집 사람들,네티즌,1.0,내돈내산 아까운 영화입니다
윗집 사람들,네티즌,1.0,15세관람가 아닌가요..?
윗집 사람들,네티즌,1.0,아니 나 하정우 좋아하는데 평점 도대체가 왜 높은지...????
윗집 사람들,네티즌,1.0,인생 쓰레기영화 보다가 나옴
윗집 사람들,네티즌,2.0,보시면 압니다. 보실 필요는 없을 것 같아요
윗집 사람들,네티즌,2.0,역대급 쓰레기영화.. 내용 너무 역하고 거북스러움인생살면서 영화보다가 거북하고 역겨워서 중간에 나온경험은 처음임네이버 리뷰에 낚여서 봤다가 시간낭비하고 왔음 절대 보지마세요
윗집 사람들,네티즌,1.0,최악이에요ㅠ돈이랑 시간 날렸어요 여자친구도 화났어요
윗집 사람들,네티즌,2.0,하정우만의 특유의 개그 포인트를 기대하고 봤는데 완전 노잼…
윗집 사람들,네티즌,1.0,정말 너무 돈 아까운 킬링타임용으로도 부족한... 댓글쓰기도 아까운 영화
윗집 사람들,네티즌,4.0,저는 별로였어요 코믹한 부분은 손에 꼽을 정도..대부분을 김동욱 표정으로 보고 있었네요..'감독 피카츄'가 제일 웃겼어요
윗집 사람들,네티즌,4.0,"배우들 자체연기력만 좋고, 그외 상황설정, 대사, 캐릭터들 별로였음. 드립이 난무하다가 끝에 좋게 마무리지으려는 속내만 느꼈음. 비추. 감독 하정우가 세 배우들 덕보는 영화일뿐 알맹이없음."
윗집 사람들,네티즌,2.0,이것도 영화! ? 내 시간이 아까워ㅠ
윗집 사람들,네티즌,2.0,진짜재미없음.이런걸영화라고.
윗집 사람들,네티즌,2.0,제가 처음 댓글다는데 제개인적인입장으로는인생에 있어서 가장 보지말았어야할영화였습니다가장 아까운 시간이였습니다.
윗집 사람들,네티즌,2.0,재미없는걸요?감동은 어디있는걸까요?
윗집 사람들,네티즌,1.0,알바 풀은듯;;; 노잼ㅋ
윗집 사람들,네티즌,2.0,리뷰보고 기대하면서 봤는데 이거 뭐에요…..? 뭘 말하고 싶은지도 모르겠고 계속 보면서 뭔가 나오겠지 하면서 봤는데 그냥 그대로 끝남ㅋㅋㅋㅋ… 이거 절대 돈주고 보지 마세요 돈아까움
윗집 사람들,네티즌,1.0,요즘 영화표도 비싼데 별점 조작해서 돈 날리는 상황 좀 안했으면
윗집 사람들,네티즌,4.0,그냥 넷플릭스용 영화..극장까지 갈거 아니고 연극 느낌..말장난..지루함..웃음포인트가 유치찬란함
윗집 사람들,네티즌,1.0,"하정우 배우님 팬입니다, 제발 영화감독은 그만해주세요."
윗집 사람들,네티즌,2.0,"제 어젯밤 꿈이 이거보다 개연성 있겠네요 어디서부터 어디까지 욕을 해야할지 감도 안잡히는 제 인생 최악의 영화, 이거 볼 시간에 그냥 유튜브 보세요 시간 아깝습니다"
윗집 사람들,네티즌,2.0,재미없어요..영화보다 나오기처음 좋은배우들데리고 너무 뭔내용인지도모르겠어여ㅠ
윗집 사람들,네티즌,2.0,알바가 존재하긴 하는구나~~~졸다가 중간에 나옴Zzz
윗집 사람들,네티즌,1.0,어휴 .. 돈 아까워라ㅠㅠ
윗집 사람들,네티즌,2.0,말로 다 떼우는 영화. 뭘봤는지도 모르겠음.
윗집 사람들,네티즌,4.0,"마지막에 이하늬(정신과 전문의), 하정우 부부가 공효진(아랫집 여자)의 의뢰로 공효진, 김동욱 부부의 섹스리스 및 소통 부재로 인한 결핍을 현장감 있게 치유해준 것으로 마무리 된거였다면 좀 더 한국 정서에도 맞고 나름 반전도 주며 영화 퀄리티가 더 높았을 것 같은 개인적인 아쉬움이 있음"
윗집 사람들,네티즌,5.0,베드신없는 19금 영화~~ 음란대사로 졸음만...아쉽
윗집 사람들,네티즌,2.0,최악의 영화였습니다뭘 이야기하고 싶었던건지..유치하고 저질스럽고ㅎ아무생각없이 본데도 바닥인 영화
윗집 사람들,네티즌,2.0,한국영화 아직 멀었네요. 평점에 속아서 봤는데~.너무 유치하네요.
윗집 사람들,네티즌,2.0,하.. 네이버 댓글알바들 다 ×× 또당했다..
윗집 사람들,네티즌,2.0,자고왔어요. 실망100퍼
윗집 사람들,네티즌,2.0,할말조차 없다걍 중간에 나옴
윗집 사람들,네티즌,2.0,어디서 웃어야 할지 모르겠어요.. 너무 재미없었습니다 그래도 롤러코스터는 나쁘지 않았는데..
윗집 사람들,네티즌,2.0,하.. 별점에 속았네요 속았어
윗집 사람들,네티즌,1.0,보다가 집에 가는데 중간에 폰 만지는 사람 있는거 보니 나만 지겨운게 아닌 듯
윗집 사람들,네티즌,1.0,최악 중간중간 억지웃음포인트 몇개내용도 불쾌 전개도 억지 마무리도 어색태어나서 본 가장 최악의 영화.
윗집 사람들,네티즌,4.0,음.. 뭘 말하고 싶은건지?
윗집 사람들,네티즌,2.0,"웃기다 그래서 봤는데하정우 진짜 돈 안들이고 말만하고, 공효진 딕션 그게 뭐야 아휴 간만에 본 영화 시간 돈 날림. 댓글들에 속지말자."
윗집 사람들,네티즌,10.0,하정우 너무 웃김 ㅋㅋㅋㅋ 아침부터 웃었네요
윗집 사람들,네티즌,10.0,"오랜만에 돈안아까운 영화본듯합니다. 보통 흥미떨어져서 졸리기도 하고 그런데, 런타임 내내 집중했어요"
윗집 사람들,네티즌,10.0,중간중간 웃음을 터트리게 됩니다!!연인과 보러가기 좋아요 ㅎㅎ 재밌었습니다
윗집 사람들,네티즌,1.0,평생 살면서 이런 저급한 영화는 처음입니다. 적당히 저급해야하는데 심각한 수준이네요. 보다가 나가서 줄담배 피다가 들어가서 다시 보려다 도저히 못 보겠어서 그냥 나왔네요. 한번 보시면 시간의 중요성을 깨우치실 수 있습니다.
윗집 사람들,네티즌,1.0,오랜만에 감상평 남기네요. 아직 보지 않은분들을 위해 씁니다. 정말 이런게 영화라고 버졋이 극장에서 상영한다는거 자체가 역겨웠네요. 중간에 나오고 싶은 마음 꾹 참아가며 보는 내내 언제끝나나 시간만 보다 나왔어요. 평점에 속지 마세요. 정말 최악의 영화였네요.
윗집 사람들,네티즌,1.0,그냥 개ㅈ망영화 시간아 스트레스만받음
윗집 사람들,네티즌,2.0,아니 오랜만에 극장에서 보다가 잤다
윗집 사람들,네티즌,2.0,진짜 보다가 잠들었네 ㅡㅡ 돈 아깝고... 집에서 잘걸 하.. 개노잼
윗집 사람들,네티즌,2.0,최악인데 진심 보다 중간에 나왔네요 이렇게 보기 불편한 영화는 처음입니다
윗집 사람들,네티즌,1.0,평점 알바들 득실득실 하는거 같네요. 영화본 사람들이 한결같이 불쾌하다고 하는데 어떻게 저런 평점이.. 영화가 너무 저속해요
윗집 사람들,네티즌,1.0,"남편이랑 봤다가 30분 남겨놓고 도저히 못 보겠기에 나왔어요. 배우와 평을 보고 고른 영화인데 시간이 얼마나 아깝던지. 공효진 연기가 하드캐리 했고 중간에 몇 번 웃기긴 했지만, 전반적으로 찜찜하고 기분이 더러워요. 시간을 되돌리고 싶다면 절대 절대 절대 안 볼 거예요."
윗집 사람들,네티즌,1.0,노잼~~ 평점에 속지마세요.중간에 보다가 나오기는 처음인듯~~
윗집 사람들,네티즌,2.0,하정우식 주절주절 쉴새없는 대사로만 2시간 가까이 꽉채움장소도 아파트 거실 한정적인 공간에서만 풀어내니까 집중할꺼라고는 배우 대사밖에 없는데 질보다는 양만 많은 대화시작 30분지나서부터 기빨림진짜 아무리 호불호 갈린다하지만 호가 있다는게 신기합니다.
윗집 사람들,네티즌,1.0,보는 내내 불쾌하고 기 빨렸습니다. 이때까지 본 영화 중에 제일 병맛에 최악입니다.
윗집 사람들,네티즌,2.0,끊임없이 정신사납게 계속 쏘아대기만하는 대사들이 가득했고 내용과 웃음포인트 모두 지루해서 졸았어요ㅠㅠ기대가 컷던건지 실망도 커요ㅠㅠ
윗집 사람들,네티즌,10.0,생각보다 훨씬 웃기고 훨씬 현실적이라 시간 가는 줄 모르고 봤어요.
윗집 사람들,네티즌,10.0,너무 재밌었어요 ㅋㅋㅋ 계속 웃기만 했던 영화..
윗집 사람들,네티즌,10.0,원래 한국 코미디 영화 싫어하는데 지인이랑 맞추느라 봤어요. 근데 나름 예상 못한 웃음도 있고...한참 웃다가 끝나는 허무감 뒤에 현실을 돌아보게 하는 여운도 있어서 좋네요. 완벽한 타인을 웃음이란 코드로 풀면 이렇게 되지 않을까 생각되네요
윗집 사람들,네티즌,10.0,집 이라는 공간 안에서 지루할 틈 없이 대사와 연기 그리고 그의 따른 연출로 재밌게 봤습니다!하피카츄사랑해
윗집 사람들,네티즌,10.0,생각없이 보다가 스트레스 풀릴정도로 웃은 영화! 코미디 추천입니다! 보고 하루종일 피카츄 생각만남…. 최고의 코미디 영화 진짜 강추강추! 웃겨요~~ 웃겨 ㅋㅋㅋ
