제목,작성자유형,평점,리뷰
마이클,네티즌,8.0,"어릴때는 그저 이상한 사람인줄 알았다..어른이 되고 우연히 Ben 을 듣고, 깜놀..이게 마이클 잭슨 이라니..그때부터 였을꺼다, 우리형 마이클…이영화를 통해 다시 한번 그를 추억해본다…"
마이클,네티즌,4.0,결말이 to be continued 이게 맞나? 3-4시간 작품이었어야 할걸 억지로 편집해서 둘로 쪼개논건 끔찍하다
마이클,네티즌,4.0,잘못만들었음 중요한게 많이 빠진 느낌
마이클,네티즌,7.0,마이클잭슨시대는 아니지만 그래도 엄청난 가수인걸 알앗지만 저렇게 아버지한테 맞고 태클당하면서 자라서 아버지 품을 벗어나 성장하는 마이클잭슨을 보면서 소름이 돋앗다 엄청 재미있지만 마이클잭슨을 죽인 가족이 돈을 벌어서 평점은 낮게 주고싶네요 마음은 10점이지만요
마이클,네티즌,10.0,이영화. 마이클. 우리가 몰랏던. 마이클 일상을 알게될수 있는 영화 최근영화 중에 젤 나은거 음악을 사랑 하고 마이클 사랑하고. 그리워 하면서 ㅎ
마이클,네티즌,10.0,영화 보는 내내 가슴이 뭉클하더군요.
마이클,네티즌,8.0,"분명 흥겹고 즐거운데, 텅 빈 느낌은 채워지지 않는구나.."
마이클,네티즌,10.0,I miss you Michael
마이클,네티즌,10.0,그가 살아있었다면 ㅠㅠ큰 기쁨이자 가장 슬픈 영화 ㅠ
마이클,네티즌,9.0,1980년대 중후반 부터 팝송을 들었습니다. 그때 마이클잭슨의 인기는 어마어마 했죠. 하지만 지금과는 달리 팝음악과 아티스트에 대한 정보를 취득하는 것이 쉽지 않았던 것 같습니다. 마이클잭슨의 어린시절 이야기는 전혀 몰랐는데 영화보면서 애처러운 대목이 많더라구요. 공연과 스릴러 뮤직비디오 재연은 압권이었습니다. 영화관에서 보는거 추천합니다. 2차관람 예정입니다.
마이클,네티즌,10.0,보지 않고 암말 마라! 일단 그가 어떤 사람인지 먼저 보고 이야기 하자!
마이클,네티즌,10.0,다들 꼭보세요 꼭!!!!
마이클,네티즌,10.0,마이클잭슨 역할 연기자 너무 대단
마이클,네티즌,10.0,너무 짧개만 느껴졌던 그리운 마이클의 모습ㅠ30년전 콘서트에서 봤던 그때가 생각나서 울컥했어요ㅠ
마이클,네티즌,10.0,남아있는 가족들도 있고.. 제작 과정에서 구설수가 많았던 만큼 좀 사리는 느낌. 마이클의 어두웠던 고통의 묘사 부족한건 분명 아쉬움..그럼에도 압도적인 플레이리스트와 주연배우들의 퍼포먼스에 감탄 나온다. 당장 2편 낋여와
마이클,네티즌,10.0,17년전의 그는 우리곁을 떠났지만 전기영화를 통해 마이클 잭슨이 다시 돌아왔다. 마이클 part 2가 기대된다.
마이클,네티즌,10.0,한마디로 The King Of POP!!
마이클,네티즌,10.0,"더이상의 마이클을 환생 시키는것은 불가능!! 또다른 별 어딘가 맘껏 춤추고 노래하고 있을 마이클...이번생 당신과 함께할수 있음이 행운, 영광이었고 감사합니다 사랑합니다"
마이클,네티즌,10.0,마이클잭슨의 인생을 2시간동안 담아내기엔 짧았다..
마이클,네티즌,10.0,고증오류다 뭐다 하는데 일반인이 느끼기에 마이클 잭슨을 더 가깝고 뭉클하고 그에게 더 빠져들수 있게 해주는 영화였음 이렇게 마이클 잭슨을 더더 일아가고 빠질것 같은 영화임 진짜 다들 꼭 보셈!
마이클,네티즌,10.0,"만약 드래곤볼이 실제로 있고,다 모아서 신룡이 한 가지 소원을 들어준다고 하면,마이클 잭슨을 다시 살려주라고 빌고 싶습니다."
마이클,네티즌,10.0,말이 필요없는 영화
마이클,네티즌,10.0,영화관에서 꼭 보세요 대박이에요 !!!!
마이클,네티즌,9.0,가장 좋아하는 노래중에 하나가 안나와서 9점
마이클,네티즌,10.0,와~~빌리진은 지금 봐도 전율이~~ 마이클잭슨은 진짜 어나더레벨이네요~
마이클,네티즌,10.0,"2시간 짜리 마이클 잭슨의 뮤직 비디오를 본 느낌입니다.아쉬운 부분이 꽤 있었지만, 50을 앞둔 지금, 청소년 & 청년의 추억과 감동이 다시금 느껴져 너무 좋았습니다.Dolby Atmos 같은 특별관에서 다시 감상하고 싶네요 =)"
마이클,네티즌,10.0,서사나 스토리 감동은 없고 히트곡만 줄줄이 나오다 끝나는 뭔가 앙꼬없는 찐빵같은 느낌....그래도 별5개...고3때 신라호텔 로비에서 죽치던 추억을 가진....공연 직관 3번한 40대가 쓴글
마이클,네티즌,10.0,MJ is Invincible!
마이클,네티즌,10.0,이 영화를 통해 마이클 잭슨이 신이 내린 사람이란 것을 처음 느꼈다
마이클,네티즌,10.0,넘 재밌어요 몇번 더 볼 예정
마이클,네티즌,10.0,역시는 역시나~ 위대한 전설의 마이클잭슨이 부활한 듯한.. 자파잭슨의 노력과 흔적이 보인다. 마이클잭슨의 몰랐던 부분도 알게 되고 감동과 연민이 느껴졌다. 좋아하는 명곡들이 흘러나올 때 절로 내적 흥분이ㅋㅋ 아직 선보이지 못한 명곡들은 2부에서 기대를 해본다♡
마이클,네티즌,10.0,허리띠 장면 눈물ㅇㅣ흘렀다나도 맞아 봐서 알지구석에 쪼그리고 어린 마이클**역ㅅㅣ 위대한 팝의 황제 돈스탑이너프 .빌리진. ?심장이 쿵쾅쿵쾅 너무도 일찍갔어 하늘에서 저희 대한민국 지켜봐 주세요^^
마이클,네티즌,10.0,진짜 시간가는줄 몰랐다벌써 끝이라고? 얼른 2편을 주세요
마이클,네티즌,10.0,아직도 감동이 가득한 마음으로 마이클 잭슨의 공연을 현장에서 관람하는마음으로 토요일 아들둘 데리고 또 마이클을 보러갑니다제가느낀 감동을 아들들과 같이 하고 싶네요
마이클,네티즌,10.0,스토리는 지루..근데 공연 장면들은 정말 굉장함. 마지막 공연 장면은 울컥. 눈물 찔끔. 크레딧 다 올라가고 노래 다 듣고 나옴.
마이클,네티즌,10.0,세상이 품지못한 팝의 황제.영화와 음악으로 또 한 번 영원하다!
마이클,네티즌,10.0,나오자마자 보러갔는데 재미있어요 .. 또 나오면 가서 볼정도
마이클,네티즌,10.0,엔딩 크레딧 나올 때도 여러 노래들을 들었습니다. 자파 잭슨 어려운 연기를 잘 해냈어요.
마이클,네티즌,10.0,MJ의 일개기를 담기엔 시간이 부족했지만 자파잭슨의 연기력은 보는 내내 감탄사를 일으킨다 피는 속일수없다
마이클,네티즌,10.0,영화라기 보다는 마치 마이클 팬들을 위한 콘서트를 보고온 느낌이다.마이클의 팬이라면 고민하지말고 관람하시길.
마이클,네티즌,10.0,마이클 잭슨의 위대한 노래와 춤을 영화관에서 볼 수 있었다는 것만으로도 충분히 행복했던 시간이였슴!자파르 잭슨의 거의 완벽에 가깝게 마이클의 노래와 춤 그리고 섬세한 얼굴표정을 재현한 노력에 진심어린 경의를....
마이클,네티즌,10.0,대중이 좋다는데 혼자 악플다는 애들은. 본인이 정상적인 사회생활을 하는 지부터 생각해보길
마이클,네티즌,10.0,그는 전설이고 영원한 황제.
마이클,네티즌,10.0,"정말 어렸을때부터 마이클 잭슨 팬인데, 너무 못 담아낸거 같다 ... 정말 아쉽다!!!"
마이클,네티즌,10.0,정말 짠한 마음으로 재미있게 봤어요.
마이클,네티즌,10.0,아이 러브 유~ 마이클~!^^
마이클,네티즌,10.0,아주 벅찬 감동을 느꼈다. 마지막 런던 콘서트 장면 보고 울었다 ㅠㅠ 배우가 얼마나 연습했는지 가늠이 안된다. 박수를 보낸다. 평론가는 점수가 낮다는데 아마 마이클 영화의 미화된 점이나 각색된 부분을 고려해서 지적한 것 같다. 마이클 생애에 대해서 잘 모르는 사람이 보기엔 마이클은 음악에 순수한 열정이 있고 팬들에게 친절하며 멋진 사람이었다.
마이클,네티즌,10.0,감동 마잭이 보고파요 ㅎㅎ 아쉬움
마이클,네티즌,10.0,유년~Bed 앨범까지의 이야기. 보는내내 삼촌이랑 똑닮은 조카 덕에 푹 빠져 봤습니다.싱어롱 극장이 생길것 같은?궁뎅이가 들썩들썩ㅎㅎㅎ감독아 2편 내놔
마이클,네티즌,10.0,34년살면서 이렇게 처음으로 관람평작성해봅니다.안보면 후회할거같은 영화이며 정말 영화내내보면서마이클잭슨의 수많은 띵곡들이 있엇다는걸 다시한번 알게되었습니다 정말 재미있고 감동있게 너무 잘봤습니다감사합니다.
마이클,네티즌,10.0,지루할 틈이 없었음! N차 관람 예약할거임
마이클,네티즌,8.0,마이클 팬으로서 정말 기대 많이 했는데 조금은 아쉬웠습니다 ..! 물론 2시간으로 마이클에 대한 모든 이야기는 담을 수 없겠지만 대부분의 사람들이 오해하고 있는 내용들은 조금 풀어줄 수 있지 않았을까 하는 아쉬움이 큽니다 또 마이클 명곡이 많은 만큼 한곡을 풀로 보여주기 보단 여러곡을 한 절씩 또는 조금씩이라도 더 들려주는 게 어땠을까 싶구요 ㅠㅠ 그래도 마이클 팬이라면 꼭!! 보시는 거 추천드립니다??
마이클,네티즌,10.0,"케이팝. 아이돌들이 꼭 보고보고 또 봐야할 교과서적인 영화다. 겸손과 예술가로서 지녀야 할 소양, 시대를 너무 앞서 나간 천재의 불운이 안타까울 따름이다. 강력 추천한다. 그리고 2부가 더 기대된다."
마이클,네티즌,10.0,마이클이 살아 돌아온 것 같아요~♡
마이클,네티즌,8.0,잭슨5 투어공연 부분에서 너무 지루하네요 대표곡도없고 너무 비중을 둔듯 관객들의 함성소리만
마이클,네티즌,8.0,보는데 울컥울컥했네 ㅠㅠ 이런 순수한사람을…그동안 억까당한게 더욱 안쓰러워짐
마이클,네티즌,10.0,재미있게 보았습니다.화면크고 사운드 좋은 영화관에서 보세요
마이클,네티즌,10.0,"제목이 왜 마이클잭슨이 아니라 마이클인지 알게됨. 혹평하는 몇몇들을 이해는 한다만 그는 그시대에 위대한 팝의 황제임에 틀림없다. 나의 10대, 20대 열광한 스타를 진짜 리얼하게 만나볼수 있어서 좋았고 조카라지만 너무 딱 떨어지는 배우라 놀람."
마이클,네티즌,10.0,성인기저귀 차고 들가세요. 진짜 지립니다.
마이클,네티즌,10.0,2편 나오나요? 계속 들어왔던 노래지만 감동이네요
마이클,네티즌,10.0,레전드 오브 레전드다.그는 음악계의 전설이다.
마이클,네티즌,1.0,지리긴 뭐가 지려 진짜 진심으로 하는말인거냐. 마이클 에게 있어서 불명예스러운 영화. 치욕스럽다 그냥. 보는 내내 괴로웠음. 조셉 잭슨 전기 영화인지 이게 음악 영화인지 보헤미안 보다 스토리 전개에 구멍이 난자한데 도대체 뭘 보고 감동을 먹고 뭘 보고 좋았다는지 이해가 안된다. 그냥 10점에 분명히 아쉬운 점이 있는거 아는거 다 아는데 묵인하는거 보면 마이클 죽음 이용해서 이득 취하는 악마들이나 너네나 다름 없다고 본다.
마이클,네티즌,9.0,첫목소리 듣고 벌써 감동
마이클,네티즌,2.0,가장 마이클잭슨을 괴롭혔던 자들이 돈 욕심에 만든 영화. 쟈넷 잭슨이 안나온거면 말 다한거임. 그리고 이렇게 대단한 사람의 일대기를 이렇게밖에 못 만드나? 영화도 별로고… 결정적으로 싱크로율이… 춤은 너무 가볍고… 편히 쉬는사람 들쑤시는 느낌 눈물났음
마이클,네티즌,7.0,영화의 가치는 낮을지언정 마이클 잭슨은 높고 위대하다
마이클,네티즌,10.0,최고예요!!!!한번더 보고싶어요!!!
마이클,네티즌,10.0,아이맥스로 마이클 잭슨의 명곡을 들으니까 더 좋다
마이클,네티즌,10.0,감동의 물결입니다!!
이프 온리,실관람객,10.0,관람객
이프 온리,실관람객,8.0,관람객
이프 온리,실관람객,9.0,관람객
이프 온리,네티즌,10.0,제남자친구가 보라던 영화인데 워낙 영화를 좋아하지 않는지라 아무런느낌없이 보고 잊었던 영화입니다 그리고나서 남자친구랑 헤어지고 생각나 다시 봤는데 처음봤을때는 아무렇지 않았던 장면에서 펑펑 울었습니다 .. 개인적으로 정말 추천하는 영화입니다.
이프 온리,네티즌,10.0,마음이 가는대로 사랑했을뿐인데..
이프 온리,네티즌,10.0,호준아!나 혼자 이 영화 또 봤어.. 보는 내내 네 생각만 나더라넌 이제 내 옆에도 이 세상에도 없지만 영화 속 명대사처럼 사랑하는 방법도 사랑받는 방법도 가르쳐줘서 고마워너와 함께한 시간 모두 잊지 않을게. 사랑해.
이프 온리,네티즌,10.0,몇번을봐도 볼때마다 슬프고감동인영화
이프 온리,네티즌,10.0,"몇번을 계속봐서 대사를 외울지경이지만, 늘 이안이 모든 걸 다알고택시를 타러가기 전의 말과, 택시를 탈때의 장면은 아직까지도 많은 눈물이 흘리더라... 울고싶을 때마다 보고싶은 영화 중 영순이!!"
이프 온리,네티즌,10.0,멜로물중에서는 단연 압도적위치에 있는 영화 비극적 결말이지만 분위기는 어둡지않게 그려낸 명작. 헤어진 연인보다는 곁에 있는 소중한 사람에게 소홀해지기 쉬운 오래된 연인에게 더 와닿는 영화
이프 온리,네티즌,10.0,이영화를보고 평점을낮게주는사람은 사랑을모르는사람이겠죠........
이프 온리,네티즌,10.0,수없이 많이 멜로 영화를 봤지만 처음이자 마지막으로 울어본 영화네요!! 몇번을 봐도 감동적입니다
이프 온리,네티즌,10.0,감수성이란 찾아보기 힘든 남고의 고3남학생까지도 감성에 빠지게 할만큼 슬프고 아름다운 영화
이프 온리,네티즌,10.0,영화를 많이 본 편은 아니지만 여태껏 영화를 보면서 처음으로 눈물이 흐른..
이프 온리,네티즌,10.0,이 영화를 보고 나니익숙함에 속아 소중한걸 잃지 말자는 말이 생각나네요
이프 온리,네티즌,9.0,빗속의 장면도 슬펐지만 개인적으론 오두막집에서 끝은 무조건 비극이라는 것을 안 남자의 심경을 보는 게 정말 슬프더라.. 그 장면부터 쭉 운듯하다..
이프 온리,네티즌,10.0,이안의 심리묘사가 정말 잘 되어 있네요.서로가 사는 방향만 고집하려던 모습에서 어짜피 피해 갈 수 없음을 깨닫고 결국은 애인을 위해 희생하는 그 심리까지...정말 잘 만들어진 영화같아요.
이프 온리,네티즌,10.0,쉽게 헤어지고. 쉽게만나는 커플들이 꼭 봤으면 좋겠습니다.
이프 온리,네티즌,10.0,계산없이 사랑하세요.
이프 온리,네티즌,10.0,눈물이 나오진 않았지만 그 이유는 나한테 있는 것 같다. 진정한 사랑을 해본 사람이라면 절절한 눈물을 흘릴 영화다. 나도 꼭 그런 사람이 생긴다면 다시 봐야겠다. 마음이 가는 대로 사랑을 했을 뿐인데... 이 대사가 굉장히 기억에 남네요...
이프 온리,네티즌,9.0,"남자는 마지막으로 여자에게 최고의 하루를 선물로 주려고 했지만, 실제로 선물을 받은 것은 바로 남자였다."
이프 온리,네티즌,10.0,10년된 남친과 사귄지 100일쯤 됐을때 본 영화인데(2004년개봉작)진짜 엄청 울었던 기억이..난 개인적으로 택시기사 아저씨의 대사가너무 와닿았다
이프 온리,네티즌,10.0,심장이 부셔질듯 아픈 사랑영화.멜로영화중 갑. 남자인 내기 훌쩍훌쩍 했다면 그것으로 끝.
이프 온리,네티즌,10.0,방금봤는데 멍하다. 충격먹었다. 당장내일죽어도 괜찮다 생각하는 나에게 크게 한방 먹인 영화다. 지금부터 내 인생 최고의 영화다. 모든 사람들이 이 영화를 죽기전에 봐야한다. 그정도로 영화가 주는 메시지는 무지막지하다.
이프 온리,네티즌,10.0,"""자기한테있어서 난 만년2순위잖아..""...그게속상해....더비참한건 거기에 익숙해진다는거야..."
이프 온리,네티즌,10.0,진짜 쩌는거 같다...
이프 온리,네티즌,8.0,이 영화같은 사랑해보고 싶다. 인생에서 이 사람이 아니면 절대 안될것 같은 그런 사람을 만나 평생을 같이 할 수 있다는 것은 큰 축복일 것이다. 계산하지 않는 순수한 사랑. 내 모든걸 바쳐도 아깝지 않는 사랑.나도 그런 사람을 만나 사랑할 수 있을까?
이프 온리,네티즌,10.0,"최고!내용도,ost도,연기도, 연출도♥"
이프 온리,네티즌,10.0,내생의 최고의 영화.진짜 감동이다. 이보다 더 먹먹한 엔딩이 있을수있을까사랑하는 법을 알게해줘서 고맙다는 말이 지금도 내맘을 울리고있다
이프 온리,네티즌,10.0,헤어질까 싶은 분들은 무조건 봐야 함
이프 온리,네티즌,10.0,택시기사뭐임? 존나소름돋고무섭
이프 온리,네티즌,10.0,산 언덕에있는 별장안에서 이안의 시계가 깨지고 과거를 되돌리수없다고 채념하는 이안의 눈빛은 5년이 지난 지금도 잊지못하는 명장면
이프 온리,네티즌,10.0,내 인생 최고의 영화를 물음 이프온리.. 영화 한번보면 다신 안보는데 이건 두번 세번봐요 볼때마다 너무 슬픔..
이프 온리,네티즌,10.0,연애를 시작하고 100일 전에 보면 가장 좋을 영화. 있는 그대로 사랑하게 만든다. 특히 하루라는 시간의 제약을 둠으로써 그녀와 함께하는 시간동안 행복하게 해주자는 교훈도 담는다. 사실 다 아는 것들도 영화를 보면 다시 깨우치는듯 ㅋㅋ
이프 온리,네티즌,10.0,제가 정말 좋아하는 멜로영화여서 처음으로 평점 남겨봐요 정말 추천드려요.
이프 온리,네티즌,10.0,남자배우의 명대사 아직도 아른하네요. 아 정말 교훈적이고 좋았습니다. 저도 같이 울었네요.
이프 온리,네티즌,10.0,진정한 사랑이 무엇인지 보여주는 영화
이프 온리,네티즌,10.0,내가 본 영화중 최고입니다떠나고 후회하지말고 있을때 잘합시다계산적인 사랑말고 마음이 가는대로 사랑하길..
이프 온리,네티즌,10.0,과거가 아무렴 어때중요한건 이순간인데
이프 온리,네티즌,10.0,결말이 세드라는걸알고 봐서 대충짐작은햇는데 마지막 남자주인공의 택시안에서 대신죽음을 맞이하는 표정.제스처.눈빛모든게 가슴을 더 저리게햇다. 스토리는뻔한멜로지만 진정한사랑을느끼게해주는 배우들의 연기..한국에서도 이정도 멜로는나와야 돈내고보지..
이프 온리,네티즌,10.0,계산없이 있는 그대로 사랑하자
이프 온리,네티즌,10.0,말하지 않아도...
이프 온리,네티즌,10.0,사랑하는 사람을 위해 모든것을 버린 멋진 남자.. 정말감동이네요 제가본 멜로영화중 스토리구성이며 시간흐름 장면전환 모두다 좋앗던 영화인것같네요ㅎㅎ
이프 온리,네티즌,9.0,진정한 사랑이 무엇인지 일깨워준다. 지금 연인에게 소홀하다면 꼭 보면서 생각하게 되는 영화다.
이프 온리,네티즌,10.0,이프온리.. 사랑하는이에게 내전부와삶을주어도아깝지않다.. 이영화는 찐한 에스프레소같은 향기를품은 좋은작품이다 별10개 당신은 모든걸포기할수있나요?
이프 온리,네티즌,10.0,사랑한다. 사랑한다. 사랑한다.
이프 온리,네티즌,10.0,나라면 대신 탈 수 있을까..? 사랑 참 어렵다..
이프 온리,네티즌,10.0,소중한 사람은 있을 때 행복한 것이다. 하지만 정작 행복할 때는 그것을 느끼지 못한다.우리는 항상 행복하다. 그러니 행복할 수 있을 때 더 행복하자.
이프 온리,네티즌,10.0,사랑을 해본 사람이라면 눈물이 날 수밖에 없는 영화인 것 같아요! 스토리 자체는 조금 진부하고 유치한 것 같다고 느꼈지만 그럼에도 불구하고 눈물을 펑펑 쏟으며 봤습니다. 특히 이안이 택시를 타기 전 했던 대사는 정말 최고였어요.
이프 온리,네티즌,9.0,마지막에 택시만 안탔어도 10점인데...
이프 온리,네티즌,8.0,사만다 캐릭터는 정말 사랑스럽다.
이프 온리,네티즌,10.0,지금 Love will show you everything 듣는데 여운이 가시질 않는다
이프 온리,네티즌,10.0,사랑하는 여자를 위해 운명을 바꾼 남자..그의 사랑하는 방식.. 감동적이네요ㅠ.ㅠ
이프 온리,네티즌,1.0,나랑은 진짜 안맞았던 영화
이프 온리,네티즌,10.0,제가 남잔데... 울었습니다. 사랑이 아름답더군요.
이프 온리,네티즌,10.0,말이 필요없음 그냥 보고 울어야함
이프 온리,네티즌,10.0,영화계의 명작임 정말 안보면 후회 하는 영화
이프 온리,네티즌,5.0,나만 별론가...뭔가 와닿지가 않네
이프 온리,네티즌,10.0,남친이 추천해줘서 봤는데 기대도 안하고본 영화가 새벽에 눈물을 펑펑흘리게해줫다여태까지본 멜로영화 중 가장 감동적이고 슬픈영화 연애에있어서도 가족 주변 사람에 있어서도익숙함에 속아 소중함을 잃지말자 .
이프 온리,네티즌,2.0,"새로 얻은 하루가 너무 길어서 개연성이 없게 느껴졌고, 연주회에 늦지는 않을지 조마조마 하면서 봤다. 그리고 죽음을 미리 보지 않았다면 남자는 갈수록 여자에게 지치고 여자는 남자에게 실망만 커졌을 관계가 아닌지... 그래도 사랑이었을지 싶다."
이프 온리,네티즌,1.0,구려... 진짜로.. 어떤 여운도 감동도 느낄 수 없었다. 명대사만 보면 괜찮은데 영화를 보는 내내 느꼈던 실망스러움이 그걸 덮어버려서 그것마저 별 느낌을 받지 못했다. 마지막으로 갈 수록 택시기사 등장할 때마다 소름돋아 마지막에 택시기사가 쳐다볼 땐 그냥 호러인줄 소름 오소소 돋았음
이프 온리,네티즌,1.0,왜 다들 재밌다고 하는건지 잘 모르겠다. 운명을 바꾸려는 이야기의 영화들중에 가장 단순하고 진부한 영화였다. 깊고 유쾌한 로맨스를 기대했지만 둘 다 아니였다.
이프 온리,네티즌,1.0,와 이런 구닥다리 사고 로맨스 영화 평점 이렇게 높을 일이냐보는 내내 남주 행동 짜증나고새로 주어진 날에 하는 남자 행동도 그지같은디 무조건 감격하는 여주 짜증났지만 제일 짜증나는건 결말이었다이딴 영화에 시간 쓴게 아깝네
이프 온리,네티즌,1.0,내가 본 멜로 영화 중 최악..마지막에 오케스트라 연주랑 여자가 노래 부를 때너무 오글거려서 온몸에 소름이 돋음..너무 과대평가 된 영화가 아닌가 싶다..
이프 온리,네티즌,5.0,이쁜 온니 외에는 그닥 기억에 남는게 없다.개봉 당시에 봤다면 어땠을까...다른 감상평에 공감하기엔 2019년은 늦어도 너무 늦은듯 ㅜㅜ
이프 온리,네티즌,10.0,베스트댓글 스포 실환가
이프 온리,네티즌,2.0,내 별점은 지극히 내 기준. 평점 보고 골랐던 작품인데 아무런 느낌이 없고 억지스러운 감정이 드는 내가 정말 사랑을 몰라서인가?오히려 다른 사람들과 다른 감정이 드는 내가 우려스러워지기도 했다. (베플을 읽어보면 너무 격해 놀라울정도..!)로맨스 영화 좋아하고 옛날 영화도 좋아하는데 이상하게 나랑 안 맞던 영화 .
이프 온리,네티즌,1.0,밑댓글 너무공감 ㅠㅠ... 별로 감동이 없어요.. 안와닿아.... 무덤덤 ㅠㅠ 이게 그렇게까지 인생영화라 칭송받을정도인지싶고.. 내가 찌들고 메말랐나 걱정될정도....였는데 최신순보니 나랑 똑같은 기분이신분이 댓글 달아놓으셨네.. 공감뉴르고갑니다 후 ㅋㅋㅋ 사만다가 부르는 노래는 좋더라고요.. 네..
이프 온리,네티즌,1.0,솔직히 평점 높은거 이해안감
이프 온리,네티즌,10.0,남자도 울게 하는 이영화 강추입니다.예전에 친구들이랑 같이 봤었는데 안 울었던 친구가 없었으니...영화 내용도 좋고!굿!
이프 온리,네티즌,6.0,뻔한결말에 개연성없고 현실성없음 파괴적사랑 발전적이지 않음
이프 온리,네티즌,2.0,이게 무슨 감동인지... 그래서 대신 죽는 게 감동인가? 죽을 각오를 하면 뭐든 다 할 수 있다? 그래서 대신 죽으면 감동이 되는 것인가???
이프 온리,네티즌,6.0,솔까 과대평가 쩌는 듯딱히 반전도 없고 뭔지
이프 온리,네티즌,10.0,평점댓글에 스포가있어서 그것만빼면 좋았네요. 댓글만안봤어도 더 감명깊었을듯요ㅜ
이프 온리,네티즌,1.0,내 가슴이 지금 오작동인지..
이프 온리,네티즌,2.0,뻔하디 뻔하다. 죽음을 소재로 눈물 짜낸 삼류 사랑이야기
