제목,작성자유형,평점,리뷰
8번 출구,네티즌,8.0,"게임을 어떻게 영화화했을지 궁금했는데 나름 잘 만들었네요...인생을 살며 어떤 선택을 하느냐에 따라 끝없는 굴레에 갇힐수도,벗어날수도 있다는 메시지...영화속에선 아빠가 되는 과정에서 선택의 기로에 선 주인공이 어떤 태도를 가져야하는지 말해주고 있네요"
8번 출구,네티즌,10.0,재밌어요추천합니다! 두세번 깜놀하는 장면 있음호불호 있음초반에 지루할 수 있음몰입감 좋음
8번 출구,네티즌,7.0,나의 8번출구를 찾아내기 위해 내게 필요한게 무엇인지 알려주는 친절한 공략집
8번 출구,네티즌,7.0,'이상현상'이라는 연옥 속에 빠져있는 우리 사회의 모습
8번 출구,네티즌,9.0,"이 작품은 원작을 잘 반영했다는 점과 드러내고 싶은 주제를 잘 표현했다는 점에서 괜찮은 작품입니다. 연기도 잘 하셨었고요. 단, 답답했다는 부분은 조금은 있었지만, 게임을 영화화하고, 그걸 잘 풀어냈다는 점에서 칭찬할 수 있을 것 같습니다."
8번 출구,네티즌,10.0,예전에 즐겨하던 게임인데 추억도 돋고 좋았습니다 ㅎㅎㅎ 다만 게임을 안해본 남친은 공황 올거 같았다네요ㅋ 스토리 특성상 반복 되는 화면이 원래 게임을 잘 모르시는 분들께는 조금 지루하다고 느끼실수도 있겠지만 저같은 매니아 분들은 너무 재밌게 보실겁니다!!
8번 출구,네티즌,8.0,주의력결핍장애가 있지않는한 누구든 탈출까지 10분컷가능한 영화
8번 출구,네티즌,10.0,간만에 본 철학적인 공포영화.
8번 출구,네티즌,8.0,막 비싸게 볼만한 영화까지는 아니지만 플룻이 촘촘히 잘 짜인듯
8번 출구,네티즌,8.0,"살짝 지겨울랑 말랑 아리송한데, 볼만했음."
8번 출구,네티즌,7.0,"Bolero의 반복되는 악장에 몸을 맡기며 변화를 두려워하고 이상현상이 생기면 외면하며 뒤로 돌아가고 싶어하지만, 결국은 앞으로 나아가야지만 얻을 수 있는 행복이란 것들. 많이는 아니더라도 조금씩 꾸준히 변해가는 것만으로 이 세상은 도전해 볼 가치가 있다."
8번 출구,네티즌,10.0,8번 출구 보고 왔는데 정말 재밌더라고요! 마지막까지 긴장감이 유지되고 매일 반복되는 일상에서 조금이라도 다른 행동을 한다면 그 하루도 나를 의미있게 만드는 거잖아요. 스릴러 영화지만 나를 철학적으로 돌아보게 하는 영화였어요. 지하철이라는 익숙한 공간을 새롭고 낯설고 스릴넘치는 장소로 바꿔놓은 연출이 인상적이었습니다!
8번 출구,네티즌,8.0,☆☆☆&!!♡~~~
8번 출구,네티즌,10.0,"8번출구 게임 영상들도 재밌게 봤는데영화는 더 재밌게 봤어요. 이 게임을 도대체 어떻게 영화로 풀까했는데, 엔딩까지 완벽.연출 사운드 스토리 다 좋았습니다!"
8번 출구,네티즌,8.0,스토리 창의적이고 신선했어요.
8번 출구,네티즌,7.0,게임내용을 다 알고봐서 덜 무서웠습니다!! 게임이랑 다른 부분도 좋았어요
8번 출구,네티즌,10.0,너무 재밌고 인상적이고 이제까지 영화중에 가장 임팩트가 쎘어요 평생 잊지못할 영화에요 꼭 보세요!!!!
8번 출구,네티즌,10.0,즐겁게 관람 했습니다원작 게임의 현실 공포감을 영화로 잘 표현 했네요안보신분들은 스릴러 공포영화 한번 보러가세요
8번 출구,네티즌,10.0,스토리도 탄탄하고 배우들의 뛰어난 연기가 좋았어요!
8번 출구,네티즌,10.0,영화관에서 보길 잘했다
8번 출구,네티즌,10.0,난 재밌엇음… 등장인물 별로 에피소드가 나눠져있얶던게 인상깊다. 기괴하면서 미스테리한 느낌. 독특했다. 사실 니노 보려고 본 영화인데. 내용도 재밌어서 좋았음. 근데 관람평은 왜이럴까
8번 출구,네티즌,10.0,이 게임을 어떻게 영화로 풀까 싶었는데 적절한 서사가 들어간 것 같아서 좋았어요 배우분들 연기 너무 잘하시고 꼭 화면 크고 사운드 좋은 극장에서 보시길!!!!
8번 출구,네티즌,10.0,기존의 스릴러하고는 연출이 좀 달라서 확실히 신선한 느낌이 있는거 같습니다. 재밌게봤습니다
8번 출구,네티즌,10.0,반복되는 일상에서 살아가는 우리들이 자주 느꼈을 불안을 생각해보게 하는 영화인것 같다.
8번 출구,네티즌,10.0,8번출구란 영화 잘봤습니다~매우 흥미로운영화입니다
8번 출구,네티즌,10.0,일본영화는 잘 안보는 편인데 게임원작이라 아이들이랑 같이 보면 좋을것 같아 예매해서 봤는데 나름 잼있게 잘 봤어요..중간중간 조금 지루한감은 있지만 독특한 소재라 마지막까지 긴장감을 놓을 수가 없어요..
8번 출구,네티즌,10.0,"영화의 기본 설정은 원작 게임과 같습니다. 주인공 '헤매는 남자'(니노미야 카즈나리)는 끝없이 반복되는 지하도에 갇히고, 다음의 단순한 규칙을 따라야만 탈출구인 **'8번 출구'**를 찾을 수 있습니다.?이상 현상을 발견하면 되돌아가고?이상 현상이 없으면 앞으로 나아가라?이 단순한 룰은 관객을 즉시 주인공의 '틀린 그림 찾기' 여정에 동참하게 합니다. 미묘하게 뒤집힌 포스터, 늘어나는 그림자, 순간적으로 변하는 소품 등, 일상적인 공간에서 벌어지는 기괴한 변주는 관객에게 극도의 몰입감과 긴장감을 선사합니다. 단순함이 주는 공포, '리미널 스페이스(Liminal Space)' 특유의 압박감이 스크린을 가득 채웁니다."
8번 출구,네티즌,10.0,일본 스릴러 공포 영화 특유의 특색이 옅어서 재밌게 본 영화네요~ 스토리도 좋고 몰입감있게 끝까지 재밌게 봤어요!!
8번 출구,네티즌,10.0,매일 일상적으로 접하는 지하도라는 같은 장소이지만 좀더 자세히 살펴보면 미묘한 차이의 풍경에서 심리적인 긴장감을 느끼게 하는 일본 스릴러 영화. 감독의 세련된 연출이 백미 인 영화로 한번 볼만한 영화로 추천함다.지하도라는 한정된 공간에서의 심리적인 긴장감을 느끼게 하는 심리 스릴러의 폭팔성은 대단하다. 일상이 무료하다 생각 되시면 한번쯤 볼만한 영화로 추천함다 ~~~.
8번 출구,네티즌,10.0,게임이 꽤 단순한데 영화는 지루하지 않고 재미있었다 스토리도 좋았는데 배우분들 연기가 대박이었다 기대를 크게 안 해서 그런지 기대 이상으로 너무 재밌게 보고 나온 영화
8번 출구,네티즌,10.0,영화다보고 나올때 exlt의 감사함이란~!쌈빡한영화
8번 출구,네티즌,10.0,일본영화가 이렇게 재미있는지 처음알았습니다작품성과 연출 모두 뛰어난 작품이니다감사합니다
8번 출구,네티즌,10.0,와 게임을 이렇게 풀어나가네 전혀 예상치 못한 전개에 경악을 금치못함나만당할순없으니까 다들 봐야함
8번 출구,네티즌,10.0,공포의 탈을 쓴 철학영화
8번 출구,네티즌,10.0,게임에서만 플레이 한 걸 영화로 직접 보니까 신기하고 재밌네요 ㄹㅇ 추천
8번 출구,네티즌,10.0,단순한거 같지만 빠져들게 되고 몰입감이 높아져서 재미있게 봤다. 기존의 일본 스릴러물과는 다른 연출도 돋보이고 지하철역 출구라는 공간적 구성이 독특해서 흥미롭게보았고 새로운 스타일의 영화여서 긴장감있게 봤다.
8번 출구,네티즌,10.0,지하철출구를 빠져나오는 반복되는 스토리 패턴에서지루할만하면 이상현상이나오고 니노의 연기와 여러가지 인물들의 스토리로 지루하지않고 여운있는 작품이였습니다
8번 출구,네티즌,10.0,엥 이게 영화화 했다구...? 싶었는데 의외로 메시지 있는 스토리라 좋았어요 간만에 볼만한 일본영화 생겼네요
8번 출구,네티즌,10.0,오랜만에 본 스릴러 영화인데 올 가을 영화관에서 힐링하는 시간이었다.단순한 규칙을 기반으로 진행되는 스토리에 몰입도도 충분했고 연출력도 훌륭했다.
8번 출구,네티즌,10.0,"칸 영화제 미드나잇 스크리닝 부문에 초청되었으니 이미 세계적인 주목을 받은 작품이고, 부산국제영화제에도 초청되어서 나름 기대하고 봤습니다.상당히 철학적인 내용이 연출미도 좋고 각 배우들의 연기가 좋았습니다"
8번 출구,네티즌,10.0,관람평보고 별로라는 평이 많아서 볼까말까하다가 유튜버들이 8번출구 게임하는거 보고 궁금해서 봤는데 볼만했던 것 같음.
8번 출구,네티즌,10.0,요근래 본 최고의 영화입니다! 90분내내 숨을 쉴 수 없었어요!
8번 출구,네티즌,10.0,일본영화를 영화관에서 보는거는 처음이네요스릴넘치는영화 제 스타일이네요
8번 출구,네티즌,10.0,"기존 일본 스릴러와는 다르게 연출이 세련되고 감각적이어서 새로운 스타일의 장르적 재미를 느낄수 있습니다~ 또한, 한정적 공간에서 폭발하는 심리스릴러의 묘미가 압권이었습니다^^"
8번 출구,네티즌,10.0,무한반복 지하철 통로 ... 탈출해야하는 심리극... 소름이다.. 재밌어요.
8번 출구,네티즌,10.0,일상생활에서 흔히 접할 수 있는 일이기에 더 가까이 공포가 엄습해 오는 명품 스릴러!
8번 출구,네티즌,10.0,게임 원작이라서 어려울지도 모르는데 자칫 지루할 수 있는 스토리를 배우들의 연기와 세련된 연출로 잘 풀어냄
8번 출구,네티즌,10.0,배우들의 탄탄한 연기가 단순할지 모르는 반복이라는 소재를 심리적 긴장으로 잘 이어줌 정말 재밌는 영화
8번 출구,네티즌,10.0,"배우들의 섬세한 감정 연기와 어두운 색감의 연출이 잘 어우러져, 마지막까지 긴장감을 놓을 수 없었다."
8번 출구,네티즌,10.0,배우들의 명품 연기와 심리적 긴장감이 상당히 잘 어우러진 영화입니다 재밌었어요
8번 출구,네티즌,8.0,"너무 몰입했네요,, 제가 마치 8번출구를향해 가는 기분이였어요!..무섭기보단 기괴한 느낌이 더 크네용재밌고 소름돋아요"
8번 출구,네티즌,10.0,집중이 되는 스릴 넘치는 이야기 여운이 느껴져서 좋았던 영화입니다
8번 출구,네티즌,9.0,갑툭튀도 적당하고 소리가 진짜 다 했음. 후반부에 내용이 산으로 가는 것 같지만 그래도 나름 감동 포인트도 있었음. 게임에 있는 이상현상을 다 담아냈는데도 어색하지 않고 퀄리티가 아주 높음.
8번 출구,네티즌,10.0,기대이상 이였고 생각보다 재밌었음.
8번 출구,네티즌,10.0,이 영화의 원작 게임을 생각했을때 어떻게 그 소스에서 이런 내용을 뽑아냈는지 그저 감탄스러울뿐
8번 출구,네티즌,10.0,관객들에게 계속적으로 질문을 던지고 생각하게 만드는 영화로 굉장히 집중해서 보게 만드는 영화입니다.공포 게임같은 느낌이었어요!
8번 출구,네티즌,10.0,"영화 소개를 보고 흥미로워 보게됐는데 재밌게 잘 봤어요.한정된 공간에서 느껴지는 스릴, 공포를 잘 연출한 것 같아요."
8번 출구,네티즌,10.0,무한히 반복되는 지하도에 갇힌 남자가 '이상 현상'을 발견하고 규칙에 따라 8번 출구를 찾아 탈출하는 과정을 그린 미스터리 스릴러.. 긴장감있습니다.
8번 출구,네티즌,10.0,주연배우들읙 연기도 좋았고. 내가 만약 저상태로 무한루프속에 빠진다면 어떻게할까 생각하게됨.
8번 출구,네티즌,10.0,공포영화는 뒷머리끝이 오싹한 느낌이 든 재미로 봐요.혼자서 걷는 것 좀 무섭지요.스토리와 연기가 재미있네요.
8번 출구,네티즌,10.0,영화 8번출구 게임을 실사화 했다는 것에 흥미 있었습니다좋은 배우들의 연기력에 기대 되는 작품 될것입니다반복되는 공간속에서 느껴지는 심리적 긴장감도 재미나겠습니다
8번 출구,네티즌,10.0,"평범한 장소, 한정적인 장소에서의 스릴러가 완전 묘미네요~ 기존 일본스릴러와 다르게 세련되고 감각적인 연출이 좋았어요."
8번 출구,네티즌,10.0,보통의 일본 스릴러랑은 다른 느낌..영화 분위기도 뭔가 세련되고 연출도 맘에 들어요한번 더 보고싶네요
8번 출구,네티즌,10.0,영화 스릴이 장난아니고 나오는 배경음악이 진짜 닭살 돋게 좋아요 배우들의 연기도 진짜 좋구요 가족 친구 연인들이랑 보는거 추천~~
8번 출구,네티즌,10.0,"기존 일본 공포 작품들의 경우 갑작스러운 등장이나 음산한 분위기로만 연출했다면, 반복적이고 이상하지 않아야 할 상황에서 미세한 변화들이 공포로 다가왔습니다. 또한, 일본은 원작을 헤치지 않는 선에서 영화화를 잘한다는 장점 때문인지 영화 속 주인공에 감정이입해서 혼란을 느끼는 점도 흥미로웠어요! 공간이 주는 압박감이 다른 공포물과는 확연히 달랐습니다."
8번 출구,네티즌,8.0,"제한된 공간과 소재,인물 속에서 이정도 영화가 나왔다는 부분에 박수를."
8번 출구,네티즌,10.0,여시랑 더쿠에서 이 일본영화 평점 낮추자고 좌표찍었던데 정말 수준 처참하네요
8번 출구,네티즌,10.0,"나는 어릴 적부터, 유튜브로 공포 게임을 즐겨 보면서 컸다.지금도 꾸준히 즐겨보는 편으로 오늘 감상평의 주인공인 '8번 출구'가 출시되었을 때도진짜 재밌게 보았다.처음 접하는 게임의 형태와 시스템이 새로웠으며이 게임을 기준으로 여러 아류작들이 대거 탄생하게 되었을 만큼 게임 역사의 한 획을 그었다 생각한다.그리고 몇 년 뒤인 오늘, 게임을 원작으로 영화 상영이 시작되었다.솔직히, 생각보다 재미가 없겠다는 생각이 8할이었으며영화 초반에도 그렇게 큰 재미는 느끼지 못하였다.그러나, 탈출이라는 목표만으로 전개되는 게임과는 차이점을 주어오리지널 스토리나 캐릭터를 추가하였는데 생각보다 괜찮았다.특히, 이 영화는 탈출이라는 '나온다'라는 개념을작중에서 '낙태'와 '출산'에 비유하며 영화에 잘 녹였는 듯하다.영화의 메시지나 연출 등기대를 크게 안 한 상태에서 본 탓인가생각보다 재밌었으며, 후반에는 약간 감동적이기도 하였다."
8번 출구,네티즌,9.0,단순한 게임에완벽한 스토리를 더하니완벽한 예술이 탄생했다
8번 출구,네티즌,10.0,솔직히 기대 전혀 안 했는데..니노 연기 진짜 많이 늘었구나. 그리고 스토리가 생각보다 너무 탄탄해서 놀랬고 마지막까지 깔끔했습니다. 정말 재밌게 봤어요
8번 출구,네티즌,10.0,뫼비우스의 띠같은 8번 출구에서 탈출인가 그져 발버둥치는 것인가
8번 출구,네티즌,10.0,원작 게임 플레이영상을 워낙 재미있게 봤고 영화로 나온다했을때 이걸 도대체..?어떻게..?라는 생각이 들면서도 기대가 되었는데 생각보다 재미있게 봤어요 스토리도 가끔 아주 세세한부분에서 엥? 싶은데 전반적인 스토리는 원작게임 내용없는거치고 잘만들어진거 같습니다 다양한 결말해석을 보고 나니 더 흥미진진하게 느껴지네요.
8번 출구,네티즌,10.0,원작게임의 감성을 해치지않으면서도 영화만의 새로운 서사를 집어넣은게 매우 탁월했음
8번 출구,네티즌,10.0,우리는 8번출구에서 나갈 수 없다
8번 출구,네티즌,10.0,8번 출구 공포게임 재밌는 사람들은 이 영화가 재미없을 수가 없다 큰 기대 없이 봤지만 재밌었던 영화!
8번 출구,네티즌,10.0,큰 스크린으로 보니 몰입 잘됨! 나도 주인공처럼 이게 뭐지 하다가 틀린 것도 같이 찾아보고 같이 놀람..! 완전 공포는 아니지만 약간 스릴도 있어서 후회 없고요. 극장에서 보기 잘한 듯함!!
8번 출구,네티즌,10.0,옛날감성이긴 하지만 요즘시대에 필요할때
8번 출구,네티즌,10.0,기다렸던 8번출구!! 한정적인 공간에서 스릴 넘치는 긴장감이 크으으으b
8번 출구,네티즌,10.0,신박하고 독보적인 장르로 몰입감 굿!
8번 출구,네티즌,10.0,원작 게임을 직접 플레이 해본 입장에서 처음 영상화 소식을 들었을 때는 걱정이 있었지만 결과적으로는 원작의 분위기를 잘 살렸다고 생각합니다. 재미있게 봤습니다.
8번 출구,네티즌,10.0,간만에 흥미 진진하게 보았음 !!!
8번 출구,네티즌,10.0,8번 출구 게임이 이렇게 완성도 높게 영화를 만들지 몰랐습니다 재미있었어요
8번 출구,네티즌,10.0,진짜 진짜 모두가 봐야 할 영화
8번 출구,네티즌,10.0,자칫 지루할 수 있는 내용을 전혀 지루하지 않게 만들었음 끝까지 긴장감있게 잘 본듯
8번 출구,네티즌,6.0,다른건 제쳐두고 주인공 천식이나 애기 울음소리가 소음 수준이라 좀 힘들었음..
8번 출구,네티즌,7.0,"흥미로운 영화, 상영시간이 길었으면 지루할 뻔 했다"
8번 출구,네티즌,7.0,주인공은 천식 발작 계속 일으키면서 그넘의 약은 왜 자꾸 가방에 넣는거냐??주머니가 없냐??저런 덜떨어진 애가 어떻게 고마츠 나나를 임신시킨거지??게임을 많이 해서 그런지 답답해 죽는 줄 알았네~그래도 이 간단한 게임을 이렇게 까지 서사를 붙여서 메세지를 준다는 건 대단하다.살짝 빤히 보였던 클리셰도 잘 비틀었고~
8번 출구,네티즌,2.0,생각보다는... 작품이 하도 좋다해서 보긴했는데호불호가 많이 갈릴듯 하네요
8번 출구,네티즌,10.0,매일 빽뺵한 지하철을 타고 출근하고 그게 더 지옥같아 불쌍해
8번 출구,네티즌,10.0,게임을 원작으로 칸영화제에 초청작이라 기대감이 있었고 스릴러 영화이지만 감독이 무엇을 연출하고 싶었는지 생각하면서 보니깐 더 재미있는거 같아요
8번 출구,네티즌,10.0,반복되는 삶도 다른 선택이라면 다른 삶이 된다. 재미있었습니다!
8번 출구,네티즌,10.0,엄청 지루한 스릴러 영화일 것만 같았는데 전혀 달랐다. 다 보고 난 후에는 오히려 많은 생각을 가지게 만들면서 각자 가지고 있는 고민적인 것들을 대입해서 고민 속에서 이성적으로 생각하며 탈출할 수 있게끔 도움을 준다는 느낌?
8번 출구,네티즌,10.0,정말 재미있게 봤어요 기대이상 입니다...혹시 망설 이시는분들께강추합니다
8번 출구,네티즌,10.0,스리러물이지만 내용도 생각해볼 의미가있는 좋은 영화입니다배우들의 연기 몰입도도 아주 좋았습니다
8번 출구,네티즌,10.0,"언출도 연출이지만 배역들의 맡은바 연기력이 우수함, 스릴러에 빠져보니 시간가는줄몰랐음!!추천함"
8번 출구,네티즌,10.0,아무기대안하고 봤다가 완전 빠져버린 영화!!특히 배우들의 연기가 대단해요~시간가는지 모르고 보게됬어요!!이런영화는 특이하면서도 무섭네요
8번 출구,네티즌,10.0,기존에 일본스릴러랑은 다른 차별화를 둔 영화이다. 잘보았다.
8번 출구,네티즌,10.0,"?기존 일본 스릴러와는 다른, 세련된 연출과 감각적인 분위기를 강조한 점이 정말 인상 깊어요. 평범한 지하도라는 한정된 공간에서 폭발하는 심리 스릴러의 묘미를 제대로 보여줄 것 같아 기대감이 최고입니다! 무한 루프라는 설정이 선사하는 새로운 스타일의 장르적 재미를 스크린에서 꼭 느껴보고 싶네요."
8번 출구,네티즌,10.0,"너무 재밌게 잘 보고 왔습니다! 기존 일본 스릴러외는 다른, 세련된 연출과 감각적인 분위기를 강조하였습니다. 그리고 새로운 스타일의 장르적 재미가 있었고 한정된 공간에서 폭발하는 심리 스릴러의 묘미가 있었어요!! 연기도 너무 좋았습니다~"
8번 출구,네티즌,10.0,와!!! 진짜 살면서 본 일본 영화중에 가장 재밌었어요!!! 최고
8번 출구,네티즌,10.0,시간가는줄 모르고 보았네요강추합니다 좋아하는 배우까지 나오니 즐거운 시간이었습니다
8번 출구,네티즌,10.0,기대없이봤는데 감명깊게잘봤어요 새로운스타일의 재미와 탄탄한스토리덕에 즐겁게봤습니다^^
8번 출구,네티즌,10.0,게임 하나로 90분짜리 영화를 만든게 진짜 대단하긴 함 은근 무서움
8번 출구,네티즌,10.0,생각보다 너무 깔끔하게 잘 만들어서 놀람.. 폐쇄공포증 간접 체험하고 옴
8번 출구,네티즌,10.0,"익숙한 일상 공간을 통해 사회의 불안과 인간 내면의 두려움을 섬세하게 보여준다.화려한 장치 없이도 현실적인 긴장감을 유지하며, 보는 내내 숨이 막히는 듯한 몰입을 준다.특히 평범한 ‘지하철 출구’가 탈출구이자 막다른 길처럼 느껴지는 상징이 인상적이었다.영화가 끝난 뒤에도 한동안 그 출구 앞을 떠올리게 되는, 여운이 깊은 작품이다."
8번 출구,네티즌,10.0,"기대를 엄청 하고 봤는데도 너무 흥미롭고 도파민 쫙 나왔어요,, 올해 최대의 경험이었습니다 꼭 스크린엑스로 보시길…"
8번 출구,네티즌,10.0,오랜만에 일본 영화를 봤어요 좋아하는 배우가 나와서 얼른보러왔네요 연출도 훌륭하고 잼있었어요 강추합니다!
8번 출구,네티즌,10.0,최근 본 작품 가장 감명 깊게 본듯
8번 출구,네티즌,10.0,기존의 스릴러와는 다르게 영상미 퀄리티가 높고좁고 한정된공간에서의 스릴러라는 내용이 인상적이였어요 ! 최근에 재밌게 본 영화가 드문편인데 재밌게 본 영화중 하나!
8번 출구,네티즌,7.0,참신했으나 굳이 영화관에서 볼 필요는 없고 요금을 지불하고 지하철이나 집에서 봐도 좋을안한 작품이에요.
8번 출구,네티즌,10.0,방금 보고나옴. 감동 메시지 호러 다있음. 돈 안아까움!
8번 출구,네티즌,10.0,"진짜 오랜만에 제대로 짜여진 한국영화를 본 느낌입니다. 지루하지않고 적당한 속도감과 구성스토리, 배우들의 연기력 너무 좋았어요"
8번 출구,네티즌,10.0,스토리가 재미있네요! 지루하지도 너무 루즈하지도 않고요
8번 출구,네티즌,2.0,가짜 평점임말도 안 되게 재미없음별하나도 아까움
8번 출구,네티즌,2.0,개인적으로는 일본 쓰레기 영화임. 반복되는 지하철통 씬은 나도 매일 지하철로 왕복 3시간 다니는 입장에서는 최악의 설정이다. 좋다 호불호가 있다고는 말하는데 어떤 호가 있나? 어떤 메세지를 주려고 하나?? 각각 개인의 서사? 사회적의미?? 공포? 모두 실패한 그저그런 원작게임에 별 의미도 크게 보이지는 않는 서사... 스토리라인? 메세지? 흡입력? 금년에 본 최악의 영화.. 집에서 넷플릭스로 보면 5분도 못 넘겼을 쓰레기.. 제작비 1억을 못넘겼을...영화.. 투자대비 현재 영화순위 2위 대박난 영화...Roas 측면 1만배 대박난 영화.. 혹시 평점을 보고 볼려는 사람들.. 잘생각하고 보기 바람
8번 출구,네티즌,2.0,평정은 거의 사기수준임! 보다가 중간에 나왔음!!
8번 출구,네티즌,10.0,"예고편볼땐 사람이 왜이리 많아,, 하면서 안무섭고 병맛일것 같았는데... 생각보다 반대로 감동적이고ㅜ사람마다 스토리있어서 너무 좋았음. 그리고 영화로 통해 많은것을 깨닿게 해줌..진짜 착하게 살아야지.."
8번 출구,네티즌,8.0,"출구 없는 세상 속에서, 나는 좋은 어른일까 반복해서 되묻기."
8번 출구,네티즌,10.0,"주인공 연기 개잘하네,,"
8번 출구,네티즌,7.0,공익광고같은영화. 잘만든 영화
8번 출구,네티즌,8.0,애기 개잘생김그리고 마지막에 소름돋음
8번 출구,네티즌,7.0,평점 높길래 디게 기대했는데 이게 뭐지..? ;;; 기대 안하고 보면 볼만할 듯. 일단 주인공 행동 너무 답답해서 보는 도중에 한숨만 계속 나왔음.
8번 출구,네티즌,8.0,천식환자인데 벤토린 흡입약 그따위로 뿌리니까 약이 잘안듣지 라는 생각이 날 지배함
8번 출구,네티즌,8.0,"주변의 놓치기 쉬운 반복 속 변화를 공포로 다시 표현한다. 용기를 내지 못한 개인이 굴복하느냐 이겨내냐를 잘 그렸다. 또한, 주인공이 자신의 과오를 직접 마주치게 만드는 장치의 활용은 이 영화의 공포 분위기를 다해줄 뿐만 아니라 관람객들도 단순히 놀라는 것에서 벗어나 직접 생각해 볼 수 있게 만든다는 점에서 감탄했다."
8번 출구,네티즌,10.0,게임은 인터넷으로 봤던터라 별 기대안하고 봤는데 생각보다 잘 구현해냈음.별로 일줄알았는데 사운드적인 요소와 연기미가 집중을 하게 함.
8번 출구,네티즌,9.0,짧지만 굵었다. 쉽고 이기적인 선택을 할 것인가 조금 어렵지만 용기를 낼 것인가
