제목,작성자유형,평점,리뷰
주토피아 2,네티즌,10.0,"와... 9년을 존버한 보람이 있네요. 주디랑 닉 붙어있을 때마다 입꼬리 안 내려가서 혼났습니다. 1편보다 세계관도 훨씬 넓어지고, 새로 나온 동물 친구들도 하나같이 매력 터져요! 이번 겨울엔 주토피아에 뼈 묻겠습니다. N차 관람 무조건 갑니다!"
주토피아 2,네티즌,10.0,닉이 주디 바라보는 사랑스러운 눈
주토피아 2,네티즌,10.0,누군가는 목숨까지 걸 필요는 없다고 얘기하지만 그럴만한 이유는 이세상에 차고 넘친다 그리고 그 이유는 내가 아닌 너인 경우가 더 많아야 진정한 주토피아
주토피아 2,네티즌,10.0,"진짜 기다림이 아쉽지 않았다. 닉에게 한번 더 감기는 시간, 사랑해 파트너..!"
주토피아 2,네티즌,10.0,좋다.. 너무 정말 너무너뮤 좋아요 ㅠㅠㅠ
주토피아 2,네티즌,10.0,Agree to not agree
주토피아 2,네티즌,10.0,디즈니가 이 갈고 만들었나봄 ㅋㅋ영화 한장면 한장면이 꽉 차고 디테일 장난 아님.진짜 3번 봐야 그 디테일 다 볼 듯 9년만이라 사람들 기대 엄청 올랐을텐데진짜 갠적으로 충분히 충족하고도 뛰어넘었다 생각함둘이 서사나 스토리도 완벽함.
주토피아 2,네티즌,10.0,너무너무 좋았어요 이제 3 나오는 것만 영원히 기다리구 있어요... 닉주디 관계성 너무 좋고
주토피아 2,네티즌,10.0,진짜 너무 재밌고 악당 반전이 1편보다 더 충격이여서 짜릿했고 중간중간 다른 영화의 장면이 보여서 너무 웃겼어요! 그리고 무엇보다 닉의 고백이 ㅁㅊ거 같아요....
주토피아 2,네티즌,10.0,그동한 봤던 영화중에 가장 재밌었고 닉과 주디의 콤비는 여전하고 개리의 등장으로 더 재밌고 새로운 악당도 좋고 너무 재밌습니다
주토피아 2,네티즌,10.0,재미와 감동 둘 다 있음..
주토피아 2,네티즌,10.0,"성공적인 세계관 확장, 풍부한 스토리, 주제를 벗어나지 않는 서사"
주토피아 2,네티즌,9.0,모범적인 후속작의 예시인것 같다.3편 빨리 나왔으면
주토피아 2,네티즌,10.0,홉스 앤 와일드! 서로 툭툭 속사포로 내뱉는 사랑고백은 그 어떤 사랑보다 뜨겁다
주토피아 2,네티즌,10.0,닉 주디 영원해줘 두번 보고싶은 영화
주토피아 2,네티즌,7.0,"사랑스러운 닉과 주디 그리고 "" 쥬 게더 ! """
주토피아 2,네티즌,10.0,재밌어요. 2번 봤네요. 주토피아3도 얼른 보고 싶어요.
주토피아 2,네티즌,10.0,닉은 주디를 너무 사랑해
주토피아 2,네티즌,10.0,사랑해 파트너ost 맛집…
주토피아 2,네티즌,7.0,기대가 너무 컸나… 하지만 이 대사는 기억될 듯 “사랑해. 파트너.”
주토피아 2,네티즌,10.0,믿고 보는 디즈니 주토피아2
주토피아 2,네티즌,10.0,닉주디가 사랑을 한다…
주토피아 2,네티즌,10.0,닉주디 만으로도 충분히 사랑스럽지만 관람하고 나면 작품의 메시지와 전달 역시 마음에 남을 것이다
주토피아 2,네티즌,10.0,1보다 재밌는데!! 시리즈로 2 나온 것 중에 제일 재밌음
주토피아 2,네티즌,10.0,1편도 수작이었는데 뛰어넘을 만한 작품. 더 큰 재미를 위해 1편보고 2편 관람 바람.
주토피아 2,네티즌,10.0,1보다 2가 더 재밌는 영화
주토피아 2,네티즌,10.0,기대 안하고 봤는데 올해 최고의 영화
주토피아 2,네티즌,10.0,주토피아 1보다 2가 더 재밌는듯. 진짜 너무 재밌다..
주토피아 2,네티즌,10.0,좋았슨 그냥 보셈 안보면 후회함
주토피아 2,네티즌,10.0,9년을 기다린 보람닉과주디 최고의 조합
주토피아 2,네티즌,10.0,사랑해 파트너
주토피아 2,네티즌,10.0,너무 재밌어요 3편 나와라 뿅
주토피아 2,네티즌,10.0,닉은 확실히 여우임을 알 수 있었다. 주토피아3도 나왔으면 ㅠㅠㅠ 4DX로 봤는데 더 재밌었어요
주토피아 2,네티즌,10.0,연출도 좋고 스토리도 좋고 재밌음
주토피아 2,네티즌,8.0,그러니 우린 손을 잡아야 해 저 빙하에 빠지지 않도록.
주토피아 2,네티즌,10.0,제 최애 영화가 주토피아라서 엄청 기대하고 봤는데 역시 너무 재밌었어요ㅠㅠ주디랑 닉 둘 다에 너무 이입하고 봤더니 눈물 나더라구여..둘이 행복했으면 좋겠어여ㅠㅠ
주토피아 2,네티즌,10.0,"※주의. 스포가 진짜진짜 많습니다※ 솔직히 주디 계획은 사랑하지 않으면 못한다고 생각해요, 목숨 걸었는데... 근데 닉은 끝까지 함께 하고 부서진 당근펜 주워다 고치고 합니다. 그.. 닉이 명대사가 너무 많이 적립됩습니다. ""벌써 내가 보고싶어?"", ""내가 경찰이 된건 무리에 속하려고야. 그리고 그 무리는 너야"", ""네가 세상에서 제일 소중해"", ""사랑해 파트너"" 등등(((진짜 겁나 폭스에다가 순애가 석였어요, 너무 좋아요 진짜 이대로 죽어도 된다(3 나오면 어쩌려고) 사실 닉에게 주디는 인생을 바꿔준 사람이잖아요. 진짜 절대 사랑입니다. 그리고 여기까지 보면 닉은 사랑 주디는 우정인거 같은데 쿠키 보면 ""사랑해 파트너"" 돌려봅니다. 이거는 쌍방입니다. 제가 주토피아 경찰이었으면 진짜 왜안사겨 할듯요. 여기까지 닉주디였고 영화도 새로 나온 캐릭들도 귀엽고 스토리도 진짜 재밌습니다. ost도 진짜진짜 좋아요. 진짜 인생영화 톱 3에 듭니다. 진짜 꼭 보세요."
주토피아 2,네티즌,10.0,위키드보고 삐예로 짜증난 모습 닉보고 달랜다.다음편엔 웨딩카 준비하겠지서로의 다름을 받아들이고 찐케미 폭발임
주토피아 2,네티즌,6.0,"조조영화를 보러 갔는데 중간에 깜빡 졸아서 중간내용은 모르지만, 영화 자체는 재밌음"
주토피아 2,네티즌,7.0,마지막 날림전개 너무 아쉬움
주토피아 2,네티즌,10.0,연말 최고의 영ㅎㅘ
주토피아 2,네티즌,10.0,1편을 본 나이가 2편을 보았을 때 내 나이 기준으로 딱 맞게 상황에 맞는 고민들이 녹아들어있어서 공감하기 좋았다. 1편일 땐 사회 초년생. 2편일 땐 사회에 녹아들었지만 여전히 큰 고민들이 세세하게 반영되어 있어서 스토리는 유쾌하게 흘러가는데 좀 울뻔 했음
주토피아 2,네티즌,10.0,후속작이 이렇게 재밌는 건 처음...
주토피아 2,네티즌,10.0,1편이 딸 태어날 때 같이 개봉한 영화에요.. 딸이 걸어 다닐 즈음 주토피아 1을 보고 늑대 울음 소리 흉내내면서 좋아 했었는데 이제 10살 3학년이 되어서 같이 2편 보러 극장에 다녀 왔습니다.1편 봤을 때 감동이 살아 나는 것 같았습니다. 다만 ost는 기억에 남는게 없어요. 1편 ost는 애들이 하도 따라 불렀는데. 그게 조금 아쉬워요 ^^
주토피아 2,네티즌,10.0,진짜 최고임 짱임... ㄹㅇ
주토피아 2,네티즌,10.0,너무나 예고편이 재미있을것 같다.
주토피아 2,네티즌,10.0,완전 너무 재미있었다. 강추
주토피아 2,네티즌,9.0,1보다는 그닥 재밌지는 않는 듯
주토피아 2,네티즌,10.0,주토피아에 또 경찰주제로 푸는건가 했는데 또 엄청 재밌는 스토리를 들고 귀엽고 흥미진진하게 풀어줬네요. 역시 악을 처단하려면 깨시민이 많아야 합니다. 우리나라 현 정치 상황도 다들 주의깊게 바라봐 주시길 바랍니다. 닉 주디 처럼 우리나라도 간첩세력에 이겨냈으면 합니다.
주토피아 2,네티즌,10.0,디즈니 최애커플 ! 뭔 토끼랑 여우 연애가 이렇게 재밌고 설레냐
주토피아 2,네티즌,10.0,가젤 나오고 ost zoo 나올 때 갑자기 향수자극되면서 눈물날 뻔함초등학생이었던 제가 대학생이 되어있네요…
주토피아 2,네티즌,10.0,중학생 우리딸이 사랑하는 닉!~~~ 너무 사랑스러운 영화~ 한장면 한장면 정말 소중하다. 딸이 사랑하는 닉을 사위처럼 생각하며 영화를 봤는데 왜 영화를 보며 우리딸은 우는가....ㅎㅎㅎ 그 덕에 나도 살짝 움... 너무 소중한 영화
주토피아 2,네티즌,10.0,지금 영화관에서 3번째 관람중인데 여운이 계속 남네요 너무 재밌어요
주토피아 2,네티즌,10.0,이영화 재밌어요 이영화 추천 합니다
주토피아 2,네티즌,10.0,닉주디 진짜 너무사랑해요
주토피아 2,네티즌,10.0,닉은 주디를 너무 사랑해
주토피아 2,네티즌,10.0,닉이 너무 알파메일이라서 이 세상 남자들이 남자로 안 보여요 어카죠? 너무 하.. 그냥 보세요 근데 주디가 싸가지가 좀 없어진거 같아요
주토피아 2,네티즌,4.0,Pc를 놓곤 이제 디즈니를 말할 수가 없다.
주토피아 2,네티즌,4.0,1편에서 파트너십으로 묶인건 어디가고 주디가 다시 정신나간 열혈 바보가 되었나..
주토피아 2,네티즌,6.0,30대 후반 아재가 보기엔 좀 유치합니다...
주토피아 2,네티즌,1.0,영화관에서 잣다...
주토피아 2,네티즌,10.0,진짜 잼없어 진짤루 재멊어
주토피아 2,네티즌,4.0,내가 늙은건가 뭔가 아쉽네
주토피아 2,네티즌,4.0,너무 톡톡 튀는 연출이 많아서 산만하고 자극적이라 보는 내내 머리만 아팠음. 억지 교훈에 억지 감동.. 1편만한 2편은 없는듯. 스토리 자체도 좀 유치함
주토피아 2,네티즌,6.0,개인적으로 극장에서 꼭 볼 만한 영화는 아니었고 평범했음.
주토피아 2,네티즌,2.0,1편보다 재미있을거라는 기대는 안했지만 그래도 너무 재미없었음
주토피아 2,네티즌,10.0,너무 잼게 봤어요 !!완전 내스타일 영화
주토피아 2,네티즌,10.0,와 역시 기대를 저버리지 않음 꿀잼
주토피아 2,네티즌,10.0,올해 최고의 영화
주토피아 2,네티즌,8.0,영화보고 불면증 해소했습니다
주토피아 2,네티즌,10.0,1편을 너무 좋아해서 기대하고 봤는데 진짜 대만족!
주토피아 2,네티즌,10.0,너무 재밌었어요! 세계관 확장이 완전 좋네요. 동물들 행동도 잘 반영 했어요!!
주토피아 2,네티즌,10.0,음악도 좋고 내용도 훌륭해요 꼭봐야함
주토피아 2,네티즌,10.0,사건사고가끊임없네 지루할 틈이없음
주토피아 2,네티즌,10.0,3에서 사겨라!!! 제발
주토피아 2,네티즌,10.0,주토피아3가 벌써 기대되네요 ㅎㅎ
주토피아 2,네티즌,10.0,"주디, 닉 너무 사랑스러움 ㅠ"
주토피아 2,네티즌,10.0,
주토피아 2,평론가,10.0,성능 좋은 디즈니 산소호흡기2
주토피아 2,평론가,10.0,여전히 재미있으나 좀 정신 사납다
주토피아 2,평론가,10.0,역차별에 정지한 시즌1보다 소수자의 역사를 찾는 시즌2가 더 ‘유토피아’적
주토피아 2,평론가,10.0,"포용, 이해의 태도를 겸비한 성장 서사가 반갑다"
위키드: 포 굿,실관람객,6.0,현피 뜰 때가 제일 재밌었다
위키드: 포 굿,실관람객,8.0,음...1편이 훨씬 좋았고 이번편은 뭔가...많이 아쉽고 지루했어요ㅠ
위키드: 포 굿,실관람객,7.0,감정선이 뒤죽박죽인 느낌이고 편집이 된건지 스토리 전개도 뚝뚝 끊기는 느낌 시각적인 효과와 연기는 좋았지만 아쉬움이 남는다
위키드: 포 굿,실관람객,5.0,보는 내내 막장이라서 짜증났음 짜증날 때 쯤에 감미롭게 노래 불러서 중화되고 다시 막장되고 한번 울고 끝날 때까지 개막장 스토리
위키드: 포 굿,실관람객,10.0,위키드 2는 영화를 조금 깊게 파지않거나 감정선을 이해를 못한다던지 1만 보고 아 웅장하고 재밌다만 생각하고 어느정도의 스토리를 알지못하면 지루하고 막장으로 보일수 있다 하지만 배우들의 연기에 빠져 하나하나 들여다 보면 위키드에서만 볼수있...
위키드: 포 굿,실관람객,2.0,"위키드1에서 엘파바가 특별한 피부색과 틀별한 힘을 가지고 태어나 힘든 인생을 거쳤지만, 선한 마음과 정의로운 성격+ 세상에 둘도 없는 친구 글린다를 만났고, 이 우정의 힘을 빛내 문제를 해결하는 내용으로 원작과 다르게 가길 바랬어요ㅠ 그래서 원작보다는 더 전달하는 메세지가 있고, 희망을 주길 바랬는데, 2는 행복한 사람도 없고 그냥..이럴거면 둘의 우정을 내새운 의미가 있나 싶고 다 떠나서, 1에서 피해본 동물들에게 향해지는 악행을 막고자 했는데 당한 인물들이 돌아올수도 없고..친구 엘피와 좋아했던 피에르가 죽은줄알고, 엘파바의 뜻과 마음을 혼자 굳건하게 이어가는 글린다도 딱하고, 그냥 절망만이 남은 영화같아서 정말 아쉬웠어요"
위키드: 포 굿,실관람객,1.0,피에로가 약혼녀 버리고 친구 좋다고 하고 그 친구는 또 좋다고 친구약혼남이랑 뜨밤보냄 ㅋㅋ 소박맞은 글린다가 너무 불쌍함.. 거기다 친구한테는 죽었다고 하고 약혼남이랑 도망가서 둘이 사랑하겠다고 떠남.. 갑자기 친딸이요? 막장 드라마세요? 별 1개도 주기 싫어요
위키드: 포 굿,실관람객,10.0,연기를 이렇게 잘하는지 몰랐음 ㅜㅜ 진짜 노래들도 너무 좋은데 색감이 진짜 미쳤음 지친 제 눈과 귀를 휴가보내줬어요
위키드: 포 굿,실관람객,5.0,"스토리, 개연성, 재미 모두 1편에 못미쳤고 1편은 160분였어도 지루하지 않았는데 137분인 2편은 지루했음."
위키드: 포 굿,실관람객,10.0,1년간의 긴 인터미션이라는 기다림의 시간이 충분한 가치가 있는 영화였습니다 ㅜ
위키드: 포 굿,실관람객,7.0,1편이 더 재밌었다... 디파잉 그래비티 같은 곡도 없고...
위키드: 포 굿,실관람객,10.0,평점이 1편보다 낮아서 기대를 덜 했는데 난 2편이 더 여운이 남고 좋았다 no good deed 너무 멋졌고 for good에서 눈물 줄줄.. 위덕이라면 이 이상 잘 뽑은 영화없다고 생각할듯너무 좋았다…
위키드: 포 굿,실관람객,8.0,아우! 여동생 잘못되면 언니 탓 하는거 볼때마다 빡침. 초반에 좀 지루하지만 볼만해
위키드: 포 굿,실관람객,4.0,아... 밍숭맹숭탕 먹는거같애 영화 컬러가 회피형임
위키드: 포 굿,실관람객,10.0,너무 재밌게 보고 나옴 오즈의 마법사 내용을 모르고 가면 당황스러울 수도 있을 것 같아서 대충 찾아보고 가는 걸 추천합니다. 감독님부터 배우들 모두 위키드 덕후들이라 그런지 곱씹고 찾아볼수록 더 매력있는 웰메이드 뮤지컬 영화라고 생각합니다.
위키드: 포 굿,실관람객,8.0,엘피 ㅠㅠ 다잃고 남자 얻음 글린다 사랑.우정 잃고 명예 얻음
위키드: 포 굿,실관람객,5.0,2편이 이렇게까지 아름다운 쓰레기로 흘러갈 줄은... 원하는 설정에 끼워맞추려고 모든 인물들의 캐릭터성이 파괴되는 것 같아서 납득이 가지 않았다. 특히 피예로랑 엘파바 같이 있을 때마다 머리가 멍해지고 불쾌하더라. 마지막에 너로 인하여 노래 부르면서 우정 미화해주는 건 좋았다. 그런데 결국엔 다시 피예로랑 도망이라니 글린다한테는 말도 안해주고 이게 뭐하자는 건지 모르겠다. 두 사람의 우정만 중심으로 다뤘으면 아름다웠을 텐데 피예로를 우정의 갈등소재! 허수아비로 좀 쓰겠다! 이딴 식으로 다루면서 억지로 끼우다가 총체적으로 쓰레기가 됨. 보고 나서 이렇게 기분이 이상해지는 영화는 처음이다.
위키드: 포 굿,실관람객,4.0,"곡을 제외한 서사와 드라마타이징과 설득 모두에 실패한 아쉬운 용두사미 작품인 원작 위키드 뮤지컬의 아류작 그 이상 그 이하도 아님... 위키드를 알고 위키드 팬인 사람들을 위한 헌사 포인트들은 너무 좋았는데, 공연에서의 아쉬움을 그대로 가져 올 거면 영화화 한 의미가 없지않나. 너무 불친절하고 개연성이 떨어지는데 이걸 그냥 그대로 녹여버리면.. 이래서 사람들이 너무 고이면 안좋은거같음. 뮤지컬과 영화는 대중예술인데 대중예술의 기본은 ""아무 준비 없이 가서 편안하게 보고 감동을 받을 수 있는"" 성질의 것이 기본이어야 함. 그러나 위키드를 알아야 하고 원작 오즈의 마법사를 알아야 이해가 되는 순간 이는 그런 기본성질에 위배한 것이라고 봄.부제목이자 페이즈2의 메인주제인 ""For Good""(선을 위해)이 성립이되려면 둘의 우정이 필요한데 그 우정과 성장의 모먼트들은 어디에 있었나? 관객이 채워야 할 몫이라면 이걸 극화 한 이유는 무엇인가? 번역의 아쉬움. 차라리 한국판 위키드 가사를 갖다넣지 ""No good deed"" 넘버는 듣다가 가사보고 놀라서 감동 사라짐.나머진 원작 위키드 뮤지컬이 가진 고질적인 드라마적 개연성과 핍진성의 결함이라.. 여하간 용두사미여서 너무 아쉽고 또 아쉬움."
위키드: 포 굿,실관람객,4.0,"따라가야 하는 원작 스토리라인이 있다보니 1편보다는 아쉬웠음. 전체적인 흐름이 갈등과 봉합의 반복인데, 너무 쉽게쉽게 이뤄지며 계속 반복되다보니 다소 지루하게 느껴짐. 뭔가 대단한 균열, 전투가 있을것처럼 하는데 기대했던 스케일에 미치지 못한 느낌. ost도 1편에 비해 보고나서 기억나는게 딱히 없음. 원작스토리를 모른다면 그나마 재미포인트가 있을 것 같음. 좋았던 건 화려한 오즈 세트와 의상, 동물들..."
위키드: 포 굿,실관람객,4.0,"급발진으로 뭉게버린 서사, 잘라먹은 당위성, 임팩트없이 시종일관 뜬금없고 음침하게 가라앉는다. 모든역량은 1편에 집중되고 찌꺼기만 표류한다. 백설공주를 떠오르게 하는 악몽의 데자뷔."
위키드: 포 굿,실관람객,7.0,네사가 제일 빌런이더만
위키드: 포 굿,실관람객,10.0,위키드 2 - 평점보고 망설이지 마시고 꼭 넓은 영화관 스크린으로 보세요. 사운드가 좋은 곳이면 더 좋구요!
위키드: 포 굿,실관람객,9.0,"색감이 알록달록 쨍하니 예쁨 도로시는 구두와 그림자만 나오는 게 좋은 연출이었던 것 같다 위키드는 엘파바와 글린다의 이야기라는 것 같은,,,다 보고 나니 확실한 마무리가 있어서 동화를 한 권 읽은 것 같은 개운함이 있었음!"
위키드: 포 굿,실관람객,8.0,""" 네가 선한 존재로 남기 위해서는 악역은 필요하니까 """
위키드: 포 굿,실관람객,8.0,두 마녀의 마법 같은 우정 이야기
위키드: 포 굿,실관람객,4.0,"사랑과 전쟁, 부부의 세계, 펜트하우스 그리고 친구와의 우정도 챙기고;;;"
위키드: 포 굿,실관람객,2.0,뮤지컬영화가 노래도 별로고 스토리는 k막장 아침드라마 수준이고 개지루함
위키드: 포 굿,실관람객,10.0,오즈의 마법사 이야기 알아야 재미있음 현실세계 풍자 제대로 함영상미좋음왜 7점대인지 모르것네
위키드: 포 굿,실관람객,10.0,위키드 1을 지겹도록 보고 듣고 1년을 기다려서 그런가 개연성은 별로 신경 안쓰이고 그냥 새로운 모습의 엘파바 글린다가 나온다는 것 자체로도 너무 행복하고 재밌었어요. 재관람 하고싶은 인생영화입니다 !!
위키드: 포 굿,실관람객,7.0,감동적이며 노래는 여전히 좋지만 1편에 비해 루즈한건 어쩔 수 없다
위키드: 포 굿,실관람객,10.0,"누군가에겐 아쉬울지라도 나에겐 이 영화를 보는 모든 순간이 최고의 순간이었음을장면 하나하나에 원작에 대한 존경과 사랑, 팬들과 작품에 대한 고민과 노력이 다 느껴졌습니다감사합니다"
위키드: 포 굿,실관람객,10.0,위키드 덕후로서 말하자면 원작에 비해 개ㅐ잘만든 영화라고 느꼈습니다.초반에 조금 루즈하긴 하지만 영상미가 너무 좋아요.뮤지컬 2부에서 진짜 띠용스러웠던 개연성을 열심히 커버하려고 애쓴게 보였음..위키드 1을 완전히 다 기억하지 못한다면 유튜브 요약본이라도 보는 것을 추천합니다. 오즈의 마법사 내용도 대충 알고가는게 좋아요. 유튜브 관심사 mhz 채널 영상 추천합니다(본인아님) 포굿을 훨씬 재밌게 볼 수 있을거같아요!
위키드: 포 굿,실관람객,10.0,평점에 속을뻔했다... 두번보세요
위키드: 포 굿,실관람객,6.0,1편에서 쌓아올린 서사를 날려먹은 오락가락 연출
위키드: 포 굿,실관람객,10.0,작년에 1편 3번 보고 1년 내내 OST 들으면서 기다림..ㅠㅠㅠㅠ 너무 좋아요
위키드: 포 굿,실관람객,6.0,언제 끝나나 했는데 갑자기 끝남
위키드: 포 굿,실관람객,10.0,완벽한 프리퀄. 원작에 대한 존경을 담아
위키드: 포 굿,실관람객,10.0,아름다운 뮤지컬 영화 2부작의 완벽한 마무리
위키드: 포 굿,실관람객,10.0,1에 디파잉이 있었다면 2에는 노굿디드가 있다
위키드: 포 굿,실관람객,8.0,"1편 후반에 엘파바가 부른 곡같은 감동적인 노래가 없어서 조금 아쉬웠지만, 그래도 재밌게 잘 봤습니다러닝타임이 좀 길어서 중간중간 좀 졸면서 봤어요"
위키드: 포 굿,실관람객,10.0,"뮤지컬이라는 장르 특성상 표현하기 힘들었던 개연성들을 사이사이에 잘 스며들게 해놨음. 뮤지컬 팬에게는 더할나위 없는 영화. 영화의 새로운 오리지널 곡은 개인적으로 아쉬웠지만 엘파바와 글린다의 속내를 표현해 개연성을 더했음. 특히 엘파바와 동물들의 대화, 그리고 노래로 왜 엘파바가 악역을 자처하면서까지 오즈에 머물러 선한 일을 하는지에 대해 말해줘서 좋았음. 1편에서 디파잉 그라비티가 많이 아쉬웠는데 노 굿 디드에서 사용한 연출 보고 일부러 강약을 조절했구나 싶었음. 영화에서 특히 좋았던 점은 닥터 딜라몬드와 다른 짐승들이 모두 자신의 권리와 자리를 되찾은 것을 보여준 점. 글린다가 엘파바의 유지를 이어받아 선함과 사랑으로 오즈를 바꿔나갈 미래를 더 선명히 그릴 수 있었음. 오즈의 희망찬 미래가 그려지는 것과는 반대로 모든 것을 뒤로 하고 자신의 손으로 망가트린 피에로와 함께 사랑하는 오즈를 떠날 수밖에 없었던 엘파바와 자신의 진실된 모습을 보여줄 수 있었던 가장 사랑했던 두 사람을 한꺼번에 잃게 된 글린다가 너무 안쓰럽고 아름다워 눈물이 나왔음."
위키드: 포 굿,실관람객,7.0,너무 기대했나봐요 좀 아쉽네요딱히 좋은 오스트도없고 그저그랬습니다
위키드: 포 굿,실관람객,6.0,1에서 칼 뽑아 놓고 도로 집어 넣음...
위키드: 포 굿,실관람객,10.0,F들의 파티에 초대되어 개연성따위 그냥 느낌으로 느껴버림
위키드: 포 굿,실관람객,7.0,스토리와 감정선을 따라가기가 다소 힘드네요...
위키드: 포 굿,실관람객,4.0,그들의 감정선을 따라갈 수가 없다.
위키드: 포 굿,실관람객,4.0,'오프닝 시퀀스 넘나 좋았는데...'2.0/5.0 없는 이야기를 억지러 지어낸 것이 아님에도단순한 메시지를 여러 입을 거쳐 비비 꼬아 풀어 내니어른말을 하는 어린이한테 인생설교를 들은 기분두 사람의 우정에 좀 더 집중 했다면 어쌨을까...그 와중에 엔딩은 그럴싸해서 쓸데없이 개운해
위키드: 포 굿,실관람객,7.0,돌포랑 오티는 이쁜데.. 영화는..
위키드: 포 굿,실관람객,6.0,기존의 스토리를 비튼 것은 좋았지만 다소 억지스러운 부분들이 있어서 아쉽다. 더구나 작품 특성상 가장 중요한 노래들 중 와닿는 곡들이 없었음.
위키드: 포 굿,실관람객,7.0,원래 뮤지컬도 2막은 힘 빠지는 구조라 예상은 했다만 아무리 그대로 뮤지컬을 그대로 복붙해서 단점을 고스란히 가져오는 건 좀.. 오리지널 곡들도 다 별로고 오디오 채우려고 이전 곡들 보컬만 바꿔 부르고.. 좀 많이 아쉬웠다. as long as you're mine은 기대한 것보다 훨씬 더 좋았다. 조나단 노래 개잘부른다. 쓸데없는 앞부분에 서사를 더 넣어 지루한 구간을 만들고 후반부는 뮤지컬 마냥 5G급 스킵 전개를 보여주는 등 전개 속도 엉망이라 감정 몰입이 안되어 아쉬웠다.
위키드: 포 굿,실관람객,10.0,하.... 감동 ㅠ네가 없었다면 지금의 난 내가 될수 있었을까?나도 살아 오면서 만난 좋았던 인연 싫었던 인연들이 지금의 나라는 사람을 만들게 한게아닐까?!!철학적 성찰을 하게 하는 이야기다1년 기다리길 잘했당
위키드: 포 굿,실관람객,10.0,세상을 더 좋은 모습으로 바꿀 수 있는 것은마법이 아닌 선한 마음이다.
위키드: 포 굿,실관람객,4.0,개연성이 실종됨 돈아깝다
위키드: 포 굿,실관람객,10.0,너로 인해서 나는 변했어
