제목,작성자유형,평점,리뷰
야당,실관람객,10.0,"《야당》 보고 왔어요!진심… 기대 이상으로 너무 재밌었어요?스토리가 탄탄해서 그런지 시작부터 끝까지 지루할 틈이 1도 없더라고요.전개도 빠르고, 액션은 또 얼마나 시원하게 터지는지… 몰입감 최고!강하늘, 유해진, 박해준 배우님들… 이 조합은 그냥 말이 필요 없죠.연기도 다들 너무 잘하시고, 캐릭터 간의 긴장감이 쫀쫀하게 이어져서 계속 집중하게 돼요.이 영화는 정말 영화관에서 꼭 봐야 하는 작품이에요.큰 화면에 사운드까지 제대로 받으면 감정 몰입도 확 달라요.오랜만에 이렇게 속이 뻥 뚫리는 영화 봐서 너무 만족했어요!주말에 뭐 볼지 고민 중이시라면, 이건 그냥 무조건 추천드릴게요 :)"
야당,실관람객,10.0,흥행 잘되고 있는데 더더 잘되었음 좋겠어요.
야당,실관람객,10.0,시간 가는줄 모르게 재미 있어요.
야당,실관람객,10.0,오랫만에 영화다운 영화를 본 느낌 강하늘 본인한테 딱 맞는 옷을 입고 연기한듯 자연스러워 깜놀
야당,실관람객,10.0,야당이 첨에 뭔가 했어요 이런 의미가 있다는걸 처음 알았고요 강하늘 배우님 연기 정말 잘하시네요 다른곳에서 볼때랑 또 다른 느낌이었어요 유해진 배우님과 박해준 배우님 채원빈 배우님 모두 최고였어요 주말에 뭐할까 고민하신다면 야당 영화 한번 보세요
야당,실관람객,10.0,야당이 뭔가 했더니. !! 믿고 보는 강하늘 ! 완전 짜릿늘어지지않고 속도감있는 연출에 박수!
야당,실관람객,10.0,실력파 배우들 믿고 보는 연기 짱입니다 작년부터 올해까지 본 영화 중에 ㄹㅇ 제일 긴장감있고 재밌게 봤어요 꼭 보세요 진짜....강추강추
야당,실관람객,10.0,"진짜 이렇게 시간 순삭된 영화 오랜만ㅋㅋ줄거리 미리 보고 가긴했는데 중간에 한 번도 지루할 틈 없었어요. 배우들 연기 케미도 장난 아니고, 연기 진짜 쫀쫀하게 잘하고 액션도 빵빵해서 엄마랑도 해서 다시 한 번 보러 가려고요ㅋㅋ"
야당,실관람객,10.0,강하늘 유해진 박해준 연기 최고!! 범죄액션은 역시나 실망하지 않는 영화네요?? 마약은어 야당이 있는 걸 이 영화 때문에 알았어요! 마지막 엔딩은 역시 도파민 쵝오 마약에 취한 연기는 정말 있을 것 같은 표정이라 넋 놓고 봤습니다. 영화관에서 봐야 잼나요
야당,실관람객,10.0,배우라인이 좋아서 가볍게 보러갔다가 기대이상으로 스케일이 커서 재밌었어요스토리도 탄탄하고 액션도 화려해서 볼거리가 있어요
야당,실관람객,8.0,딱 킬링타임용 그 이하 그 이상도 아님그치만 요즘 한국 영화는 킬링타임조차 안 되기에올해 본 한국 영화 중 가장 나은 것 같음
야당,실관람객,10.0,어떻게 흘러갈지 뻔하고 결말도 뻔하지만 재밌다ㅋㅋㅋㅋ
야당,실관람객,10.0,배우들 연기도 굉장히 자연스러워서 몰입이 잘 되네요 흥미롭게 풀어나가서 지루할 틈이 없었어요
야당,실관람객,8.0,2시간동안 몰입해서 볼 수 있는 꽤 괜찮은 한국영화입니다.
야당,실관람객,6.0,식상하고 뻔하고...
야당,실관람객,4.0,신선한건 야당이라는 닉네임뿐. 하나같이 전부 진부하다.
야당,실관람객,2.0,알바 그만 좀 써라 이 나쁜놈들아 그냥 K시네마 믿거다 이제
야당,실관람객,8.0,너무 뻔한데 볼만함지루할 틈 없이 볼 만한 영화
야당,실관람객,7.0,"오랜만에 한 눈 팔지 않고 엔딩을 향해 오직 진직하는 쾌감을 즐기긴 했으나, 중간중간 포장되지 않은 길의 정비가 좀 필요해 보이는 아쉬움이 계속 생각남"
야당,실관람객,10.0,이런 통쾌한 영화 진짜 오랜만이네요!통쾌 상쾌하다가 엔딩까지 유쾌!!! 범죄도시 베테랑 뻔한 시놉보다 백배 나은!
야당,실관람객,9.0,"나오는 모든 배우들 연기 참 잘하지만 감독의 연출 능력? 강약 조절이 부족한 게 느껴짐.. 모든 장면이 강강강강으로 구성하였다 하더라도 그 강함의 정도와 깊이를 조절 했어야 했는데, 연출이 강으로 가다보니 배우분들 연기 집중에 약간 힘들었음 그래도 간만에 재미있게 본 한국영화임"
야당,실관람객,9.0,이것저것 섞인 느낌이지만 볼만 합니다.특히 현실 반영이 엄청나네요.
야당,실관람객,10.0,흥미진진한 스토리 구성 다 좋았습니다
야당,실관람객,10.0,강하늘 연기 찢었다 스토리 통쾌함
야당,실관람객,10.0,내용 자체는 특별하지 않는데 깔끔하고 틈 없이 재밌어요
야당,실관람객,10.0,야당이 그 야당이 아니고 그 야당
야당,실관람객,8.0,야당법석 보러왔당 영화야당 빠져든당 강하늘 연기 잘한당 욕이 찰지당 :)
야당,네티즌,10.0,요근래 본 영화중에 제일 재밌게 봄기존 마약 영화랑 다른 느낌이라 주제도 신선했고 특히 배우들 연기 파티임누구 하나 못하는 사람이 없어서 편안한 관람 삽가능
야당,네티즌,10.0,"""검사는 대통령을 만들 수도 죽일 수도 있어""라는 대사가 가장 기억에 남네요.. 현실에 있을법한 일을 반영한 영화라 엄청 몰입하면서 봤습니다 갠적으로 요근래 영화 중에 가장 재밌었어요"
야당,네티즌,10.0,속도감 좋고 연기력 다들 대박.마약판 내부자들..올해 대작 될듯 최소500만
야당,네티즌,6.0,많이 봤던 한국 범죄영화
야당,네티즌,10.0,진짜 믿고 보는 유해진 출연 영화액션물이라 베테랑 느낌도 나고 스토리도 탄탄해서 좋았음 완전 강추
야당,네티즌,4.0,뻔한 스토리 뻔한 연출 예전에는 일년에 몇편씩 찍어내던 그저그런 영화중 하나... 하지만 요즘에는 이 정도 영화조차 없다는게 한국영화의 현실 이정도만 찍어도 박수를 받을수있는다는게 참...
야당,네티즌,7.0,알바 그만 쓰셈 그정도는 아님 솔직히 볼만은함
야당,네티즌,6.0,왜 다 봤던 장면 들었던 대사 예상되는 스토리감독이 올드한건가...신선한건 오직 제목
야당,네티즌,10.0,주연배우들 연기 합이 진짜 좋았고 끝까지 긴장을 놓을 수 없는 연기였습니다 .. 범죄액션 장르 좋아하면 완전 강추추
야당,네티즌,2.0,스토리가 너무 뻔하고 진부함 연출이 3류 영화 느낌. 검찰악마화+무능하고 힘없는 경찰+약쟁이 정치인아들. 베테랑 정도의 퀄 기대하고 가면 유치해서 못봄
야당,네티즌,6.0,평점에 당했다.. 재미없는건 아니지만 적당한 킬링타임 오락영화 수준이고.. 9점은 아니고 7점 정도 줄까 했는데 마지막 엔딩크레딧에서 6.5점으로 낮춤.와 평점알바들한테 올만에 속았네 ㅋㅋㅋㅋ 야당짓 당했네
야당,네티즌,4.0,진짜 한국사람들 이해가 안간다. 이딴 영화들 맨날 똑같은 쓰레기 영화들 진짜 재밌나??? 보고 공황장애 올뻔. 진짜 뛰쳐나가고 싶었음
야당,네티즌,4.0,"내부자들에 대한 열화적 오마주. 강하늘 = 이병헌, 유해진 = 백윤식, 박해준 = 조승우, 채원빈 = 이엘이라 보면 그럭저럭 구성은 맞춰진다. 다만, 전체적으로 스토리는 산만하다. 관객이 이해할만한 딱 그 정도 수준에서 그럭저럭 이어지지만 중요한 서사라는 연결고리..."
야당,네티즌,1.0,내부자들 부당거래 베테랑 원라인 꾼 뭐 이런영화들 다 짬뽕해서만듬 ㄹㅇ 창의성이라곤 없는거냐?
야당,네티즌,10.0,재밌어 재밌어! 너무 재밌어
야당,네티즌,2.0,한국영화 개봉하면 댓글알바들 무조건 10점 주네요.항상 똑같은 멘트..
야당,네티즌,6.0,"볼만은 했는데, 그다지 재밌거나 한 번 더 보고싶은 마음은 없었음. 이런 내용의 스토리를 가진 영화들이 너무 많아서 질리긴 함. 초반부는 볼만한데 중 후반부터 점점 눈이 가진 않음.."
야당,네티즌,5.0,잘 팔린 걸 따라만 해도 재미는 있다고 해주니 창작자의 양심은 어디 갔나
야당,네티즌,6.0,"""익숙한 음식도 어떻게 맛깔나게 만드느냐에 따라...""의 모범사례 중 하나."
야당,네티즌,10.0,시간순삭!!! 오랜만에 재미있게 보고 왔네요.
야당,네티즌,6.0,클리셰 범벅으로 얼룩진 스케치북같은 영화. 이에 더해 캐릭터와 전혀 어울리지 않는 배우들의 악다구니.
야당,네티즌,6.0,"너무 진부한 마약영화.. 오글거리는 대사와 예측가능한 연출들.. 강하늘 연기마저 어색해보인다,, 중간에 19세 장면은 필요도 없어보이는데 굳이…? 마지막 반전까지도 예상가능했음… 댓글 알바 실화임??"
야당,네티즌,2.0,감상평 주작인가요?... 스토리 중간중간 너무 유치해서 결말이 궁금하지도 않고 중간에 그냥 나가버리고싶었어요..
야당,네티즌,6.0,알바 겁나많다잉ㅋㅋㅋ
야당,네티즌,6.0,"스피디한 전개로 혼을 빼놓으나, 돌이켜보면 클리셰 범벅"
야당,네티즌,6.0,범죄영화 클리셰 끝판왕벌어질 모든 내용이 다 예측됨
야당,네티즌,2.0,영화 스토리가 진부하고 과거 비슷한 스토리 반복재생
야당,네티즌,6.0,늘 예상되는 스토리~반전 코따까리도 없음..식상함
야당,네티즌,10.0,강강강 지루할틈이 없다
야당,네티즌,4.0,스토리가...너무 별로임 여러 국내 액션 영화들 짜집기 한 듯한 내용과 예상 범위에서 벗어 나지 않는 스토리 그리고 중간중간 캐릭터들의 초반 개인 스토리가 없어 개연성이 떨어짐 아쉬운 내용들이 많다고 느낀 영화
야당,네티즌,6.0,허술하게 이어진 스토리.중간부터 진부한 스토리.졸리다.
야당,네티즌,2.0,별 반개 없냐 내당이다 내당. 내가 당했다
야당,네티즌,6.0,"6.5정도.. 내부자들과 비슷한 스토리지만 연출, 연기, 대사와 반전 등은 비교불가. 개인적으로 대사나 연출의 임팩트가 마음을 울리지는 않고, 스토리는 예측이 가능하며 각 인물의 동기나 개연성은 좀 아쉬운 느낌. 단 이건 내부자들과 비교했을 때이고, 킬링타임용으로는 지루하지 않고 좋았음."
야당,네티즌,2.0,제발?댓글알바좀쓰지맙시다?한국영화를스스로좀먹는짓이예요?댓글에속은관람객들은이제한국영화외면하게됩니다?ㅠ?어트케10점만점이?도배를할수있나요?
야당,네티즌,2.0,너무 뻔한 전개와 개연성이 없어요..
야당,네티즌,4.0,흠.배역의 부조화 빌런인 해진 흠.형사역.흠..강하늘.흠..약간의 스토리가 내부자들이랑비교를하게되는 하지만 전개가 너무 빠른듯한?누가 보여주면 볼듯..
야당,네티즌,4.0,이야.. 이걸 9점 준다고? 수준보소ㅡㅡ;;;
야당,네티즌,2.0,30만원 줘도 다신 안볼듯..
야당,네티즌,10.0,"시사회로 봤는데,이정도의 영화라면 그냥 즐기기 충분한거같아요~베테랑과 내부자들이 섞인 느낌이 납니다!추천해요~~"
야당,네티즌,4.0,진부하다.... 강하늘 / 국회의원 아들내미 연기 굿! 끝!
야당,네티즌,4.0,배우들은 호감이었으나 스토리가 너무 뻔하고 진부했다
야당,네티즌,7.0,기대를 많이 했는데 생각보다 별루스토리 전개 미약 배우들 연기는 좋음
야당,네티즌,2.0,이거 다들 평점알바 하시는건가...?
야당,네티즌,3.0,오랫만에 보는 영화라 너무 기대한 탓일까. 소재는 알고봐도 풀어나가는게 전부 진부하다 새로울게없는.. 킬링이하였음. 앞으로 대중성에는 속지않으리..
야당,네티즌,1.0,6~7점 정도의 영화인데 너무 과도하게 평점이 높아서 1점 줍니다. 중간 중간 스토리 연결이 너무 부자연스러워서 보는 내내 정신이 없었네요.. 클리셰 범벅까지야 그냥 오락 영화니까 이해하는데 이런 스토리로 9점 받는 게 이해가 되지 않네요.
야당,네티즌,5.0,오늘 보고 왔는데 생각보다 아쉬웠어요 평점이 9점대나 되는 게 신기하네요강하늘이 갇혀있는 곳에 운동기구가 있는 것도 신기하고 어떻게 풀려나서 나왔는지도 모르겠네요 코믹하게 보이는데 빵 터지는 웃음포인트는 없더라구요 (극한직업 범죄도시 베테랑이 더 재밌었어요)
야당,네티즌,1.0,영상통화만 안 했어도 3점은 줬을거예요
야당,네티즌,6.0,내용 전개 극중결말 다 좋았어요다만 극히 개인적인 생각 이지만 유해진 배우님이공조 때와 마찬가지로 생계형 형사를 하셧으면어땠을까 하는 생각이 들었어요...특유의 대사호흡 발성이 파렴치한 검사 역활을 하기엔외모적으로나 약간은 아쉬웠어요...그냥 쭈욱 많이 하시던역활만 하셔도 끝까지 잊혀지지배우 분으로 남으실것 같아요유해진 배우님을 좋아하는 팬으로 끄적였어요..
야당,네티즌,6.0,잘빠진 오락 범죄물 영화
야당,네티즌,10.0,먹어본 맛이지만 재밌었다
야당,네티즌,6.0,익숙한 장면들을 스피드로 만회하려 했지만...
야당,네티즌,2.0,"평정이 높고 예매율이 높아서 속아서 봄, 완전히 3류 영화 수준, 정치적인 의도를 갖고 만든 쓰레기 영화."
야당,네티즌,6.0,9점대 영화가 맞나 싶음..그냥저냥 흔하디 흔한 마약범죄 영화같음반전도 상상이 가고 그냥 킬링타임용으로 좋긴하지만 너무 높은 평점이 주작을 의심하게 된다.
야당,네티즌,4.0,딱 말해줄게. 내부자들 + 범죄의도시 + 배태랑 짜집기한 영화. 킬링타임 낫배드. 기대하고 볼 영화 아님.
야당,네티즌,5.0,딱 5점!후반부에는 전반부와 짜집기가 많아 지루하고 억지느낌 강해요 유해진씨는 코믹이 잘어울리는데 진지해서 뭔가 가짜느낌?!
야당,네티즌,7.0,약간.. 내부자들 오마주 느낌이 있었음. 나쁘진 않았으나 굳이 보러갈 정도는 아닌듯
야당,네티즌,1.0,뻔히 예상되는 한국영화
야당,네티즌,6.0,"전체적인 스토리는 나쁘지 않았는데, 배우들의 연기가 개인적으로는 아쉬웠습니다. 스포방지를 위해 세세하게 표현하진 않을 건데 유해진님, 강하늘님 연기가 다소 오버스럽거나 이질감이 느껴졌습니다."
야당,네티즌,5.0,꼬을대로 꼬은 꽈배기에 설탕까지 잔뜩뿌린 맛...
야당,네티즌,6.0,"킬링타임, 클리셰 향연"
야당,네티즌,1.0,"노잼입니다 재밌다길래 범죄도시 정도 기대하고 봤는데 그냥 처음부터 끝까지 불편한질질 끄는 약쟁이, 국개의원 스토리가 전부고 뻔한클리셰에 영화 한편을 보고 기억에 남는 대사 하나가 없는 영화는 정말 오랜만이네요 정말 범죄도시처럼 하하하 웃으면서넘어간 장면이 단 하나도 없었습니다 작가가 능력이 없는건지 일단 농담섞인 유머가 단 한장면도 없는데 그래도 상관없다면 보시길 솔직히 이딴 영화가 재밌다니 그런분들이 부럽네요"
야당,네티즌,1.0,우선 감동은 1도없는영화ㆍ지루하지않고 잼있음ㆍ 9점대 평점을 받을 영화는 절대 아님ㆍ딱 7.5 점 정도 킬링타이용ㆍ네이버 가라평점작업 많이 해놓은듯 ㆍ 평점좀 내려가라고 1점줌
야당,네티즌,5.0,지금 평점 말이 안됨 돈값 못함 그냥 내부자들 하위호환 느낌
야당,네티즌,2.0,명대사 명장면 하나 없는 영화다.. 킬링타임용이면 약맞는거 칼쑤시는거 바퀴벌레 장면 섹파티장면 이런거나 넣지나 말지 이도저도 아닌...
야당,네티즌,2.0,세상이 나를 속이나?..나만 잡탕찌개 먹고 나왔나?...평점에 나만 낚이는 것인가?....
야당,네티즌,6.0,그냥 흔한 한국영화임 9점대는 절대 아닌데..
야당,네티즌,4.0,그냥저냥 6점 정도로 볼 만하긴 한데 여기 대부분이 평점조작이라 2점 깎음. 스토리는 여러 이해관계가 얽혀 나름 참신하지만 허술한 부분이 많은데 왜 진작 악당 쪽에서는 1차 영상을 뺏어놓고 삭제를 안 한 건지 여자는 왜 메시지로 2차 영상을 안 보낸 건지 이해가 불가능함.
야당,네티즌,6.0,많이 봤던 스토리. 유머코드 식상. 크게 재미 없음.
야당,네티즌,6.0,아는맛... 10자이상
야당,네티즌,1.0,어디선가 본듯한 영화들의 스토리 연출 같은게 섞인느낌...스토리도 스토린데 앵간하면 내가 배우연기로 잘 안 말하는데 강하늘은 맡은 배역이 원래 그런 컨셉인거죠...?자뻑심한 중2병 캐릭터 같아요...
야당,네티즌,6.0,진부한 영화. 알바를 얼마나 썼는지 평점이 9점이 넘음.. 리뷰 잘 살펴보고 보시길..
야당,네티즌,1.0,평점에 내가 제대로 야당질 당했네…
야당,네티즌,5.0,뻔하고 재미없음 여주는 왜 죽임?
야당,네티즌,6.0,"관람평에 ㄷ천만냄새가 난다, 내부자들 마약판이다라고 해서, 기대감이 있어 용아맥에서 봤지만... 낚임.개인적으로 루즈하고, 너무 다음스토리가 예상가능했고, 통쾌하지도 않음. 주관적 감상평임."
야당,네티즌,2.0,"스토리도 그렇게 탄탄하지 않고, 연기 잘하는 배우들인데 이 영화에서는 너무 어색해요.."
야당,네티즌,4.0,폭삭 속았음. 폭삭 속을일 없다더니 ….반전에 익숙한 한국인 입맛엔 다소 밍밍한 영화밍밍함을 없애기위해 추가한 중간중간 캡사이신같은 그로테스크한 장면들은 깊이감 없이 톡톡 쏘기만했다…
야당,네티즌,6.0,평점이 좋길래 기대하고 봤는데.. 그냥 그랬음. 보는내내 영화 내부자들이 떠올랐음. 어설픈 내부자들 느낌 ㅎㅎ
야당,네티즌,6.0,...흠 그냥 ott용
야당,네티즌,4.0,강하늘 유해진 나와서 봤는데 줄거리가 진부하고 개연성도이상하고 뚝뚝 끊기는느낌에 재미가없었다 시간이 너무 안가더라평점에 낚였다
야당,네티즌,1.0,전체적으로 개연성없고 캐릭터들이 밋밋하고 전개가 뻔하고...자극적인것만 넣은느킴초반 10분까지가 젤 재밌음 스피드하게 전개되긴함
야당,네티즌,7.0,"좀 시시하달까요? 뻔한 전개와 스토리, 반전"
야당,네티즌,6.0,검사외전..배테랑.. 신세계를 모조리 짜집기 한듯
야당,네티즌,7.0,최악은 아니었지만 기대가 너무 컸던듯.. 맥주 한캔 마시면서 봐서 그런가 살짝 졸렸어요.
야당,네티즌,6.0,늘 먹던 뻔한 맛 굳이 돈내고 영화관까지 가서 볼 정도는 아니고 그냥 ott에 떳을 때 시간 때우기로 보면 딱 좋음
야당,네티즌,1.0,이게 왜이리 별점높은지 이해가 안가네요. 너무 허점이 많고 억지로 짜맞추기한 스토리인데 경쟁영화가 없어서인지 과대평가된듯 진짜 내용이 너무 허술합니다.
야당,네티즌,6.0,"이정도 평점은 아닌거같은데 왜이렇게 평점이 높은지 모르겠네요, 뻔한 클리셰가 좀 아쉽고 강하늘 연기는 잘봤네요"
야당,네티즌,2.0,이런 스토리 어설프고 유치한 영화가 9점이야? 평점 알바 쓰는구만
야당,네티즌,1.0,주연 너무 깝쳐서 비호감이스토리가 무슨 쌍팔년도 스토리. 정치검사에 건달에 대통령후보 아들에... 유해진을 저래 못쓰는감독첨이다
야당,네티즌,1.0,강하늘 - 오케이 거기까지! 하는 식의 촌스러운 유쾌한 척 연기. 유해진 - 검사인데 이렇게 냉철해보이지 않을 수가 있나 감독 - 스토리가 이렇개 허술한데도 100만을 넘다니... 진짜 경쟁작 없는게 천운. 정말 재미없어요
야당,네티즌,4.0,명장면 명대사 명연기따윈 기대하지마라.뻔한 스토리에 화가남.
야당,평론가,4.0,중개자가 날뛸 수밖에 없다는 비극
야당,평론가,4.0,묵은 양념 범벅인데도 씹는 맛이 있군
야당,평론가,4.0,그리하여 답은 검찰불신
괴수 8호: 미션 리컨,실관람객,8.0,역시 이미 다 본 장면도 영화관에서 보는건 음향의 맛이 다름. 근데 기대하고 있던 전투신이 빠진부분에 대해서는 너무 아쉽다 생각....
괴수 8호: 미션 리컨,실관람객,10.0,평범한 소년만화 뻔한 클리셰지만 익숙한 맛이여서 나쁘지않았다 애니메이션을 보지않고 봐도 무방
괴수 8호: 미션 리컨,실관람객,7.0,전형적인 구성 속에서도 향후 전개에 대한 기대감을 안기는 작품이다
괴수 8호: 미션 리컨,실관람객,10.0,"괴수를 잡으려는 자, 괴수가 되지 않게 조심하라... 하지만 이미 괴수가 되었다면?"
괴수 8호: 미션 리컨,실관람객,10.0,재미있게 보고 나왔어요
괴수 8호: 미션 리컨,실관람객,10.0,영화를 요약을 적절하게 하여 괴수8호를 처음 보는 사람들에게도 재밋게 관람이 가능한 영화였습니다.그리고 호시나 휴일이라는 영상이 캐릭터마다 매력이ㅜ넘치고 좋았어요bb
괴수 8호: 미션 리컨,실관람객,7.0,스핀오프(슴슴한 팬 서비스)*
괴수 8호: 미션 리컨,실관람객,9.0,만화도 재밌게 봐서 즐거웠어요
괴수 8호: 미션 리컨,실관람객,8.0,오티때문에 처음 접했는데 낫베드
괴수 8호: 미션 리컨,실관람객,6.0,원작 몰라도 볼만하다했더니 원작 요약편이었구나
괴수 8호: 미션 리컨,실관람객,10.0,긴 스토리를 압축시켜서 모르는 사람도 보고 재밌게 볼 수 있음.
괴수 8호: 미션 리컨,실관람객,6.0,핵심 전투를 삭제할 정도로 외전이 중요했던건지
괴수 8호: 미션 리컨,실관람객,8.0,나쁘지 않게 봤어용 킬링타임용 낫베드
괴수 8호: 미션 리컨,실관람객,8.0,그냥저냥 볼만햇어요@
괴수 8호: 미션 리컨,실관람객,6.0,애니는 처음 봤는데 나쁘진않았다
괴수 8호: 미션 리컨,실관람객,7.0,퀄리티는 복잡미묘원작 스토리도 갈 수록...
괴수 8호: 미션 리컨,실관람객,5.0,
괴수 8호: 미션 리컨,실관람객,6.0,작화는 여전히 좀 아쉽지만…
괴수 8호: 미션 리컨,실관람객,6.0,무슨 이야기인지 모르겠다.
괴수 8호: 미션 리컨,실관람객,5.0,지루하다. 재미없다. ..
괴수 8호: 미션 리컨,네티즌,10.0,1기를 재밌게 본 1인입니닷! 극장에서 볼 수 있다는 소식을 보고 당장 보고 왔어요~ 호시나 좋아하시는 분들은 꼭꼭 봐야할 것 같은 스토리네요ㅎㅎ 물론 저도 좋아해서 두배로 재밌게 즐겼습니당! 액션물이야말로 극장에서 볼 때 재미가 두배인거 아시죠.. 2기 애...
괴수 8호: 미션 리컨,네티즌,2.0,넷플릭스 내용과 동일함...
괴수 8호: 미션 리컨,네티즌,8.0,아이구 봤던 내용 나오는 거구나...실망스럽다
괴수 8호: 미션 리컨,네티즌,10.0,이미 본 건데도 극장에서 다시 보니까 감동이 과함ㅠㅠ 호시나 최애이신 분들은 이거 꼭 두번 세번 보셔야만...
괴수 8호: 미션 리컨,네티즌,10.0,2기만을 손꼽아 기다리다.. 극장판이 나왔다는 소식에 바로 달려갔다옴 ㅜㅜ... 역시나 왕 크게 보니 왕 재밌고 마냥 감탄만 하게 되... ㅜㅜ!!!
괴수 8호: 미션 리컨,네티즌,10.0,1기 안보고 봐도 충분히 재밌게 즐길 수 있었습니다! 괴수 등장할 때 나오는 고정 테마곡이 몰입감을 높여주는 것 같습니다. 그리고 엔딩 크레딧 이후에 나오는 쿠키 영상도 재밌게 잘 봤습니다~!! 빨리 2기 나왔으면 좋겠어요
괴수 8호: 미션 리컨,네티즌,10.0,잼나는 애니들 장점들을 다 모아놨네요.ㆍ 차세대 대세 애니메이션이 되지 않을까 싶네요!
괴수 8호: 미션 리컨,네티즌,10.0,액션을 극장에서 보니까 더 짜릿함 2기가 기다려진다
괴수 8호: 미션 리컨,네티즌,10.0,2기 빨리나와라... 극장에서 보니까 액션 미쳤음요 ㅋ
괴수 8호: 미션 리컨,네티즌,10.0,OST가 넘 좋구 미나 대장이 넘넘 멋있었어용!!!!ㅎㅎㅎ
괴수 8호: 미션 리컨,네티즌,4.0,ㅈㄴ 허무띠ㅜ 애니 봤으면 걍 보지 마세요^_ㅜ
괴수 8호: 미션 리컨,네티즌,6.0,"2시간 이내에 압축해야 하는 총집편의 한계, 1기를 먼저 보고 가는 것을 추천한다"
괴수 8호: 미션 리컨,네티즌,2.0,시간단축버젼바쁜사람용
괴수 8호: 미션 리컨,네티즌,10.0,괴수 8호 애니메이션은 아직 안봤는데 영화로 보니 재밌엇어요. 호시나 너무 귀여워요 큐ㅠㅠㅜㅜ 그리고 노래 invincible 너무 좋아요 원래 알고 있었지만 극장에서 들어보니 더 좋았습니다.
괴수 8호: 미션 리컨,네티즌,10.0,흥미로운 스토리와 시원한 액션이 어우러져서 재미있게 봤어요^^
괴수 8호: 미션 리컨,네티즌,9.0,역시 극장판은 너무재밌다.체인소맨 존버합니다♡♡♡♡
괴수 8호: 미션 리컨,네티즌,1.0,죠죠같은애니를 만들어야한다
괴수 8호: 미션 리컨,네티즌,10.0,역시.. 괴수8호는 정말 감동입니다.. 팝업도 다녀와야겠어요. ;)
괴수 8호: 미션 리컨,네티즌,8.0,원작만화가 개인적으로 별로였는데도 애니가 잘 나온 사례
