제목,작성자유형,평점,리뷰
로비,실관람객,5.0,"하정우식 유머로 완성된 2시간짜리 병맛 드립 블랙 코미디! 전작인 <롤러코스터>처럼 작정하고 웃기려고 찍은 것과는 달리 블랙코미디라는 장르답게 공정한 세상에 일침을 날리는 메시지가 담겼다고 느꼈다. 박장대소를 할 영화는 아니지만, 순간순간 피식거리게 만드는 드립들이 생각난다. 다만 연기를 너무 잘해서 비호감 가는 캐릭터는 유독 인상이 깊었다."
로비,실관람객,10.0,하정우 배우님이 감독인 영화네요.
로비,실관람객,10.0,아니 ㅋㅋ진짜 너무 현실같아서 더 웃프다.. 하정우식 대사 너무 내 취향..
로비,실관람객,6.0,
로비,네티즌,1.0,이제 하정우 영화는 믿고 거르는 게 나을 듯...
로비,네티즌,2.0,평점 10점준 애들은 로비 받았냐
로비,네티즌,6.0,보다가 김의성 죽이고 싶을 정도로 연기를 잘함
로비,네티즌,1.0,그냥 꽁트를 보는 듯이 영화에 100억 가까이 들어갔다는게다 개런티인가
로비,네티즌,1.0,"하정우 연거푸5개를 말아먹네...""하정우 이대로 괜찮은가"""
로비,네티즌,2.0,10점 주는 사람들 댓글 잘 보면 알바가 태반인거 같습니다.. 이거 보느니 고독한 미식가 2번보는게 훨 재밌음
로비,네티즌,1.0,손바닥으로 가려지지 않는 골격의 부실시공
로비,네티즌,1.0,하정우 배우 좋아하는데 이건아님... 처음으로 보다가 나옴 ㅠㅠㅠㅠ
로비,네티즌,1.0,골프영화냐하 ~~~~하정우 인맥 자랑하는 영화다내용도 최악이고하정우 취미로 영화 만들지 말아라
로비,네티즌,1.0,"이 배우들로 만들수있는 작품이 이정도라니 ㅋㅋㅋ 하정우는 제발 배우만 하길 바라고 국내 영화 마케팅 중 빵티, 시사회에서 바이럴하면 추첨해서 경품준다 이딴거 좀 하지마라 결국 시간지나면 까발려질 수준+속고 관람하는 피해관객들만 늘어난다. 진짜 영화..."
로비,네티즌,2.0,너무 재미없는데요...스토리도 연관성 없고.. 결말도 흐지부지
로비,네티즌,4.0,"장르가 뭔지, 하정우는 무슨 말을 하고픈지..."
로비,네티즌,1.0,정말.. 처음으로 영화보다 중간에 나가고싶었어요.. 그래도 졸린거 꾹 참고 의리상 끝까지 봤네요.. 흑 내 아까운 2시간.. 싫어하는 사람이 있다면 이 영화 추천하세요
로비,네티즌,1.0,나 강원도 인제에서 영화봤는데 로비 영화가 코미디영화라서 봤는데 더 우울했다.웃긴게 하나도 없었다.그냥 골프치는게 거의95%였고 무슨결말인지도 모르겠다.아 잠이나 잘껄..
로비,네티즌,2.0,평점에 완전 속음돈이 너무 아깝습니다.
로비,네티즌,2.0,중간에 나가는 사람도 있고 조는 사람도 있을정도로 재미가 없었음. 연출이 아쉬운 영화
로비,네티즌,1.0,현직 작가로서 수치스럽다..유명배우가 기획 감독한다는 프리미엄이 있다해도 정도껏이지.. 재밌으면 관객들이 자동으로 영화관을 다시 찾을거라는 출연배우의 인터뷰까지 있었기에 더 배신감이 밀려든다.이 제작비와 투자찬스를 놓친 다른 작품들에 사죄하길..이 영화 덕에 내 평생 골프칠 일은 없을듯..
로비,네티즌,1.0,진짜 관람평쓰는거 처음임 진짜 개재미없고 하품계속하고 진짜 돈이아까움 내가미쳐 내두시간돌려놔!!!
로비,네티즌,4.0,요리로 치자면 최고의 식재료로 개밥을 만든 느낌
로비,네티즌,1.0,평점 알바들 풀었나. 1점도 아깝다. 결말도 억지고 자다가 나왔네
로비,네티즌,1.0,오랜만에 영화관 간건데.. 리뷰 좀 미리 보고 갈 걸 그랬어요 ㅎ..별점 0은 안되나보네요
로비,네티즌,4.0,이거 별점 많이 준 사람 다 바이럴같음시간아까워요 보지마세요
로비,네티즌,1.0,댓글 알바들 로비 받았냐?
로비,네티즌,2.0,"인생 최악의 영화!! 2025.04.03 로비!! 하정우 배우의 연기를 좋아해서 기대하고 봤는데, 정말! 대박! 짱나게! 실망스러웠습니다. 개인적으로 지금까지 본 모든 영화 중 2016년 개봉작 사냥(주연 안성기, 조진웅)이 최악이었는데 이번 로비가 가볍게 기록 경신을 해주었내여! 시간과 돈이 아까웠고, 영화를 다 보고 나서 기분만 불쾌해졌습니다. 출연한 배우들은 다들 연기력도 좋고 커리어도 탄탄한데, 이런 작품으로 인해 흑역사로 남을까 안타까운 마음이 듭니다. 스토리도, 감동도, 재미도, 남는 것도 없는 로비!! 배우들 연기 중 욕설도 더럽게 느껴진 영화는 처음! 분명 영화는 봤는데 기억에 남는 건 없고 기분만 불쾌해진 영화! 하정우 배우님 감독은 이제 그~~만!! 로비 영화 안 본 눈 삽니다.!"
로비,네티즌,1.0,이건 좀.. 으아아아 내 시간...
로비,네티즌,1.0,하정우 믿었는데 배신당함!
로비,네티즌,2.0,좋은캐스팅 라인업.. 내용은 산으로 태어나서 보다가 중간에 나옴..
로비,네티즌,2.0,뭔가 지루했어요....배우님들 연기가 아까움 ㅜㅠ에휴
로비,네티즌,1.0,4월 02일 롯시에서 보고 왔는데 관객 4분 계셨고 단 한명도 웃지 않음 갑자기 10점평이 많아지는 이유가 궁금하네 전 최근들어 제일 재미없게 본 영활입니다
로비,네티즌,2.0,재밌다며..무슨 내용인지 모르겠다ㅠ
로비,네티즌,1.0,진짜개노잼임 제에발 시간아끼세요
로비,네티즌,1.0,이런 배우들을 데리고 이런 망스런 스토리에 전개는 처음이네요 ㅎㅎ연기 구멍 하나가 있었고 골프를 모르는 사람이 보면 살짝 먼소리인가 싶을겁니다 ㅎ
로비,네티즌,1.0,중간부터 졸앗고 촘촘하지 않는 느낌
로비,네티즌,1.0,이거볼빠에 그냥 프러 골프 유튜브를 보셈 개노잼 그냥 돈아까움
로비,네티즌,2.0,뭐지..? 이걸 꼭 쓰고 싶게만드는영화
로비,네티즌,2.0,PPL과 인맥으로 떡칠하고.. 골프 기업 접대 받고 만든 '로비' 영화. 김의성 이동휘 배우가 연기력을 이런 곳에 남용한다면 본인들 커리어에도 마이너스 아닐까. 이걸 걸어주는 CGV도 가증스럽다. 하정우 감독의 취미 활동은 그냥 개인 소장하고 본인 집에서 친구들과 봤으면 좋겠다.. 코로나 이후 OTT 확대와 겹치며 척박해져 가는 한국 영화 산업에 침을 뱉는 영화.
로비,네티즌,1.0,보다보다 최악의 영화.너무 심한거 아녜요?넘나 재미없어서 중간에 나가려다가 그래도 혹시해서 끝까지 봤는데시간이 너무 아까웠습니다
로비,네티즌,4.0,지루합니다...하정우대배우님 좋아하는데...아닌건아니죠
로비,네티즌,1.0,좋은 배우에 좋은 연기를 빼고 나면 아무것도 남지 않는 영화...
로비,네티즌,2.0,에휴... 배우분들 고생하셨습니다.
로비,네티즌,1.0,기대가 안된다 안봐도 본 거 같다 그냥 안땡긴다
로비,네티즌,2.0,그냥 취미로 만든 영화를 극장에 개봉한 듯...
로비,네티즌,6.0,골프장 장면이 대부분인 로비 골프 코미디. 재미는 그다지 없음
로비,네티즌,1.0,재미없어요 최근에 본거중에 제일재미없었어요
로비,네티즌,1.0,이런허접한대본연출로 영화를만든다면 전국민이 다 감독데뷔가능
로비,네티즌,4.0,오늘 바로보고옴그냥 골프 클립 두시간 보는기분ㅎㅎ.. 중간중간 재밌는 드립도 있긴한데 .. 연기력 좋은 사골 배우들로 라죽끓인듯한.. 그냥 골프 좋아하는 남친있음 같이 가주세요 좋아는 하던데 영화가 좀 정신없었어요
로비,네티즌,4.0,간만에 개노잼이에요 돈아까워요
로비,네티즌,1.0,지루해서 1시간 다 잤음 다음 주에 아마추어 볼 껄 여자친구한테 미안해서 돈 아까운 노잼 영화이다
로비,네티즌,5.0,솔직히 뭐가 웃긴지 모르겠음저는 영화 보면서 한 번도 안 웃었음생각보다 기대 이하네요영화 제작은 이 영화가 끝이길 바랍니다
로비,네티즌,1.0,노잼...절대 보지마시길 골퍼여자 연기 못함 ㅜㅜ
로비,네티즌,1.0,이 정도 했으면 감독 때려치워라. 이게 재밌냐? 주변에 조언해주는이가 하나도 없나?
로비,네티즌,1.0,대충 클레멘타인 어쩌구
로비,네티즌,1.0,"거미집의 단점만 그러모은 영화. 거미집 인물배분 너무너무 잼있어! 인생영화! 최고!! 하는 사람들한테도 추천할까 말깐데, 이것도 아닌 분들이라면 그냥 시간 아끼세요. 참고로 본인은 거미집 관람 당시 정우성이 불탈 때 ""와우 신박해 김지운감독 센스 짱! 어떻게 정우성을 불태울 생각을?! 푸핫낄낄낄낄컥컥컥-!!!"" 육성으로 호평한 너그러운 사람임에도 로비엔 이 점수 줬습니다."
로비,네티즌,1.0,하정우에게 투자하는 사람들이 ㅂㅅ인거지
로비,네티즌,1.0,내용도 하나도 모르겠고 초반 30분 정도 보다가 때려치고 나왔다 돈 버렸다
로비,네티즌,2.0,오늘 이후로 하정우씨는 감독 말고 배우만 하기로
로비,네티즌,1.0,이게 뭐임.. 걍 접대 골프 영화인줄 알았음 친구랑 보다 잠들뻔ㅋㅋㅋ
로비,네티즌,5.0,하정우 감성 모르면 나가라 해서 나옴 어디서 웃어야 할지 모르겠음
로비,네티즌,2.0,정말 이건아니다 ㅠ 시간이 아까웠어요
로비,네티즌,2.0,"전형적인 그냥 영화. / 연기못하는 그들이 등장하고, 조연이 웃음을 만들기 위해 노력하고, 이쁜 여주가 등장하고~ 뭐 그런... 결국 해피엔딩이어서, +1점 / 유명배우 제외하면, 연기 너무 심하게 어색했다는... 알바인지, 팬인지.. 과도하게 리액션해주었지만, 딱 그 몇사람만 웃은.. 무대인사 끝나니까. 반은 나간듯."
로비,네티즌,1.0,차라리 자전차왕 엄복동을 보러 가세요
로비,네티즌,1.0,배우란 연기만 하는것이다.감독을 하는건 영화에 대한 모독이다.진짜...뭘 보여주려고 만든 영화인지..노잼에다가 내용도 없고 관객에게 뭘 던져주는지도 모르겠고...보는게 너무 힘들었다...
로비,네티즌,4.0,보다가 졸다가 ....하
로비,네티즌,1.0,뻔한 영화. 로비 영화인줄 봤는데 주제는 골프
로비,네티즌,1.0,노잼.. 퍼거슨 없는 맨유가 더보기 눌러야 순위에 나오듯이 감독이 중요한 것 같다. 솔직히 불쾌한 느낌만 남음
로비,네티즌,2.0,하정우라는 네임파워 아니면이런 시나리오로 이런 배우들이 캐스팅되고 이런 연출로 투자받을 수 있었을까?정말 목숨걸고 생업으로 글쓰고 연출하는 분들 위해 그냥 소소한 취미로만 하시길.
로비,네티즌,4.0,관객수 50만명도 안나올영화
로비,네티즌,4.0,개그적요소가 너무 난잡하게 들어있는 느낌이였어요
로비,네티즌,1.0,일반인들이 잘 이해할 수 없는 용어와 주제가 많아서 별로 와닿지 않음 웃음 코드 아예 안맞음 배우들 대사도 잘 안들렸음 시간 아까웠음
로비,네티즌,1.0,어디 구독자 7명짜리 골프 TV 보는게 더 재밌음
로비,네티즌,2.0,쩝.. 노잼.. 기대 너무크게함
로비,네티즌,2.0,이 좋은 배우들을.... 하정우배우님은 그냥 배우만 하시는게 좋을듯 해요..
로비,네티즌,2.0,넘 실망헸어요 웃음 포인트도 거의 없고 티브이 킬링타임용으로도 비추 ㅠㅠ
로비,네티즌,6.0,10분짜리 이야기를 2시간으로 늘린 싱거운 영화
로비,네티즌,2.0,이 영화가 재밌다고 한다면 100% 마케팅.
로비,네티즌,2.0,최시원 최혜정 왜 나온건지 모르겠구 대사 하나도 안들림..스토리 약함 ㅠㅠ
로비,네티즌,2.0,볼만한 장면이 없다 하정우 감독 하지말길
로비,네티즌,1.0,아 이따구니깐 제목이 로비였구나....
로비,네티즌,2.0,국산영화수준 정말 왜이러냐
로비,네티즌,2.0,추석 설날때 티비로 할때 봐도되고 안봐도 되고그냥 극장에서는 패스하길 극장가서 볼 정도는 아니고 말장난도 안 웃김. 어떤 내용이 좋아서 만들었는지 궁금함. 흥행할 내용은 아님 손익 못 넘긴다
로비,네티즌,1.0,"진짜 보면 후회합니다 돈, 시간, 내 마음마저 날려버림 보지마세요"
로비,네티즌,2.0,영화 임팩트가 너무 없고요 모순이 심한거 같아요 친구가 800억에 산다고 했을때 자손심 부려서 안판다고 했으면 그 의지를 이어서 계속갔으면 모를까 골프하면서 계속 승부 조작하면서 발악 하면서 말도 안되게 자존심부리는게 현실적으로 말이안되는거 같습니다 뭔가 내용이 골프에서 골프로 끝나는 골프관심도 없는 사람이보면 실망 많이할 영화입니다 너무 아쉬운점이 많아요..
로비,네티즌,4.0,롤러코스터같은 b급 코미디 기대하고 갔는데 ...내 돈 내놔라!!!이건 뭐 웃음 포인트도 모르겠고 스토리도 진부하고 장르는 코미디야 드라마야 ?? 권선징악을 말하고 싶은거야? 하~결론은 재미 드럽게 없었다.
로비,네티즌,1.0,ㅠㅠ의리로 봤는데 실망..
로비,네티즌,2.0,하정우의 배신 감독이 하정우네 와씨
로비,네티즌,2.0,하.... 내시간 돌려줘ㅜ
로비,네티즌,2.0,김의성 좌파 ㆍ 연기자가 영화나 관심 가지지 정치연기자다보니 영화에서 보니 짜증나고 영화도 재미없음
로비,네티즌,1.0,하정우 감독은 자기 영화에는 나오지 마라
로비,네티즌,1.0,최악 리얼보다 더 최악의 영화 시간 아까움
로비,네티즌,1.0,재밌을라하는데 재미가 없음…………..
로비,네티즌,2.0,골프 로비 나름 잘 풀어낼 수 있는 소재가 아닌가? 이게 뭔지 재미도 없음
로비,네티즌,6.0,여성골퍼씬 부터 ..갸웃하다가. 설마했는데 그대로 흘러가더라..잔잔한 드라마정도
로비,네티즌,4.0,기대가 커서 그런가 휘몰아치는 말장난에 대체 어디서 웃어야할지 갸우뚱하니 영화 끝났다 극장에서 웃음 소리 한번 안나더라 배우들의 연기력이 아깝게 느껴졌다
로비,네티즌,2.0,하정우 배우님 배우로서는 정말 좋아하는데 감독은 쫌
로비,네티즌,4.0,에효... 아쉽다 아쉬워. 골프장에서 계속 최실장 비유만 맞추다 끝난다 ㅠ 내 두시간 ㅠㅠ
로비,네티즌,2.0,왜재밌다고하는지 모르겠음
로비,네티즌,1.0,구역질 나는 스토리 역겹다 진짜 최악이다
로비,네티즌,6.0,"솔직히 독립영화 수준... 배우와 배우 소통하는데 왤케 말이 빨라요?.. 대사가 제대로 안들림... bgm으로 억지로 상황을 키우는 느낌, 상황이 크지도 않은데..장면의 대부분이 골프면 너무 심한거아닌가요;; 대단한 배우들은 왜 썼는지 이해 안감..남편이 이거 왜 보자고 함 ㅠㅠ.. 저도 실망했음.."
로비,네티즌,2.0,하정우 감독은 소질이 읍네ㅋㅋ 최근3년간 최악입니다 돈아끼세요
로비,네티즌,1.0,재미 감동 슬픔 교훈 하나도 없음 이 영화를 본 시간이 너무 아까움
로비,네티즌,1.0,로비보다가 중간에 로비로 나가고싶었다..
로비,네티즌,4.0,하정우의 인맥이 총동원된 괴작 제작비 100억은 이 배우들 때문인가 롤러코스터도 피식잼 이것도 피식잼 하정우식 코미디 말장난 너무 지겹다. 공무원들과 기업들의 비리를 통한 사회 고발을 블랙 코미디로 승화한 건 좋은데 근데 이 좋은 배우들로 이도 저도 아닌 영화를 만들었네;; 그냥 OTT 가져와도 볼 영화를 왜 극장에서 걸었는지 스피드 쿠폰으로 딱 4000원 값하는 영화.. 김의성의 개저씨 연기와 이동휘의 깐족거리는 연기 강말금 배우 연기까지는 좋았지만 박병은 한국어 영어 섞어 쓰는 연기 너무 짜증 근데 강해림이라는 배우의 발견은 귀하다 롤러코스터의 고성희가 있다면 로비에는 강해림이 있었다. 마지막에 나름 사이다 장면도 있었어서 그나마 위안거리.. 하정우는 제발 잘하는 연기만 했으면 좋겠다 감독 한다고 하면 주위에서 제발 말려줘..
로비,네티즌,4.0,하정우 형님 팬입니다 일단 이영화는 골프의 룰에대해 잘모르시는분은 정말 그조그만한 개그코드도 공감하기가 어렵습니다 그냥쭉 처음그 코드로 밀고나가지 왜 중간에 갑자기 진지빨고 장르바꿔서 정말 내가등에서 식은땀이 났습니다. 롤러코스터 진짜 잼있게봤는데 실망입니다 형님
로비,네티즌,1.0,20분만에 영화관 나온 영화는 처음
로비,네티즌,6.0,이거 재밌게 봤다고 하는 사람 가까이 하지 마라... 지금 코엑스 무대인사 회차로 보고 나오는 길이다....이게 보통 배우들 무대인사보면 좀 응원해 주고 싶은 마음 생기기 마련인데 너무 심하다....알바들은 나중에 영화 보게되면 꼭 반성이라도 하길 바란다... 너네가 돈 받고 쓰는 글 몇 마디 때문에 관객들의 하루를 망칠 수 있다....
로비,네티즌,6.0,솔직히 재미는없고 스릴 없고 그냥 그저 평범했습니다
로비,네티즌,2.0,감독 하지 말고 배우만 하자
로비,네티즌,1.0,아 이게 처음부터 끝까지 개그요소가 하나도 안웃겨가지고 ..ㅠ 정색만하다 나왔어요 그리고 영화의 절반이상이 골프장에서 의미없는 대화하는 내용이라니 쫌.. 스토리도 없고 하..
로비,네티즌,1.0,재미없어요 욕하고 성희롱하고 더럽고 폭력적이고 스토리없어요
로비,네티즌,2.0,완전 최악 이딴 영화 돈 주고 보지 마세요
로비,네티즌,6.0,개인적으로는 재미있다고 느껴지지 않았음!큰 기대는 안했는데 그래도 재미가 없음 내용도 없고 그냥 어떻게든 웃길려고 노력하는 모습
로비,네티즌,1.0,재미없고 스토리 빈약하고 시간이 아까웠다. 영화이름을 난장판이라고 지었으면 이해하는데 제목도 영화와 맞지 않는다.
로비,네티즌,4.0,제작비 100억짜리 만담쇼. 만담은 술자리에서나(공통점은 결국 ‘토한다’) 만담쇼에 동원된 유일하게 빛나는 강말금 배우.
로비,네티즌,3.0,이거 뭐 재미도 없고 감동도 없고 교훈도 없고
로비,네티즌,4.0,화려한 라인업에 비해 그닥재미는~~~~
로비,네티즌,1.0,그냥 배우 보는 재미.. 시간 돈 다 아까움
로비,네티즌,4.0,그는 롤러코스터에서 멈췄어야 했다.
로비,네티즌,4.0,출연진 덕에 너무 기대한거 같네요지루했어요
로비,네티즌,2.0,좋은 배우들 데리고 스토리는 별로네요
로비,네티즌,2.0,한국 사회에서 없어져야 할 건 로비가 아니라 인맥 영화다.
로비,네티즌,5.0,보다가 영화관 로비(?)로 나왔어요..
로비,네티즌,5.0,하정우의 인맥으로 인한 과다한 배우진의 난잡한 로비식 골프
로비,네티즌,2.0,죄송해요 저랑은 안맞아요
로비,네티즌,3.0,말맛을 살렸다던데 어디가요? 나만 못 찾는건가요? 롤코보다 넘 재미도 없고 의미도 없고 아쉬웠어요
로비,네티즌,1.0,돈아까워요 하정우 진짜 감떨어졌구나를 깨달았고요 뭘 의미하고 뭘 말하고 싶은건지에대해 의구심만 넘쳤으며 보는내내 억지 코믹으로 지루해서 빨리 나오고싶어 안달이 났었습니다. 진짜 비추해요
로비,네티즌,2.0,관람평보고 어느정도는 재미있겠다 생각하고 관람했는데....영 아니네요....돈아까워서 후회했습니다...
로비,네티즌,1.0,하정우씨. 클로젯-비공식작전-1947보스턴-하이재킹-브로큰-로비 연속으로 말아먹은 작품 꼬라지보세요. 진심으로 당신 작품 볼 때마다 욕 나와요. 주연배우로서 책임감도 없이 방송에 나와서 히히덕 거리고 있고 인스타 댓글놀이나 하고 적당히 하세요 진짜..
로비,네티즌,4.0,다른 것도 별로지만최시원 박해수 혜정이세명 이야기는 왜 굳이 넣은거임?
로비,네티즌,1.0,웃음이 나왔습니다. 어떻게 이런 재미없는 영화가 있나 싶어서 헛웃음이 나왔습니다.관람객 인생 처음으로 중간에 나갈까 고민했네요.그나마 박해수 배우가 연기를 정말 잘하는건 알겠더라구요. 네.
로비,네티즌,4.0,맛 없는 양념 범벅의 소란한 야단법석.
로비,네티즌,2.0,아~~ 정말 영화 보는 내내 진심 괴로웠습니다. 이런 쓰XX 영화를 돈 주고 보고 있다니~~
로비,네티즌,2.0,영화관까지 와서 볼영화는 아닌거 같음
로비,네티즌,6.0,8점은 아닌거같다....
로비,네티즌,6.0,"딱, '롤러코스터' 직전까지..."
로비,네티즌,2.0,배우들 전부다 연기가 다 별로그냥 시간 때우는 연기돈아까워 죽겠어
로비,네티즌,2.0,저는 .잘 모르겠어요...
로비,네티즌,2.0,진심 중간 골프장 장면부터 그냥 나가고 싶었다...
로비,네티즌,1.0,"자신의 영화 특징을 말맛이라고 하겠지만, 말장난에 불과하다. 그의 영화엔 캐릭터 진정성이 느껴지지 않는다. 그냥 장난일뿐!"
로비,네티즌,2.0,하....아깝다 시간과 돈
로비,네티즌,5.0,영화가 끝나자 사람들의 짧은 탄식이 이어졌다.마치 '이게 끝이야?'라고 말하는 듯했다. ㅡㅡㅡㅡ그도 그럴 것이 나름 유명한 요리사가 온갖 훌륭한 식재료들로 잔뜩 기대감을 갖게 해놓고는 조미료를 미친 듯이 집어넣어 이상한 짬뽕 요리를 만들어놓고 이게 바로 내 스타일이라 자랑하는 영화를 내놨기 때문이다.ㅡㅡㅡㅡ 하정우는 배우와 관객 모두를'2nd 롤러코스터'에 태워놓고 제대로 즐길 시간적 여유마저 주지 않는다. OTT에 익숙해진 요즘 시대에 영화 처음부터 끝까지 자막 없이 빠른 대사처리는 피곤함을 선사할 뿐이다.마치 돌고래유괴단 CF를 1.5배 속도로 100분 넘게 본 느낌이랄까? ㅡㅡㅡㅡ 처음엔 신선함이라도 있었으나 이번엔 그마저도 없다.쟁쟁한 배우들을 포진시켜놓고 고급 블랙코메디를 표방하였지만 독립영화와 상업영화 그 어딘가에 멈춰있는 연출력에 헛웃음이 난다. ㅡㅡㅡㅡ 명배우들의 연기가 조급해보이다 못 해쫓기는 듯 보이며 감독이 히든카드로 내세운(?)엄하늘 배우의 캐릭터에서 오는 연기도100% 살리지 못 했다. 그나마 강말금 배우의 열연은 빛났다. ㅡㅡㅡㅡ 블랙코메디 영화가 '배설'이 될지 '해소'가 될지는 전적으로 연출의 몫이다.하정우는 이번에 무슨 영화를 만든건가?
로비,네티즌,1.0,돈과 내 사건이 아까워 죽긋네
로비,네티즌,6.0,내가 너무 기대하고 봤나봐..
로비,네티즌,1.0,텅빈 영화관서 할배만 재밌어하더라. 할배코드 영화
로비,네티즌,2.0,승부는 진짜 고맙겠닼 ㅋㅋ동시에 이딴 영화가 나와섴 아마 이영화 때메 승부는 관객수 더 올라갈 듯ㅋ
로비,네티즌,1.0,에바에요.. 역대영화중 휴대폰계속 만지작했던 영화ㅠㅠ
로비,네티즌,1.0,허삼관도 그랬고. 하정우는 배우만 해라. 감독은 진짜 아니다
로비,네티즌,2.0,"참., 하정우는 쓸데없는 욕심이 많다., 그냥 너 잘하는 연기만 하면 안되는거야?; 사람이 말야 다 잘할순 없거든; 영화가 너무 내용도 없구; 몰입도 안돼; 막 지들끼리 졸라 크케 지껄이고 오버하고; 극혐이구; 쓸데없이 대사가 너무 많은데; 지들끼리 막 그런걸 그냥 구경 하는 느낌?; 골프장에서만 영화 다 찍음; 여자선수가 무표정인데 젤 연기 잘하고 이쁜 느낌?; 오히려 좋은 배우들이 많이 나오는데; 활용을 잘 못하는 느낌; 산만하구; 그와중에 이동휘만 좀 그나마 괜찮구; 돈 주는데 왜 안받니? 캐디 처럼 악착 같이 받아내는게 더 현실적인거지., 무튼 개지루하구 영화적 재미는 별로.,"
로비,네티즌,1.0,평점 댓글 로비 했나봄 ㅋ왜 죄다 10점 올라옴?이정도면 대한민국이 들썩했어야 할 영화여야 …영화로써만 평가받길
로비,네티즌,2.0,자기들끼리 웃겨서 ng냈다길래... 설마설마했는데. 본인들만 웃겼던걸로.... 최시원 설정 너무 느끼해서 구역질남.
로비,네티즌,4.0,이상하다..난 재미없던데..ㅜㅜ
로비,네티즌,2.0,한국영화의 수치 너무하다 정말
로비,네티즌,4.0,롤러코스터 완전 팬이라 개봉첫날 봤는데... 마태수 좀 뜬금포고... 개연성도 좀 떨어지고... 좀 억지 웃음이고... 진프로도 스토리가 억지스럽고 연기고 쩝... 하정우 팬으로 영화가 잘됐으면 좋겠지만 일반관객 반응이 궁금하네요
로비,네티즌,2.0,한 두 개 정도는 웃긴 장면들이 있어서 쇼츠로 보면 재밌게는 보일 듯
로비,네티즌,1.0,그냥 최악.유명한배우들 데리고 이런 졸작을 만들다니..진짜돈아깝고 재미없음곧ott나올듯
로비,네티즌,5.0,진짜 재미없어요 돈아까움
로비,네티즌,1.0,아무런 재미도 감동도 의미도 없는 영화.
