제목,작성자유형,평점,리뷰
승부,실관람객,8.0,이병헌의 연기는 역시나 이번에도 돋보였다.유아인도 연기를 너무잘해 아쉬울정도주인공들의 대국을 눈앞에서 같이보고있는 느낌 우직한 이야기속에서 대담하게 이야기를 이끌어간다
승부,실관람객,8.0,사제로 만나 서로를 성장시키는 두 천재 이야기
승부,실관람객,10.0,여태 수많은 영화를 보고나면서 영화값이야기가 먼저 나왔는데 절대 영화값이야기가 안나오는 영화였음. 알게 모르게 감동과 여운이 오래가는 영화.
승부,실관람객,10.0,바둑을 잘 알지 못하지만 흥미진진해서 몰입하며 볼 수 있었습니다
승부,실관람객,7.0,바둑에 대해서 잘 모르는 사람도 두 배우의 연기와 스토리를 통해 재밌게 볼 수 있는 영화였다.
승부,실관람객,10.0,"주식트레이딩하면서 조훈현님의 <고수의생각법> 사서 읽었었는데, 이렇게 묻힐뻔한 영화가 개봉되어 기쁜맘에 개봉일 기다렸다 봤어요.주식 매매하는 마음을 다잡는데 도움이 되었습니다. 주연,조연 모두 맛깔난 연기에, 씽크로율까지! 즐거운 영화감상이었어요!"
승부,실관람객,8.0,2시간 금방가네 재밌네
승부,실관람객,10.0,연출도 좋고 연기 짱 ㅠㅠㅠㅠ
승부,실관람객,10.0,"모두의 평점, 감상평이 틀리지 않았네요... 긴장감과 편안함을 주는 감동적인 영화였습니다. 실화바탕의 시나리오가 입니다"
승부,실관람객,9.0,바둑을 몰라도 볼만한 영화였습니다
승부,실관람객,10.0,"근래들어 본 영화 중 최고, 바둑 하나도 몰라도 되고 바둑 이야기가 아니라 인물에 관한 얘기였음, 본인이 키운 제자에게 최고를 빼앗긴 인물이 그걸 어떻게 받아들이고 더 성장해 나가는지 보는 재미, 2인자 캐릭터 최고ㅠ"
승부,실관람객,10.0,올해 상반기 한국 최고 영화
승부,실관람객,10.0,최근 3년간 본 영화중에서 최고였음
승부,실관람객,10.0,배우들 연기가 너무 좋았어요. 바둑을 몰라도 전혀 상관 없어요.
승부,실관람객,10.0,승부가 재미있어요. 감사합니다.
승부,실관람객,10.0,재밌게 잘 봤습니다!!
승부,실관람객,10.0,"바둑을 몰라도 재밌을 것이라던 홍보멘트, 찐이었습니다 정말 쫄깃쫄깃 했어요!"
승부,실관람객,10.0,정말 오랜만에 재미있는 영화봤네요~
승부,실관람객,10.0,멋진 연출과 탄탄한 연기 !역시 실망시키지 않는 이병헌 !
승부,실관람객,10.0,이기고 싶으면 계속 이겨
승부,실관람객,10.0,"최고의 배우들이 보여준 실사에 가까운 연출, 단연 올해 최고의 영화."
승부,실관람객,8.0,"바둑을 알았다면 더 재미있었겠지만, 바둑을 몰라도 그 특별한 관계에서 오는 미묘한 감정과 적당히 긴장감있는 승부만으로도 괜찮았다."
승부,실관람객,10.0,프로는 이기는 것이 의무이다.
승부,실관람객,9.0,승부 오래 기다린 보람있는 영화
승부,실관람객,9.0,바둑이라 읽고 인생이라고 말한다
승부,실관람객,10.0,"최근 영화로 치면 10점입니다. 바둑을 알고보면 더 잘보이는 영화고, 모르면 연기만으로도 전달되는 긴장의 응축이 매수마다 전달됩니다."
승부,실관람객,10.0,바둑 하나도 모르고 봤는데 재밌다
승부,실관람객,9.0,영화에 나오는 모든 분들이 연기를 너무 잘해서 바둑을 모르는데 재미 있게 보고 왔어요
승부,실관람객,10.0,믿고보는배우들의열연
승부,실관람객,10.0,"치열한 수 싸움 속에 담긴 집념과 승부의 무게, 마지막 순간까지 손에 땀을 쥐게 만드는 영화. ""이 영화는, 길이 남을 명작입니다."""
승부,실관람객,9.0,"스토리 자체가 실화를 바탕으로 엄청 자극적인 소재는 아니잖아요. 그런 점에서 심심하게 느껴질 수도 있겠다 싶기도 한데 연기 보는 맛이 있었고, 영화로 만들 정도의 스토리인가 걱정은 했는데 그냥 저냥 볼만 했습니다. 영화관은 갈건데 이 영화 밖에 선택지가 없다면 보셔도 괜찮을 것 같고, 막 꼭 봐야 될 정도의 재밌는 소재는 아닐 것 같습니다. 유튜브의 조훈현9단과 이창OO단이 나오는 '승부' 다큐를 같이 보시면 좋을듯 합니다."
승부,실관람객,10.0,오랜만에 한국영화중에 제대로된 진한 연기로만 느껴지는 감동이 있습니다 꼭 가서보세요
승부,실관람객,8.0,이제 이병헌 연기는 9단을 넘어선것같음....
승부,실관람객,10.0,이병헌 배우의 연기가 실감나고 좋았습니다
승부,실관람객,8.0,이병헌은 조훈현 그자체였다.
승부,실관람객,8.0,관객들과 만나지 못할 수 있는 영화였는데 극장에서 다행이 볼 수 있었네요. OTT 창고 영화들보다 훨씬 재밋음
승부,실관람객,10.0,근래 3년 간 본 한국 영화중에 최고였음이건 그냥 극장에서 봐도 돈이 안 아까움스토리 몰입도 연기 다 최고임
승부,실관람객,10.0,연기보는맛이 있어 좋았음
승부,실관람객,10.0,바둑을 바둑답게 담은 영화
승부,실관람객,10.0,역시 이병헌이라는 말밖에 안나오는 연기력이었다
승부,실관람객,10.0,바둑돌처럼 단단해지는 그들의 여정
승부,실관람객,10.0,후속편도 만들어 주세요 이창호 이세돌으로
승부,실관람객,8.0,바둑도 연기도 막상막하의 명승부
승부,실관람객,10.0,최고의 배우들이 나와서 스토리 .연기력 탄탄
승부,실관람객,9.0,반상의 대가들이 소리없이 벌이는 처절한 전투.
승부,실관람객,8.0,두 배우의 연기가 기가 막힘
승부,실관람객,10.0,이병헌 연기에 감동받음.웹툰 <화점>이 생각났다. 좋은 작품임.
승부,실관람객,10.0,바둑이야기 인데 재밌어요.
승부,실관람객,10.0,"""바둑은 자신과의 싸움이다."""
승부,실관람객,8.0,두 주연 캐릭터의 바둑 스타일과 두 주연 배우의 연기 스타일이 비슷해서 흥미로웠습니다
승부,실관람객,8.0,솔직히 잘 만들어서 아깝다
승부,실관람객,10.0,배우님들 연기 너무 훌륭해서 바둑 모르고 봤지만 집중해서 잘 봤어요. 오랜만에 제대로된 영화 본 기분이에요
승부,실관람객,10.0,"도리 없지, 그것이 승부니까."
승부,실관람객,10.0,"바둑을 몰라서 더 깊은 공감은 못했지만, 몰라도 재밌었으니 아는 사람은 얼마나 더 재밌게 볼까?"
승부,실관람객,8.0,바둑문외한인데도 흥미진진 재미있어요
승부,실관람객,10.0,이병현 배우에 다큐 얘기를 듣고 바둑의 바도 모르는데 다큐 한편보고 참을수 없어 처음으로 본 혼영 승부! 오랜만에 영화가 끝날때까지 흥미진진 하게 봤습니다. 바둑 영화를 처음보거나 바둑을 모르는 사람이 봐도 적극 추천 할 수 있는 영화 인거 같습니다.
승부,실관람객,10.0,연기 좋아요 잘 봤습니다
승부,실관람객,8.0,영화관에서 봐야 더 재밌음
승부,실관람객,10.0,몰입감 있게 잘 봤습니다. 이슈만 없었어도 더 흥행 잘 될 것 같은데 아쉽네요.
승부,실관람객,8.0,실제 경기를 보는 듯한 두 배우의 엄청난 연기력
승부,실관람객,10.0,생각보다 더욱 재미있었던것 같아서 츄천드리겠습니더
승부,실관람객,7.0,스승과 제자의 치열한 연기 승부
승부,실관람객,10.0,일단 문화의날 개봉은 신의한수!!
승부,실관람객,8.0,두배우 포함 모두들 연기 좋았습니다
승부,실관람객,8.0,연기력으로 캐리했네요 ㅋㅋ 잘봤습니다
승부,실관람객,9.0,정말 타이트 한 연기 대결을 보는 듯 함. 스승과 제자 사이에 피할 수 없는 대결에 그 어떠한 것도 끼어들 수 없는 오직 마음만을 나눌 수 있는 멋진 승부. 승자와 패자의 정의가 무색해 짐
승부,실관람객,9.0,승부 영화 잘 만들었다.
승부,실관람객,8.0,재밌게 잘 보았습니다 !!
승부,실관람객,8.0,뭐 어떤 카타르시스라던가 유머라던가 극적인 각색이라던가 이런 부분이 적어서 영화라기보다는 어떤 재연물을 보는듯 했다. 그렇지만 시간가는 줄 모르고 보다보니 벌써 끝나있더라
승부,실관람객,9.0,영화는 괜찮은데 보는 몇몇관람객땜에 (핸드폰게임쳐하고 있는 OOO 사진찍는 미친 아색기앞자석에 신발벗고 다리올리기)영화를 충분히 즐기지 못함12세라도 보호자 없이 출입하는건 좀
승부,실관람객,8.0,무심에서 피어난 성의로 서로의 삶을 대한 흑과 백
승부,실관람객,10.0,사제이자 숙적이었던 그들의 이야기.
승부,실관람객,10.0,이건 봐야 함. 무조건 봐야 함.
승부,네티즌,10.0,유아인은 동나이대 배우론 대체불가긴하다 ㅋㅋ 이병헌은 걍 신이고
승부,네티즌,10.0,유아인은 연기는 정말 최고구나
승부,네티즌,9.0,청출어람을 바라지만 후생가외를 느끼는 복잡한 심정.
승부,네티즌,10.0,"이병헌은 연기의 신이다! 조훈현 완전 빙의, 싱크로율 쩜!간만에 극장에서 영화 같은 영화 본다."
승부,네티즌,9.0,이병헌+ 유아인한국 연신의 조합이라 의심하지 않고봣음. 바둑도 인생이다 굿굿
승부,네티즌,10.0,연기력이 곧 사람들이 영화에 빠져들게 하는 설득력이 된다는 걸 보여주는 영화..
승부,네티즌,10.0,후기연기 걍 둘다 미쳤네...
승부,네티즌,10.0,댓글악플알바 지리네 ㅋㅋ 유아인 편집없이 나왔는데 뭔 헛소리지 시사회에서 봤는데 이병헌 유아인 배우 연기 지립니다스토리도 드라마틱하면서 연출 좋음 흥해라 승부
승부,네티즌,10.0,이병헌 역시 최고야~~~
승부,네티즌,10.0,오 이병헌은 조훈현 그자체네 역시는 역시다 재미있고 몰입감 최고네요
승부,네티즌,10.0,유아인은 연기 계속 해라
승부,네티즌,10.0,촤고다 진짜 극장에서 보길잘한듯
승부,네티즌,10.0,"바둑이라곤 돌 색깔밖에 모르는데, 몰입감이 장난이 아니에요. 이병헌과 유아인의 연기가 진짜 대박입니다. 너무너무 재미있게 잘 봤어요"
승부,네티즌,10.0,"이병헌,유아인 각각 나이대 대표하는 연기의신임...ㄷㄷ"
승부,네티즌,10.0,명불허전. 연기로 깔수없는 이병헌 유아인
승부,네티즌,8.0,"유아인, 이병헌 왜 이 둘이 연기계의 정점인지 알려주는 작품. 둘의 연기가 곧 기승전결이다."
승부,네티즌,10.0,이건 그냥 대박!!! 대사 하나 하나에 몰입감 장난 아님!!!!바둑에 바짜도 모르는데도 한알 한알 둘때의 그 긴장감이 그대로 전달 되었어요~ 극장에서 보는거 무조건 강추!!!!
승부,네티즌,10.0,병헌이형 연기 죽여요유아인형도 연기 작살
승부,네티즌,10.0,진짜 너무 재미있게 봤고 유아인 오랜만에 봐서 너무 반가웠어요. 연기는 말할 것도 없이 너무 좋았습니다
승부,네티즌,10.0,그냥 조훈현 이창호 둘이 연기한줄 생긴거도 싱크로율90%임. 특히 유아인 옆모습이 그냥 이창호임.2025년 젤 잼게봤음.진짜 간만에 영화끝날때쯤 시계봤다 참고로 난 직장인이고 댓글알바따위 안함
승부,평론가,10.0,반집 승부에서 성심을 다해 신의를 지킨다는 것
승부,평론가,10.0,‘승부’의 대명사가 될 자격을 지닌 두 전설
승부,평론가,10.0,바둑돌보다 인간을 더 잘 뒀다
승부,평론가,10.0,"천재들의 승부수, 소리 없이 강하다"
승부,평론가,10.0,묘수 풀이는 없어도 시종일관 진지한 태도로 대국에 임하다
승부,평론가,10.0,연출을 넘어서는 실화의 힘
승부,평론가,10.0,팽팽히 죄고 묵묵히 자극하기
베러맨,실관람객,4.0,난잡하고 반복적인 연출이 지겨워요. 침팬지여서 이질감이 들고 몰입이 안 돼요. 나이도 가늠이 잘 안됩니다. 구분하기 쉽게 하려고 설정한 것 같은데 패착이었습니다.
베러맨,실관람객,7.0,엔딩 띵곡 들으려 2시간 감수 요망
베러맨,실관람객,9.0,신선한 음악영화였어요테이크댓 시절의 뮤지컬연출은 짜릿했습니다가족과의얘기는 눈물났어요위대한 쇼맨? 그것도봐야겠어요
베러맨,실관람객,4.0,긴 러닝타임동안 나 이렇게 힘들어 나 이렇게 잘나가 무한반복
베러맨,실관람객,6.0,왜 원숭이가..나와요 .. 내용도 지루했어요
베러맨,실관람객,7.0,"베러맨 7점 ...,,,"
베러맨,실관람객,6.0,아니 이걸 아빠를 용서해?
베러맨,실관람객,7.0,계속 기억에 남는건 아니지만 노래는 좋았고cg랑 정신없는 연출은 불호
베러맨,실관람객,10.0,슈퍼스타의 삶에 드리워진 어두운 그림자.. 근데 왜 굳이 유인원의 모습이어야 했을까?
베러맨,실관람객,6.0,모순적 감정을 가진 덜진화한 딴따라(그래도 좋다)
베러맨,실관람객,5.0,저렴하게 잘봤습니다!
베러맨,실관람객,4.0,살짝 기대했지만 노래 연출은 볼만했지만 내용은....비추천
베러맨,실관람객,10.0,로비의 노래와 생애에 대한 신선한 전개네요
베러맨,실관람객,6.0,"위대한 쇼맨 감독이 제작했다고 해서 완전 기대했는데, 굉장히 전개가 난잡해서 별로다."
베러맨,실관람객,6.0,리얼 물음표 대마왕이 되었다
베러맨,실관람객,5.0,신명나는 몽키매직..
베러맨,실관람객,6.0,Better Man2025
베러맨,실관람객,7.0,"과한 듯 세련된 영국 스타일, 그 정점인 로비 윌리엄스. 생각보다 테이크댓 시절이 많진 않았다."
베러맨,실관람객,8.0,노래가 신나고 연출 좋아요
베러맨,실관람객,10.0,"이승국님 해설보고, 관람하시는 거 추천해요~"
베러맨,네티즌,1.0,"마약쟁이의 구질구질한 자기연민을 늘어지고 지루하게. 글고, 이럴거면 아예 이 영화의 감독도 원숭이에게 맡기지 그랬나... 장점이라곤 눈을 씻고 봐도 안 보이는 졸작."
베러맨,네티즌,6.0,마지막 10분를 위한 2시간....솔직히 마약쟁이의 구질구질함이 이때쯤엔 해소해줘야지? 싶은데도 해소되지 않는 답답함으로인해 지쳐가다가 단 10분만에 빠르게 모든게 해결되는 것을보고 허무함도 들었지만 노래나 연출 등은 충분히 봐줄만 했기에 6점은 줄만함.
베러맨,네티즌,2.0,시간아깝고 재미도 없다.
베러맨,네티즌,6.0,허물을 벗어 진화로 거듭났다는 로비의 거만한듯한 자화자찬 빅쇼
베러맨,네티즌,4.0,자기 잘난 맛에 인생 막 산 아이돌이 종교로 인생세탁 성공한거 본 느낌이라 기분나빠요.
베러맨,네티즌,8.0,침팬지가 아니었더라면 더 좋았을것 같고구간 스킵도 연출이 이해하기 쉽지 않고우울감과 자기자신을 사랑하며 극복해나가는듯함뭐랄까 노래빼곤 애매하네요
베러맨,네티즌,7.0,로비 윌리엄스나 테이크뎃을 알았더라면 아쉬움에 익숙치 않은 인물이라 공감이 부족했으나 많은부분 공을 들인영화로 중반까지 약쟁이의 칭얼거림을 가족애 충만한 영화로 전환하는데 성공... 아마 몽키는 열등과 조롱의 대상인 자아의 케릭터를 표현하기위한 ...
베러맨,네티즌,6.0,개봉한 날 보고왔는데 한마디로 하자면 지루해요 중간에 나갈까 생각했는데 끝까지 본 게 대단하네요계속 쓸데없는 섹드립이나 치고….기억에 남는OST가 있다면 예고편에 나오는 노래정도??그리고 주인공을 왜 침팬치로 했는지 잘 모르겠어요CG티나고..
베러맨,네티즌,7.0,GPT! 로비윌리엄스 영화 만들어줘.혹성탈출 다중인격 버젼으로.
베러맨,네티즌,8.0,자본이 지배하는 시대에 음악과 춤이 무슨 필요 있냐는 질문에 대한 한 인간의 답가
베러맨,네티즌,8.0,로비 윌리엄스 역할은 사람이 했어야 했다 생각하면 추천! 원숭이가 해서 더 좋았다 생각하면 비추!
베러맨,네티즌,2.0,... 인간 엄마 아빠가 침팬지를 낳은거야?? 시작부터 현타 옴
베러맨,네티즌,6.0,노래랑 완성도는 좋은데 너무 정신없고 중간에 졸았음.. 원숭이를 굳이 넣었어야 하는 생각이 보는 내내 들었을정도로 불쾌한 골짜기였음
베러맨,네티즌,8.0,"내가 로비였음 아빠 용서 못하고,니콜이었으면 로비 용서 못함"
베러맨,네티즌,6.0,자기 자아와싸움 재미있게 봤습니다중간부분에서 조금 지루함 노래 연출 너무 좋았습니다
베러맨,네티즌,9.0,"위대한쇼맨을 인생영화로 고를 만큼 좋아해서 믿고 봤습니다. 원숭이가 처음에 불호였는데, 점점 녹아들어 멋져보이기까지 하더라구요. 로비 윌리엄스 모르는 9n년생인데도 재미있게 잘 봤어요. 초반은 위대한쇼맨과 연출이 비슷하다는, 감독이 한 인간의 흥망성쇠를 다루는 스타일이라는 생각이 들었습니다. 할머니와의 장면은 눈물났어요. 표값이 아깝지 않은 영화인데, 누구를 끌고 가서 보거나 N차로 관람할 정도는 아닌 것 같습니다. 확 끌리는 노래도 없어서 아쉽습니다. 그렇지만 매우 잘 봤어요."
베러맨,네티즌,8.0,있는 그대로의 나 자신을 사랑하는 것부터가 시작
베러맨,네티즌,10.0,음악과 연출이 너무 좋아요 이 침팬지가 날 울려 ㅠㅠ
베러맨,네티즌,10.0,상반기 영화 중 최고였어요!!!
베러맨,네티즌,10.0,추천합니다 재미썽오 로비
베러맨,평론가,10.0,"‘혹성 가왕’에 당혹, 감탄, 부담"
베러맨,평론가,10.0,아는 만큼 가면의 자서전: 지금 그 사람 이름은 잊을 뻔했지만
베러맨,평론가,10.0,"혐오와 도취, 자존감과 자존심이 부싯돌이 돼 타오른 아이콘"
베러맨,평론가,10.0,구차한 자기 연민마저 로비답게 섹시하고 쿨하다
미스터 로봇,실관람객,10.0,기대 1도 없이 봐서 그런가 이 영화 진짜 개고퀄임. 만12세 이상 관람가던데 솔직히 수위는 청불급인듯. 배급사야 홍보 좀 해라 개고퀄 영화 사람들한테 외면받는거 가슴 아프다
미스터 로봇,실관람객,8.0,감독님 다음작도 기대합니다
미스터 로봇,실관람객,10.0,12세 이용가는 아니고 15세 이용가로 하지 아이들이 혹시 보다가 놀라는건 아닐지 정말 재미있게 잘봤습니다 미스터 로봇 화이팅
미스터 로봇,실관람객,10.0,한국판 월E생각하고 봤는데 그게 아니었네 ㅋㅋㅋ근데 진짜 잘만들었음. 디자인도 그렇고 성우분들 연기도 그렇고 엄청 만족함.결말도 다음이야기를 대비한거 같은데 꼭 대박나서 다음편까지 봤으면 좋겠음
미스터 로봇,실관람객,7.0,3D모델링이 애기들 전용 애니메이션 느낌이 물씬 나서 초반부엔 역시 괜히 보러왔나 싶었는데 주인공 로봇 나오고부터는 정말 재밌게 본거 같습니다. 연출도 12세 이용가 답지 않게 화려했고 중간에 좀 잔인한 연출들이 약간 있어서 12세가 보기엔 좀 무서...
미스터 로봇,실관람객,7.0,액션신 좋고 볼만한데 이거 왜이리 잔인한가요..최소 15세 같은데
미스터 로봇,실관람객,10.0,보다가 로봇이 으스러지고 기름튀는 연출이 있어서 애기들이 보기에는 무서울 수도 있겠네요ㅠㅠ
미스터 로봇,실관람객,7.0,"혹시 스토리 작가님과 연출감독님 끼리 제대로 협의가 되지 않은 채로 영화를 만드신건가요? 스토리는 누가봐도 어린아이들을 대상으로 한 k신파가 버무려진 단순한 이야기인데 또 장면 하나하나는 피튀기고 심장 뜯고 괴성지르는 잔인한 장면들이 많았습니다 자칫 어린아이들이 로봇 나오는 애니메이션 영화라고 무심코 봤다가 트라우마 생겨 나갈까 걱정일 정도였습니다 (실제로 제 좌석 앞에 부모랑 같이 보던 아이는 반 이상을 못보고 엄마 품에 기대고 있더군요..) 영화 자체는 한국 애니메이션 영화가 이 정도로 발전했구나 싶을 정도로 퀄리티나 촬영구도 성우분들의 연기력 등 기술적인 측면에서는 감탄이 나올 정도로 좋았는데 반면에 스토리는 개연성이 많이 부족하고, 심지어 질질짜다가 피튀기고 또 하하호호 하다가 심장뜯기고 이런 식의 반복이라 이거 타켓층을 어린아이로 하겠다는 건지 아님 어른들을 대상으로 하겠다는 건지 이해가 잘 안가는 영화였습니다..한줄 요약:한국 애니메이션 기술의 발전 good, 하지만 그외는 글쎄..."
미스터 로봇,실관람객,8.0,문명의 발달로 차가워진 세상에서 가장 소중하고 필요한것을 깨닫게 해주는 작품입니다
미스터 로봇,실관람객,10.0,제목이 유치하다고 생각하며 보았는데 생각보다 영상이나 스토리가 좋았고 마지막에 나오는 OST 가 너무 좋았어요^^
미스터 로봇,실관람객,8.0,한국 애니메이션계의 빛나는 쾌거!
미스터 로봇,실관람객,10.0,유아용으로 만들도록 노력한 성인용 영화과하지 않고 여운남게 봤습니다
미스터 로봇,실관람객,6.0,로봇이긴해도 부셔지는 장면은 조금 잔인하네요그외 한국 애니매이션이 꽤 발전한걸 볼 수 있어서 나쁘진않았습나다
미스터 로봇,실관람객,10.0,재미있ㅇㅓ요 감사합니다.
미스터 로봇,실관람객,10.0,"SF 재구성 내공, 어른 만화의 성취"
미스터 로봇,실관람객,10.0,우리나라 애니가 점점 발전하는가 같아요.
미스터 로봇,실관람객,8.0,아이들이 보기엔 좀 수위가 센것 같습니다. 내용은 아쉽지만 액션신 그래픽은 좋았다고 생각합니다. 한국애니영화가 발전되는게 보이네요
미스터 로봇,실관람객,8.0,"액션과 영상미가 꽤 좋았습니다. 스토리나 대사, 편집은 좀 아쉬웠구요.. 슬로 모션같은 것도 너무 과하게 많이 사용된게 아닌지.. 꽤나 잔인해서 타겟 연령대가 높은 작품인데 캐릭터들 대사나 모션은 또 어린 관객들을 고려한 것 같고.. 그 부분이 좀 언밸런스한데. 그래도 전작 <스트레스 제로>에 비하면 굉장히 많이 발전된 모습이라고 생각합니다."
미스터 로봇,실관람객,10.0,생각보다 재밌어요. 기대도 하지않고 봤는데 눈물 날뻔했음. 터미네이터2 보는 스릴과 긴장감도 있고 나나 귀여워요. 감동이 있습니다 잘봤어요. 감독님 다음 직품 더 기대됩니다
미스터 로봇,실관람객,6.0,개인적으로 퇴마록보다 자연스럽고 좋았어요. 연출이 좋아서 만족스러워요.
미스터 로봇,실관람객,7.0,2055년 좀 잔혹한 대체 가족 이야기
미스터 로봇,실관람객,7.0,굿.굿.굿.굿.굿.
미스터 로봇,실관람객,6.0,생각보다 무난하게 만들어진 이야기.
미스터 로봇,실관람객,10.0,감독님 너무 잘봤어요. 다음작품도 기대할께요.
미스터 로봇,실관람객,10.0,"생각보다 훨씬 깊이 있는 이야기와 감정선에 놀랐어요. 한국 3D 애니메이션이라 해서 가볍게 볼 줄 알았는데, '미스터 로봇'은 그런 예상을 완전히 뒤집었어요. 아이를 잃고 고독하게 살아가던 남자 주인공이 한 아이를 만나면서 부성애를 회복해가는 이야기인데, 그 과정이 정말 뭉클하고 따뜻했어요. 저도 친구랑 같이 봤는데, 둘 다 눈시울이 뜨거워졌던 장면들이 몇 있었어요. 연령 등급은 낮지만, 생각보다 자극적인 장면도 몇 있었고 감정선이 진해서 아이들보다는 어른들이 더 공감할 수 있는 영화 같았어요. 몰입감도 뛰어나고 연출도 훌륭해서 시간 가는 줄 모르고 봤네요. 많은 분들이 이 영화의 감동을 느꼈으면 좋겠어요. 정말 추천합니다."
미스터 로봇,실관람객,9.0,"스토리가 살짝 아쉬운 부분이 있기는 하지만, 그림체가 아주 훌륭한 멋진 작품이네요^^"
미스터 로봇,실관람객,4.0,2025.04.04.
미스터 로봇,실관람객,5.0,부모들이 아이들 눈가리기 급급최소연령 설정 잘못된거같아요
미스터 로봇,실관람객,4.0,영상미 말고는 크게 볼 건 없는 것 같아요 ㅠ
미스터 로봇,실관람객,8.0,이영화는 12세가 아니고 15세 입니다 12세인줄 알고 너무 깜짝놀랐습니다 그런데 칭찬해 줄거리는 배경음악밖ost밖에 없음 특히 윤석열 김건희 같은 영화
