제목,작성자유형,평점,리뷰
신명,실관람객,10.0,현 사회를 이해하기 위한 꼭 봐야 할 영화입니다.
신명,실관람객,10.0,충격 그 자체. 대한민국 국민이라 느낄수 있는 우리만의 정서이면서 감동. 일반인들의 후원으로 제작되어서 더 큰 의미가 있었습니다.
신명,실관람객,8.0,김규리 배우님 열연하신 영화 잘 봤습니다.앞으로도 다양한 작품으로 명연기 만났으면 좋겠습니다
신명,실관람객,10.0,배우들이 원본들을 씹어 삼켰습니다....진짜 관련 사건이나 인물들을 알면 아! 저...저거! 할 포인트가 많아요.아무튼 사악한 술수로 남을 해치려고 하는 자는 벌을 받는다는 것을 알려주는 오컬트 정치 스릴러 신명...꼭 보세요!
신명,실관람객,10.0,김규리님의 연기력에 감탄했습니다영화가 꼭 흥행하였으면 좋겠습니다.
신명,실관람객,10.0,스토리의 전개가 빠르고 집중도가 높은 다큐를 보고 나온 느낌아었다
신명,실관람객,10.0,실화기반이라 소름임연기 잘해서 재미남마지막 쿠키는 감동 박수나옴천만 갔으면
신명,네티즌,10.0,꼭 한번씩 아니 세번씩 보세요.
신명,네티즌,10.0,진실의 빛을 찾아가다 보면~
신명,네티즌,10.0,"충격적이었습니다. 그 짧은 시간에 이정도 작품을 만들어내다니, 놀랍습니다. 오컬트의 맛을 봤네요. 파묘2의 느낌입니다. 끝날때까지, 한시도 쉴틈을 안주네요. 김규리배우의 인생연기에 찬사를 보냅니다."
신명,네티즌,10.0,가짜인듯 진짜같은 모든것이 다 밝혀져야 할 것입니다!
신명,네티즌,10.0,검은 빛을 뿜어내는 쥬얼리..소름끼치게 무서운 그들을 막아낸 대한민국 국민여러분 사랑합니다.
신명,네티즌,10.0,감동실화 전국민이 봐야함
신명,네티즌,10.0,윤거니정권의 민낯을 집요하게 탐사취재 해왔던 열린공감tv의 자료를 바탕으로 만들었기에 정말 놀라운 이야기가 연속적으로 이어집니다. 좀 단순화하면 더 집중되지 않았을까 생각도했지만 전체적인 만듦새 나쁘지않았고 충분한 가치있는 영화였습니다. 힘든 상...
신명,네티즌,10.0,대한민국국민이라면 꼭 알아야 하는 내용
신명,네티즌,10.0,좀 무서움... ㄷㄷㄷ
신명,네티즌,10.0,내란 세력 청산하고 특검 가자~~!!
신명,네티즌,10.0,흥행돌풍을 예상해봅니다
신명,네티즌,10.0,우와 말이 안 나온다!! 진짜인가?”이거야 이거야 이거야 이거야ㅠㅠ진짜야. 나 방금 보고 나왔는데… 아직도 숨을 못 쉬겠음. 말이 안 나와.”“진짜 영화였음.”영화 끝나면 바로 퇴장하지마시고 마지막 영상까지 꼭 보고가시길
신명,네티즌,10.0,김건희 니도 보고 있나?
신명,네티즌,10.0,한국 사람이라면 꼭 봐야 할 영화 특히 마지막 쿠키영상 레전드입니다
신명,네티즌,10.0,보고 싶어 미치겠다 빨리 귀국해서 봐야지
신명,네티즌,10.0,천하의 벌받을 것들. 1000만 가자
신명,네티즌,10.0,시사회를 봤는데 모두 매진이었으며 관객층은 정말 다양했다 저예산 영화임에도 현실을 그대로 옮겨 만들었고 실존 인물들을 묘사했기 떄문에 몰입도가 아주 높다 물론 한푼 두푼씩 사람들이 모아 만든 저예산 영화이기에 많은 것들을 함축적으로 담기에는 부족하며 전개가 매끄럽지 않고 디테일 역시 부족한 점은 어쩔 수 없다 쿠키 영상에 배우 안내상의 인사 영상에 울컥 했고 모든 관객들은 박수를 쳤다내가 가진 투표 한장이 얼마나 중요한 것인지 다시한번 뼈저리게 느끼게 해주는 명작이다
신명,네티즌,10.0,내란종식 상기시키는 스토리 꼭봐야될 영화
신명,네티즌,10.0,흥행 대박 한번만 보지말고 두번 보고 세번보고 꼭 보세요
신명,네티즌,10.0,너무나 현실적이면서도 비현실적인 얘기를 잘 풀어갔음. 마지막 장면과 같은 그들에 대한 엔딩이 현실에서도 꼭 이루어지길 바람
신명,평론가,10.0,"천박한 욕망, 조악한 묘사"
신명,평론가,10.0,참사에 대한 몰윤리는 광장에 대한 모욕이다
