제목,작성자유형,평점,리뷰
메소드연기,네티즌,2.0,러닝타임이 90분인데도 지루했습니다웃음포인트 너무 뻔했고 감동이 억지스러웠고 제목의 의미로 마무리는 메소드연기로 끝난 이 영화를 보는 내내 이들이 표현하고 싶었던 것이 과연 뭘까… 뭘 표현하고 싶었던 걸까 내가 뭘 놓쳤기에 이 영화의 본질조차 이해거 안될까 라는 생각에 내내 의아했고 지금까지도 궁금한 작품이네요.다른 분들의 평을 보며 느껴보겠습니다.
메소드연기,네티즌,2.0,이게 코믹인지 새드인지...갈피 못잡는 대본과 윤경호씨만 웃기고결말도 뚱딴지 같고 진짜 헛웃음치며 나온 최악..저는 올해 첫 영화로 이걸보고 올해 영화를 접었습니다.
메소드연기,네티즌,10.0,상영관 너무 없네... 배급사가 파워가 작은건가요 너무 아쉽
메소드연기,네티즌,10.0,이동휘 배우 이름 세글자 믿고 보는 영화
메소드연기,네티즌,10.0,"메소드연기 재미와 감동을 담은 영화에요!이동휘님 연기가 너무 좋았고, 윤경호님도 너무 좋았어요! 잘 되었으면 좋겠네요!"
메소드연기,네티즌,10.0,이동휘 배우에게 류승범 배우가 보인다알계인 개봉을 기다려본다
메소드연기,네티즌,10.0,삶을 살아가는 모두의 이야기는 메소드 연기이다
메소드연기,네티즌,10.0,게레락걍개게겍ㄱㄱ꺄꾝꾝굑교고꼭ㄲ고으를르를꼬를ㄹㄹㄱ껅ㄱㄱ꼭꼬똑고꼳꼬고ㅗㅗ르ㅡ르를!!!!이동휘 연기 너무 잘한다는 뜻
메소드연기,네티즌,10.0,이동휘씨 연기가최고네요
메소드연기,네티즌,10.0,현실과 허구의 세계를 교묘하게 줄다리기 하면서 관객들을 착각의 늪에 빠지게 하는 매력적인 영화. 코미디 장르? 웃기기는 하지만 의외로 삶의 태도를 진중하게 고민하게 만드는 가볍지 않은 영화입니다. (김금순 배우님 화이팅)
메소드연기,네티즌,10.0,초등생과 봐도 괜찮을지요?
메소드연기,네티즌,10.0,처음엔 그저 코믹영화라 생각 하고 가벼운 마음으로 관람 하다가 마지막에 눈물을 흘리게 하는 영화
메소드연기,네티즌,1.0,제 스타일은 아니었습니다 ..
메소드연기,네티즌,10.0,이 영화를 보고 기립박수를 쳤습니다..이걸 보기위해 태어난게 아닌가 싶기도 하네요
메소드연기,네티즌,10.0,한국 코미디 영화를 찾는 다면 그건 바로 “메소드연기”배꼽찾다 보니 어느새 눈가에 눈물이 고여있었습니다재미와 감동의 울림이 공존하는 영화
메소드연기,네티즌,10.0,코메디인줄 알았는데 보고나니 감동... 인생영화 각 .. ㅜㅜ
메소드연기,네티즌,10.0,"이동휘 배우님,,,,500만 넘어서면 거제도 한달 살기 해주세요!!!!"
메소드연기,네티즌,2.0,어디에서 웃어야 하는지 포인트도 모르겠고 초반에 발음이 뭉게져서 대사가 잘 안들리기도 함. 약간 억지스러운 전개와 뻔한 스토리 뇌를 비우고 가볍게 보려해도 마지막에 가서는 빨리감기를 하고싶었다.
메소드연기,네티즌,10.0,배우들 연기가 감동적이예요 보는내내 울컥했어요
메소드연기,네티즌,10.0,귀 = 제 커리어.. 잘 봤습니다!
메소드연기,네티즌,1.0,태어나서 제일 시간 아깝게 본 영화 만든 저의가 뭐야? 감독이 뭐하는 사람인지 까지 찾아 봄 .
메소드연기,네티즌,1.0,뭐를 말하고 싶은거야??
메소드연기,네티즌,4.0,음.. 영화중간에 3번정도 집에갈뻔했습니다..
메소드연기,네티즌,1.0,1점도아깝다. .윤경호믿고 봤는데. . 이건.내가만들어도 이보다는 더 잘 만들겠다ㅜㅜ나는솔로가 더 잼있다
메소드연기,네티즌,5.0,재미는 없지만 배우들이 노력한게 보이긴해서 5점
메소드연기,네티즌,2.0,로베르토 로드리게스가 자신의 엘 마리아치를 데스페라도로 다시 감독해왔듯 아마 감독 본인의 독립영화를 메이저 영화로 재구성해서 한번 더 갈 생각이었는 모양인데 그 영화와 제목만 같을뿐 전혀 다른 영화임...감독이나 배우가 가장 저지르기 쉬운 실수가 영화판이나 드라마판을 작품 소재로 보여주는거지(웃음)재밌을것 같지만 제작현장은 전혀 재미없다.인간바퀴벌레야...일을 좀 해라...비공감을 쳐눌러야지...비공감을 누르는 너는 앞으로 되는 일이 하나도 없고 죽을때도 비참하게 너홀로 죽으리라
메소드연기,네티즌,1.0,돈날림.... 시간날림... 다 안보고 중간에 나온 영화는 첨임
메소드연기,네티즌,7.0,"이동휘의 연기 차력쇼라지만, 코믹물은 전혀 아니고, 드라마라 하기에도 가족영화라 하기에도 애매했음."
메소드연기,네티즌,1.0,그냥 홍보영상이 다인 영화
메소드연기,네티즌,1.0,평점 10점 뭐지???
메소드연기,네티즌,5.0,"이동휘,윤경호 배우님 평소 좋아하고 포스터가 코미디 같아서 호기심에 한번 예매하고 봤습니다. 딱 한번 미소지었네요. 그것도 썩쏘. 그냥 돈아까운 영화입니다."
메소드연기,네티즌,1.0,"이동휘가 아티스트병 걸려서 본인이 하정우 인줄 알고 만든 재활용도 안되는 쓰레기.이런 본인 만족용 영상물은 본인 개인 소장용으로 사비 들여서 만들어야지, 투자자 돈받고 만들 생각하지 마라 정말로...한국영화계를 최소 10보 이상 후퇴시킨 영화라 부르기도 민망할 수준임. 이거 10점 주고 재밌다는 애들은 죄다 배급사 쪽 마케팅 인력이거나 이동휘 지인임.진심으로...인생 살면서 봤던 영화 중 최악의 영화로 내가 돈 받고도 안 볼 수준의 영화."
메소드연기,네티즌,10.0,나만 당할수는 없지~~개꿀잼 돈 시간 많은분들 보세요
메소드연기,네티즌,1.0,10점 평을 받을만한 영화도 평점 몇 개 없는데 10점 평점비중이 이렇게 많을 수 없겠다 사기를 칠거면 안들키게해라
메소드연기,네티즌,1.0,관람평에 봇이 얼마나 많은지 보여주는 영화
메소드연기,네티즌,1.0,다른영화는 개봉하면 1점이 꼭 아침마다 달리는데 왜 바이포엠 영화에는 1점이 안달릴까? 그래서 달어봅니다
메소드연기,네티즌,1.0,쩝... 예고편보고 재밌을 것 같았는데.. 배우들은 좋은데 영화 자체가 별로.. 내용도 그렇구.. 초반부터 노잼이였음.. 너무 루즈했던 영화..
메소드연기,네티즌,6.0,곧 평점 6점대로 떨어질 영화
메소드연기,네티즌,1.0,진짜 세상 재미없네요코미디도 아니고 뭐도아님
메소드연기,네티즌,2.0,솔직하게 독립영화 였으면 나쁘지 않았는데굳이 이걸 상업영화로..그냥 개인기 쇼 하는 듯연출 없고…
메소드연기,네티즌,1.0,휴 이딴영화를 보다니 진짜 분노가 치민다
메소드연기,네티즌,1.0,별로 웃기지도 않은데 웃어달라고 오바영화가 아직도 있구나싶었다 전개도 늘어지고.. 보다 나왔다 간만에
메소드연기,네티즌,1.0,역시 초반 평점 알바들이 설치는군.이게 재미 있다고?내 시간 돌려줘.
프로젝트 헤일메리,네티즌,10.0,"모든게 완벽한 영화연출, 영상미, 연기, 음악 다 좋았음책을 안보고 영화를 봐서 더 좋았던 것 같음"
프로젝트 헤일메리,네티즌,10.0,단종빠돌이들 별점테러할거같으면 개추 로튼토마토 95%가 1점이란다ㅋㅋㅋ 저능하네 진짜ㅋㅋㅋ왕사남은 이 영화에 발톱 때만큼도 못한 영화입니다
프로젝트 헤일메리,네티즌,8.0,인류애를 넘어선 범존재론적 우주애.
프로젝트 헤일메리,네티즌,10.0,좋음! 좋음! 좋음! 왜 안봄. 질문?
프로젝트 헤일메리,네티즌,10.0,모든 것이 끝나고 어디로 가야할지 알 수 없을 때 너를 만났지
프로젝트 헤일메리,네티즌,10.0,나를 모르는 40억 명을 위한 희생은 한발작도 내딛기 어렵지만 내가 마음을 연 한 생명을 위해서는 목숨도 아깝지 않을 수 있다는 것
프로젝트 헤일메리,네티즌,9.0,"""더 문"" 관계자들 보고있나. SF는 이렇게 만드는거다."
프로젝트 헤일메리,네티즌,8.0,의리빼면 시체인 외계인과 우주에서 생사고락 절친만들기 프로젝트
프로젝트 헤일메리,네티즌,10.0,좋음 좋음 좋음 좋음 좋음
프로젝트 헤일메리,네티즌,10.0,우리 로키 귀요미♡♡♡♡ 재밌음재밌음재밌음
프로젝트 헤일메리,네티즌,6.0,왜 이렇게 평이 좋은지 당최 이해할수가 없네요…SF치고 설득력도 신선함도 저에겐 약했으며 몇몇 에피소드는 참기 힘들만큼 유치했어요. 러닝타임이 필요 이상 길게 느껴진 것도 그때문인듯요. 배우들 연기는 좋습니다만…
프로젝트 헤일메리,네티즌,10.0,눈과 귀가 황홀해지는영화!
프로젝트 헤일메리,네티즌,9.0,에스에프가 아니다 휴먼드라마다
프로젝트 헤일메리,네티즌,1.0,보다 간간히 졸았어 아 재미없어 외계생명체가 꼬마돌이 뭐야
프로젝트 헤일메리,네티즌,1.0,2시간 30분 리클라이너 의자에 뻗어서 잤음 너무 한다
프로젝트 헤일메리,네티즌,10.0,레전드 인생영화 100번 더 보고싶음
프로젝트 헤일메리,네티즌,10.0,진짜 처음 리뷰 쓰는데 미친영화입니다.. 너무 너무 재밌어요
프로젝트 헤일메리,네티즌,10.0,근 5년내 최고의 영화.2시간 반동안 지루하지 않음.21세 e.t.
프로젝트 헤일메리,네티즌,10.0,아니 진짜 인터스텔라 이후로 이정도로 멋진 우주영화가 나올 줄이야. 스토리부터 영상미까지 그냥 너무 멋져서 3번관람 각이다 그냥.올해 최고의 영화
프로젝트 헤일메리,네티즌,10.0,10점짜리 영화 오랜만이네요 ㅠㅠ 명작이다 진짜 …. 로키야 사랑해 그레이스 사랑해 ㅠㅠ 너무 재밌고 sf영화 보면서 운적은 또 처음 ㅠㅠ 꼭 보세요
프로젝트 헤일메리,네티즌,10.0,책도 읽어볼 예정. 감동적이고 최근 영화들 중 제일 괜찮았음. 억지신파따위 없고 과학지식없는 나도 이해가 충분히 될만큼 잘만들었다 생각함
프로젝트 헤일메리,네티즌,10.0,벅차고 경이롭다과학적 공학적 철학적 종교적 울림이 있는 영화
프로젝트 헤일메리,네티즌,10.0,테토 감동 너무 감동 매우 감동
프로젝트 헤일메리,네티즌,8.0,이런걸 영화관에서 봐야지... 근데 우주 영상미는 인터스텔라보다 떨어짐
프로젝트 헤일메리,네티즌,10.0,너무 재미있고 따듯한 영화 ㅠㅠ
프로젝트 헤일메리,네티즌,8.0,역시 사람보단 동물이.. 외계인이.. 낫다^^
프로젝트 헤일메리,네티즌,8.0,내 친구 꼬마돌 !! 넌 내 꺼야!
프로젝트 헤일메리,네티즌,5.0,기대하고봤는데….. 그렇게 특별한것도 없는 느낌이고 .. 너무 그냥 조금은 지루한 힐링물 같았어요 인터스텔라나 마션을 기대하고 가서 그런걸까요 ㅠ (물론 소설 원작 읽지 않은 사람입니다)
프로젝트 헤일메리,네티즌,8.0,
프로젝트 헤일메리,네티즌,10.0,소설원작 영화중에 가장 만족스러웠던...
메소드연기,실관람객,2.0,관람객
메소드연기,실관람객,1.0,관람객
메소드연기,실관람객,7.0,관람객
메소드연기,실관람객,9.0,관람객
메소드연기,실관람객,5.0,관람객
메소드연기,실관람객,8.0,관람객
메소드연기,실관람객,4.0,관람객
프로젝트 헤일메리,네티즌,9.0,"지구에서 끌려나갈 땐 생각할 시간도 없었는데, 지구로 돌아갈 땐 마음의 여유가 넘치는 게 너무 좋았다. 우주에 가서야 용기를 내게 할 존재를 찾았네"
명탐정 코난: 세기말의 마술사,실관람객,10.0,관람객
명탐정 코난: 세기말의 마술사,실관람객,8.0,관람객
명탐정 코난: 세기말의 마술사,실관람객,5.0,관람객
명탐정 코난: 세기말의 마술사,네티즌,10.0,작화 스토리 다 지금은 없는 감성을 갖고있음.. 사람들이 구작을 좋아하는 이유ㅠㅠ
명탐정 코난: 세기말의 마술사,네티즌,9.0,괴도 키드의 멋드러진 등장.
명탐정 코난: 세기말의 마술사,네티즌,8.0,일본 이름도 그렇고 성우분들도 어색해서 ㅠㅠ 쌀짝 아쉽더라융
명탐정 코난: 세기말의 마술사,네티즌,7.0,괴도 키드의 뒷이야기가 궁금해진다
명탐정 코난: 세기말의 마술사,네티즌,10.0,개재밋음 진짜 키드도 그렇고
명탐정 코난: 세기말의 마술사,네티즌,10.0,괴도키드 나오는 극장판중 가장 재밌다
명탐정 코난: 세기말의 마술사,네티즌,10.0,"영화 보는 내내 황홀했음..작화는 뭐 말할 것도 없고, 스토리가 그냥 띵작임....감탄 나옴 ㄹㅇ"
명탐정 코난: 세기말의 마술사,네티즌,10.0,그 시절 그 감성 아니더라도 스토리 최고. 근데 로컬라이징안할꺼면 그냥 재더빙 하지마...
명탐정 코난: 세기말의 마술사,네티즌,10.0,극장에서보니까 너무 좋았어요
명탐정 코난: 세기말의 마술사,네티즌,10.0,영상으로 보는거랑 극장에서 보는거랑 완전 다르네
명탐정 코난: 세기말의 마술사,네티즌,10.0,"다시 그때 그 감성으로 되돌아 갈수 있어 기뻤다.그때에 처음 입덕하고, 뜨겁도록 사랑했던 근본 라인."
명탐정 코난: 세기말의 마술사,네티즌,10.0,이번영화 다 재미가있고 쓰릴있겠네요.
명탐정 코난: 세기말의 마술사,네티즌,10.0,개띵작헤이지??
명탐정 코난: 세기말의 마술사,네티즌,10.0,어렸을 때 티비로 봤던 걸 영화관에서 다시 보게 되다니 감격ㅜㅜ 요즘 나오는 것들에 비해 전개가 매끄럽고 내용도 재밌어서 하나도 안 지루했다. 특히 달걀이 아름답고 웅장해서 볼 맛 났음! 옛날 극장판들 재개봉 많이 해줬으면 좋겠다.
명탐정 코난: 세기말의 마술사,네티즌,7.0,예날 작화 너무 좋고 스토리 연출 브금 전부 낭만 그자체다
명탐정 코난: 세기말의 마술사,네티즌,10.0,내가 본 달걀 중 가장 아름다운 달걀이었다…
명탐정 코난: 세기말의 마술사,네티즌,10.0,
명탐정 코난: 세기말의 마술사,네티즌,7.0,괴도키드는 봐도봐도 설렌다.
명탐정 코난: 세기말의 마술사,네티즌,8.0,이거 방탄유리야 개섀꺄!!
명탐정 코난: 세기말의 마술사,네티즌,10.0,극장판은 늘 새로운 스토리니까 그게 더 좋은거같음..
명탐정 코난: 세기말의 마술사,네티즌,6.0,"진화하는 코난, 아쉬운 후반부"
첨밀밀,실관람객,10.0,관람객
첨밀밀,실관람객,9.0,관람객
첨밀밀,실관람객,8.0,관람객
첨밀밀,실관람객,7.0,관람객
첨밀밀,네티즌,10.0,"나이가들고 15년만에 다시보니 또다른 사랑이 보인다.술주정뱅이강사,죽어간 고모,문신남,소정 등등.. 그들은 그 나름대로의 방식으로 사랑을 하고있엇다,,어렸을땐 왜 안보였을까? 이 영화는 나이가 들어서 보면 더 다가온다..홍콩영화의 걸작이다"
첨밀밀,네티즌,10.0,난 이 영화가 너무 좋다 어렸을 땐 엇갈리는 아쉬움만 보였고 스무살 초반엔 홍콩사람들이 보였고 스무살후반엔 다른 사랑들이 보였는데 서른한살을 지나는 오늘은 내 지나간 이십대가 보인다
첨밀밀,네티즌,9.0,진작에 솔직했더라면... 사랑은 모든 걸 내려놓아야 할 만큼 어렵다
첨밀밀,네티즌,9.0,버림받은 소정이 불쌍해서 1점 감점. 가장 기억에 남는 건 영표(증지위)다. 자기 여자가 아직 옛 연인을 잊지 못한다는 사실을 어렴풋이 알면서도 끝까지 자기는 순정을 보인다. 영표 죽고나서 미키마우스 문신이 드러나는 장면 너무 슬펐다.
첨밀밀,네티즌,10.0,이맛에 로맨스보는듯 근데 줄거리에 결말이 다 나와있으면 어쩌자는거냐 ㅋㅋ
첨밀밀,네티즌,10.0,첨밀밀을 능가하는 로맨스물이 세상에 또 있을까 모든 마음이 자연스럽고 현실적이고 다채롭고 감동적이다
첨밀밀,네티즌,10.0,나이가 들면서 볼때마다 느낌이 다른 영화
첨밀밀,네티즌,10.0,"주인공이 불륜을 저지름에도 불구하고 이 영화가 아름다운것은 주인공과 주변사람들의 다양한 유형의 사랑 속에서 사랑의 달콤함과 씁쓸함, 이성으로는 제어 할 수 없는 아름다움과 추악함을 모두 보여주기 때문이다. 해석은 관객 개개인이 해야할 문제일것이다."
첨밀밀,네티즌,9.0,명작임애 틀림없다. 누구나 꿈꾸는 사랑이 바로 이런 것특히 마지막 장면에 등려군의 사망소식에 두사람이 같은 생각을하고 월량대표아적심의 노래가 나오면서 만나는 것은 정말 90년대 멜로 최고마지막 씬 아닌가 할 정도
첨밀밀,네티즌,10.0,내가 본 중국 영화 중 최고의 영화였다.
첨밀밀,네티즌,10.0,그 어떤 멜로 영화보다 더 기억에 남는 영화 첨밀밀
첨밀밀,네티즌,10.0,"배에서 이별을 고하려던 장면, 단추 끼워주는 장면, 실수로 클락션을 누르는 장면, 마지막 미키마우스 문신 장면... 잊을 수 없다. 장만옥, 영화 보기전엔 참 못났다... 싶었는데 정말 아름답고 예쁘다. 굉장히 동양적이고 청초하고... 빠져든다."
첨밀밀,네티즌,10.0,그 둘은 잘 살고 있을까..? 문득 그 미소 뒤에 그들의 삶이 궁금해진다 정말 마음이 따뜻해지는 영화
첨밀밀,네티즌,10.0,"대륙인으로서 홍콩에 꿈을 안고 가는 그들, 우리가 아메리칸 드림을 한창 가졌을때 같다... 정말 수작...."
첨밀밀,네티즌,9.0,조폭 대장 아저씨 모든 걸 다 알고 따뜻하게 품어줬는데 죽어버렸네 ㅠㅠ
첨밀밀,네티즌,10.0,"만나고 헤어지고 만나고 헤어지고 결국 만나게 되는... 서로의 마음을 알면서도 끊어질 듯 이어지는 인연이 정말 아름답다. 스토리, 음악, 연기 모든 것이 완벽하다. 명작 중의 명작이다."
첨밀밀,네티즌,10.0,만나게될 사람은 어떻게든 다시 만나게 된다....
첨밀밀,네티즌,10.0,"집에가서 따뜻한물로 목욕하고, 내일 아침 일어나서 다른남자 찾아"
첨밀밀,네티즌,10.0,멋지다. 이 영화에 등장하는 한 사람 한 사람의 인생이 결국은 사랑임을 보여준다. 이따금씩 가슴 짠함을 느끼고플 때 새벽녘에 보고픈 영화.
첨밀밀,네티즌,10.0,여운때문에 잠을 잘 수가 없네..
첨밀밀,네티즌,9.0,"현실과 이상, 우연과 필연, 사랑과 우정 그렇게 공존할 수 없는 것들의 뒤엉킴이 마력으로 다가오는 진진한 영화. 평점을 아니 쓸 수 없다."
첨밀밀,네티즌,10.0,이 영화가 나왔을 때 나는 고1. 그때 봤다면 이해 못했을텐데 서른이 넘어서 보니 각각의 사랑들이 이해가 된다. 미키마우스 문신을 보고 우는 장만옥을 보고 왜 국제영화제에서 상 받은 여배우인지 알겠다.
첨밀밀,네티즌,10.0,"팔찌 하나만 사서 ""실은 너줄려고 산거야 소정에게 다 이야기했어 이요 사랑해 내가 몸이 부서져라 일해서라도 널 행복하게 해줄께 사랑해 이요"" 이랬더라면~"
첨밀밀,네티즌,10.0,2022년 11월 20일 ebs 보고계신 분?
첨밀밀,네티즌,10.0,"나이 40이 되어 다시보니 그냥 좋은 영화에서, 걸작이 되어 있더라. 물론 언제나 장만옥은 최고.."
첨밀밀,네티즌,10.0,나는 원래 영화는 한번 보면 다시는 잘 보지 않는다 그렇지만 첨밀밀은 몇번을 봐도 좋다 장만옥의 연기는 완벽해
첨밀밀,네티즌,10.0,언젠가 내곁을 스쳤었을지도 모른다
첨밀밀,네티즌,10.0,너무도 매력적인 그녀 장만옥♥♥만날사람은 언젠가 만나게 된다 ...
첨밀밀,네티즌,10.0,장만옥의 표정(내면)연기가 일품이었던 작품. 영화를 보는 내내 그녀의 표정에 웃고 울고 했다.
첨밀밀,네티즌,10.0,지금봐도 정말 재밌다.. 진짜인연은 돌고돌아도 만난다는것
첨밀밀,네티즌,10.0,"첨밀밀 ""달콤함"". 월량대표아적심 ""달빛이 내 마음을 대신하네""깔려서 뭉그러든 초콜릿이라 할지언정 여전히 달콤하듯, 오래된 영화지만 여전히 내 맘을 대신한다."
첨밀밀,네티즌,10.0,열번도 넘게본 영화
첨밀밀,네티즌,10.0,영표 문신보고 웃으면서 우는 장만옥의 표정연기는 진심 압권이다
첨밀밀,네티즌,10.0,마지막에 첨밀밀 노래나오면서 둘이 재회할때 진짜 영화 반전을 보듯이 소름끼침. ㅋㅋㅋ
첨밀밀,네티즌,10.0,"그 시절 홍콩, 그들만의 바쁜 삶과 분위기, 그 속에서도 사랑은 존재했다. 등려군 노래와 함께"
첨밀밀,네티즌,10.0,달콤하고아프다...
첨밀밀,네티즌,10.0,세월이지나도 바래지않을명작..
첨밀밀,네티즌,10.0,불륜이고 뭐고 웃기지 말고 원래 그는 그녀가 운명이었다. 내 인생 최고의 로맨스 영화.. 상실의 아픔과 중요함을 느낄 수 있어서 좋았다. 그냥 최고.
첨밀밀,네티즌,9.0,아시아 멜로 영화의 명작. 사랑이란 이런 것임을 정말 잘 표현했다.
첨밀밀,네티즌,10.0,"꿈을 찾아 헤메이던 20대에 나도 누군가를 만나 사랑을 나눴고, 꿈을 꾸었다. 축축하게 젖은 젊음처럼 느껴졌지만, 햇살같은 사랑으로 버텼던 청춘들의 이야기"
첨밀밀,네티즌,9.0,단순한 사랑이 아닌 다양한 인간관계와 사랑법을 보여주는데 상당히 여운이 많이 남는다. 거기다 아름다운 배경음도 좋고 등려군을 통한 두 주인공의 인연도 인상적이다.
첨밀밀,네티즌,10.0,분명 해피앤딩인데 난 왜 슬프지?ㅠㅠ
첨밀밀,네티즌,10.0,"가장 촌스럽고, 어설픈 모습으로 다가오던 유년의 그 시절과...가슴깊이 박히고, 곪아 버린 첫사랑의 아련함으로 영화는 가장 솔직하게 말하고 있다.인연과 운명의 저울질 속에서 ""지금 이 순간"" 이라고...!"
첨밀밀,네티즌,10.0,"울린것은 클락션이였을까, 내 마음이였을까.."
첨밀밀,네티즌,9.0,단 한시간의 만남을 평생 간직하고 살았던 아줌마가 내게는 이 영화의 주인공
첨밀밀,네티즌,10.0,"홀로 타지에 와서 외로웠던 두 사람이 서로에게 빠질 때, 힘들지만 가장 즐거웠던 때를 함께 보낸 이요를 잊지 못하고 약혼녀를 떠난 소군, 빈털털이가 됐을 때 돈도 있었고 자길 챙겨준 조폭을 떠나지 못했던 이요, 사랑은 타이밍..."
첨밀밀,네티즌,10.0,만나게 될 인연은 꼭 다시 만난다.
첨밀밀,네티즌,10.0,그냥 보세요 말이 필요할까요..?
첨밀밀,네티즌,10.0,"사실 소군이 고향에 결혼할 여자가 있다는 설정을 집어넣지 않았었더라도 타지에서 꿈을 찾아 정글같은 도시로 온 남녀의 애틋한 사랑 이야기로 그럴듯한 영화가 만들어졌을 것이다. 그러나 소군이 결혼할 여자를 두고도 이교와 사랑에 빠질수 없었던 이야기를 집어넣음으로써 오히려 인생의 복잡다단함과 외로움, 애틋함과 씁쓸함같은 감정들을 더 진하게 느낄수 있는 이야기가 되지 않았나 싶다. 그 감정들이 너무 절절하게 느껴져 단순히 불륜이라고만 치부할수 없는 현실적인 공감을 이끌어내며 깊은 여운이 남는다."
첨밀밀,네티즌,10.0,멜로중 최고다. 이걸 왜 이제 봤을까
첨밀밀,네티즌,10.0,나이를 먹고 다시보니 여운이 굉장히 깊게 남는 걸작
첨밀밀,네티즌,10.0,10년이 지나고 나서 다시봤는데 마지막 미키마우스 장면이 잊혀지지가 않는다. 어릴땐 그 장면이 안보였던거 같은데. 이상하게 무슨 감정인지는 모르겠는데 보고나서도 눈물이 났다. 지금도 생각하면 코끝이 진해진다. 이게 무슨감정인지 모르겠다.
첨밀밀,네티즌,10.0,표 오빠.. 진정한 남자다...
첨밀밀,네티즌,9.0,나는 좁은 공간에서 외투 두겹이나 입혀주는 씬이 좋았다 호호
첨밀밀,네티즌,10.0,내가 30대가 되면 이 영화가 또 어떻게 다가올까참..좋은 영화다
첨밀밀,네티즌,10.0,서울드림을 안고 대학에 진학했던 기억이 새록새록... 볼때마다 삶의 아름다움을 느끼는 영화
첨밀밀,네티즌,8.0,장만옥의 연기는 역시 최고였다.
첨밀밀,네티즌,10.0,슬프고도 아름다운 영화..20대때와는 달리 나이들어서 보니 정말 명작임을 부인할수 없는..
첨밀밀,네티즌,10.0,"장만옥.. 죽은 표 얼굴 보고도 안 울었는데, 돌려주세요 하고는 미키마우스 문신보고 울었다.. 그것도 웃으며 우는 장면. 여소군과의 재회.. 다시 사랑을 이룬다해도 그녀를 보던 미키마우스의 모습은 잊혀질까..열 번을 봐도 여운 남는 세기의 명작."
첨밀밀,네티즌,10.0,"이젠 지쳐서 사랑을 못 할것 같다가도 이 영화를 보면, 나는 역시 사랑 없이는 살 수 없을것 같다는 생각이 든다."
