제목,작성자유형,평점,리뷰
어쩔수가없다,실관람객,10.0,평점이 좋지 않아서 보러 갈까 망설였는데 제 기준에는 꽤 재밌었어요. 영화 곳곳 재미있는 요소들도 많이 담겨있어서 영화 본 후에 대화할 거리도 있었어요 . 2시간 넘는 시간 동안 전혀 지루하지 않았어요. 배우들 연기만으로도 10점 가치 충분히 하는 듯
어쩔수가없다,실관람객,2.0,관객들은 이미 너무나도 멋지고 수준높은 영화들을 기억하고 있기에 그 기대에 도무지 미칠 수 없는 그저 이게 뭐지? 싶은 공감도 감동도 없는 영화 ~ 실망 입니다관객들의 기대치와 수준은 이미 이 영화를 앞서고 있네요 영화평 처음 써봅니다
어쩔수가없다,실관람객,10.0,저는 너무 재밌게 잘 봤어요. 연기를 다들 너무 잘하심.
어쩔수가없다,실관람객,10.0,네이버 평점에 편견을 갖고 보지 마셔요.본인의 생각으로 감상하시길 바랍니다.이제는 어느 정도 세계적 문화 강국 서열에 올라가 있다고 자부할 수 있는 나라에서 '거장'과 '대배우'라는 호칭을 아무에게나 붙인다 생각하지 않습니다. 자본주의 사회에서 치열하게 살아가고 있는 평범한 가장들의 고뇌를 블랙 코미디로 잘 표현했다 느꼈습니다. 생각할 거리와 나눌 이야기가 많은 영화라 좋네요.
어쩔수가없다,실관람객,2.0,오랜만에 영화관 가서 시간과 돈 버림. 작위적인 맹탕을 엿가락처럼 늘려놓은 졸작. 앞으로 기대안됨.
어쩔수가없다,실관람객,10.0,"예매 했는데 평점이 낮고 혹평이 많아서 취소할까 고민하다 욕을 해도 내가 직접 보고 판단하자는 마음으로 극장을 향했습니다. 큰 기대를 접고 영화가 시작되었는데 초반부터 전혀 지루함 없이 이야기가 전개되었고 혹시나 걱정했던 잔인함이나 폭력성도 두드러지 않게 영화에 몰입하여 러닝타임 2시간 15분이 금새 지나갔습니다. 배우들의 연기도 훌륭했고 감독의 연출, 시나리오, 메시지도 좋았습니다. 낮은 평점이나 많은 혹평들 때문에 망설이신다면 그정도 욕먹을 망작은 절대 아니고 베니스 영화제에서 기립박수 받을 충분한 이유가 있는 작품입니다. 기생충과 비슷한 느낌이지만 개인적으로는 기생충보다 재미있고 흥미롭게 감상했습니다. 50대 가장으로서 사회를 바라보는 관점에서 좀 더 공감이 가지 않았나 합니다. 한국영화, 박찬욱 감독 화이팅입니다. 와이프는 손예진 연기의 재발견이라네요."
어쩔수가없다,실관람객,6.0,하 진짜 답답하네 영화는 걍 겉멋만 들었네
어쩔수가없다,실관람객,7.0,무슨 말을 하고 싶은 거냐
어쩔수가없다,실관람객,10.0,좋은영화임 평가가 너무 낮음
어쩔수가없다,실관람객,6.0,사진 이쁘게 나온다는 sns 유명 맛집이래서 오픈런으로 가서 먹었는데 굳이 줄서서 먹을 필요가 있었나? 싶은 맛집 같은 느낌이 드는건 어쩔 수가 없다
어쩔수가없다,실관람객,10.0,재밌는데...평점이 너무 낮은것 같은...
어쩔수가없다,실관람객,10.0,아니 별일점 준 사람들 뭐죠?? 작년부터 통틀어 드디어 볼만한 영화다 싶었는데 왜 다들 별점테러하는지.. 영화재밌고 기법도 기발하고 웰메이드입니당
어쩔수가없다,실관람객,6.0,나만 지루한 게 아니었구나..
어쩔수가없다,실관람객,10.0,"평점이 너무 안좋아서 고민하다 보러갔는데, 생각보다 더 재밌게 봤습니다. 특히 경쟁이 치열한 직장생활을 하다보니 저는 만수의 역할이 이해가 가더군요. 현실적이면서도 과장되어있는 박찬욱감독만의 역설적인 연출과 내용도 마음에 들었습니다."
어쩔수가없다,실관람객,10.0,너무 재밌었어요 이정도 혹평받을 영화아니네요 역시 직접봐야함
어쩔수가없다,실관람객,1.0,"감독 , 배우빨로 겨우 백만 살짝 넘기고 끝날듯,,, 재미는 솔직히 없네요"
어쩔수가없다,실관람객,10.0,이게 왜 평점이 이런건지 진짜 1도 모르겠다.대한민국 영화 관람객 수준이 이정도 밖에 안되나? 생각도 들고 ㅎ
어쩔수가없다,실관람객,4.0,노잼이었음 ㅈㅅ... 사실임 ㅜ
어쩔수가없다,실관람객,1.0,이건 뭐지? 재미도 감동도 없고..한대 때리고 싶은데 어쩔수가없다..천원에 보지 않았다면 정말 후회 할 뻔했다
어쩔수가없다,실관람객,2.0,박찬욱 이름값에 안어울리는 실망작 재미도없고 내용도 산만하네요 아쉽습니다.
어쩔수가없다,실관람객,1.0,너무 공감할수 없는 내용때문에 끝까지 보기힘들었어요
어쩔수가없다,실관람객,4.0,문화의 날에 정부쿠폰 더해서 천원에 봤으니 망정이지
어쩔수가없다,실관람객,10.0,평점은 의미없다는걸 느낍니다..초반에 너무 낮은 평점에 걱정이 되었지만 개인적으로는 완전 좋았습니다
어쩔수가없다,실관람객,10.0,너무너무 재밌었습니다
어쩔수가없다,실관람객,10.0,평점이 낮네요 저는 재밌게 봤습니다 올라가야하는 가혹한 현실을 과장해서 잘 표현했다고 생각합니다 끝에 미묘하게 엇갈리는 듯 합쳐진 가족간의 감정선 최고였어요 또 굉장히 웃긴 부분도 많았습니다
어쩔수가없다,실관람객,1.0,원작소설을 펼치자마자 빨려들어갔었는데 영화는 그러나 상상이상으로 허접함. 독서광이라는 박찬욱에게 뛰어난 원작을 독창적 색깔로 주물럭거릴만한 역량이 과연 되는지 이번에 새삼...
어쩔수가없다,실관람객,10.0,요근래 제일 재미있게 봤습니다.40대 중반에 퇴사를 한 내 자신과 오버랩이 되어서 더 재밌게 본 것일수도 있습니다. 박찬욱과 봉준호가 콜라보한 느낌도 들었어요. 전 간간히 웃으며 재미있게 봤습니다. 오랜만에 제 취향의 영화라서 반가웠어요!
어쩔수가없다,실관람객,10.0,정말 어쩔수가 없다 어쩔수가 없어 .
어쩔수가없다,실관람객,10.0,핸드폰 시간 한번도 안보고 몰입해서 봤네요. 역시 배우들 넘나 연기잘하고 영화표값이 전혀 아깝지 않았어요. 지인이 보고 추천해서 봤는데 영화보고나서 추천해줘서 고맙다 했네요. 평점 보지마시고 직접보시고 판단하시길요.. 관람평 작성 원래 안하는데 안타까워서 하네욤~~
어쩔수가없다,실관람객,10.0,솔직히 평점때문에 기대 안했는데 너무 잘 만든 영화다. 연출이며 스토리며 연기까지 절대 돈아깝지 않다. 누구나 이병헌이고 누구나 한번쯤 저렇게 살아간다.보편적이지 않은 것은 완성시키는 과정도 너무나 외롭다.
어쩔수가없다,실관람객,2.0,근 3년간 본 영화 중에 제일 최악임. 박찬욱은 배우가 살렸다
어쩔수가없다,실관람객,10.0,한결 더 세련되어진 박찬욱 감독의 블랙코미디를 담기엔 한국이 너무 좁다
어쩔수가없다,실관람객,10.0,이야 이걸 못느끼나베니스에서 상탔으면절대 이런식으로들함부로 평가 못하지은유와 풍자를 못알아 먹으면그냥 내가 상식이 모자란가 돌아보십쇼
어쩔수가없다,실관람객,8.0,"현재 평점 보고 볼까말까 고민하지 마시고, 직접 보시길~!"
어쩔수가없다,실관람객,10.0,불호 평이 납득이 안가요. 엄청난 완성도 입니다.
어쩔수가없다,실관람객,10.0,재미없다고 해서 궁금해서 보고왔는데 너무 재밌게 잘봄 (:
어쩔수가없다,실관람객,1.0,보다가 중간에 나왔어요..
어쩔수가없다,실관람객,10.0,난 겁나 웃겼는데 평이 안좋네 그래도 내가 재밌 으면 그만임
어쩔수가없다,실관람객,10.0,단연컨대 2020년대 전체 통틀어 나온 최고의 한국영화! 박찬욱 감독 지휘아래 연기파 배우들의 연기대결까지 완벽한 영화!
어쩔수가없다,실관람객,9.0,나만 재밌게봤나…..?
어쩔수가없다,실관람객,9.0,"영화평이란 게 주관적일 수 밖에 없지만 이 영화에 1점 테러하는 사람들 진짜 이해할 수가 없음.그래도 이해해보려고 1점 남긴 평들을 주욱 읽어봤는데 오히려 더 분노가 일음.1점을 준 이유가 내용이 잘 이해가 안 되서, 감독이 대가병 걸려서, 한국에서 있을 수 없는 일이라 현실성이 없어서 등등. 아니 이게 대관절 말이 되는 평들인가. 현실을 다큐처럼 세세하게 구현하기도하고 그 중 한 단면을 현미경처럼 들여다보고 극대화해서 과장된 모습으로 투사하기도 하고 우리가 살아가는 현실을 다양하게 변주해서 표현하는게 영화라는 매체의 본질 아닌가? 내용이 이해가 안 간다고 징징거리기 전에 문화적 사회적 소양이 전무한 당신들 문제인지 먼저 한 번 되짚어보면 좋겠고 좀 공부하고 이해하고 알아가려는 노력이라는 걸 좀 해보면 좋겠다 진짜... 내가 박찬욱 감독을 리스펙 하는 이유는 세상의 여러 단면을 직시하는 용기가 있어서임. 이 사람은 대중이 좋아할만한 길이 뻔하게 있음에도 그 길로 잘 가지 않음. 영화를 보다보면 꼭 마음 속에 불편한 감정을 일으키고야 마는데 그게 늘 생각할 거리를 던져줌. 헤어질 결심만큼은 아니었지만 어쩔 수 없다도 기어코 그렇게 만듬. 영화를 보고 나서 그게 연출이든 대사든 연기든 사운드든 어떠한 작은 부분이든 몇 일이고 계속 마음에 맴돌게 만들 수 있는 영화가 좋은 영화라 생각하고 그런 측면에서 어쩔수없다는 좋은 영화라고 생각함."
어쩔수가없다,실관람객,10.0,"좋아하는 배우와 감독이라서 기대를 많이 하고 봤는데, 기대 이상 재미있게 봤습니다. 스토리 라인을 미리 알고 있었기 때문에 뻔하지 않을까 했는데 역시나 전개가 흥미로 웠고 군더더기 없는 연출이 아주 좋았어요. 여러번 발을 동동 구르며 엄청 웃었네요. 이 시대 가장들이 애잔 하기도 하고 서로 누가적인지 모호하고 캐릭터 하나하나가 안타까웠습니다 아마 그게 평범한 우리들의 모습이겠죠. 특히 이성민 배우의 연기는 미쳤네요."
어쩔수가없다,실관람객,1.0,정말 어쩔 수 없다뭘 해도 어쩔 수 없다내가 할 수 있는 것은 나가는 거였다
어쩔수가없다,실관람객,10.0,네이버평점 믿지말고 보러가세용 재밌음
어쩔수가없다,실관람객,10.0,"재밌게 잘 봤습니다! 취향을 탈 것 같지만, 분명히 잘 만든 영화라고 생각해요."
어쩔수가없다,실관람객,10.0,재밌었어요! 평점 테러를 받을 작품은 절대 아니라고 생각합니다.
어쩔수가없다,실관람객,10.0,평점 왜 낮은지 모르겠네 1점 준 사람들은 그냥 테러수준임.. 영화 안봤다고 본다 약간 낯설 수는 있지만 연출력과 연기력만으로도 최소 8점은 먹고 들어가는데 1점 테러는 그냥 박찬욱 안티라고 본다
어쩔수가없다,실관람객,1.0,아... 최악이었어요 보다가 졸았네요
어쩔수가없다,실관람객,1.0,"다음날까지악영향. 재미는개뿔 예고가다고 , 반전 해피앤딩 없음. 깨름직하고. 드러운느낌. 사람못믿개만들려작정한 악마가만든느낌."
어쩔수가없다,실관람객,10.0,한국판 모던 타임즈. 웃다보면 씁쓸한 미소가 찾아온다.
어쩔수가없다,실관람객,10.0,아니 이 영화를 어떻게 이런 낮은 별점으로 평가할 수 있나. 모국어로 이런 영화를 즐길 수 있는 점에 감사한다.
어쩔수가없다,실관람객,10.0,"사람들이 재미없다고 느끼는 지점도 충분히 이해가 되지만 깊이있는 해석을 해보면 역시 박찬욱이구나 싶다. 천재적인 연출과 연기, 파면 팔 수록 놀라운 메타포 등에 놀라게된다. 언제나 그랬듯이 박찬욱 영화는 아는 사람 눈에만 보석같은 빛이 보이지 싶다. 아는만큼 보이고, 보이는 만큼 놀라게하는 마에스트로"
어쩔수가없다,실관람객,9.0,"어쩔 수 없는 욕망의 굴레에 빠져 위험할 대로 삐뚤어지거나 무력해진 인간들. 그렇게 열심히 살지 말지. 영화가 넌지시 건네는 연민과는 달리, 자신만의 잣대를 공격적으로 들이미는 관람평들까지가 영화의 완성."
어쩔수가없다,실관람객,1.0,영화 감독도 어쩔 수가 없이 다른 영화 감독들 찾아가야 할 듯.
어쩔수가없다,실관람객,10.0,"재미없다는 사람도 많군.. 음.. 난 정말 오랜만에 재밌는 영화 봤는데.. 너무 잔인한 상황을, 영화이기에 능청스럽게 아무렇지도 않게, 비꼬며 과하게 그려내는 게 웃픔을 자아냈다. 이병헌 배우, 연기를 잘 해도 그동안은 그닥 호감이 가지 않았는데, 난 개인적으로이제 이병헌 배우를 좋아하지 않을 수 없을 듯. 염혜란 배우를 이런 역으로 캐스팅 한 것도 통쾌했다. 그리고 젊었을 때 장면, 너무 예쁘게 잘 나왔다. 영화 평을 보면서 정말 각자 경험이 이렇게 다를 수 있구나를 새삼 느끼게 됐다. 누구를 탓할 필요는 없을 것 같다. 이런 우리를 알고 감안해서 그려야하는 게 감독의 일인듯."
어쩔수가없다,실관람객,10.0,평점 최소 8점이상인데 평이 극과극이네그래도 무조건 보는거 추천한다.
어쩔수가없다,실관람객,10.0,평점 너무 낮아서 10점줌 못해도 7.5 이상은 나와야 할 영화
어쩔수가없다,실관람객,10.0,"평점보고 안보려고 했는데, 정말 잘 만든 영화는 맞는것 같다. 원작이 있는 소설을 본인만의 색깔로 만들어 낸다는 것만으로도 충분히 가치가 있는 것 같다."
어쩔수가없다,실관람객,7.0,뭔가 극단적인 느낌이 보기 힘들게 한다
어쩔수가없다,실관람객,8.0,평점이 엄청 낮내..그 정돈 아닌데..범죄도시 같은 단순재미만을 원한거라면비추한다
어쩔수가없다,실관람객,8.0,"솔직히 주제의식?은 이미 손때 많이 묻었고, 본인 작품을 비롯한 여러 영화의 레퍼런스도 보이지만, 개성을 살려 끝끝내 수작 이상을 만들어내셨네. 본인의 세계에 갇혀 산다는 의견에는 살짝 동의... 하지만 소재를 잘 살리면서 보편성 있게 마무리한 덕분에 씁쓸한 여운이 계속 남음."
어쩔수가없다,실관람객,8.0,"평점이 이렇게 까지 낮을 이유는 없는거 같은 영화 , 나쁘지 않고 올해 한국영화중 굉장히 수준급이긴함 볼만하니까 고민되는분들은 편하게 보세요"
어쩔수가없다,실관람객,4.0,영화를일케만들고천만가고싶다하면어쩌라는건지
어쩔수가없다,실관람객,9.0,"네티즌 평점보고 쫄면서 갔는데 생각보다 많이 좋았어요.연기, 음악, 미장센이 좋았으면 대체로 좋은거 아닌지."
어쩔수가없다,실관람객,10.0,네이버평점은 이제 안믿음.가장이라면 느끼는게 많을 것. 살인은 그 상황을 타개하고자 표현하는 영화적 연출일뿐. 영화전체를 이해했음 좋겠음.
어쩔수가없다,실관람객,2.0,웬만하면 그러지 않는데 영화보다가 잘 뻔 했다.내용이 산만하고 전달하고자 하는 게 별 의미가 없다. 대배우들이 아까운 영화.
어쩔수가없다,실관람객,8.0,영화 잘 봤습니다. 호불호가 갈려서 큰 기대 안하고 봤는데 전 괜찮았어요.
어쩔수가없다,실관람객,7.0,메세지는 알겠는데 그걸 말하는게 너무 재미없게 만들었음... 같은 블랙코미디인 기생충에 비하면 현저히 노잼임 그나마 이병헌하고 배우들 연기덕에 끝까지봤지만 영화자체는 기대만 못하네요
어쩔수가없다,실관람객,6.0,박찬욱 감독 작품 중 최악의 졸작
어쩔수가없다,실관람객,10.0,진짜 재밌게 보고 왔음여러번 보면서 디테일 체크할게 많은듯박찬욱특유의 대유법 스러운 연출이 다층적으로 심어져있어서 보는 맛 좋아유
어쩔수가없다,실관람객,4.0,박찬욱 스럽지 않은 영화. 헤어질 결심이 흥행은 했지만 생각보다 흥행하지 못한 탓인지 몰라도 대중성 있게 만들려다 실패한 작품 느낌임.
어쩔수가없다,실관람객,6.0,이도저도 아닌 애매모호함
어쩔수가없다,실관람객,10.0,"영상미가 독보였고 배우들 연기도 좋았는데, 스토리 공감이 사람마다 다를 수 있겠더라고요."
어쩔수가없다,실관람객,10.0,"""어쩔 수가 없다""무슨 뜻인가 했더니시대를 거를 수는 없겠지만 진짜 어쩔수가 없다 구나 싶다아,,,하"
어쩔수가없다,실관람객,10.0,"네이버 평점보고 볼까말까 고민했는데,안봤으면 큰일 날 뻔 했네요!"
어쩔수가없다,실관람객,6.0,거장의 섬세함보단 난잡함이 두드러진다
어쩔수가없다,실관람객,8.0,혹평이 많아서 기대없이 봤는데.. 전체적으로 너무 좋았어요왜! 때문에 그리 혹평이 많았는지영상미 연출 연기 다 좋았습니다너~무 재미없다고 하시는 분들은 동화같은이야기만 보고싶은진 건지…?
어쩔수가없다,실관람객,5.0,소문난 잔치집에 막상가보니 먹을게 하나도 없었다..박찬옥감독님 감을 잃으셨나...보면서 마음이불편했어요.
어쩔수가없다,실관람객,4.0,기대하고 봤는데 실망입니다..
어쩔수가없다,실관람객,10.0,노래도 좋고 박찬욱감독답게 영상미도좋고 진짜 순수하게 너무 재밌게봤는데 왜 평이 낮은건지 모르겠음 안티들이 테러하는거 아니고는 이렇게까지 낮을 이유가 없어보임 진짜
어쩔수가없다,실관람객,4.0,"감독,배우 이름값 빼면 평작 또는 허세 가득인 망작이라는 게 딱 맞말… 중간중간 블랙코미디가 좋았지만 부분부분이 기발했지 전체 감상평은 좋게 못 내리겠다.."
어쩔수가없다,실관람객,10.0,"감독의 전 작품들에 비해 스케일, 미쟝센 부분에서 평범하다? 라고 생각이 들 수도 있겠지만, 영화가 진행되면서 현실의 씁쓸함, 처절함까지 느꼈습니다. 영화가 끝나고도 피곤하지 않았고 생각이 많아지면서 정신이 명료해지더라구요. 이로인해 같이 영화를 본 일행과 대화할 거리가 많아진 것을 보니 저에겐 이 영화는 소모적이지 않았고, 좋은 영화였던 것 같습니다."
어쩔수가없다,실관람객,10.0,혹평하는 이들은 좀더 나이먹고 보면 안될까? 결혼하구서 보니 이 블랙코미디가 얼마나 여러가지를 느끼게 하는지 너무 잘봤다...역시 박찬욱
어쩔수가없다,실관람객,10.0,"평이 왜이렇게 낮은지 잘 모르겠네요. 평점에 휘둘리기 보다 한 번은 보고 결정하셨음 합니다. 베테랑 배우들의 뛰어난 연기 앙상블에 소름이 돋았고, 독특한 영상미와 끝까지 긴장과 기대를 놓을 수 없는 흥미진진한 스토리였어요. 저는 근래 들어 본 영화중에 가장 재미있고 흥미로운 영화였는걸요. 블랙코미디라는 장르를 제대로 보여준 영화가 아니었나 싶습니다!"
어쩔수가없다,실관람객,9.0,"50중반, 남일 같질 않네,,"
어쩔수가없다,실관람객,10.0,박찬욱감독의 영상미는 그 누구도 까내릴수 없음영화를 본 후 어쩔수가 없다라는 제목에서 느껴지는 찝찝함까지가 이 영화의 끝이 아닐까..코믹 포인트도 있고 충분히 흥행할만한 작품이라고 생각함
어쩔수가없다,실관람객,10.0,"아무 생각 없이 봐도 재밌거니와, 생각하며 보기에도 재밌는 영화. 우리의 현실과 닮아있습니다."
어쩔수가없다,실관람객,10.0,재밌는데 왜 평점 박은거임
어쩔수가없다,실관람객,1.0,애순이엄마 예뻐짐..
어쩔수가없다,실관람객,2.0,(당신이 재미없다해도) 어쩔수가없다
어쩔수가없다,실관람객,2.0,기대하고 봤는데 너무나 지겨워요~근데 재미없고 시간은 길어요~완전 실망~~
어쩔수가없다,실관람객,6.0,염혜란 배우 연기가 인상 깊었어요 새로운 모습
어쩔수가없다,실관람객,10.0,원작 소설을 먼저 읽고 영화를 봤어요.원작에서 뺄 건 빼고 넣을 건 넣고 부족한 개연성을 보충하기 위한 요소들도 적절했던 것 같아요.이정도의 평점을 받을 영화는 아니라고 생각하지만 스토리 인물 상황이 특정 연령 전후로 공감 정도가 극명하게 나뉘기 때문인 것 같아요
어쩔수가없다,실관람객,10.0,"아무래도 감독 네임밸류가 있고, 출연진 라인업도 짱짱하다보니 개봉도 하기 전에 엄청난 관심이 모인 것 같긴 하다. 개봉 후 평점이 박해서 보기 전에 살짝 기대를 내려놓고 보긴 했는데, 난 충분히 잘 봤다. 메시지도 명확했고, 배우들 연기도 흠 잡을 곳 없었다. 사람들이 뭐라 해도 어쩔 수 없이 즐길 수 밖에 없던 영화!"
어쩔수가없다,실관람객,9.0,감동은 없지만 재미 있게 봤다. 평점을 보고 안볼까 했지만 보길 잘 한거 같다. 영화의 재미 역시 개인의 취향일뿐이라는 걸 느낌
어쩔수가없다,실관람객,10.0,너무 재밌었어요 다시보러 또 갈 생각입니다! 영상미도 뛰어나요
어쩔수가없다,실관람객,10.0,암만 봐도 1점 줄 영화는 아닌데 밸런스 맞추고자 10점 줍니다.보고 나선 씁쓸하다가 시간이 지날수록 곱씹어보게 되네요. 이성민 염혜란 배우님 연기가 특히 좋았습니다.직접 보고 판단합시다.
어쩔수가없다,실관람객,10.0,박찬욱영화는 그만의 독특한 세계가 있다. 그의 영화를 보면 2-3시간동안 그의 세계에 정신없이 빠진다. 난 그게 좋다. 박찬욱만의 느낌이 참 좋다.
어쩔수가없다,실관람객,8.0,전작보다 약하긴 하지만 아무리 생각해도 1점 짜리 영화는 아닌듯 댓글부대 테러 받는듯하네요
어쩔수가없다,실관람객,4.0,서사도 별로고 공감이 안되는건 어쪌수가 없다
어쩔수가없다,실관람객,2.0,"이 영화를 본 후, 여러가지 생각이 들지만... 참 기괴하다 라는 생각은 지워지지않는군. 도데체 왜 이 영화를 봐야하는지 난감."
어쩔수가없다,실관람객,10.0,"정말 재밌게 봤어요. 이성민, 염혜란, 이병헌 배우가 대치하는 씬은 정말 웃기고 눈물나요"
어쩔수가없다,실관람객,10.0,평점이 낮길래 볼까말까했는데 생각보다 재밌게 봄
어쩔수가없다,실관람객,6.0,모두가 열심히 만들었는데 매력이 없었어요. 여유가 없는 작품이었달까.
어쩔수가없다,실관람객,6.0,"안 본 눈, 뇌 삽니다 ㅜㅜ"
어쩔수가없다,실관람객,9.0,"생각할 거리를 주는 영화를 선호하는데, 이 작품도 그랬다. 줄거리는 호불호 있겠지만 그 외의 요소들이 너무 좋았음!! 평점 너무 믿지 말자. 이 정도로 낮은 평가 받을 영화는 아님."
어쩔수가없다,실관람객,10.0,6점대 영화는 아니라서 10점 줌. 중간에 조금 지루하지만 전체적으로 흥미롭게 봄. 지능 딸리거나 도파민에 절여진 사람들은 못버티는 듯
어쩔수가없다,실관람객,4.0,"감독의 유명한 미장센-푸른 색감,클래식음악등등-,배우들연기는 좋았으나 좀 지루하네요전작들인 친절한금자씨,올드보이, 복수는 나의것 ,아가씨는 무척 재밌었는데 말이죠"
어쩔수가없다,실관람객,10.0,솔직히 관람평보고 기대 안하고 봤는데 진짜진짜 재밌었음. 강추임. 왜 이 평점인지 진짜 이해불가.
어쩔수가없다,실관람객,1.0,불쾌하고 난해한 영화.이해하기에 쉽지않음.
어쩔수가없다,실관람객,10.0,"내려치기가 너무 심한 영화네요직관적으로 봤을때도 재밌고 좋은 영화, 숨은 의미를 찾아보는 재미도 있는 영화입니다"
어쩔수가없다,실관람객,10.0,월드 클래스의 영화 였습니다.우리나라에 일런 감독과 이런 배우들이 있다는게 자랑스랍게 느껴 지내요~
어쩔수가없다,실관람객,10.0,지루하다는 평이 많던데 저는 흥미진진하게 봤습니다추천!
어쩔수가없다,실관람객,10.0,평점이 낮아서 걱정했는데 왜 낮은지 정말 이해가 안되네요. 오랜만에 정말 좋은 영화를 봤습니다. 너무 재밌게 봤습니다~
어쩔수가없다,실관람객,10.0,시간가는줄 모르고 봤다 평점 박살났다고 안보면 후회함 예고편보고 재밌을거같다라고 생각되면 무조건 봐라 소신대로.
어쩔수가없다,실관람객,10.0,"정말정말 재미있게, 시간 가는 줄 모르고 봤습니다. 극장 스크린으로 한번 더 보면 더 좋을 것 같구요. 작년올해 본 영화중 제게는 최고의 영화입니다."
