제목,작성자유형,평점,리뷰
살목지,네티즌,10.0,곤지암급은 아니지만 배우들 연기를 너무 잘하고 압도적인 공포감과 몰입감과 긴장감 살목지만의 물귀신 남자 귀신까지 오랜만에 역대급으로 무서운 공포였다ㅎㄷㄷ
살목지,네티즌,4.0,스토리가 우유에 밥 말아먹음...현실성이 없어서 몰입이 안됨...
살목지,네티즌,8.0,김혜윤 때문에 참고봤습니다..내용도 너무 재미없고 전체적으로 내용이 많이 아쉬웠어요
살목지,네티즌,1.0,…돈 아까우어ㅓㅓㅓ어어ㅜㅜㅜ심괴가ㅜ더 재밋음
살목지,네티즌,2.0,스토리없는 개망작이여요. 진짜 다 보고 나올때 짱남
살목지,네티즌,2.0,네이버 평 남기긴처음이네요. 최악이에요
살목지,네티즌,1.0,알바 너무 티나 댓글들 좀 참신하게써봐
살목지,네티즌,2.0,심야괴담회가 더 무서움
살목지,네티즌,5.0,점프 스케어에 치중한 영화는 아니어서 겁쟁이도 볼 수 있는 반면에 전형적인 동료 간 이간질이 나오는 등 전형적인 공포영화의 공식을 답습. 좋게 보자면 무난하나 나쁘게 보자면 밋밋.
살목지,네티즌,2.0,연기자들한테는 죄송하나..영화스토리는 최악인듯.. 아무생각없이 공포영화 만들려고 노력만 한 느낌. .
살목지,네티즌,2.0,기대를 너무 많이 했어…
살목지,네티즌,6.0,물음표100만개??
살목지,네티즌,10.0,생각보다 재밌고 무서워서 좋았어요 배우분들 연기 잘하셔서 몰입이 잘 됩니다 !!
살목지,네티즌,6.0,1. 요즘 영화에 비해 런닝타임이 짧음. 그래서 그런가 초반 루즈함이 없는데 개연성이 많이 부족함. 부장의 말한마디로 관람객에게 강제로 스토리를 주입시킴. 2.남자주인공이 왜 있어야 하는지 잘모르겠음. 없어도 되는 캐릭터인데 굳이굳이 끼워놓은 느낌. 3.단순하게 한국공포라는 장르로만 봤을때는 평균이상임. 곤지암 보는 느낌인데 비교해보자면 곤지암이 더 재밌었음. 4.연기력은 김혜윤님은 넘사고... 나머지는 뭐 딱히....
살목지,네티즌,6.0,"스토리가 홀려서 생기는 일로 진행되기 때문에 감정이입되는 부분은 딱히 없었어요. 감정 이입되는 부분은 아 답답하다 왜저럼 ? 이런 순간.커플로 나오는 인물들도 비호감, 일하러 가서 낚시할려고 온 형, 동생도 비호감이였지만 부장이 최고 비호감..."
살목지,네티즌,6.0,이런 저런 시도는 봐줄만 했지만 그게 전부입니다.
살목지,네티즌,6.0,공포영화인 줄 알았는데 사랑영화였습니다. 배우분들의 연기는 정말 좋았어요
살목지,네티즌,10.0,팀장은 도대체 팀원을 몇트째 보내는거임이정도면 팀장이 연쇄살1인마
살목지,네티즌,8.0,정말 너무 무서워요!!!꿈이 나롤거 같아요!
살목지,네티즌,10.0,너무너무 무서워요 ㅠㅠㅠ
살목지,네티즌,10.0,좋아하는 배우가 나와서 보러왔어요 재밌습니다 추천해요~
살목지,네티즌,8.0,심장 떨어지는줄 알았네 ㅋㅋㅋ
살목지,네티즌,10.0,즐겁고 재밌게 볼 수있는 간만의 공포영화!
살목지,네티즌,10.0,하 존느 무서워요 예... 첨부터 끝까지즌나 무섭습니다온몸이 아프구요 계속 눈감고있었네요...
살목지,네티즌,10.0,겁나 무서워서 욕이 저절로 나왔어요제대로 본 귀신나오는 장면이 없어요..다 가리고 봄귀신들이 끝까지 표복스럽게 굴어서 갈수록 짜증나요ㅋㅋ 작작해 이것들아 소리가 나옵니다
살목지,네티즌,10.0,진짜 오랜만에 무서운 영화 봤습니다 솔직하게 너무 무서워서 중간부터 제대로 못봤습니다 결말만 알고 있어요 겉옷 챙겨 가세요 얼굴 덥고 봐야됩니다!!!!
살목지,네티즌,8.0,공포영화 재밌게 봤네요 저한테는 별로 안무서웠어요
살목지,네티즌,9.0,무섭다 무섭다 해서 기대하고 보러 갔는데... 생각보다 무섭진 않아요.. 뒷 내용을 안 봐도 어떤 장면이 나올지 상상이 가는 영화였어요....그래서 그런지 무서움이 없었어요
살목지,네티즌,10.0,에휴 믿지마세요 ㅠㅠㅠ
살목지,네티즌,9.0,첫돌탑 장면부터 저도 모르게 소리질렀어요
살목지,네티즌,10.0,스크린 엑스로 봤는데.. ㅁㅊ 제대로 본 장면이 없음... 사방이 스크린이라 진짜 어딜봐도 살목지고요 무서운거 잘보는 분만 스크린엑스로 보길 추천함.. 아니면 눈만 감고 나온 사람됨.. 이거보고 한국공포영화가 이제 밝다는 생각함 자기가 진짜 무서운거 좋아한다? 한번쯤 꼭 보는 거 추천함
살목지,네티즌,10.0,뻔한 물귀신 그런 영화겠거니 하고 별 기대없이 봤다가 너무 재밌었어요. 연출이 너무 좋고 어떻게 나를 또 홀리고있을지 계속 생각하게 되는 영화네요
살목지,네티즌,2.0,그냥 스토리랄게 없음 깜짝 놀래키는 점프 스케어 7~8번이 전부 같은 돈 시간이면 헤일메리를 한번 더 보셈
살목지,네티즌,6.0,개연성이 별로에요. 갑툭튀 요소가 많긴한데 별로 안 무서워요.원래 공포영화 보면 후유증 같은 느낌이 있어야되는데 거의 없네요.배우분들의 연기력은 정말 좋았기때문에한번 정도 볼만 합니다.
살목지,네티즌,2.0,깜짝깜짝놀라게하는 장면은있었으나 꼭 장소는다르지만 꼭 흡사 외국영화1408을보는듯한 느낌이들었습니다 결론도 허무하네요 ..예상반전!
살목지,네티즌,4.0,.... 그냥 그랬음 예고편이 다인듯
살목지,네티즌,10.0,배우들 연기 잘해서 놀랬음 특히 윤재찬 연기 잘하시느듯
살목지,네티즌,4.0,연기는 좋았는데 움찔하는 순간은 있었지만 여운도 남지않는 무섭지 않은 공포영화였다..
살목지,네티즌,10.0,한국공포영화중 쵝오
살목지,네티즌,10.0,처음부터 끝까지 온몸에 전율이 흐르며 심장을 조여오는 영화. 공포영화 좋아하는 사람들이라면 꼭 보시길 추천합니다.
살목지,네티즌,10.0,2시간 내내 쫄리는 긴장감때문에 넘 힘들었음지금까지 본 한국식 공포영화 중에는 제일 재밌고 신선하게 무서웠다!
살목지,네티즌,10.0,정말 재밌어요! 또 보고싶어요~ㅎㅎ
살목지,네티즌,10.0,김혜윤의 표정을 따라가라
살목지,네티즌,4.0,스토리가 음.. 평점보고 놀람요 곤지암이랑 비교를 많이 하던데 전 곤지암이 무섭긴 했어요 점프스퀘어는 좋았으나 마지막엔 좀 피곤.. 그걸로만 영화를 채울순 없는거 같고 결말이 아쉬웠습니다
살목지,네티즌,10.0,여자 친구랑 너무 재밌게 봤음 끝가지 긴장감을 주는 공포영화 최고 대박나세요
살목지,네티즌,10.0,사운드 빵빵한 관에서 보세요. 저는 롯시 월타 광음관에서 봤는데 점프스케어마다 깜놀함 티켓 값 번 느낌!
살목지,네티즌,10.0,오랜만에 무섭고 재미있었음
살목지,네티즌,10.0,오랜만에 공포영화 개봉하고 봤는데 딱 내 스타일!!!! 또 보고싶은 영화
살목지,네티즌,10.0,영화관에서 모르는 사람들과 소리 지르며 공포영화본게 얼마만인지.. 그래서 더 재미있었음. 연출 연기 딱 좋았음
살목지,네티즌,10.0,공포영화인데도 영화관가서 오늘 뭐 보지? 하고 선택해도 괜찮은 영화 다시보고싶네여
살목지,네티즌,10.0,내용을 떠나 오랜만에 제대로 된 공포영화라고 생각 됩니다. 공포 분위기 몰입갑은 최고
살목지,네티즌,7.0,음..방금 봤는데 그정돈가?싶음너무 기대는 하지마세요
살목지,네티즌,10.0,저수지라는 공간이 주는 스산함이 정말 잘 표현된거 같아요 신기한 장비와 연출들도 많았고 무서워서 손가락사이로 보느라 팔과 어깨가 아프지만 재밌게 잘봤습니다
살목지,네티즌,10.0,꽤 무섭고 움찔 장면 많아요
살목지,네티즌,10.0,오랜만에 재밌있는 공포영화 였어요!!살목지 잘 만든 공포영화예요! 대박나실듯!!
살목지,네티즌,10.0,"배우들이 다들 한명한명 특색있게 모두가 연기를 너무 잘해서 몰입력이 상당했습니다. 그리고 장다아가 너무 예뻤어요. 사운드가 빵빵하고 영화관에서 보니 더 무서웠고 스릴 넘쳐서 심장이 떨렸어요.꼭 영화관에서 보시는 걸 추천드려요.김혜윤, 이종원, 김준한, 김영성, 오동민, 윤재찬, 장다아 연기들이 아주 미쳤습니다"
살목지,네티즌,9.0,점프 스케어 때문에 무서워서 눈을 가렸는데 귀로 공격하네.. 저도 모르게 작게 3번 소리 질렀어요사운드와 점프스케어로 쫄리는 맛이 굿
살목지,네티즌,10.0,연기 다들 넘잘하고 긴장감 맥스 몸에 힘이들어가서 보고나면 긴장이 풀어져서 삭신이 쑤심 넘 잼나게 봤음
살목지,네티즌,10.0,너무너무너무 … 무섭고 재미있는
살목지,네티즌,10.0,같이 갇혀있는 기분 나갈수 없는 공포 깔끔하게 무서운
살목지,네티즌,10.0,무서워요스토리도 재밌어요
살목지,네티즌,10.0,맛있고 깔끔하거 무섭다!!!
살목지,네티즌,10.0,공포물 처음 스크린 입성 ㅎ 화장실 다녀왔는데 화장실 가고 싶어 죽음 뭔 말인지 알죠! 지루할틈 없음 몰입감 쵝오!
살목지,네티즌,10.0,오랜만에 한국 공포영화중 재밌게봄
살목지,네티즌,10.0,공포영화를 못보는 완전 초보쫄보인 관람자인데 김혜윤 팬심으로 본건데..와~~~이건 팬심으로 쓰는게 아니라정말 잼있어요!!!에버랜드 롤러코스터타는 그런 짜릿함 스릴.스트레스가 확 풀 리는 영화입니다.완전강추!!!!감독님 정말 다음 공포영화가 기대됩니다!!혜윤님 힘뺀연기도 좋고다른 배우님들 연기도 최고였어요
살목지,네티즌,10.0,롤러코스터 타는 느낌입니다.. 심장이
살목지,네티즌,10.0,몰입감 공포감 배우들의연기 모두만족
살목지,네티즌,10.0,귀신 비쥬얼에서 놀라고 진짜 놀라라고 만든 구간에서 또 놀라고 .. 최근 본 영화 중에 제일 긴장하면서 봤어요
살목지,네티즌,9.0,"기존 국내 공포영화와는 확실히 다르다. 공포감 압도되는 분위기, 연출, 연기 하나도 아쉬운게 없다. 너무 놀라서 현기증이 날 정도로 공포감이 확실한 영화."
살목지,네티즌,2.0,할매떡밥 안풀리고 영화 물귀신+블레어윗치 합친느낌임 결말도 이상하고
살목지,네티즌,3.0,"아무런 정보 없이 그저 시간이 남아 보게 된 영화. 결론부터 말하면 시간과 돈이 아깝다. 공간, 스토리, 인물 간의 연결이 부족하고 개연성이 너무 떨어져 영화에 몰입이 안됐다. 공포 장르의 클리셰를 피하려고 하였지만 이 행동 자체가 또 다른 클리셰로 느껴졌다. 360도 카메라 활용은 아쉬웠고 미니밴은 광고비를 얼마 받았는지 의문이 들 정도로 자주 나왔다. 공포를 느끼는 정도는 사람마다 다르겠지만 개인적으로 위의 이유들로 인해 영화에서 의도한 공포 요소들이 제대로 전달 되지 못한 거 같아 아쉽다."
살목지,네티즌,1.0,기대했는데 기대가 안된 작품
살목지,네티즌,2.0,공포가 안 느껴지는 게 공포.
살목지,네티즌,2.0,갑툭튀한다고 무서운게 아니에요
살목지,네티즌,1.0,개구라치지마세요이게 뭐가 무섭나요???ㅌㅋ연기는 좋아요
살목지,네티즌,1.0,스토리가없음 결말도 이해못하겟음 놀라지도 않을정도로 긴장감도없음
살목지,네티즌,1.0,세력은 존재한다. 아무도 믿지 마라
살목지,네티즌,4.0,이번에도 평점에 속았네 ;;; 5점 이하고 정말 재미없게 봤음사실상 내용이 없음
살목지,네티즌,2.0,"이게 9.66점??? 구라 ㄴㄴ 이렇게 연기 잘하는 배우들 데리고 ㅠ 넘 실망스러움 유치한 연출,,, 뻔한 스토리 ,,,"
살목지,네티즌,1.0,알바 화력이 역대급인 영화!
살목지,네티즌,4.0,그냥 흔한 공포영화 그 이상 그 이하도 아님
살목지,네티즌,6.0,"기대를 너무 많이 해서 아쉽네요 영화관에서 볼정도는 아닌거 같아요 2인28000원 아깝 ,,,"
살목지,네티즌,4.0,갠적으론 공포감 스토리 전부 아쉽네요…. 연출은 괜찮네요 시간떼우기용으론 괜찮습니다..
살목지,네티즌,10.0,연기구멍없고 연출 루즈하지않게 잘표현함 한국공포영화 오랜만에 잘만든거 나온듯 개인적으로 적당히 무섭고 재미있었음 추천
살목지,네티즌,2.0,여기 댓글부대 넘 심하네요.연기자들 팬들인건지개봉전부터 진짜 보고싶었는데말은 아끼겠습니다.
살목지,네티즌,10.0,오랜만에 재밌고 짜릿한 공포 영화였고 배우들 연기가 모두 좋아서 몰입 할수밖에 없었음! 기회가 된다면 또 보고싶음.
살목지,네티즌,10.0,일단 공포영화러버로써 엄청난 기대를 가지고 관람하열어요. 물귀신 소재도 신선하고 특히나 감독님의 연출센스가 돋보이더군요. 한국 공포영화하면 곤지암이라고 하던데 이제 살목지로 갱신 가능하지않을까..감히 예측해봅니다. 배우분들의 연기가 너무 안정적이고 구멍하나 없이 온전히 그 캐릭터로 느껴졌어요. 부담스러운 신파도 없고 정말 군더더기 없는 깔끔하고 맛있게 무서운 공포영화였어요 추천드립니다!
살목지,네티즌,10.0,귀신이나 심괴 무서워하는분들 보면 보다 나오고 싶을정도로 무서움. 스토리가 좋고 이런것보다 순수 공포로 귀신의집 체험하는 느낌임.
살목지,네티즌,2.0,알바풀은거같은데 심야괴담이 더 무섭
살목지,네티즌,1.0,또 몰카 당했다 점수 높을 영화가 아님댓글보고 기대하고 갔는데 놀라긴하나 무섭다는 별로?..
살목지,네티즌,1.0,여주 개발암 걸릴거 같고 등장인물들 하나같이 생각없는게 답답
살목지,네티즌,4.0,"최악의 영화.... 공포도 그닥인데, 내용도 없어서 뭘 보라는건지 모르겠음"
살목지,네티즌,4.0,알바가 정말 있는건지. 아니면 취향의 차이인지 몰라도 그저그런 저예산 공포물. 뭐 딱히 반전도 없고.
살목지,네티즌,10.0,대표님으로 나오시는분 연기 진짜 잘하심ㅋㅋㅋㅋ보면 알게될 것임
살목지,네티즌,10.0,간만에 머리 식히는 영화였네요. 굿 강츄츄
살목지,네티즌,10.0,귀신을 부르는 앱영을 이정도로 만들지 그랬냐 잘할거면서 왜그랬어
살목지,네티즌,10.0,공포영화 좋아하는데 너무 재미있었어요 ! 시간가는줄 모르고봤고 기대했던거보다 무섭고 스토리도 탄탄해서 재밋게봤어용 남자친구랑 둘다 오랜만에 공포영화다운 공포영화봤다고 너무 좋았습니당 : )
살목지,네티즌,10.0,근래 최고는 노이즈였는데 순위가 바뀜 정말 무섭다 잼있다 말이필요없다
살목지,네티즌,1.0,왤케 재미가 없죠 돈 아깝네요
살목지,네티즌,10.0,공포못보는 사람이라 걱정했는데 역시나.. 나만 소리지르고있는듯했음 ㅋ 그래도 뛰쳐나갈정도의 공포는 아니였어서 끝까지 재밌게 잘봄 ㅎㅎ 그리고 무엇보다 각자맡은 배역들을 다들 너무 잘하셔서 연기구멍이없어서 너무 좋았음..! 밤에 혼자보지마시고 꼭 둘이상은 보러가길 바라며 (기왕이면 스크린x나 4d로 보셔도 좋을듯)
살목지,네티즌,4.0,일단 연기는 괜찮았지만 스토리가 너무 지루했고 공포영화라면 무서워야 되는데 무섭지가 않네요... 살목지라는 맛있는 재료를 살리지 못한 것 같습니다. 국내 영화중 곤지암과 비교를 하면 곤지암이 더 재밌는 정도? 입니다.극장에서 돈주고 보기엔...
살목지,네티즌,10.0,"오랜만에 긴장감 있는 한국공포영화 였습니다~ 많이 무섭진 않았지만 스토리 구성도 좋고 쫄깃하기도 하고,,시간이 금방 지나갔네요~ 추천합니다!"
살목지,네티즌,10.0,잘 봤습니다. 심장 쫄깃하게 만드네요 4d로 봐서 더욱더 재미 있었습니다 믿고 보는 혜윤배우님 덕분에 더 잘봤습니다
살목지,네티즌,9.0,공포영화인데 신선한 부분들이 있어 흥미로웠고요. 연출이나 배우들 연기가 좋았어요. 스토리나 서사가 조금 더 들어갔으면 어땠을까 싶네요.
살목지,네티즌,6.0,그냥 그래요... 그냥 그래...막 엄청 기대하고 봐서 그런가그렇게까지 무섭진 않아...그리고 귀신이 너무 대놓고 나오는 느낌긴장감 없이...그리고 좀... 클래식해서 언제 나올지 예측은 됨그래도 신선한 연출도 있고 나름 재미는 있었다그치만?? 그냥 그랬다 전체적으로
살목지,네티즌,10.0,"관람이 아니라 체험을 하고 온 것 같아요 온몸이 뻐근 ㄷㄷㄷ시사회랑 개봉일인 오늘 2회차 관람 했는데 처음엔 그저 무서워서 꺅꺅 거리고 왔다면, 2회차엔 오히려 더 내용이 궁금하고 뒤에 숨은 얘기들이 궁금해지더라고요.배우분들 연기도 좋아서 만족 합니다!"
살목지,네티즌,10.0,갑툭튀가 진짜 많음. 무서운거 잘보는사람한테 추천함!
살목지,네티즌,10.0,역대급이었습니다. 배우들 연기 다 잘하고 몰입
살목지,네티즌,10.0,곤지암보다 더 재밌었어요
살목지,네티즌,9.0,공포물 좋아하는 마누라 끝날때까지 비명지름 ㅋㅋㅋ 근데 마누라뿐 아니였음 . 나름 괜찮은공포물한컷도 놓칠수없는 집중력
살목지,네티즌,10.0,곤지암 이후 간만에 꿀잼 영화요
살목지,네티즌,10.0,뭐야ㅋ 눈감고봤더니 하나도안무섭네
살목지,네티즌,8.0,귀신비주얼 소름!! 개간지!!
살목지,네티즌,10.0,긴장의 끈을 놓을 수 없는 몰입감 쩌는 공포영화라 시간순삭이었어요.
살목지,네티즌,10.0,그냥 존내 무섭다.무조건 봐라 후회안한다.
살목지,네티즌,10.0,고요함 속에 스산한 공포가 좋았음.잔인하지 않고 억지스럽지 않게 연출이 된것 같아서 심야괴담회에서 보았던 그런 공포스러움이 느껴졌다.
살목지,네티즌,10.0,테토력 100% 에겐남입니다 여자친구랑 소리지르고 울면서 봤습니다. 단연코 한국 공포영화 중 1등이라고 해도 과언입니다. 완전 냥냥냐코 추천입니다
살목지,네티즌,10.0,너무무서워용 곡성이후로 무서운거같음
살목지,네티즌,10.0,세정이랑 남자 도망갈때인가 자동차 로드뷰 앵글? 그런걸로 악마 얼굴 같은거 보이게한 부분 있었는데 신기했었음
살목지,네티즌,10.0,너무 재밌었음. 공포영화가 그냥 짜증만 나게 하고 내용 이해도 안 되고 억지스러운 거 진짜 싫어하는데 이건 나중에 알게되는 스토리 뒷내용이나 공포 포인트들이 맘에 들었움. 혼자 보러 가도 ㄱㅊ을 거 같고 연인이랑 봐도 좋을 듯. 김혜윤이 연기 잘하구 이종원 잘생김
살목지,네티즌,10.0,재미지고 무서움 시간 순삭 그런데 집에가기 무서움
살목지,네티즌,10.0,사운드 땜에 더욱더 몰입해서 봤고 중간중간 깜짝 뭔가가 갑자기 튀어나오는 것이 진짜 무서웠지만 재밌게 잘 봤고 하나의 장소가 주는 공포감이 너무 좋았습니다.
짱구,실관람객,10.0,관람객
짱구,실관람객,1.0,관람객
짱구,실관람객,2.0,관람객
짱구,실관람객,5.0,관람객
짱구,네티즌,10.0,무조건 의리로 본다!!
짱구,네티즌,10.0,믿고보는 정우의 연기개봉전 부산 무대인사때 봤는데 웃음과 감동이너무 재밋게 봤습니다정우 배우 무대인사 매너도 짱!
짱구,네티즌,10.0,정우연기가 다했다처음연출인데 담백하고 여운이남는다
짱구,네티즌,10.0,가볍게 보기 좋았습니다즐거운 연기에 많이 웃다가 왔어요
짱구,네티즌,10.0,처음부터 웃다가 눈물 글썽이다가 공감되는 부분도 많고 재밋게 봤습니다~~
짱구,네티즌,10.0,가볍게 보기 재밌음~ ㅋㅋ
짱구,네티즌,10.0,영화 보는 내내 짱구와 함께 울고 웃었습니다20대 초반에만 가질수 있는 꿈을 향한 순수한 감정과 사랑경험까지 너무 재밌게 본 영화라 추천 추천 또 추천하고 싶습니다
짱구,네티즌,10.0,"정말 힐링되는 영화입니다!! 바람 보신 분들은 꼭 보시고, 안 보신 분들도 재밌게 즐기실 수 있습니다!정우, 크리스탈 파이팅!!"
짱구,네티즌,10.0,기대없이 봤는데 재밌었어요 웃긴장면도 많고!!
짱구,네티즌,10.0,"이런저런 특수효과없이 정말 연기로만 그 시절의 부산과, 누구나 자신의 한때를 생각할 수 있는 시간들을 보여줘서 너무 좋았습니다. 정말 재미있게 봤어요. 감사합니다."
짱구,네티즌,1.0,최악이다 최악이다 최악이다
짱구,네티즌,2.0,바람 후속작이라 생각하고 오는 사람 많은 거 같던데 그냥 아예 다른 영화임. 그거 까지는 뭐 바람2도 아니고 괜찮은데 영화가 알맹이가 없음. 등장인물 하나하나 그래서 뭘 얘기하고 싶은건지 모르겠음. 끝에도 결국 뻔한 예상 가는 신파. 정우가 투자까지 한 영화라고 들었는데 그냥 자기 자신에 대한 이야기를 닮고 싶었던듯함. 근데 그게 딱히 재미가 없음.
짱구,네티즌,1.0,"저 정우 배우 좋아했습니다. 근데, 이건 좀 아니지 않습니까?"
짱구,네티즌,1.0,OTT에 내기에도 민망한 영상물지구야 미안해
짱구,네티즌,1.0,의리로 봤다 근데 의리로 거짓말은 못하겠다왜 중간에 껑충 뛰어넘는 것 같지.. 마무리가 왜 이런데..
짱구,네티즌,1.0,왜 만든지 모르겠음 의도가 뭐지 ㅋㅋ...그냥 화류계 아가씨 만난거 자랑하려 만들었나
짱구,네티즌,2.0,아주 재미있게 바람을 보았고 그래서 짱구도 보았다. 짱구에서 바람을 기다렸다. 그것도 한참 계속짱구에는 바람은 없고 정우가 있었다.
짱구,네티즌,1.0,진짜 의리로볼생각하지마세요.바람이랑 개연성아에없고 .. 그냥 바람이름팔아서 관객수채울려는듯...
짱구,네티즌,2.0,일기는 일기장에 잩난하나
짱구,네티즌,2.0,보다가 나왔네요...바람을 보고 다소 기대해서 그런지 완성도가 처참합니다..ㅜㅜ 걍 잔잔히 시간버리고싶으신 분만 보시길.. 넷플로 나와도 안볼정도입니다...
짱구,네티즌,2.0,다 알바냐 속았네 기대를 너무 많이 했나봄
짱구,네티즌,4.0,바람의 기대를 부산앞바다에 수장시켜버린 정우의 자전적 욕심덩어리 졸작. 차라리 안만드는것이 나았다.
짱구,네티즌,4.0,술먹다가 영화 만들었나..
짱구,네티즌,2.0,지루함 2시간이 너무 안감..남자는 몰라도 여자는 보는거 비추오랜만에 영화관에서 영화보다 나오고 싶었음
짱구,네티즌,2.0,친구한테 영화보자고 하고 봤습니다끝나자마자 사과했습니다.밑도끝도없는 사투리에 뭘 말하고 싶은지 모르겠는 전반적인 내용끝에서야 부랴부랴 넣으려는 억지감동중간에 조금 조금씩 웃기려는 장면들이 여럿있고 웃었지만 그거 조금 웃으려고 추천하진 않을듯
짱구,네티즌,1.0,영화를 조금 본 사람이라면 아주 쉽게 거를수 있는 영화
짱구,네티즌,2.0,돈 내고 보기 너무 아깝습니다. 너무 재미가 없어요
짱구,네티즌,1.0,3점짜리 영화인데 알바들 때문에 1점 줌.
짱구,네티즌,1.0,그냥 보지마세요. 너무 재미 없어요ㅠㅠㅠ
짱구,네티즌,1.0,"정말 모든게(연출, 연기, 음악, 스토리) 엉망인 영화바람2를 기대했다면 절대 보지마라그냥 짱나게 구질구질한 영화"
짱구,네티즌,2.0,차라리 짱구는못말려를 볼 걸 그랬음
짱구,네티즌,4.0,이러지말자 진심 댓글알바가 있구나선진대한민국이라며 ..
짱구,네티즌,10.0,배우들 연기와 스토리가 좋았습니다
짱구,네티즌,2.0,실관람객 평점 7.79?? 트루먼쇼인 줄 알았다가 평론가 평점 보고 편안해짐.
짱구,네티즌,1.0,돈주고 시간버렸네요 보면서 어이가없는 영화입니다 손절하고싶은 지인있으면 주변에 꼭 추천하세요
짱구,네티즌,10.0,바람과는 또다른재미가 있다. 웃기고 눈물도 좀 나고. 웃으며 보는 영화!
짱구,네티즌,1.0,진짜 역사상 최악의 영화다
짱구,네티즌,1.0,방금 내 앞에 커플 1팀 아저씨 2명 중간에 나갔다 나도 도저히 못볼거 같은데 약속시간때문에 버텨야되서 어쩔수 없이 리뷰나 쓰러왔다 한숨만 한 30번 쉰거 같다..진짜 진심으로 내생에 최악의 영화다
짱구,네티즌,1.0,영화보는데 의리가 얘기가 왜나옴? ㅋㅋ
짱구,네티즌,1.0,이따구로 만들다니 참 드럽게 재미없네 정우는 감독 말고 연기나 해
짱구,네티즌,1.0,내용도 엉성하고 포인트도 없고 돈날리지 마십쇼 평점 8점 절대 아니고 잘줘야 3점짜리 영화입니다
짱구,네티즌,6.0,뭔가 있겠지 하고있다 끝남
