제목,작성자유형,평점,리뷰
좀비딸,실관람객,2.0,이런 영화가 500만이라는게 신기하네요 평점이 높다는 것도 신기하고... 썸이랑 갔는데도 영화가 너무 재미없어서 하품만 나오고 감동포인트를 너무 억지로 만드는 B급영화원작을 본 사람은 재밌게 본다던데 원작을 봤음에도 재미가 없었습니다.
좀비딸,실관람객,4.0,유튜브에서 웃긴장면을 다봐서 그런지본편을볼땐 그냥그랫어요ㆍㆍㆍ
좀비딸,실관람객,6.0,걍 소소하네요 정가로 봤으면 돈아까웠을거 같아요 재밌지도 않고 유치해요
좀비딸,실관람객,1.0,정말.. 아무리 컨셉이 좋다 해도.. 이리 못 만들 수가 있나요?
좀비딸,실관람객,1.0,죄송합니다 연기 좋았는데 댓글 알바로 보이는 후기들이 너무 많네요 10점짜리 후기에 공통적으로 세줄 네줄 되는 평들이 계속 올라옴 후하게 줬다치곤 너무 후하게 점수줌 계속 개그 터지는 게 아니라 초반부 이후 지루하게 가다가 끝남
좀비딸,실관람객,5.0,좀 별로였는데 흥행한게 좀 신기합니당
좀비딸,실관람객,6.0,"대책없이 유치찬란하게 굴다가, 어김없이 울라고 강요하네! 그나마 이정은배우가 구원이다"
좀비딸,실관람객,3.0,"좀비로도 보이고 사람으로도 보이는 그 딸처럼, 졸작과 망작 사이에서 사무치도록."
좀비딸,실관람객,5.0,"만4천원에 볼정도는 영화비가 너무 비싸다.. 통신사 할인혜택으로 영화비 왕창 올려놓고 슬금슬금 통신사 혜택 다 줄이는건 뭐냐;;;솔직히 이제 관람객들도 똑똑해서 말같지도 않은 스토리 전개에 공감하지않음..좀비라는것 자체가 비현실이기때문에 그 내용을 현실에 접목한 모든 부분을 비현실로 해석하지않는다.. 학교야 안가면 되고, 곧 서울로 돌아갈거라 여기학교는 안다닌다고하면 된다. 딸이 발각되면 죽는데. 숨두고있으면서 놀이공원에 데려가려는 억지 스토리 전개는 공감할수없다."
좀비딸,실관람객,6.0,그냥 그래요... 관객 수 200만명 넘었길래 재밌나 보다 하고 봤는데 음.. 그냥 저냥 막 지루한건 아닌데 그렇다고 재미있는것도 아니고 ..
좀비딸,실관람객,10.0,연기들을 다 너무 잘해서 재밌게 봤음ㅋㅋㅋ가볍게 보기 좋은 영화
좀비딸,실관람객,10.0,연기 1등 조정석2등 애용이Feat. 귓가에 맴도는 넘버완
좀비딸,실관람객,4.0,웃어야 되는데 안 웃겨서 난감함. 진부한 신파에 중학생 아들도 실망.
좀비딸,실관람객,2.0,좀비연기는 어색하고 억지감동에 뻔한 스토린데 이렇게까지 인기많을 일인가
좀비딸,실관람객,6.0,가벼운 영화. 나랑은 웃음코드가 안맞아서 좀 지루했다. 주변에는 웃고 우는 사람 있던데 나는 무표정. 유튜브에 쇼츠로 하이라이트 많이 뜨는거 보고 본건데 그게 전부였음.
좀비딸,실관람객,2.0,언제 끝나나 시계 계속봄ㅠㅠ 별 웃기지도 않고~~ 감동도 없고~~ !!
좀비딸,실관람객,1.0,전형적인 김치무비 돈낭비시간낭ㅂㅣ 배우들도 정신차려라 이딴거에 필모그래피 남기고싶냐
좀비딸,실관람객,6.0,잔잔하게 웃기면서 감동도 있고 결말도 깔끔. 특히 이정은님 할머니 연기가 좋았음.
좀비딸,실관람객,1.0,알바들이 만든 300만.알바들 진짜 능력자들!
좀비딸,실관람객,4.0,관람평 보고 영화 봤는데 완젼 실망이요 ㅜㅜ
좀비딸,실관람객,2.0,악플달고싶지않은데 ㅠㅠ별로입니다처음엔오그라들고 후반부에 감동잇어요
좀비딸,실관람객,4.0,몇몇 배우들의 호연에도 불구하고 진부함과 유치함에 신파까지 더해져 아쉬움과 안타까움만 남네요.
좀비딸,실관람객,2.0,"딸 때문에 보러 갔지만, 너무 저예산 b급 영화 느낌이고, 스토리도 너무 부족, 연기도 어색, 부산행의 마지막 장면만 가져다 쓴 듯한."
좀비딸,실관람객,4.0,"약한 코미디, 강한 신파"
좀비딸,실관람객,5.0,평점 만큼 재밌진 않고 볼만함
좀비딸,실관람객,2.0,원작보다 너~무 재미없고 오글거리고 너무 신파에만 치중되었음개그요소가 부장님급임
좀비딸,실관람객,7.0,"원작 각색을 잘한축에 속하는 영화. 개인적으로 결말은 원작보다 더 좋다고 생각함. 다만, 원작에없던 춤얘기나 넘버원은 너무 촌스러웠고 특히 조정석이 방에서 혼자 상상하는 신파씬은 덜어냈어야…"
좀비딸,실관람객,10.0,조정석 미쳤다ㅋㅋㅋ 그냥 사람을 울리고 웃기고 가만두질 않네 여름의 남자 인정합니다... 요즘 너무 더우니까 영화관 가서 가족들이랑 같이 보기 딱 좋은 영화일듯 그리고 고양이 좋아하시는 분들 꼭 보러가세요
좀비딸,실관람객,10.0,좀비물 하면 뻔한 소잰데 시각이 다른 전개라 잼나요. 간만에 제대로 웹툰 리멕작 잘 나왔어요. 애용이 넘 좋앙!
좀비딸,실관람객,4.0,이런 영화가 성공하니 한국영화가 이 모양인걸까
좀비딸,실관람객,1.0,유 스틸마 타임 ㅎㅎ 보기 힘드렀당
좀비딸,실관람객,1.0,초고농축 신파 덩어리.... 그리고 그래야 먹히는 씁쓸한 현실...
좀비딸,실관람객,6.0,좀많이 유치하네요 배우가 아까운..
좀비딸,실관람객,2.0,개연성 없는 스토리와 별로 안 웃긴 코미디 요소
좀비딸,실관람객,5.0,아빶 눈물 나긴 했음 피식피식 조금 웃김 근데 중간에 잠와서 졸았음 근데 그게 다임
좀비딸,실관람객,6.0,코미디도 신파도 싫어한다는 걸 깨달음
좀비딸,실관람객,4.0,애용이는 귀여웠습니다
좀비딸,실관람객,8.0,그냥 초등학교 아이들이좋아했어요.제 기준엔 그닥 좋은영화는 아니었네요.
좀비딸,네티즌,1.0,"누군가는 진실을 말해야 한다고 생각합니다말도 안되는 개연성, 억지 감동, 억지 신파, 미동도 안가는 개그… 돈 아끼세요"
좀비딸,네티즌,1.0,"평점알바에 속았습니다.. 너무 지루해서 무표정으로 봤고 몇명은 아예 나가버림. 웃음도 재미도 감동도 없고, 배우들 연기와 억지개그, 신파로 버무린 20년전 한국영화 스타일. 발로 연출하고 대충만들어도 10점주니까 관객이 만만한가? 할인쿠폰도, 돈도, 시간도 ..."
좀비딸,네티즌,1.0,엄청 재밋는줄알았는데 막상보니...쫌 실망햇어요ㅠㅠ
좀비딸,네티즌,1.0,평점 실화인가요?_?지인이 재밌다해서 갔는데...진짜 핵핵핵핵 노잼....어디가 슬프고 어디가 재밌는지도 모르겠는...영화끝나고 다들 ????이표정..총을 그렇게맞고 안죽는건 또 뭐고...생각나는건 보아노래밖에 없음 그리고 노래도 완전 옛날노래^^..내가 제일잘나가는 뭐고...
좀비딸,네티즌,2.0,아~관람평 확실한가요? 그냥 말이 안 나오네요최악이였습니다
좀비딸,네티즌,2.0,그닥 재미도 감동도 와닿지 않았음
좀비딸,네티즌,1.0,유치 뽕짝 초딩 영화입니다
좀비딸,네티즌,1.0,네이버 평점 믿고 영화보러가시는분들다시생각하세요~ 아직도 별점 알바있는듯....
좀비딸,네티즌,2.0,세싱에 웃기지도 않고 (억지웃음깅요) 액션도 후벼파는 감동도 없는데…. 그냥그러려니…. 하는 부녀간의 사랑정도…임팩트만…이렇게 열광하다니…다행이다 극장에사람이 나오니…. 평점 9점에 놀란 영화인 드림….
좀비딸,네티즌,1.0,심형래 라스트갓파더 이후 이런 감정은 처음.감독 연출 똥망에 억지신파 예고편 보고 개봉일에 본 내가 밉다
좀비딸,네티즌,1.0,누군가는..말해줘야해....제발 보지마세요....이딴걸 영화라고 만들었냐
좀비딸,네티즌,1.0,진짜 개노잼이다 인생을 낭비했다 싶을정도로 지루해서 중간중간 잠들었음 이거 왜 리뷰가 좋은거에요ㅠ 애용이도 중간중간 ai 개티남
좀비딸,네티즌,1.0,와 ㅅㅂ 알바 존나 많네 빵원티켓도 아깝긴 올만이네 ㅋㅋ
좀비딸,네티즌,2.0,유치 합니다.. 여자애들은 좀 웃는듯 단순한 사람들한테는 웃길지도?
좀비딸,네티즌,2.0,한국영화발전을 위해 기부했다 생각할게요네플릭스로 나와도 보기힘들거같아요
좀비딸,네티즌,1.0,진짜 오랜만에 극장 갔는데 역시나 이러면 한국영화는 답이 없다....억지 코메디에 신파...
좀비딸,네티즌,2.0,뻔한스토리 ocn에서 매일 틀어줄 영화 굳이 돈주고
좀비딸,네티즌,1.0,알바들 바글바글그렇게 살지 마라
좀비딸,네티즌,4.0,응?평점이 이렇게 높다구요?남편이랑 영화가 끝나서 걸어 나올 때 헛웃음 지으면서 나왔음.. .
좀비딸,네티즌,1.0,지루하고 재미없어요.. 피하세요
좀비딸,네티즌,1.0,어이없는 영화..10점은 알바인걸로ㅜ
좀비딸,네티즌,1.0,보지마시길....시갼 아까움.
좀비딸,네티즌,1.0,이게 왜 9점대인지 이해가 안돼요..영화관서 볼 영화는 확실히 아닙니다..
좀비딸,네티즌,1.0,f1 더무비 볼 때 시계 0번 봄 드래곤 길들이기 시계 1번 봄 전독시 시계 7번 봄 좀비딸 시계 16번 봄
좀비딸,네티즌,1.0,10점준 알바들때문에 평점 믿지를못하겠네 극장용은아님 지루하고 웃음도감동도 없고 갑자기 끝나버림
좀비딸,네티즌,3.0,조정석 이대로 괜찮은가 ㅋㅋ파일럿에 이은 시나리오 보는 눈.
좀비딸,네티즌,1.0,한번도 안웃었다 유치 노잼 이걸 왜 ?
좀비딸,네티즌,1.0,원작과 내용이같다면 원작도 저는 별로..억지스러운전개 억지스러운캐릭터에 신파요소까지해서 참..
좀비딸,네티즌,10.0,하나도 안웃긴것 처럼 웃기게 연기하는 조정석의 연기는 정말 최고입니다. 또 유치한 영화를 만들었네 하다가도 감동의 눈물로 돌아섭니다.
좀비딸,네티즌,2.0,고양이 밖에 생각이 안나내요
좀비딸,평론가,2.0,몸이 굳어가는 한국영화에 생기를 불어넣는 항체가 되기를
좀비딸,평론가,2.0,간결하고 정확한 스윙으로 쌓아올린 웃음 타율
좀비딸,평론가,2.0,"기묘한, 가족 신파"
좀비딸,평론가,2.0,어릴 적 사랑 담긴 배방구를 부르르 받은 것만 같이 웃음이
좀비딸,평론가,2.0,시큰둥한 사람까지 기어코 울리겠다는 의지
F1 더 무비,실관람객,8.0,우스만 뎀벨레 명품연기 잘 봤습니다.챔피언스리그 우승 축하드리고 축구와 연기 두마리 토끼 모두 잡았네요.
F1 더 무비,실관람객,9.0,"저렇게 살고, 저렇게 죽고싶게 만드는 것. 만가지 미학과 이론에 선행하는 영화적 감동의 본령."
F1 더 무비,실관람객,10.0,"땅건 사운드 미쳤습니다. 상영관 바닥도 울려버리네요. 이건 꼭 극장에서, 그것도 아이맥스, 돌비, 광음과 같은 특별관에서 보셔야 합니다! 출력이... 와....대박"
F1 더 무비,실관람객,10.0,"F1 쥐뿔도 모르지만 빵형 하나 때문에 아이맥스로 봤습니다. 근데.. 그 안에 녹아있는 드라이버들의 노력, 팀원들의 환상적인 팀웍과 노고, F1만의 전술, 그리고 타이어의 중요성까지. F1 뽕 제대로 차며 정말 오랜만에 심장 뛰는 영화를 봤습니다."
F1 더 무비,실관람객,9.0,극장이 존재해야 하는 이유
F1 더 무비,실관람객,9.0,폭발하는 도파민과 압도적인 ‘카’타르시스
F1 더 무비,실관람객,10.0,레이싱 장면이 체감상 90퍼센트처럼 느껴지기에 아이맥스나 돌비 추천. 음악도 잘 나와서 눈과 귀 다 즐거움. 그리고 브래드피트 왜 이렇게 멋있냐
F1 더 무비,실관람객,9.0,"스토리는 살짝 아쉽긴하지만 연출,cg 이런건 압도적이다. 내가 직접 레이싱 하는느낌도 있고 시원시원함"
F1 더 무비,실관람객,9.0,헤리케인도 라라랜드에서 연기 잘 하던데 뎀벨레도 꿀리지 않네요. 광음시네마로 생생한 현장감 느끼며 끝내주는 음악과 소울을 울리고 왔네요.
F1 더 무비,실관람객,7.0,낭만과 멋을 아는 올드스쿨 형님들.
F1 더 무비,실관람객,10.0,나도 2시간 반동안 F1 시트에 앉았다.
F1 더 무비,실관람객,7.0,'그' 순간에는 음악조차 필요 없었다
F1 더 무비,실관람객,10.0,탑 건이후로 가장 만족.처음으로 네이버에 별점남깁니다.
F1 더 무비,실관람객,10.0,브래드피트는 늙어도 브래드피트다
F1 더 무비,실관람객,10.0,"f1 팬으로서 이런 영화 만들어줘서 고맙습니다,,"
F1 더 무비,실관람객,10.0,극장에서 보는걸 강추!!영화보고 뽕에 취해엑셀 밟는건 주의!!안전운전하세요~
F1 더 무비,실관람객,10.0,탑건의 골수팬으로서 가히 땅건이라 부르고싶음
F1 더 무비,실관람객,10.0,뭐이런 영화가…이건 꼭 영화관에서 봐야돼….
F1 더 무비,실관람객,10.0,브래드 피트 나이 먹어도 왜 이렇게 멋있냐
F1 더 무비,실관람객,8.0,OTT가 줄 수 없는 환희와 감동. 미친 듯이 달리면서 왜 달리는 지를 생각한다.
F1 더 무비,실관람객,10.0,뜨거운게 뭔지 아는 영화
F1 더 무비,실관람객,10.0,이 영화를 보고 난 후 제 sm5가 M5가 되었습니다.
F1 더 무비,실관람객,9.0,나이가 들어도 젊음을 유지할 수 있는 건 나를 던질 정도로 열정을 갖고 있는것 아닐까. F1 레이싱에 대해서 잘 몰라도 재미있게 즐기실 수 있는 영화.
F1 더 무비,실관람객,10.0,4DX 기준. 정말 레이싱 하는 기분이 들게 하는 영화. 유니버설스튜디오에 놀이기구 타는 느낌. 집에 장난감 핸들이라도 있다면 가져가시길… 마지막 제로의 영역에 들어설 때의 그 경험은 정말 어디에서도 못느껴볼 감동적인 경험이었습니다 ㅠ 몰입만으로...
F1 더 무비,실관람객,10.0,흥미진진해요 도파민터지고 졸려죽겠다는 신랑 끌고갔더니 좋아죽네요
F1 더 무비,실관람객,9.0,인물 간의 깊은 서사는 조금 부족할지라도 레이싱의 심장 떨리는 그 긴장과 전율은 놀랍도록 극적으로 표현했기에 시간 가는 줄 모르고 재밌게 봤음. 돈값은 충분히 하는 충실한 팝콘무비였음! 마지막엔 뻔할지몰라도 나는 찡하고 감동적이었음
F1 더 무비,실관람객,8.0,브래드 피트는 언제까지 멋있는 거야
F1 더 무비,실관람객,10.0,"진짜 까리하다 영화 ㅋㅋㅋㅋ 모르고 봐도 이거 탑건감독이 만들었네 싶은 멋, 깔끔함이 있음 어떻게 이렇게 한정적인 스토리에서 미션임파서블 보는 듯한 긴장감을 주는지 대단함. 특정 순간에는 영화관 인원 전체가 같이 몰입하면서 응원하고 있다는 느낌이 들어서 특별한 경험이었음 완전 강추."
F1 더 무비,실관람객,7.0,한계를 돌파하는 순간의 고요함과 폭발을 담았다.
F1 더 무비,실관람객,10.0,돈 보다 중요한 우리 삶의 우선순위를 한번 생각해 볼 수 있어서 좋았습니다. 극장 관람 필수입니다.
F1 더 무비,실관람객,10.0,아직 안본건가??? 부럽다...레고 f1 사러가는중..
F1 더 무비,실관람객,10.0,개미침.. 육아스트레스 뻥 날림. 4디엑스로 꼭 봐야함.. 브래드피트가 이렇게 섹시하다니... 노인네인데 섹시미 폭발 노인... 눈빛이 미쳤다!!!
F1 더 무비,실관람객,9.0,와 사운드 진짜 미쳤다 ㅋㅋㅋㅋ 의자 진동때문에 진짜 옆자리 탄 줄 ㅋㅋ 삽입곡도 다 너무 좋고 로제님 노래도 있더라구요 ㅎ 무엇보다 빵형 너무 멋있음 진짜 ㄹㅇㄹㅇ!! 스토리는 살짝 아쉬워서 무조건 영화관에서 봐야할듯해요.. 광음이 돌비보다 섬세함이 아쉽긴한데 레이싱하는장면이 많아서 강추! 아맥이랑 포디도 볼까 고민중
F1 더 무비,실관람객,10.0,너무 재미있게 봄근데 로맨스는 굳이?
F1 더 무비,실관람객,10.0,이게 영화지 28년후 보고나서 보니깐 속이 다시원 분노바이러스 치료받게됨
F1 더 무비,실관람객,10.0,진짜 개재밌습니다...
F1 더 무비,실관람객,10.0,집에서 본다는 이상한 생각하지말고 무조건 영화관에서 보세요
F1 더 무비,실관람객,10.0,영화관을 가는 이유를 알려주는 영화
F1 더 무비,실관람객,10.0,F1 고증 안맞아서 불만들이 있는데 나같은 차알못들한텐 오히려좋다극장에서 다큐를 보고싶은게 아님
F1 더 무비,실관람객,10.0,"탑건을 좋아했다면, 꼭 봐야 할 영화자동차는 늘 남자의 가슴을 뛰게한다"
F1 더 무비,실관람객,10.0,영화관에서 봐야하는 영화 지인한테 재미있다고 추천할수있는영화
F1 더 무비,실관람객,7.0,브래드피트와 중2가 레이싱하는 영화
F1 더 무비,실관람객,10.0,f1 찐팬으로서 받아들이기 힘든 장면이 몇몇 있었지만… 그래도 너무 재밌었음
F1 더 무비,실관람객,10.0,스피드에 온몸을 맡기며 짱 재밌게 봤습니다. 빵형은 사람이 나이가들수록 무르익는다는 표현의 표본이것같아요. 젊을때나 지금도 완젼 멋지네요.
F1 더 무비,실관람객,9.0,극장에서만 할 수 있는 영화적 체험. 톰과 함께 하늘을 날고 빵과 함께 트랙을 달린다
F1 더 무비,실관람객,9.0,잘한다 잘한다 하니까 진짜 잘하네
F1 더 무비,실관람객,7.0,브래드피트 하비에르 바르뎀
F1 더 무비,실관람객,7.0,"어느 정도 예상되는 내용이지만 낭만과 떨림으로 커버한 영화, 아이맥스나 돌비시네마로 관람하는 걸 추천"
F1 더 무비,실관람객,10.0,제발.. 극장가서 보세요.. 정말 돈 아깝지않은 소중한 시간입니다. 정말 잘 봤어요 끝까지 소름이 미칩니다.
F1 더 무비,실관람객,8.0,오늘 빵 형의 탑건을 봤다.
F1 더 무비,네티즌,10.0,영화를 보고 집에 오는 길에 과속 단속에 걸렸습니다. 영화 보고 차 사동을 키고 엑셀에 발을 올렸는데 모든게 다 느려보이더라구요. 옆 차선 차가 끼어들라는거 평소였음 양보했을텐데 엑셀에 발이 올라갑니다. 물론 박아버리진 않았어요. 저에겐 소니도 조슈아도 ...
F1 더 무비,네티즌,10.0,그냥 ㅈㄴ 올해 가장 sexy한 영화.
F1 더 무비,네티즌,10.0,개쩌는 전율의 드라이빙
F1 더 무비,네티즌,10.0,이정도면 자동차 경주에서 최고로 보여줄건 다 보여준거다..스피드감이나 엔진음도 충분하다. 엘리멘탈에 이어 소문으로 나중에 엄청나게 흥행한 영화.
F1 더 무비,네티즌,10.0,올해 최고영화 특히 사운드 미친듯 너무 감동 입니다
F1 더 무비,네티즌,10.0,극장관람을 꼭 추천드립니다
F1 더 무비,네티즌,10.0,최고 아이맥스로 봐야함
F1 더 무비,네티즌,10.0,왜 영화관이 존재하는지 설명해주는 영화
F1 더 무비,네티즌,10.0,최근 2~3년간 봤던 영화중에 제일 재미있었음! 브레드피트 겁나 멋짐!!
F1 더 무비,네티즌,10.0,알고보니 손흥민 영화네요... SONNY 7
F1 더 무비,네티즌,10.0,"그냥 보세요. 두번 보세요.영상 퀄리티, 사운드 미쳤습니다. 남자라면 안 좋아할 수가 없는 엔진음.F1의 속도감, 브래드피트의 연기, ost 가 모두 조화롭게 어우러져 완벽 그 자체입니다.스토리는 독창적이지 않으나, 독창적이지 않은 스토리도 f1 이라는 소재가 다 커버해줍니다. 화면이 큰 극장일 수록 더 몰입해서 볼 수 있을 것 같습니다.꼭 보세요"
F1 더 무비,네티즌,10.0,넷플릭스가 영화관을 없애지 못하는 이유
F1 더 무비,네티즌,10.0,왠지 모르게 중년의 나에게 고생했다 말 해주고 싶게 만드는 영화. 그리고 틀리지 않았다고도 말 해주고 싶은 영화. 그리고 더 해보자고 격려해 주고 싶게 만드는 영화.
F1 더 무비,네티즌,9.0,OST가 chill하고 hip함..
F1 더 무비,네티즌,10.0,전직 레이서다. 내가 본 레이싱 영화중에 최고다. 꼭 4d로 보기를 추천한다.
F1 더 무비,네티즌,7.0,오글거림과 느끼함이 있지만 F1팬이라면 한 번쯤은 보는것도 나쁘지 않다. 말도 안 되고 억지스러운 장면은 제치고.. 레이싱 보는 재미는 있다. 물론 자신이 F1을 잘 안다면 불편하거나 말도 안 되어서 헛웃음 나오는 장면이 있을 수 있지만 판타지 영화라 생각하면 재미있게 볼 수 있다. 부족한 서사는 아쉽지만.. 방구석에서 TV로만 보던 엪원을 스크린에서 보는 것만으로도 감사하고 신기하달까?
F1 더 무비,네티즌,10.0,내 인생 최고의 영화! 탑건보다 더한 감동!!
F1 더 무비,네티즌,10.0,최고의 레이싱 영화. 꼭 극장에서 보세요
F1 더 무비,네티즌,8.0,영상효과나 음악은 좋았으나 연출적으로 빈약한 느낌이 강했습니다... 특히 싸우자! 하면서 책상 치는 거는 좀 많이 오글거렸습니다...
F1 더 무비,네티즌,10.0,오랜만에 돈 값하는 영화나옴
F1 더 무비,네티즌,10.0,와 이거슨.. 무조건 4dx.. 살면서 영화관에서 본 4dx 영화 중 1등임
F1 더 무비,네티즌,8.0,F1 팬이라면 한번쯔음은 볼만한영화~F1을 알면 오글 F1을 모르면 그냥 액션영화리카도가 없는 아쉬운 한편 ~
F1 더 무비,네티즌,10.0,시간이 어떻게 가는지 모르겠음 돌비로 추천 피트 형님은 왜 여전히 멋있으십니까
F1 더 무비,네티즌,7.0,"그 속도와 굉음은 매우 훌륭, 이야기는 평범하지만 오히려 그런 평범함이 특별함을 돋보이게 한다"
F1 더 무비,네티즌,10.0,"늙어도 멋있는 빵오빠 ,, F1 팬될듯"
F1 더 무비,네티즌,9.0,탑건:매버릭의 감독이 만든 영화. F1포함 블록버스터 영화 주인공들이 다 5060이라 많은 메시지를 준다. 쫓기듯 퇴직하는 수많은 베이비부머에게 영감을 줄 수 있길. 남과 비교하지말고 자신만의 타임라인에서의 '정진'이 의미있다. 승리가 고귀한게 아니고 어제의 나를 이기는것이 고귀하다..
F1 더 무비,네티즌,10.0,"내 인생 영화가 되었으며, 영화 끝나고 나자마자 또 보고 싶다는 생각을 들게 만든 영화였다. IMAX로 봤는데 더 큰 화면에서 보는 웅장함이 있었다."
F1 더 무비,네티즌,9.0,"그란투리스모에서 얻은 자동차경주지식이 이영화이해하는데 많은도움이 됐음ㅋㅋㅋ..이거보실분,먼저 그란투리스모보시면 한결 더 잘보실듯^^ㅎㅎ..재밌게 잘봤어요^^~~~"
F1 더 무비,네티즌,10.0,탑건을 능가하는 감동역시 한머 짐스
F1 더 무비,네티즌,10.0,무조건 4DX로 봐야 됩니다. 영화관이 존재하는 이유를 증명하는 영화입니다.
F1 더 무비,네티즌,10.0,세이프티카의 진가를 보여주는 영화
F1 더 무비,네티즌,10.0,올해 상영한 영화중 No.1
F1 더 무비,네티즌,10.0,영화관에서 볼 영화임 ㅎㅎ
F1 더 무비,네티즌,9.0,빵형은 .. 나이가 들어도 아무도 따라갈 자가 없구나 .. 60대 중반이 다됐는데 저렇게 멋질수 있단 말인가 .. 연기 보이스 몸매 완벽이다 ...
F1 더 무비,네티즌,10.0,말해뭐해 말해뭐해 말해뭐해
F1 더 무비,네티즌,10.0,대체 이 영화에 10점을 안주면 어디에 주시는 겁니까 형님 누나들인생 최고 영화 중 하나입니다. 정말 많이 재미있어요
F1 더 무비,네티즌,7.0,영화보고 나와서 오줌을 쌌는데.. 오줌대신 도파민이 나왔습니다.
F1 더 무비,네티즌,10.0,"두번 보니까 더 재밌네. F1 규칙도 눈에 들어오고 사운드와 OST도 귀에 들어오고 빌드업 하는 과정, 깨알 디테일, 복선 등. 뻔한 결말 어쩌고 하는데 아는 맛이 역시 맛있어요. 최고의 무대에서 하나의 목표를 위해 다 같이 노력하는 모습. 영화가 존재하는 이유. 여러분 두번 보세요."
F1 더 무비,네티즌,10.0,더위를 잊게하는 영화!
F1 더 무비,네티즌,10.0,음향좋은 극장에서 보세요
F1 더 무비,네티즌,10.0,극장에서 보세요 1인칭 시점 과 사운드 뭉클합니다
F1 더 무비,네티즌,10.0,이런 영화는 극장에서 꼭 꼭정말 오랜만에 느껴보는 극장영화였다마치 현장에서 보는듯한 느낌
F1 더 무비,네티즌,10.0,무조건 영화관에서 봐야 하는 영화 입니다.
F1 더 무비,네티즌,10.0,"F1 몰랐던 문외한도 그 매력에 빠지게 만드는 영화, 2회차 관람까지 했습니다 진짜 재밌어요ㅠㅠ"
F1 더 무비,네티즌,10.0,2025년 최고의 영화
F1 더 무비,네티즌,10.0,영화관에서 볼 수 있을 때 마음껏 봐두시길
F1 더 무비,네티즌,10.0,인생영화입니다 꼭 보세요 f1 좋아하시면
F1 더 무비,네티즌,10.0,미쳤다! TV로 보는 사람은 100% 후회한다.
F1 더 무비,네티즌,10.0,탑건보다 재밌어요 또 보고 싶음
