제목,작성자유형,평점,리뷰
28년 후,네티즌,1.0,진짜 통신사 vip아니였으면 돈아까워서 울뻔 했음
28년 후,네티즌,2.0,영화보고 리뷰 남긴적이 있는지도 기억이 안나는데 진짜 너무 별로라 남깁니다. 절대보지마세요 28주후랑 전혀 다른 영화입니다. 남자친구가 28주후 재밌대서 어제 28주후 보고 갔는데 진짜 기억에 남는건 알파의 거시기랑 예쁜 들판뿐이었습니다...
28년 후,네티즌,1.0,보면서 처음으로 나가고 싶었던 영화
28년 후,네티즌,4.0,"갑자기 인간의 죽음에 대한 성찰같은 걸 표현하려는 순간부터 도저히 참을 수가 없었다... 조디콤머가 나와서 뭔가 좀 할 줄 알았는데.... 맙소사 ㅠ내용도 어수선, 영상도 어수선... 뭔가 싶은 영화"
28년 후,네티즌,1.0,28년후가 아니라 28CM였다
28년 후,네티즌,6.0,뭔가부산행 흉내 낼려다 망한 느낌
28년 후,네티즌,1.0,별1점도 아까워요! 이런 영화는 처음이네요보다가 잠듬.
28년 후,네티즌,4.0,좀비물을 빙자한 휴먼 다큐멘터리
28년 후,네티즌,6.0,의사 아니고 장의사임.
28년 후,네티즌,1.0,이럴거머ㅕㄴ280년후도 나와라
28년 후,네티즌,2.0,좀비영화 아님;; 뭔가 그냥 경치 감상하라고 개봉한 느낌
28년 후,네티즌,1.0,2시간동안 롤이나 할껄
28년 후,네티즌,1.0,돈과 시간을 버리는 최악의 영화
28년 후,평론가,1.0,멈춰 있던 거대한 시곗바늘을 거뜬히 짊어진 채 전력 질주
28년 후,평론가,1.0,다양하지만 울퉁불퉁한 변형
28년 후,평론가,1.0,기괴한 방식의 메멘토 모리
28년 후,평론가,1.0,아포칼립스에서 소년들은 무엇으로 성장하는가
28년 후,평론가,1.0,좀비 장르를 생사의 의식(儀式)으로 이끌다
28년 후,평론가,1.0,원시로 회귀하고 죽음을 수용하면 오히려 인간은 진화할 수 있을까
바람계곡의 나우시카,실관람객,9.0,재개봉 덕분에 첫 관람했습니다. 처음에는 무난한 작품이라고 생각했는데 비슷하다고 느낀 미키17이 2025년 개봉작이고 이게 1984년 개봉작인 거 생각하면 나우시카가 정말 잘 만든 게 아닐까 싶습니다...
바람계곡의 나우시카,실관람객,9.0,이걸 다 손으로 그렸다는 점에서 그냥 박수가 절로 나옴
바람계곡의 나우시카,실관람객,8.0,잘엮고 잘푼영화....
바람계곡의 나우시카,실관람객,10.0,기대보다 더 재미있네요.
바람계곡의 나우시카,실관람객,9.0,"미야자키 하야오의 근원, 이것이 클래식"
바람계곡의 나우시카,실관람객,8.0,80년대 작품이지만 지금 봐도 메세지와 감동이 있다
바람계곡의 나우시카,실관람객,9.0,자연의 분노와 질서가 교차하는 미야자키 판타지의 원류.
바람계곡의 나우시카,실관람객,10.0,과거 지브리는 낭만그자체
바람계곡의 나우시카,실관람객,9.0,언제 또 재개봉을 해줄지 몰라서 개봉 첫날부터 보고 왔고 오랜만에 큰 스크린으로 봐서 좋았습니다
바람계곡의 나우시카,실관람객,10.0,"자연의 위협은 인간으로부터 왔음을, 기존의 방식이 아닌 조화로 살아가야 함을"
바람계곡의 나우시카,실관람객,10.0,이 영화를 영화관에서 볼 수 있어서 기쁘네요
바람계곡의 나우시카,실관람객,10.0,나우시카를 극장에서 보는 것 만으로도 벅찬다
바람계곡의 나우시카,실관람객,8.0,여러 면에서 미야자키 하야오라는 전설의 시작이라 불릴만하다
바람계곡의 나우시카,실관람객,8.0,오래된 애니인데 지금 봐도 좋네요.
바람계곡의 나우시카,실관람객,10.0,역시 명작 너무 재밌었습니다
바람계곡의 나우시카,실관람객,9.0,미키17을 재밌게 봤다면 나우시카는 필수
바람계곡의 나우시카,실관람객,10.0,포스트 아포칼립스의 시대에서 대자연과의 조화를 보여주네요 ㅎㅎㅎ 재밌어요
바람계곡의 나우시카,실관람객,10.0,지브리 미야자키 하야오 전설의 시작
바람계곡의 나우시카,실관람객,10.0,미야자키 하야오와 히사이시조 두 전설의 시작점
바람계곡의 나우시카,실관람객,10.0,미야자키 하야오 애니메이션의 원형이 되는 모든 요소들이 들어 있는 원류같은 영화
바람계곡의 나우시카,실관람객,10.0,시대를 넘어서까지 느껴지는 명작
바람계곡의 나우시카,실관람객,10.0,미야자키 하야오 최고의 걸작을 스크린으로 만나다
바람계곡의 나우시카,실관람객,9.0,내 개인적으로 지브리 스튜디오 작품 중 top3 안에 드는 작품코믹스 버전의 아성을 넘을 순 없지만 애니메이션 자체도 충분히 매력적인 이야기재개봉해준 덕분에 영화관에서도 봐보네요
바람계곡의 나우시카,실관람객,10.0,재미있게 봤습니다!!
바람계곡의 나우시카,실관람객,10.0,과연 인간이 가장 잔인하다
바람계곡의 나우시카,실관람객,10.0,지브리의 여자 주인공들 원형은 나우시카가 아닐까
바람계곡의 나우시카,실관람객,8.0,나우시카 오랜만에 잘 봤어요
바람계곡의 나우시카,실관람객,8.0,지금의 지브리를 만든 애니메이션
바람계곡의 나우시카,실관람객,8.0,정말 참 대단한 영화다.
바람계곡의 나우시카,실관람객,10.0,"미야자키 하야오만이 표현할 수 있는 자연과 인류의 조화로움. 수OO전의 영화지만 이 감독이 클래식인 이유를 보여준다. 작화, 스토리, 매력적인 캐릭터들 모두 영화사에 빛으로 기록될만하다."
바람계곡의 나우시카,실관람객,10.0,명작이네요 재밌어요 히사이시 조 음악 너무 좋아요
바람계곡의 나우시카,실관람객,8.0,역시 인간이 문제다ㅠㅠ
바람계곡의 나우시카,실관람객,10.0,OST가 정말 정말 좋고 나우시카만의 포자 키우기 비밀 지하 방은 영상미가 예뻐서 딱 나오자마자 감탄했어요.미야자키 하야오 감도의 가치관이 좋아서 보는 내내 행복했습니다.
바람계곡의 나우시카,실관람객,8.0,미야자키 하야오 철학의 원형이자 지브리 애니메이션의 모체
바람계곡의 나우시카,실관람객,10.0,40년이 지난 지금 더 선명히 다가오는 메세지
바람계곡의 나우시카,실관람객,9.0,41년 전에 이런 작품을 만들어냈다는 게 대단하지만 현재 시점에서는 조금 지루하고 단조롭기도 하네요. 그런데 왜 이렇게 TV 애니메이션으로 방영된 <미래소년 코난>과 많은 부분이 겹쳐 보이는 것인지...
바람계곡의 나우시카,실관람객,10.0,지브리 초기 영화작 인상깊게봤습니다
바람계곡의 나우시카,실관람객,7.0,취향이 아니다...메시지는 좋은데 예전 영화 티가 나서 몰입이 안되는
바람계곡의 나우시카,실관람객,7.0,어렸을적 만화 보던 기분이 떠올랐따.
바람계곡의 나우시카,실관람객,8.0,역시 지브리 초창기 애니 굳.
바람계곡의 나우시카,실관람객,10.0,옛 특유의 감성이 잘 느껴지네요 재미있게 봤네요
바람계곡의 나우시카,실관람객,10.0,지브리를 영화관에서..
바람계곡의 나우시카,실관람객,8.0,"보면서 생각나는 미키17, 듄"
바람계곡의 나우시카,실관람객,10.0,나우시카가 너무 처절하고 아련해서 눈물이 난다...ㅠㅠ 그래도 해피엔딩이라 다행ㅠ
바람계곡의 나우시카,실관람객,9.0,극장에서 볼 수 있어서 너무 감사하다... 미야자키 하야오 감독의 세계관이 가장 잘 담긴 영화 중 하나라고 생각함
바람계곡의 나우시카,실관람객,9.0,어릴때 봤을땐 마냥 재밌었는데 어른이 된 후 다시 보니 느낌이 다르다 아름답고 마음을 울리는 기억속의 ost와 끝나고 나면 귀엽고 신비하게 느껴지는 오무들 그리고 자연과의 공존의 소중함
바람계곡의 나우시카,실관람객,10.0,영화 재미있게 잘봤습니다.
바람계곡의 나우시카,실관람객,9.0,명작은 다시봐도 명작이다. 영화관에서 봐서 다행이다.
바람계곡의 나우시카,실관람객,8.0,디지털 리마스터링 아니어서 좀 아쉬웠다.
바람계곡의 나우시카,실관람객,10.0,지브리를 좋아할 수 밖에 없는 이유.
바람계곡의 나우시카,실관람객,10.0,명작은 명작이다 정말!
바람계곡의 나우시카,실관람객,8.0,개피곤 이슈로 인해 제대로 못 봤음 퓨 한번 더 봐야겠음
바람계곡의 나우시카,실관람객,10.0,명작의 클라스란 이런것
바람계곡의 나우시카,실관람객,10.0,극장에서 다시 보고 싶었는데 행복했습니다
바람계곡의 나우시카,실관람객,9.0,명작은 언제나 다시봐도감탄이 절로나온다
바람계곡의 나우시카,실관람객,8.0,자연에 대한 많은 생각이 듬 음악도 좋았음
바람계곡의 나우시카,실관람객,10.0,계속 사건의 연속이라 지루할 틈이 없음
바람계곡의 나우시카,실관람객,8.0,인류는 어떻게 살 것인가?
바람계곡의 나우시카,실관람객,10.0,"불후의 걸작, 미야자키 하야오의 야심과 메시지"
바람계곡의 나우시카,실관람객,9.0,극장에서 보는 지브리 명작의 감동!!!
바람계곡의 나우시카,실관람객,7.0,벌레들은 인간이 얼마나 미울까
바람계곡의 나우시카,실관람객,8.0,숲과 공존하지 않으면 인간은 멸망할 수밖에 없겠네
바람계곡의 나우시카,실관람객,10.0,재밌게 잘 봤습니다ㅎㅎ
바람계곡의 나우시카,실관람객,10.0,극장에서 볼 수 있어서 좋았다
바람계곡의 나우시카,실관람객,10.0,바람계곡의 나우시카 잘 봤습니다
바람계곡의 나우시카,실관람객,10.0,레전드 작품을 극장에서 본 것에 감사...
바람계곡의 나우시카,실관람객,7.0,초기작이라 그런가 연출이 산만한 감이 있다
바람계곡의 나우시카,실관람객,9.0,"지브리, 그 역사의 위대한 서막"
바람계곡의 나우시카,실관람객,10.0,어릴때 봤을땐 몰랐는데 굉장히 철학적이고 현실의 문제를 잘 다룬것 같아요
바람계곡의 나우시카,실관람객,10.0,80년대 영화다보니 아무래도 성우 연기가 약간 그시대 감성이고 음악과 사운드도 조금 빈약하게 들리는 면이 있지만 2025년 지금 다시봐도 언제나 마음에 울림을 준다.
바람계곡의 나우시카,네티즌,10.0,바람계곡의 나우시카는 현 시대를 살아가고 있는 우리에게 잊혀지지 않을 명작이다.
바람계곡의 나우시카,네티즌,10.0,지금의 지브리가 있게 해준 작품같아요
바람계곡의 나우시카,네티즌,10.0,일본만화는80-90년대가 전성기인듯.작품성 그림체 스토리 모든방면에서 정말 느끼게하는바가 많았다. 요즘 작품들은 죄다 오타쿠 모에화 쓰레기들이지만..
바람계곡의 나우시카,네티즌,10.0,미야자키껀 하나같이재밋음
바람계곡의 나우시카,네티즌,10.0,"진정한 명작이다. 30년 정도 지난 지금 봐도 이건 명작이다. 결국, 이 세상을 파괴하는 종족은 인간 뿐이다. 그게 너무 잘 표현되고 와닿았던 작품. 정말 대단한 작품이다. 메시지, 재미 이 모든 것을 잘 갖춘 작품."
바람계곡의 나우시카,네티즌,10.0,지브리는 왜 더이상 이런 작품을 만들 능력이 없어진걸까?
바람계곡의 나우시카,네티즌,10.0,"조금만 더 어렸을때 봤다면, 울었을지도..."
바람계곡의 나우시카,네티즌,9.0,영화 보고 지린건 처음이다. 우리에게 자연의 소중함과 인간은 결국 대자연 앞에서는 미물에 지나지 않는다는 것을 동화의 성격을 빌려 표현했다. 미야자키는 천재다
바람계곡의 나우시카,네티즌,8.0,"지브리 영화를 보면 인간탐욕에대한 이야기가 많이 나오는것 같더라, 전쟁 전쟁 전쟁..! 짱짱걸 나우시카ㅋㅋ 볼만했지만 길었다 ㅠ_ㅠ"
바람계곡의 나우시카,네티즌,10.0,지브리 스튜디오 의 명작을 졸리게본다는건 정신이 아직어리다는 증거
바람계곡의 나우시카,네티즌,10.0,환경 그것은 21세기에 들어서서 더욱 중요하고 심오한 문제가 되었다 나우시카라는 캐릭터를 통해 말하고자 하는 바를 충분히 설명하고도 남았다 거신병으로도 막을수 없는 오무떼는 마치 자연을 이길수없는 인간의 나약함을 대변한다
바람계곡의 나우시카,네티즌,10.0,감히 내가 평할수도 없는 대작 중의 대작.
바람계곡의 나우시카,네티즌,10.0,좋은데 가치보다 덜 알려졌다.
바람계곡의 나우시카,네티즌,10.0,"나는 지브리가 좋다.디즈니도 픽사도 드림웍스도 다 좋지만 그래도 나는 지브리가 좋다.나는 이 영화 하나가 내 인생의 명작이다.비록 지금은,앞으로는 지브리 영화를 못볼것이다. 하지만 이미 지브리는 나에게 많은 명작을 보여주었다.나는 지브리를 잊지못한다."
바람계곡의 나우시카,네티즌,10.0,100점 만점에 200점.84년도에 만든 작품이라고 생각되지 않는 작품.이야~ 어떻게 84년도에 이런 생각을 이런 작품을 만들었을까~
바람계곡의 나우시카,네티즌,10.0,이런 애니를 30년 전에 만들었다니 대단하다.
바람계곡의 나우시카,네티즌,10.0,간만에 다시 봤는데 역시나 휼륭한 작품
바람계곡의 나우시카,네티즌,10.0,나이 40에 봐도 감동이다 우리는 무언가 잊고 살고있는건아닌지ㅠ
바람계곡의 나우시카,네티즌,10.0,나우시카는 애니매이션도 애니매이션이지만 음악도 너무 좋았다 히사이시 조 미야자키 하야오 두천재의 만남
바람계곡의 나우시카,네티즌,10.0,지브리 최고의 걸작..
바람계곡의 나우시카,네티즌,10.0,순수했던옛날로돌아가고싶다
바람계곡의 나우시카,네티즌,10.0,변함없이 부동의1위를 지키는 나의 인생애니. 볼때마다 새롭고 생각이 깊어지는 작품이다.
바람계곡의 나우시카,네티즌,10.0,"세상이 오염 될 것을 예상한 듯 사람들의 이기심을 잘 비판한 것 같고, 오염된 지구에 벌레들이 점령을 하고.... 등등 소재들이 너무 창의적이고 좋은 것 같습니다. 지브리 명작 중 명작!! 보장합니다."
바람계곡의 나우시카,네티즌,8.0,84년 애니라고는 믿기지 않는 완성도.
바람계곡의 나우시카,네티즌,10.0,"그 옛날 어린 시절엔 그냥 재미있는 만화영화에 불과했다. 하지만 지금 시간이 흐르고 흘러 어언 내 나이 30줄, 그동안 인문, 사회, 과학, 철학, 등 무수한 책들을 편력하며 부족하나마 쌓아올린 한 줌의 지식이 과연 이 영화 한 편에 당할 것인가?"
바람계곡의 나우시카,네티즌,10.0,나우시카가 할배들 안심시키려고 스스로 마스크를벗고 잘들리게 말한후에 엄지손가락을 치켜 올리는 장면은 봐도봐도 멋있다. 이게바로 걸크러쉬이자 리더의 품격이 아니겠는가...
바람계곡의 나우시카,네티즌,6.0,인간이 이기심을 버릴때 비로소 공존이 가능해진다.
바람계곡의 나우시카,네티즌,8.0,오무가 불을끄고 진정하는부분이 감명깊었음
바람계곡의 나우시카,네티즌,10.0,마스크 없이는 살 수 없는 죽음의 숲. 지금 현재의 지구와 똑같은 상황이라 흠칫.
바람계곡의 나우시카,네티즌,10.0,어릴때 봤더라면 그냥 판타지적인 영화라고 생각했을텐데 지금 보니 미래의 이야기가 될 수도 있겠다는 생각이 든다. 불보다 물과 바람이 좋다는 바람계곡의 사람들. 우리는 이들처럼 자연과 더불어 사는 법을 깨달아야 한다. 대부분의 사람들이 머리로는 알고 있...
바람계곡의 나우시카,네티즌,10.0,거장의혼이담긴 마스터피스!!!
바람계곡의 나우시카,네티즌,10.0,지렸다 마지막 장면...미친 만화보고 깨달음을 얻음....심심해서 봤는데 인생작 탄생함
바람계곡의 나우시카,네티즌,10.0,아스벨이 찔려서 너무 슬펐고 한번쯤은 꼭 보면 좋은 영화인 것 같다. 그리고 나우시카가 너무 용감했다. 나우시카 아빠가 더 오래 살아있었으면 이런 일이 생기지 않았을텐데 속상했다. 나우시카가 자신의 몸을 거의 희생해서 마을 주민을 지킨 것을 보면서 '나도 한번쯤은 내 자신 말고 다른 사름을 위해 내 몸을 희생한 적이 있나?'라는 생각을 했다. 이 영화는 많은 깨우침과 다짐이 생각나는 것 같다. 그리고 무엇보다도 스토리 구성이 너무 재밌고 감동적이었다.
바람계곡의 나우시카,네티즌,10.0,30년이 다 되어가는 지금도 여전히 시대에 앞서있는 명작. 자연은 정복의 대상이 아니라 공존의 대상이다.
바람계곡의 나우시카,네티즌,10.0,모노노케 히메와 더불어 인간과 자연에 대해 생각하게 해주는 지브리 역사상 최고의 애니 중 하나. 그리고 나우시카는 지브리 여자 캐릭터 중에 제일 이쁘고 걸크 매력 넘침.
바람계곡의 나우시카,네티즌,10.0,왜 미야자키 하야오가 천재인가를 보여주는 작품. 앞으로 이런 애니메이션이 다시 나올 수 있을까?
바람계곡의 나우시카,네티즌,9.0,"정말 미야자키 감독은 선구자이며 선지자였다. 독보적인 작품이다. 영적이고, 생명과 근원을 담았다. 많은 영감과 감동을 주는 대단한 작품이었다."
바람계곡의 나우시카,네티즌,9.0,"엄청난 영화였다 이게 1984년에 나온 영화라니 믿기지가 않는다... 엄청난 상상력과 음악들 지금봐도 대단한 명작 인간과 자연의 대립, 인간은 결코 자연을 이길 수 없다."
바람계곡의 나우시카,네티즌,10.0,나우시카 애니는 원작 만화책과 스토리전개가 완전 다릅니다. 원작은 2시간에 담을 수 없을정도로 방대하고 깊은 놀라운 세계관이 그려져있죠. 그럼에도 불구하고 전혀 다른 전개로 기막힌 명작 애니를 제작한 미야자키와 지브리의 천재성에 또 놀랐습니다.
바람계곡의 나우시카,네티즌,10.0,이 영화는 정말 첫작 인데도 잘 만들었다 다른것보다도 잘 만들었고 주제를잘 표현한것 같다
바람계곡의 나우시카,네티즌,10.0,점수주는거 개인적으로 엄청 짠데.. 지브리 작품 중 제일 최고. 포스팅 할꺼지만 또 저작권 어쩌구 하겠지만 생각하는거 싫어하는 그대들은 보지 마셈. 난 30대인데 젠장 눈물남..
바람계곡의 나우시카,네티즌,9.0,현대를 살아가는 사람들이 꼭 봐야할 영화.. 마스크 없이 모든 생명에게 상처주는 일 없이 살아갈 날이 빨리 왔으면 좋겠다
바람계곡의 나우시카,네티즌,8.0,현재 진행중인 오염과 파괴
바람계곡의 나우시카,네티즌,10.0,그냥 명작이다. 또 다른 매력적인 세계와 마주했던 나
바람계곡의 나우시카,네티즌,10.0,진짜 최고에요 모노노케히메 장르랑 비슷한?
바람계곡의 나우시카,네티즌,10.0,처음본게 1996년 이었는데. 그후로10번은 넘게 본거 같습니다.정말 좋은 작품입니다
바람계곡의 나우시카,네티즌,9.0,내용도 좋지만 OST가 너무 좋다
바람계곡의 나우시카,네티즌,10.0,지브리 영화 차례대로 모두 보고있는데 이게 84년도 작품이라니...감탄했다
바람계곡의 나우시카,네티즌,10.0,"요새 지브리영화 하나하나 다 몰아서 보고 있는중인데 정말 한 작품도 빠질게 없다...상상력, 지브리감성, 던지는 메시지, 음악, 영상미...더군다나 작품들이 나온지가 30~40년전이라..더 이상 할말이 필요할까 싶다."
바람계곡의 나우시카,네티즌,10.0,10점도 모자랄정도의 명작..
바람계곡의 나우시카,네티즌,10.0,어릴때 봤을땐 말도 안되는 판타지 세계관인줄 알았는데 2019년이 되니까 비슷하게 살고 있네;; 나우시카도 쓰고 다니던 미세먼지 마스크를 나도 쓰고 사게 될줄은 어릴땐 정말 상상도 못했다.
바람계곡의 나우시카,네티즌,10.0,"마스크를 안쓰면 5분도 못버티는 그곳. 마치 요즘과 닮아있다. 40여년전의 통찰력. 지브리를 있게 해준 명작이지만, 요즘은 참 아쉽다,."
바람계곡의 나우시카,네티즌,10.0,지금 이시점에 이작품이 전하는 경고가 더욱더 가슴에 남는다 자연의 경고를 무시하지 말아야하는데 보는 내내 두려워진다
바람계곡의 나우시카,네티즌,10.0,"현재의 마야자키 하야오의 작품들보다는, 아무래도 비교적 초반 작품이다보니 지루할수도 잇는 포인트들이 있었다. 다만, '원령공주'에서도 드러난 '자연과의 공존에대한 메시지'가 똑똑히 와닿는다는 것은 틀림 없다고 생각한다.오히려, 미야자키 하야오의 초반 작품이다보니, 풋풋하고 약간의 어색한 부분이 바로 지금의 미야자키 하야오와 지브리 스튜디오를 만들어준 것같다고 생각하니 가슴깊게 와닿을 수 있었던 작품이라 생각한다. :)"
바람계곡의 나우시카,네티즌,7.0,마스크없이 살수 없는 지금과 별반 다르지않는 세계의 모습이다. 역시 인간은 스스로를 파멸시키는 존재다.
바람계곡의 나우시카,네티즌,10.0,위대한 투사의 위대한 승리. 시시한 위로보다 가슴 벅찬 감동이 더 큰 희망을 준다. 카리스마와 리더십의 진정한 의미는 이런것이다. 이 작품은 애니메이션을 위대한 수준으로 올려놓았다.
바람계곡의 나우시카,네티즌,10.0,인간이 제일 나쁘다. 그리고 그걸 고쳐나갈 수 있는 건 인간뿐.
바람계곡의 나우시카,네티즌,10.0,지브리 덕후가 아니여도 꼭 봐야할 명작 입니다
바람계곡의 나우시카,네티즌,9.0,지금 나와도 꽤나 좋은 평가를 받을 만한 작품인 듯
바람계곡의 나우시카,네티즌,8.0,그럼에도 계속해서 기회를 주는 자연의 자비로움.
바람계곡의 나우시카,네티즌,9.0,"지금의 스튜디오 지브리를 시작하게 해준 고마운 작품이자 최고의 걸작. 지키려는 자와 파괴하려는 자들, 그들 각각이 추구하는 방향은 선과 악을 단정짓기보단 차선을 택하려는 것이 아닐까. 자연의 소중함과 인간과의 대립에 관한 주제는 우리 인간에게 많은 생각이 들게 한다."
바람계곡의 나우시카,네티즌,10.0,1984년 작품... 어째 점점 퇴보한다
바람계곡의 나우시카,네티즌,10.0,근데 네이버 줄거리 소개에 내용이 98퍼가 써있네....와 진짜 재미있네요
바람계곡의 나우시카,네티즌,10.0,시대를 초월하는 명작이다
바람계곡의 나우시카,네티즌,10.0,난 왜 이걸 이제서야 본걸까
바람계곡의 나우시카,네티즌,10.0,"거신명, 오무.. 대지, 바람.... 무기, 인간.. 참 어떻게 이런 애니를 만들어 낸 것일까?"
바람계곡의 나우시카,네티즌,10.0,세기에 길이 남을 명작...
바람계곡의 나우시카,네티즌,10.0,너무감동적이고 교훈이되었습니다 눈물을 흘리며봤네요..반성하며보았습니다..
바람계곡의 나우시카,네티즌,10.0,정말 말이 필요없는 영화
바람계곡의 나우시카,네티즌,10.0,마지막 장면이 눈에서 잊혀지지 않는다. 이 영화를 보고 밤에 곤충꿈을 꿨을 정도.
바람계곡의 나우시카,네티즌,10.0,지브리의 전설적인 영화
바람계곡의 나우시카,네티즌,10.0,너무 감명받게 본 지브리 애니중 하나..
바람계곡의 나우시카,네티즌,8.0,인간의 탐욕과 무지함이 반복된다면 이런 상황을 맞이할지도 모른다
바람계곡의 나우시카,네티즌,10.0,정말 이건 명작중에 명작이다.과연 미야자키를 뛰어넘을 사람이 나올 수 있을까?
바람계곡의 나우시카,네티즌,9.0,다른 작품들에 비해 이야기가 무겁다. 나온지도 오래되어 조금 지루한 감은 있지만 아직까지도 재밌게 볼 수 있다는건 그만큼 훌륭한 작품이라는 뜻. 무엇보다 영화의 메세지가 영화를 보는 내내 관객에게 지속적으로 전달이 된다는것.
바람계곡의 나우시카,네티즌,9.0,모노노케히메처럼 자연과 더불어 살아가야한다는 교훈을 주는 영화라서 더 좋았다
바람계곡의 나우시카,네티즌,8.0,"코로나 사태를 보고 있자니, 이 영화의 주제의식은 지금도 유효한 듯. 1980년대 초반에 제작되었음에도 발이 아찔한 공중전을 비롯한 화면 연출력은 지금 봐도 세련됐다."
